REVIEW_INDEX,WEBSITE_INDEX,POI_INDEX,REVIEWER_URL,REVIEW_RATING,REVIEW_DATE,REVIEW_BODY,ATTRIBUTES_CRAWLED_TIME
,4,181,//www.qyer.com/u/986558,3,2015-10-26,樟宜博物馆中陈列的是二次世界大战终日军占领新加坡期间，盟军战俘据于此的生活记录史实，现在的监狱很美，展现出了与中国人完全不同的价值观。,2020-02-03 13:52:37.707144
,4,181,//www.qyer.com/u/399070,3,2018-09-25,新加坡被日军占领了，不列颠军队从人上人变成了阶下囚，而这里就是关押他们最主要的战俘营。大日本帝国皇军从来不把别人的生命当回事儿，于是这些英国战俘算是倒了大霉，你在这里可以看到这些昔日的殖民者老爷是怎么在此备受折磨的，博物馆氛围会让你联想起泰国北碧的那一票类似博物馆。不过说真的，与日占时期新加坡华人的遭遇相比，这些不列颠战俘的境地还不算最糟糕的。,2020-02-03 13:52:37.724424
,4,181,//www.qyer.com/u/1385466,3,2015-05-20,樟宜礼拜堂在樟宜机场附近。规模不大，以前这里是关押战俘的地方，是一座监狱。现在来到这里能够看到许多二战时期新加坡战场的历史照片和遗物，能够了解到东南亚的抗战历史，不过说实话，没必要专程过来。,2020-02-03 13:52:37.732877
,4,181,//www.qyer.com/u/4510321,3,2014-12-28,樟宜监狱入口处左侧木结构的小屋是一座由二战时期被关押在这里的英军战俘所建的礼拜堂，代表了战争时期保持自身信念与尊严的精神。现在的礼拜堂和博物馆是放大仿造的，陈列着战俘使用过的物品及书信、照片等，其中有五幅描绘《圣经》故事的壁画，作者是战俘斯坦利·沃伦。,2020-02-03 13:52:37.738887
,4,181,//www.qyer.com/u/2587444,3,2014-10-30,建在樟宜监狱的旧址上，樟宜监狱是在日本占领新加坡时期专门用来关押战俘的。这里收藏的艺术品，照片，以及曾经的战俘们捐赠的文物都让人不免怀旧。樟宜博物馆里还有一个那些战俘们使用过的临时教堂的复制品。,2020-02-03 13:52:37.743907
,4,181,//www.qyer.com/u/1493777,4,2013-12-16,建议去Changi村的时候 可以去看下 看看战争的惨痛 珍惜现在的和平,2020-02-03 13:52:37.748329
