REVIEW_INDEX,WEBSITE_INDEX,POI_INDEX,REVIEWER_URL,REVIEW_ID,REVIEW_DATE,REVIEW_RATING,REVIEW_TITLE,REVIEW_BODY,DATE_OF_EXPERIENCE,TRIP_TYPE,REVIEW_CRAWLED_TIME
,1,11,https://www.tripadvisor.com.sg/Profile/skysan,562604778,25-02-2018,4,Nice views,We had a great experience on our way to Sentosa Island. The cable cars were clean and plenty of seating. We rode most of the say without others in our car.,02-2018,Couples,2020-01-29 19:11:12.022681
,1,11,https://www.tripadvisor.com.sg/Profile/Traveler-O-World,562329997,23-02-2018,4,The Connection to Sentosa Island,The Singapore cable car provides connectivity to the amusement center of Sentosa Island. The view from the cable car is unique.,01-2018,Couples,2020-01-29 19:11:12.354992
,1,11,https://www.tripadvisor.com.sg/Profile/Dino W,562252842,23-02-2018,4,Nice but very slow,Taking the cablecar to visit Sentosa is probably the best way to go to the island but unlike all other cablecars in the world this one runs very slowly. And going to Mount Faber isn't quite as interessting as going to Sentosa.,12-2017,Couples,2020-01-29 19:11:12.733775
,1,11,https://www.tripadvisor.com.sg/Profile/MargC1955,562237890,23-02-2018,5,Great views,We hadn't been to Mt Faber for years but the cable car wasn't much different. Once we got to Sentosa though there were lots of changes including a new cable car route.,02-2018,Couples,2020-01-29 19:11:13.035025
,1,11,https://www.tripadvisor.com.sg/Profile/AizaJ,562205110,23-02-2018,4,3 way cable car,"We avail the 3 rides, sentosa, mount faber and siloso. I really enjoyed the view.. Its a great way to end up in sentosa place. They also gave us ref magnet of cable car for souvenir.",03-2017,Couples,2020-01-29 19:11:13.362614
,1,11,https://www.tripadvisor.com.sg/Profile/tjotjatjola,562192339,23-02-2018,3,Cable car like elsewhere,I know this cable car short after they finished it when I lived there in Singapore as 'Expat'. It is a comfortable way to reach 'Sentosa Island',11-2017,Couples,2020-01-29 19:11:13.731742
,1,11,https://www.tripadvisor.com.sg/Profile/Katherine P,562032959,22-02-2018,3,Good views,"We were unable to buy a single way ticket and had to buy return, which was annoying. Probably a bit expensive for what it is, online tickets are much cheaper. The views are very good though.",02-2018,Couples,2020-01-29 19:11:19.601047
,1,11,https://www.tripadvisor.com.sg/Profile/847lucillem,561879143,21-02-2018,4,Great views,"The only thing about this Cable Car that is wrong are the people running it! The day we went was a long weekend for Chinese New Year. The cable cars take 8 people and the lifties were letting cars go with 4 people or less and the line ups were HUGE. Apart from the frustration of the operation of the lift, the view and the entrance to Sentosa were great.",02-2018,Couples,2020-01-29 19:11:19.895135
,1,11,https://www.tripadvisor.com.sg/Profile/happy2602,561672840,20-02-2018,4,Great views during the ride,Taking a trip on the cable car was an attempt to see Singapore from different angles and maybe get some photographs of the islands and beyond.,02-2018,Couples,2020-01-29 19:11:20.262944
,1,11,https://www.tripadvisor.com.sg/Profile/Mrsloco,561433616,19-02-2018,4,Perfect View,Wonderful view . Worth at least a one way ride . Perfect way to get over to the island. Try to buy tickets ahead of time because line is long.,02-2018,Couples,2020-01-29 19:11:20.622219
,1,11,https://www.tripadvisor.com.sg/Profile/Car0le88,561404813,19-02-2018,4,Good views and plenty of rides!,"We caught the MRT to Harbourfront and booked tickets on the cable car to Sentosa. What we didn't realise was that you get a ride up to Mount Faber Peak as well, and for a bit extra can include the Sentosa cable car. I have to admit I don't like heights but it is something I have to do! I didn't like going up to Mount Faber Peak up over the road and valley but got used to it. We had a drink in the cafe at the top (make sure you get your change!! A lot of Americans visit this cafe early on as the cable car is close to the cruise terminal, and I think that maybe it is thought we don't count our change)We then rode all the way down to Sentosa, which was fun going over the top of the cruise ships! At Sentosa we caught the Sentosa Island cable car both to Merlion and Siloso Point beach. A fascinating island - one end a bit like Disney, and the other end a quiet beach (though it does have a zip wire going over it at one point)",02-2018,Couples,2020-01-29 19:11:20.976452
,1,11,https://www.tripadvisor.com.sg/Profile/cheron51,561358301,19-02-2018,5,best views,A must do in Singapore. Great views from the top going across. Very well supervised. Safe for the whole family.,02-2018,Couples,2020-01-29 19:11:21.283822
,1,11,https://www.tripadvisor.com.sg/Profile/Ilmar T,560410959,14-02-2018,3,Short ride,"Take the cable car from Mt Faber only if you want to see the view (which is spectacular). Otherwise, there are cheaper ways of getting to Sentosa, like walking along the boardwalk or taking the monorail or the bus. Good to do in the evening to take in the city and harbour lights.",01-2018,Couples,2020-01-29 19:11:21.662947
,1,11,https://www.tripadvisor.com.sg/Profile/SuzanneB_London,560361474,14-02-2018,4,A great way to get to Sentosa,My husband and I used the cable car to get to and from Sentosa. It’s quite costly but a nice experience and a unique way to get to and from the island. The views are good - especially of the ports and the staff are good at not filling the carts up with too many people during quieter times so you can often get a cart to yourself.,02-2018,Couples,2020-01-29 19:11:22.067748
,1,11,https://www.tripadvisor.com.sg/Profile/elementneo,559942937,12-02-2018,5,Fabulous,Views are great & it's nice to peacefully go far above the hustle & bustle below. cable car to ourselves quite romantic experience.,01-2018,Couples,2020-01-29 19:11:22.385171
,1,11,https://www.tripadvisor.com.sg/Profile/Coopper29,559904624,12-02-2018,5,Must do ride.,"A great way to see Singapore harbour and water front, great photo opportunity, not cheap but worth it",02-2018,Couples,2020-01-29 19:11:22.705406
,1,11,https://www.tripadvisor.com.sg/Profile/Peter F,559836371,11-02-2018,4,High life !,"Took Taxi to the Cable Car , great view, second best in Singapore ( after the flyer ) ! Very good views !",01-2018,Couples,2020-01-29 19:11:28.690458
,1,11,https://www.tripadvisor.com.sg/Profile/wandering2017,559756113,11-02-2018,4,Great views,"Cable car is reasonable and one way of ing to Sentosa island. Sentosa has so much to see and do. There are a few hotels to stay at also there is the fast train to ride like a monorail. Plenty of places to eat at plus there is a big food hall with variety to choose from as well plus McDonalds if need be.. Beach area to swim or a couple of bars on the ter edge as well. . There are souvineer places around, ice cream parlours, coconut drink stand, billabong m bikini bar to visit for a meal/snack, drink and play pool. Staff friendly. So much to see and do there it'# a must.",03-2017,Couples,2020-01-29 19:11:29.082361
,1,11,https://www.tripadvisor.com.sg/Profile/235stephena,559592600,10-02-2018,5,City and Sea views,"Nice to travel out to Faber Peak. Very peaceful place away from the city. Nice place to have a coffee or cold drink and just relax for an hour. Great way to travel out there and superb views over the city, river and Sentosa Island",02-2018,Couples,2020-01-29 19:11:29.376990
,1,11,https://www.tripadvisor.com.sg/Profile/558annette,559570994,10-02-2018,5,Fantastic Ride,"We thoroughly enjoyed our ride on this cable car, we went up to Mt Faber on it, then over to Sentosa and then had another ride on another cable car on the island, all on the one ticket. Great Views, friendly staff and it was easy to get to on the MRT",02-2018,Couples,2020-01-29 19:11:29.703359
,1,11,https://www.tripadvisor.com.sg/Profile/GlobeGlimpse,558715477,06-02-2018,5,This is a cable car NETWORK!,"The really cool thing about this kind of transportation is not just a way to get to Sentosa Island, is a mini network of a sky MRT. You can actually get off and back on at different stops. The ticket prices are not cheap, but it's worth the price to see Sentosa and walk around the various areas or even down to the beach. A must do in Singapore.",01-2018,Couples,2020-01-29 19:11:30.092887
,1,11,https://www.tripadvisor.com.sg/Profile/Mj_phill,558457048,05-02-2018,5,wow! a must do!,"Even if your scared of heights like me, give this a go, its a smooth way to get across to or from Sentosa with great views of the Island, harbour and Sentosa. And how can you not do Singapore without doing the cable car??",08-2017,Couples,2020-01-29 19:11:30.437060
,1,11,https://www.tripadvisor.com.sg/Profile/Five-star-critiques,558439439,05-02-2018,4,Great views-keep track of your journey though,"I bought a return ticket to and from the station by the harbour which lets you go up and down Mt Faber and to Sentosa and back. Your ticket is marked on each leg, so once you have done each section your tiucket has been used and if you want another ride you need to pay more-beware.
The journey is good, with great views of the harbour and the mountain in all directions.",01-2018,Couples,2020-01-29 19:11:30.837204
,1,11,https://www.tripadvisor.com.sg/Profile/juleschannel,558083406,03-02-2018,4,Amazing short visit to Mt. Faber,"We never had this trip before. But for our first time, this cable car trip was amazing. We had a great time enjoying the great view both from the car and from Mt. Faber. What a hideaway.",12-2017,Couples,2020-01-29 19:11:31.195093
,1,11,https://www.tripadvisor.com.sg/Profile/Kazoutlaw,558017034,03-02-2018,4,rainy day fun,"The day we had planned this trip was rainy but that suited us just fine- not too hot, no burning sun and not loads of tourists. Had a bit of trouble navigating at first, enjoyed an amazing breakfast then the segway tour- tops!",11-2017,Couples,2020-01-29 19:11:31.550914
,1,11,https://www.tripadvisor.com.sg/Profile/Vanessa W,557836674,02-02-2018,5,Great views,The cable car offers some spectacular views over Singapore and Sentosa Island. Worth the ride to see it all.,10-2017,Couples,2020-01-29 19:11:31.879656
,1,11,https://www.tripadvisor.com.sg/Profile/Tramper13,557749296,01-02-2018,5,Very Good,"To reach the theme park you can travel by road, but this is much more fun and you get some amazing views of the city and other surrounding areas. But be carful, because because at every station someone will initial your ticket and you can get caught out for extra money, so make sure to plan your trip.",01-2018,Couples,2020-01-29 19:11:37.861006
,1,11,https://www.tripadvisor.com.sg/Profile/pradeep_kumar49,557076654,29-01-2018,5,wonderful ride,The cable car ride is a not to be missed activity.There are different stations on the two lines and one can get down and see around the various attractions in sentosa islands.The view from the cable car is fantastic and the service is efficient,01-2018,Couples,2020-01-29 19:11:38.228472
,1,11,https://www.tripadvisor.com.sg/Profile/suesutcliffe,556027956,24-01-2018,4,Good views,A bit confusing at first and not cheap like everything in Singapore but well organized. Staff are helpful to confused tourists. We first went to see the Merlion and then took a further car down to Sentosa and the beach but it was so very hot with little shade we just got back on the cars and went up to Mount Faber but to be honest not much to see.,01-2018,Couples,2020-01-29 19:11:38.576410
,1,11,https://www.tripadvisor.com.sg/Profile/chillylin,555580052,22-01-2018,5,Great,Cable cars go from mount Faber to senosta. Good ride. Good views. You can also go to merilion and fort silos.,01-2018,Couples,2020-01-29 19:11:38.968079
,1,11,https://www.tripadvisor.com.sg/Profile/PrakashHathi,554144796,16-01-2018,3,A novelty; but nothing to miss out there..,"We took the cable car from Sentosa Island to the city late evening. The view was decent; with the city lights, traffic, bay and the buildings; but it was nothing special. One could easily give it a miss..",01-2018,Couples,2020-01-29 19:11:39.291883
,1,11,https://www.tripadvisor.com.sg/Profile/Peteski2016,553648674,14-01-2018,5,Great way to see Singapore and go to Sentosa Island,"This is a great way to see Singapore and get over to Sentosa Island with MGM, theme parks and lots to see and do.",12-2017,Couples,2020-01-29 19:11:39.604703
,1,11,https://www.tripadvisor.com.sg/Profile/Bazza199,553371565,12-01-2018,5,Fantastic,Great rides and great views many stop of points to wander round and see the many sites around the park.,12-2017,Couples,2020-01-29 19:11:40.001492
,1,11,https://www.tripadvisor.com.sg/Profile/David H,552916006,10-01-2018,4,Good way to spend an afternoon,"There are 2 lines, the Mount Faber Line & the Sentosa Line, they intercept at the middle station. We got a combined ticket for both at $33 each, starting at the Harbourfront Station, 15 storeys up. It's only a short walk from the Harbour Front MRT stop to the building. There is room for up to 8 people in the cable car, yet it wasn't too busy when we were there & we usually shared with another couple or a single traveller. Views are great & it's nice to peacefully go far above the hustle & bustle below. On Sentosa, be prepared to be fleeced. At the Merlion souvenir & refreshments shop a 330cl can of beer will set you back $16.00, a simple iced tea $3.50, might be worth it though, there is air-conditioning!",01-2018,Couples,2020-01-29 19:11:40.379548
,1,11,https://www.tripadvisor.com.sg/Profile/lejones,552877362,10-01-2018,5,Lovely experience,Had a lovely ride on the cable car traveled from Harbour to Sentosa no queues and had cable car to ourselves quite romantic experience.,01-2018,Couples,2020-01-29 19:11:40.703161
,1,11,https://www.tripadvisor.com.sg/Profile/jamilbaku,551988358,06-01-2018,5,Dinner,"If you are a couple, have dinner there. Great view and food is very good. Very well organised. Book from Klook - they offer good prices for everything in Singapore",12-2017,Couples,2020-01-29 19:11:41.069702
,1,11,https://www.tripadvisor.com.sg/Profile/Benna P,551686865,05-01-2018,3,Another cable car,It is expensive to go up to Mount Faber in the cable car. It is nothing special gives a different view of Singapore. The park is good but it was so humid up there that it was unpleasant.,12-2017,Couples,2020-01-29 19:11:47.061390
,1,11,https://www.tripadvisor.com.sg/Profile/Bazzandbabe,551394357,04-01-2018,5,Fantastic way to get to Sentosa,Quite a long way from Singapore CBD but taxis are cheap. Interesting ride on the cable car. Lovely views of Singapore. There is a photo booth at the attraction to take your photo and then have your copy once you get off the cable car. A nice memento.,12-2017,Couples,2020-01-29 19:11:47.402173
,1,11,https://www.tripadvisor.com.sg/Profile/Kenneth H,551263818,03-01-2018,5,Great views,We rode the cable car from Mt Faber to Sentosa and back. It was worth the cost for the views it afforded and as a way of getting to Sentosa.,12-2017,Couples,2020-01-29 19:11:47.778288
,1,11,https://www.tripadvisor.com.sg/Profile/AroundTheWorld1919,550799354,02-01-2018,1,Don’t waste your money and time,"Don’t waste your money and time unless you use the cable car as transportation to the attraction park which is a small wanna be Orlando theme park.

Staff super impolite and you are better off by saving the $33 per adult by using the big wheel to get an overview of the city.",01-2018,Couples,2020-01-29 19:11:48.151713
,1,11,https://www.tripadvisor.com.sg/Profile/Dellick,550774565,02-01-2018,4,Worth doing,A bit 'been there done that' but you've got to do it! Great views and just go with the flow! Great look back to the city and over the port. If there's a cruise liner you get to go right over the top which is fun in so far as you're pleased to be on land rather than the cruise boat!,01-2018,Couples,2020-01-29 19:11:48.527335
,1,11,https://www.tripadvisor.com.sg/Profile/RoyX965,550746858,02-01-2018,4,Great way to head to Sentosa,A ride from Mount Faber over the Keppel Harbour to Sentosa. great way to start your day and enjoy the views while en route to your activities in Sentosa or the other way around.,11-2017,Couples,2020-01-29 19:11:48.920275
,1,11,https://www.tripadvisor.com.sg/Profile/hbgser,550515303,01-01-2018,4,Perfect way to capture the skyline.,The cable car takes you to Sentosa Island and it gives one a great view of the area.Suggest it is caught at Henderson Waves to maximise the ride.,12-2017,Couples,2020-01-29 19:11:49.215938
,1,11,https://www.tripadvisor.com.sg/Profile/brottlouis,549716286,28-12-2017,5,Have Fun,It is a good place to have fun and very romantic with safe. We enjoyed the view of this lovely city.,10-2017,Couples,2020-01-29 19:11:49.601934
,1,11,https://www.tripadvisor.com.sg/Profile/Wayne T,549314793,26-12-2017,3,Delightful trip to Sentosa Island,"You can take the MRT but better still is the cable car for transport to Sentosa where you'll find amusement park activities, hotel, and casino. This is a getaway for Singapore.",11-2017,Couples,2020-01-29 19:11:49.944865
,1,11,https://www.tripadvisor.com.sg/Profile/Shilpa G,549229575,26-12-2017,5,First Cable Car Experience :),We went to Merlion Park From Siloso Point(From Shangrila Sentosa ) and it was just one station but me and my husband had an great experience .,12-2017,Couples,2020-01-29 19:11:50.308311
,1,11,https://www.tripadvisor.com.sg/Profile/AmyE2039,548800698,23-12-2017,3,Hard to locate,Walked in circles trying to figure out where to board the cable car. On boarding the wind was stronger than usual and we ended up freaked out from the experience. One time is enough. Thanks.,12-2017,Couples,2020-01-29 19:11:56.215663
,1,11,https://www.tripadvisor.com.sg/Profile/995ameliad,548519348,22-12-2017,4,Great Viewing,Even if you are a little concerned about heights - this is definitely worth it. At first I was a bit anxious but you soon get used to it. It is very efficiently run - and provides quick and easy access to Sentosa. I was expecting it to be a longer ride but it was still worth it and I was surprised that it was not air conditioned. Windows provide ventilation but it got quite hot.,12-2017,Couples,2020-01-29 19:11:56.625144
,1,11,https://www.tripadvisor.com.sg/Profile/VishDem,548266144,21-12-2017,3,Nice and a bit scary,Had a fabulous view of the sea. The ascension was a bit scary when the cable car started swaying a bit sidewards. It spiced the journey... Overall was nice.,12-2017,Couples,2020-01-29 19:11:56.981637
,1,11,https://www.tripadvisor.com.sg/Profile/gowthamg463,548212794,20-12-2017,4,Nice experience,Not a long one like the cable car in langkawi. Still we can enjoy nice view and experience it if not done it before anywhere..,11-2017,Couples,2020-01-29 19:11:57.362953
,1,11,https://www.tripadvisor.com.sg/Profile/Bruce W,547827747,18-12-2017,5,Romantic Dinner for two,We had a wonderful time doing 3 circuits and having a course each trip around. Was a great way to spend a romantic dinner. Food and wine was excellent and we had a great experience. Fully recommend it for other couples well worth it,11-2017,Couples,2020-01-29 19:11:57.686017
,1,11,https://www.tripadvisor.com.sg/Profile/G7508LNrichardp,547064260,14-12-2017,4,Good Experience - but expensive,"Great fun (and thankfully our return journey was just before an epic storm), but very expensive at about £19pp return for a journey that is less than 10 mins each way. Very high off the sea/ground in parts so not for the faint-hearted. Got a free fridge magnet at the end so some sort of keepsake for the £19!",11-2017,Couples,2020-01-29 19:11:58.036883
,1,11,https://www.tripadvisor.com.sg/Profile/ivanhelenperry,546945487,13-12-2017,5,up up we go!,"My husband's first visit to a cable car - his words ""breath-taking!' We traveled from the Harbourfront station up to Mt Faber then onto from there to Sentosa Island. It was well worth the money and the pictures we got were fantastic! Highly recommend to anyone visiting Singapore!",12-2017,Couples,2020-01-29 19:11:58.363345
,1,11,https://www.tripadvisor.com.sg/Profile/sniri2014,545862155,08-12-2017,4,Very nice experience but too pricey,"A great way to start and get Sentosa island. The view is very nice and it create enthusiasm prior reaching the pleasure island. However, the price for family is quite high",07-2017,Couples,2020-01-29 19:11:58.727649
,1,11,https://www.tripadvisor.com.sg/Profile/Edward M,545627566,07-12-2017,5,Fantastic views from the car,"Take some time and visit Sentosa via the cable car ride. Once you pay, you can ride it as many times as you wish. Many things to see and do in Sentosa and stay for the light show, Should not miss it, it was fantastic. You can get local foor and American fast food and all kinds of Asian style food in the area. Close by is a casino, mall and Universal Studios park. You can spend on day or more in this area. Very scenic area and good eating places too. All from cheap eats to fine dining can be found here. Definately would recommend going here.",11-2017,Couples,2020-01-29 19:11:59.080212
,1,11,https://www.tripadvisor.com.sg/Profile/Muhamad A,545052104,04-12-2017,5,Nice View! Must Try!,"I just take a half trip to mount fabre, it is quite high, but it is very safe, The cable car connects the Mainland with the Sentosa Island.",12-2017,Couples,2020-01-29 19:11:59.406976
,1,11,https://www.tripadvisor.com.sg/Profile/CoolTravelFreak,543976674,29-11-2017,5,Entry to Sentosa ..,"This takes you from the MRT station to the Sentosa Island ... The view is good .. There are other ways to reach the sentosa island like the train , you can walk and even the bus .. Not much to write about except for a cable car experience and the view ...",02-2017,Couples,2020-01-29 19:12:05.423564
,1,11,https://www.tripadvisor.com.sg/Profile/DeeBee1011,543781308,28-11-2017,5,Viewing Singapore from a Height !!,"The cable car connects the Mainland with the Sentosa Island. Runs like clock-work, travels across the water from where one gets a super view of Singapore and whets your appetite for what will follow on Sentosa.",10-2017,Couples,2020-01-29 19:12:05.786904
,1,11,https://www.tripadvisor.com.sg/Profile/Bob L,542959390,24-11-2017,4,Good views from harbourfront to sentosa,Arrived on mrt at harbourfront. Cable car was not well sign posted but eventually found our way to cable car station in separate building to vivo shopping centre. Redeemed our sia card for tickets which was easy. Views from harbourfront to sentosa was very good.,11-2017,Couples,2020-01-29 19:12:06.090809
,1,11,https://www.tripadvisor.com.sg/Profile/191cm1,542764820,23-11-2017,5,Spectacular views over Sentosa and Singapore,"Crossed over to Sentosa by cable car, great fun, spectacular views. Would recommend even if you're afraid of heights although there is a monorail near the cable car centre to get you over to Sentosa",11-2017,Couples,2020-01-29 19:12:06.495568
,1,11,https://www.tripadvisor.com.sg/Profile/Ajay K,542368847,21-11-2017,5,Singapore Cable Car,"I visited singapore in september 2017 and took a cable car ride.This is an excellent ride and must do in singapore.I booked ticket through Klook which gave 40% discount.Other online sites also give good discount,so it will be economical to buy ticket online. You can board from top that is mount Faber or harbour front near vivo city mall .If you board from harbour front then you should go to mount Faber station and get down and take photos etc. and then again board the cable car which will take you to Sentosa island.You will get excellent view from mount Faber to Sentosa island.It is a must do in singapore but remember to take full ride from mount Faber to Sentosa instrad of harbour front to Sentosa.",09-2017,Couples,2020-01-29 19:12:06.826731
,1,11,https://www.tripadvisor.com.sg/Profile/Denis M,542341465,21-11-2017,4,A relaxing way to reach Sentosa,"A bit pricey, but worth the journey to see the harbour. The staff are quite pleasant and the cars themselves are very comfortable. It wasn't busy so we had the car pretty much to ourselves.",11-2017,Couples,2020-01-29 19:12:07.158967
