REVIEW_INDEX,WEBSITE_INDEX,POI_INDEX,REVIEWER_URL,REVIEW_ID,REVIEW_DATE,REVIEW_RATING,REVIEW_TITLE,REVIEW_BODY,DATE_OF_EXPERIENCE,TRIP_TYPE,REVIEW_CRAWLED_TIME
,1,11,https://www.tripadvisor.com.sg/Profile/Naveen N,351181300,27-02-2016,4,Good views,We used cabel car from mount Faber to Sentosa.. Very nice views.. It was morning and we could see the harbour and far away!! Locals recommended the other side as well. Trying Sentosa to Faber at night to get SG view from Faber at night.. You could try that also..,02-2016,Couples,2020-01-29 19:18:26.662642
,1,11,https://www.tripadvisor.com.sg/Profile/MelB776,351005916,26-02-2016,5,The best way to visit the Sentosa,Always a hairy and interesting ride and the best way to get to and from Sentosa. The views from the top are magnificent.,12-2015,Couples,2020-01-29 19:18:27.009723
,1,11,https://www.tripadvisor.com.sg/Profile/danjor44,350804903,25-02-2016,5,not to be missed,only way to go to serotsa island to see the light show . the few over the harbour is fantastic you can return to the mjain land by bus or taxi,02-2016,Couples,2020-01-29 19:18:27.360857
,1,11,https://www.tripadvisor.com.sg/Profile/fantastictraveller22,350797338,25-02-2016,5,awesome experience,nice overlooking view! vivo city to sentosa island was adventure and view was just amazing to the eyes! i love vivo city a very big mall with all the signatures and sentosa was a cool place to explore,02-2016,Couples,2020-01-29 19:18:27.722993
,1,11,https://www.tripadvisor.com.sg/Profile/jemLiverpool,350561405,24-02-2016,5,Fabulous Views,"Went early morning,no queues and we had all the individual cars which carry 8 to ourselves.The views were fab and got some great photos.
The ticket costs approx £16 return and for that you can ride 3 different lines,we took one line down to the beach and it was a lovely sunny day.
Really great value and a must do if in Singapore.",02-2016,Couples,2020-01-29 19:18:28.020990
,1,11,https://www.tripadvisor.com.sg/Profile/ThurlbyReviewer,349566858,21-02-2016,5,Fabulous views,"We caught the mrt to harbour front and then bought tickets for faber peak and sentosa, $29 each. We first went up to Faber Peak and there are fabulous views over and beyond Sentosa island. We walked along the Faber loop and over the unusual Henderson Waves bridge. There are signs warning about wild monkeys but we didn't see any. We saw an oriole, brilliant yellow, and a very pretty spotted butterfly.
Then we went on the cable car to Sentosa. The cars take 8 people but we had one to ourselves for each trip. Very interesting to look down on the cruise ships as you go over. We went from one end of the sentosa line to the other, stopping off to see the merlion. The beaches look wonderful and everywhere is very clean and well maintained. Finally we caught the cable car back to our starting point. A very enjoyable half day out.",02-2016,Couples,2020-01-29 19:18:33.941013
,1,11,https://www.tripadvisor.com.sg/Profile/dian550,349325352,20-02-2016,4,Good views,I went to Sentosa Island and this one way ride in the Cable Car was included in the half day tour. It was a good way to get to Sentosa and provided good views and a smooth journey although it is rather short.,02-2016,Couples,2020-01-29 19:18:34.328768
,1,11,https://www.tripadvisor.com.sg/Profile/HeatSeekerWrexham_UK,348815865,18-02-2016,5,A fun way of getting to the destination,"Cable-cars by their nature give great views. In addition, they’re an easy way to reach the destination.
Views from the cars are excellent, and I’m pleased to say they no longer block any of the windows with pictures - it used to happen. Cars can get rather warm. The opening windows help, but on the Faber to Sentosa route, they’re only on one side of the car, and don’t get much airflow if on the downwind side. However fan have now been fitted, so we always find the temperature pleasant.
You can buy tickets to cover both the route from Sentosa to Mt Faber, and also the route on the island from Imbiah to Siloso. Although the latter is quite short, it does give some stunning views of the forest on Sentosa as well as parts of Singapore. The small extra cost of buying the ticket for both routes is well justified. I do prefer the unlimited use tickets, it’s worth the extra as it’s great to also do the ride after dark.
Local residents will find the Faber Licence outstanding value at S$39 as it gives unlimited access to the cable-cars for a year, sadly it’s not available to visitors.
Most of the time boarding is quick, with very short queues, if any. Peak times can be difficult. Tour groups on occasions will use a sequence of cars, so you have to wait until they’ve all gone through. But overall, on weekdays we’ve had little delay using the cars.
Disabled access is good, with lifts when necessary. Toilets are easily found at all Sentosa stations, naturally they are always very clean. Mt Faber can be a problem, the toilets are at the foot of the steps down from the gift shop, turn right at the bottom. The signs aren’t obvious, so ask staff for help if necessary.
Our first visit to Sentosa was by cable-car (in those days it was cable-car or ferry, the causeway did not exist). We’ve enjoyed every ride. It is expensive, but unforgettable.",02-2016,Couples,2020-01-29 19:18:34.684910
,1,11,https://www.tripadvisor.com.sg/Profile/dedacain,348375303,17-02-2016,5,Excellent,what a view on both lines. we took tickets of both the cable car and enjoyed the view. Best part when it enters into building and come out from there. No claustrophobia for wife. since children were in universal studio doing all dangerous ride we decided to do cable car since our age was not permitting to do rides. Its beautiful experience. Dr jain,12-2015,Couples,2020-01-29 19:18:34.994262
,1,11,https://www.tripadvisor.com.sg/Profile/Henk H,347216618,13-02-2016,5,Bretah taking,"We caught a taxi from the hotel to the cable car a ride of 20 minutes and costing 7 dollars very cheap. The cable car ride was great & very enjoyable, on arrival finding that there was another cable car ride going across the island & was included in the ticket. Great ride as well & you see the place from the comfort of the car above the tree tops.",02-2016,Couples,2020-01-29 19:18:35.392676
,1,11,https://www.tripadvisor.com.sg/Profile/Ceamur A,343530461,29-01-2016,5,Nice trip,I reccomand taking this trip. if you wish to visit Sentosa ispand and some other places from the island i suggest to buy a combo ticket with all the other activites because it'a a better deal for you.great view over the island.,01-2016,Couples,2020-01-29 19:18:35.735845
,1,11,https://www.tripadvisor.com.sg/Profile/Daya V,343219348,28-01-2016,4,Good experience,Good ride. Not much queue even on weekends. We took the Mount Faber + Sentosa line. Both the lines were good. Would have been exciting if there had been some glass bottomed cars to make it more thrilling.,01-2016,Couples,2020-01-29 19:18:36.097567
,1,11,https://www.tripadvisor.com.sg/Profile/VivaHawaii,343209430,28-01-2016,5,Worth a Visit,"The main destination for the Singapore Cable Car is to go from the main city to Sentosa Park. Even if you are not planning to spend the day at Sentosa, this cable car ride is worth taking in. You'll get a great view of the city, harbor, and Sentosa.",03-2015,Couples,2020-01-29 19:18:36.504560
,1,11,https://www.tripadvisor.com.sg/Profile/TravelStudio,342997177,27-01-2016,4,Exciting View,"If you Want to have a Bird Eye View of Sentosa this is the Ride which you need to take , though its a shared ride but you will love to see the view of sentosa",12-2015,Couples,2020-01-29 19:18:36.849426
,1,11,https://www.tripadvisor.com.sg/Profile/George B,342943499,27-01-2016,3,A Very Expensive Trip,"The Singapore Cable car has been upgraded since we last visited.

The cable car runs form Sentosa island to Harbourfront terminal and then on to Mt. Faber.

The cable car is very expensive to ride - there are no one way fares and the fare for a return trip is $SG26 each - no discount.

As a result most people now take the monorail from the new Harbourfront terminal (some 150m away) - the cost is $SG 4 each way. The new harbourfront terminal is at the entrance to Harbourfront metro station.

At the Mt Faber terminal ther is no public transport form the top to the bottom - no bus service etc - so you either walk down the hill or catch the cable car back to Harbourfront. At Mt. Faber there is only an expensive restaurant - even the lookout is now closed and can not be accessed.

As a result the most popular route to access Sentosa Island is now the monorail.

However the view across the bay to Singapore is spectacular to say the least - but comes at a price",01-2016,Couples,2020-01-29 19:18:37.173040
,1,11,https://www.tripadvisor.com.sg/Profile/denleigh,342736182,26-01-2016,5,A great morning,"This cable car from Mt Faber to Sentosa via Harbour front is a wonderful experience.Not only do you have the three stops above to explore, you have a new cable car which goes from one side of Sentosa Island to the other when you get there - this is included in the price and gives access to most of the attractions of Sentosa.",01-2016,Couples,2020-01-29 19:18:43.166484
,1,11,https://www.tripadvisor.com.sg/Profile/anshuman_goswamy,342550719,25-01-2016,5,Great views and experience,"While Sentosa Express is a faster option of reaching your destination at Sentosa Island, this one tops the chart for the stunning views it offers. The ride takes you over the docks and gives you a bird eye's view of the waterpark, beach Sentosa Merlion and entire Sentosa Island. Worth the ride.
P.S. - don't fall for ""ride with marvel characters"" charade and make your ride unnecessarily expensive.",02-2015,Couples,2020-01-29 19:18:43.523626
,1,11,https://www.tripadvisor.com.sg/Profile/rikk_rikk,342484612,25-01-2016,3,Only to see veiw,"I recommend Cable car only if you want to see the view of Harbour Port. There Cable Car rides one from Harbour Port to till sentosa isalnd and second is within sentosa island. from First carble car line (harbour point) also known as old line, you can see Port and sew with big ships and few part of sentosa island (resorts, water park). From other line (also know as new line) you can see almost all attraction points (all Beach, Tiger tower, Parajump etc ). You need to buy tickets both each cable car (together / separately/ one line). I suggest buy tickets online from local dealers.",01-2016,Couples,2020-01-29 19:18:43.894044
,1,11,https://www.tripadvisor.com.sg/Profile/Jadiel K,342083772,23-01-2016,4,Not unique but enjoyable-avoid going in the afternoon due to convectional rain,Its ideal for viewing the port & parts of the thrilling Sentosa Island. If you are lucky you can pass on top of cruise ships docked near harbourfront station. Don't go in the afternoon if you are uncomfortable with humid conditions.,01-2016,Couples,2020-01-29 19:18:44.211344
,1,11,https://www.tripadvisor.com.sg/Profile/srk800,341680490,21-01-2016,5,Amazing,Just loved the cable car .Though a short 10-15 minute journey but breath taking views and just fabulous travel to sentossa.Recommend travel from Mount faber to sentossa,01-2016,Couples,2020-01-29 19:18:44.615120
,1,11,https://www.tripadvisor.com.sg/Profile/AGMB5,341610143,21-01-2016,4,Very Nice!,"The cable car ride is a unique experience which shouldn't be missed at all . It's a bit expensive but worth seeing as the ride is memorable you can use it one way see the beautiful sea below and the boats along side the pier..But 2-way is much better, as you can also alight at The Faber Peak for a quick nature walk.",09-2015,Couples,2020-01-29 19:18:44.949960
,1,11,https://www.tripadvisor.com.sg/Profile/Pete_Gill_W,341338773,20-01-2016,2,No good just to go to Mount Faber,"We were being jolly lazy and only wanted an easy way to go up to Mount Faber. We got the MRT to Vivo City and walked to the cable car station. We queued for 20 minutes watching staff treat customers with total indifference. We were then told we could only go up to Mount Faber if we purchased a SGD$26pp ticket that included the entrance fee to Sentosa Island - all tickets include this entrance fee, want it or not!
We overcame our laziness and walked up th small hill and back in about 90 minutes (at a stroll).",01-2016,Couples,2020-01-29 19:18:45.322622
,1,11,https://www.tripadvisor.com.sg/Profile/Delightfully_Davis,340588362,17-01-2016,3,Expensive views,"We found the cablecar rides to be very expensive, even when coupled in an attraction package. We were also put off because the staff assured us that the cablecars would run until 1:00am on New Year's Eve, but they closed them down early and we had to walk across the bridge instead. The views are fantastic, but the ride is short. I would recommend riding the cable cars back and forth a few times for the view alone so you feel you get your money's worth out of the ticket.",12-2015,Couples,2020-01-29 19:18:45.709304
,1,11,https://www.tripadvisor.com.sg/Profile/Tarn1971,339823047,14-01-2016,5,Amazing view!,Loved the cable ride. We went over to Sentosa and travelled around in the cable car and the views were amazing. After our visit to Sentosa we up to Faber for a cocktails. Loved every moment of it.,01-2016,Couples,2020-01-29 19:18:46.029966
,1,11,https://www.tripadvisor.com.sg/Profile/Vicki M,339045509,11-01-2016,4,Great way to get to Sentosa,"We got a train to the HarbourFront MRT and hopped on the cable car from the HarbourFront station. We arrived about 10:15am and the line for tickets was massive (we were there during the Christmas/New Year's period). And the line moved slowly. As we waited, the back of the line kept extending. If you're going to go in the morning, best to get there as early as you can. I think they open at 9am.

When hopping on the cable car, the car moves slowly along the platform so you have to hop on while it's moving. Probably not recommended for anyone with walking difficulties.

The views from the cable car were enjoyable. The glass of the car curves, so if you look behind your seat, you could see directly underneath you. Can be scary if you're scared of heights.",12-2015,Couples,2020-01-29 19:18:46.423725
,1,11,https://www.tripadvisor.com.sg/Profile/Jan B,338843317,10-01-2016,4,Great harbour views,"We took this cable car ride as a stop off the Hop On / Hop Off bus tour. Although is was Christmas time, we did not experience any lines, and had a fabulous view of the harbor on our way to Sentosa. Down side is either riding back up and waiting for next bus, or getting a taxi back to town, as this area is quite a ways away from the downtown area.",12-2015,Couples,2020-01-29 19:18:52.403676
,1,11,https://www.tripadvisor.com.sg/Profile/Heidi C,338042773,07-01-2016,5,What a way to see the sights,"Little clear pods with a clear view all around, windows that open enough to let some fresh air in and a small fan to cool you down when it gets a little warm. Take the trip up to Mt Faber hop off and take a walk in the beautiful parklands. Wander down to the sundial that points out countries and things of interest. Hop back into your pod for the trip to Sentosa out over the Ocean, the resorts and pools. We hopped back on for the last part of the trip back to the half way point, but you can catch the train out from Sentosa if you wish. wonderful opportunity for loads of photos.",11-2015,Couples,2020-01-29 19:18:52.769184
,1,11,https://www.tripadvisor.com.sg/Profile/Brian C,337830781,06-01-2016,3,Clean and great views but expensive option,"THe cable car trip to Sentosa island is generally offered as a complex option of packages with various multi-ride and or entry to various attraction on Sentosa. The views are great, however in our case somewhat subdued by weather. It isn't cheap and I understand that at peak times there can be queues. We we there in early JAnuary so the queues were very short. There are extensions over the length of the island which have lovely views over the beaches and rainforest.",01-2016,Couples,2020-01-29 19:18:53.146820
,1,11,https://www.tripadvisor.com.sg/Profile/Okarchitect,337515604,05-01-2016,4,Aerial Highway,"After arriving by Metro, the walk thru the Mall was short and easy directions to the ticket counter. Recommend planning your day and activities prior to securing Tickets. Both directions to island and the Mount is an easy ride and good view. Sometimes wait for the que line.",12-2015,Couples,2020-01-29 19:18:53.563000
,1,11,https://www.tripadvisor.com.sg/Profile/kimmberly49,337420840,05-01-2016,3,Taxi problem,The tickets are sold as return not single.....good job we wanted to go one way back to mainland which was great but at mnainland we waited 30 mins for taxi in the end went back and caught taxi from shopping mall at harbour stop but even then took another one hour but it was xmas!!,12-2015,Couples,2020-01-29 19:18:53.854995
,1,11,https://www.tripadvisor.com.sg/Profile/acrgreen,337167462,04-01-2016,4,Fantastic views,We took the Cable car to and from Sentosa Island all I can say is what views. Downside the queue for tickets.,12-2015,Couples,2020-01-29 19:18:54.230212
,1,11,https://www.tripadvisor.com.sg/Profile/Stevejshaskey,336843959,03-01-2016,4,Good fun and great views,"My wife and I had the great opportunity to travel to mount Faber on the cable car.

There is a couple of different lines to travel and the staff were helpful with advice on which route to take to get the most from the trip.

The cable car goes quite high, but the smoothness and comfort of the cars worked well to relax my wife, who is uncomfortable with heights sometimes.

We were lucky as it wasn't that busy, but I imagine it can be sometimes.

We spent a couple of hrs getting on and off the cable car having a look around etc, and we're glad we weren't rushed.

We had a good experience on the cable car and would recommend it if you have the time.",11-2015,Couples,2020-01-29 19:18:54.630184
,1,11,https://www.tripadvisor.com.sg/Profile/562jemmaj,336396331,01-01-2016,3,Great view of the city to Sentosa Island.,"There was four of us that went there in a taxi up the winding hill to the venue. It was $30 per adult to get to Sentosa Island via the cable car. There is good ventilation in the cable car and lights for at night.

You can see a great span of the city and also the Sentosa Island. You go through one of the buildings as well.",07-2015,Couples,2020-01-29 19:18:54.963737
,1,11,https://www.tripadvisor.com.sg/Profile/olatorres,336373344,01-01-2016,4,Way to sentosa,We rode this cable car located in Harbour Front Station. I think it was 25 Singapore dollars. It is a good experience but the trip distance was very short. It was hot when we were inside the cable car. It was noon when we got here. The cable car is made of glass.,02-2015,Couples,2020-01-29 19:18:55.312609
,1,11,https://www.tripadvisor.com.sg/Profile/RobndAnge,336354860,01-01-2016,5,SO MUCH FUN!,I went with my partner on the cable car to access universal studios and the aquarium I had more fun on the cable car than them both! Well worth it as it was a highlight of our trip.,02-2015,Couples,2020-01-29 19:18:55.669802
,1,11,https://www.tripadvisor.com.sg/Profile/averya312,705095856,01-09-2019,3,Great views but overpriced,The view was nice but it wasn’t worth $33 sg dollars. The car doesn’t have ac so it was stuffy. I would save your money and look for cheaper ways to get to the island.,08-2019,Solo,2020-01-29 19:19:26.857880
,1,11,https://www.tripadvisor.com.sg/Profile/taylorpurcell,695311132,04-08-2019,5,Better than I expected by far,"This was such a cool experience. Taking a cable car to a man made island paradise is something you definitely can't do most places. It was run very efficiently, I had no wait. When you arrive on Sentosa (island) there's a surprisingly cool gift shop - reasonably priced unique trinkets. The way back is a little more complicated as you take two cars and that confused me - but to be fair I had spent the day at Universal, Hard Rock etc and I was exhausted and not 100% sober. The signage isn't unclear, it's just a longer walk than I thought.",02-2019,Solo,2020-01-29 19:19:27.256819
,1,11,https://www.tripadvisor.com.sg/Profile/BigChrisKenney,691586379,22-07-2019,5,Truly beautiful views,"I went from the beach to Mount Farber in 40 min.

There are two tracks for the cable cars. I took both. It is a good and fast way to get the the big southern island. It is common to see the locals use it as well. Te full day trip price is 35SGD, but for just 4 extra dollars, you can get a year round pass. It is just super hard to get that pass. Great views of southern Singapore.

To get the pass, you have to go back to the station that you bought your ticket from, then tell them you want to pay for a year pass. They will instruct you to go to a website then you have to wait two weeks for confirmation and I stopped there.

You can get a family pass as well.",07-2019,Solo,2020-01-29 19:19:27.585045
,1,11,https://www.tripadvisor.com.sg/Profile/barfiner,681160799,13-06-2019,4,Nice view and pricey,"I done this one time, its office is located behind the aquarium. It was safe and i got a nice view. Recommended but it doesn't go very high",06-2019,Solo,2020-01-29 19:19:27.944664
,1,11,https://www.tripadvisor.com.sg/Profile/sandra t,677529859,30-05-2019,5,Fantastic,I have a real thing about cable cars so this was a must do. Really enjoyed it and went mid week so had cable cars to myself. Fabulous views and scenery. Loved it.,05-2019,Solo,2020-01-29 19:19:28.307549
,1,11,https://www.tripadvisor.com.sg/Profile/187dunc,674107011,15-05-2019,2,Please don't waste your money,"When you go to the ticket office, it gives the impression that you can get a cable car ticket for $18. But that isn't the case. It's $35. Considering the short journey and the cash cow at the other end of it. Please don't waste your money. This truly truly isn't worth it. Simply go to a tall building nearby and go to the top floor, it'll be far cheaper and you'll get the same view.",05-2019,Solo,2020-01-29 19:19:28.658166
,1,11,https://www.tripadvisor.com.sg/Profile/dadhas,670033125,29-04-2019,5,GREAT IF YOU LIKE HEIGHTS,Unfortunately I was petrified as i'm not good with heights but was determined to try it. The views were spectacular and the cable car was sooooo high we had to change midway. Everyone loved it.,04-2019,Solo,2020-01-29 19:19:28.966100
,1,11,https://www.tripadvisor.com.sg/Profile/peediewife,664662633,08-04-2019,4,Very enjoyable,"Unlike some reviewers, i found that as it was quiet, I only shared 1 of my 3 journeys with another person. The views were great and really demonstrated that singapore is a major port and sentosa is singapore’s blackpool!",04-2019,Solo,2020-01-29 19:19:29.352182
,1,11,https://www.tripadvisor.com.sg/Profile/788riyab,662224934,30-03-2019,5,This is an amazing trip!,"One ticket covers quite a lot, so taking a few trips back and forth in the cable car, is a good investment! you can buy a cheap ticket on klook.com, they answer all emails too. :)",03-2019,Solo,2020-01-29 19:19:29.685108
,1,11,https://www.tripadvisor.com.sg/Profile/Matthew_Penfold,662136007,30-03-2019,1,Ticketing system is poor,"I purchased a ticket for the cable car to go from mount father to Sentosa from the Sentosa online store. I received an electronic ticket which includes tickets for the aquarium and universal studios. I got off the train at harbour front and took a tiresome walk up to mount Faber. At the ticket counter I’m told I can’t redeem my ticket at the ticket kiosk.
I’m very disappointed, I’m told to go back to harbour front to redeem my ticket and there’s apparently small print on my ticket that says to do so.
Very poor instructions and the ticket seller made no effort to assist me.
Not impressed",03-2019,Solo,2020-01-29 19:19:29.963251
,1,11,https://www.tripadvisor.com.sg/Profile/mcmahon_t,659536564,19-03-2019,5,Flying without wings,Although expensive at S€30 for the round trip from Sentosa to Mt Faber the experience should not be missed and provides some great photo opportunities.,03-2019,Solo,2020-01-29 19:19:35.985684
,1,11,https://www.tripadvisor.com.sg/Profile/lefebo,656340779,04-03-2019,4,nice and comfortable,"not cheap, to be honest but worth the money! one can step out and walk around the forest park with lots of food/drink",02-2019,Solo,2020-01-29 19:19:36.310446
,1,11,https://www.tripadvisor.com.sg/Profile/lrose1014,655257174,27-02-2019,5,Great way to Sentosa,A great way to get to Sentosa. Great views! doesn't feel like you up in the air. The cable car ride is smooth.,02-2019,Solo,2020-01-29 19:19:36.614352
,1,11,https://www.tripadvisor.com.sg/Profile/Roderick J,649572246,02-02-2019,5,Stunning Views,"The nice views one can get from this cable car will last in our memories. You have to go to Sentosa, climb to its highest peak and then enjoy! For those who enjoy Starbucks there´s one very close.",12-2018,Solo,2020-01-29 19:19:36.981441
,1,11,https://www.tripadvisor.com.sg/Profile/Travelbug291,643152513,03-01-2019,5,Stunning Views,"Last here in 1983 an amazing changing landscape was to be expected, however I could not have imagined the transformation. The whole harbour area transformed from a dry dock to soaring apartment blocks overlooking a swimming pool. No better way to see it all than by the very comfortable cable car offering 360 degree views. Fantastic",12-2018,Solo,2020-01-29 19:19:37.305080
,1,11,https://www.tripadvisor.com.sg/Profile/silverjym,642308784,30-12-2018,5,It's a fun way to go to Sentosa,"I took the hike up to Mt. Faber (easy hike). Cable car is really worth doing once. If you want to go by yourself, just tell attendant. They are very accommodating.",11-2018,Solo,2020-01-29 19:19:37.590266
