REVIEW_INDEX,WEBSITE_INDEX,POI_INDEX,REVIEWER_URL,REVIEW_ID,REVIEW_DATE,REVIEW_RATING,REVIEW_TITLE,REVIEW_BODY,DATE_OF_EXPERIENCE,TRIP_TYPE,REVIEW_CRAWLED_TIME
,1,11,https://www.tripadvisor.com.sg/Profile/Darnel-HDI,450433287,08-01-2017,4,A Nce Experience,With this cable car you will pass above the water. You can enjoy and take picture of Sentosa Island and Singapore Ports. It was a nice experience.,09-2016,Family,2020-01-29 19:03:21.953167
,1,11,https://www.tripadvisor.com.sg/Profile/escapebo,450079107,07-01-2017,5,"Easy, Safe & Comfortable","We used Cable car system to get Universal Studios. Easy to navigate, really comfortable system. Nice to see around from high.",12-2016,Family,2020-01-29 19:03:22.286850
,1,11,https://www.tripadvisor.com.sg/Profile/Trishsue60,449706951,06-01-2017,5,Great way to see the sights,"Can be long queues to get tickets, but worth the wait, 2 lines both offer great views, everything was clean and reasonably priced",12-2016,Family,2020-01-29 19:03:22.620425
,1,11,https://www.tripadvisor.com.sg/Profile/JKKDelhi,449608721,05-01-2017,5,Great views,Use the cable car across both routes - Mount Faber and Sentosa Line. Exceptional Views of blue seas... port of Singapore. There are deals to get the tickets cheaply so watch out for them. They also click your photos so if you are interested get them too.,12-2016,Family,2020-01-29 19:03:22.950991
,1,11,https://www.tripadvisor.com.sg/Profile/Ingy13,449462124,05-01-2017,4,Wonderful views,Great views. We used the cable car to travel from the Mount to Sentosa Island. Probably worth visiting if in Singapore.,12-2016,Family,2020-01-29 19:03:28.847636
,1,11,https://www.tripadvisor.com.sg/Profile/Sajith709,449219377,04-01-2017,5,Don't miss this,"If you are going to sentosa, don't miss to take cable car. Its not required to take the ticket from Mount Faber. Harbout station to Sentosa itself will give you a nice experience. Try to book both ways so that you can get both day and night views. Anyway there are lot of activities in sentosa. A day at sentosa is not enough.",12-2016,Family,2020-01-29 19:03:29.187882
,1,11,https://www.tripadvisor.com.sg/Profile/Trevor S,449213567,04-01-2017,5,Best way to approach Sentosa,If you are planning to spend a day on the resort island of Sentosa then this is an ideal way to approach it. You get excellent views back across the city but can also get birds eye views of the attracions on the island.,12-2016,Family,2020-01-29 19:03:29.548771
,1,11,https://www.tripadvisor.com.sg/Profile/dvkn,448432416,02-01-2017,4,Amazing view,"Gives a beautiful view of the entire city. If you are afraid of heights like me, and avoided flyer, this is better, as unlimited ride comes as package.",12-2016,Family,2020-01-29 19:03:29.901617
,1,11,https://www.tripadvisor.com.sg/Profile/vivekshandilya,448234248,01-01-2017,5,A ten minute of awesome beauty.,"This is one of the highlights when you go to Sentosa Island. I tried all , mono rail, cab and Cable car. I loved this one. Moreover between Sentosa stations you can take this as many times as you like ...",12-2016,Family,2020-01-29 19:03:30.260382
,1,11,https://www.tripadvisor.com.sg/Profile/Anshuman_Gautam,447190911,28-12-2016,5,For Indian tourist - A must try,This was my first cable car experience. Happy to say that I was not disappointed. It was an amazing experience hanging so high with some breathtaking view.,12-2016,Family,2020-01-29 19:03:30.606535
,1,11,https://www.tripadvisor.com.sg/Profile/naoura1,447135102,28-12-2016,5,yes take it,go there to enjoy the experience and all the views . if you are scared of heights then you will probably get scared a bit,07-2016,Family,2020-01-29 19:03:30.956524
,1,11,https://www.tripadvisor.com.sg/Profile/KGB777,446825715,27-12-2016,4,Nice views,"Decided to get the annual pass for $135. This wasn't the most efficient process, but once you have it you're set for the year and it gives access to the original cable car and the newer line across Sentosa. Great views. Better to visit in the morning to avoid the crowds.",12-2016,Family,2020-01-29 19:03:31.357522
,1,11,https://www.tripadvisor.com.sg/Profile/poyntonrob2,446605880,26-12-2016,4,Great views,"If we want aerial views of Singapore then this is a must do activity but if you are scared of heights it will be a challenge, particularly in windy weather. Definitely the best way to travel to Sentosa!",12-2016,Family,2020-01-29 19:03:31.649668
,1,11,https://www.tripadvisor.com.sg/Profile/shirlcb,446361301,24-12-2016,5,Beautiful Views,A nice way to get scenic views of Sentosa Island. You can hop on and off at every station if you have time or just take a round trip and enjoy the view. Sunset view from Mount Faber was beautiful so plan your visit.,12-2016,Family,2020-01-29 19:03:32.010990
,1,11,https://www.tripadvisor.com.sg/Profile/blairkk25,446178231,23-12-2016,5,Best Way To Go To Sentosa Island,"My wife, two children and I visited Singapore in June 2016. We took the Singapore Cable Car to Sentosa Island. Going there the views of Sentosa Island were great and going back the views of the Singapore skyline were great. On Sentosa Island, you can change to another cable car to go to Universal Studios. Your best deal is to buy a one-day pass for the cable car.",06-2016,Family,2020-01-29 19:03:37.817531
,1,11,https://www.tripadvisor.com.sg/Profile/SABY M,445540413,20-12-2016,5,Breath Taking View,Must ride the cable car to Sentosa...amazning areial view of the city and perfect to take some nice picture of the city and Sentosa.,12-2016,Family,2020-01-29 19:03:38.162971
,1,11,https://www.tripadvisor.com.sg/Profile/JoB1618,445141359,19-12-2016,5,Another must do in Singapore,Fun little trip for the whole family. Scenic and a different way to get back to accommodation on Sentosa Island from shopping centre. Conveniently located,12-2016,Family,2020-01-29 19:03:38.519920
,1,11,https://www.tripadvisor.com.sg/Profile/hdriller,445034619,18-12-2016,5,Interesting Ride,"Very modern cable cars. It's an interesting ride from Mount Faber to Sentosa Island. You can see very good view of the surrounding.

The tickets include the cable car rides on Sentosa island as well.

At the ticket counter, you can get many discounted tickets to the different attractions on Sentosa Island.

Recommended for first time visitors to Singapore.",12-2016,Family,2020-01-29 19:03:38.840743
,1,11,https://www.tripadvisor.com.sg/Profile/ninipatriciaaquino,444823274,17-12-2016,5,good view and relaxing,"Like Singapore Flyer, it provides good view of the city. Staff were friendly. This is a good way to go to Merlion Tower, Madame Tussauds, Sentosa.",12-2016,Family,2020-01-29 19:03:39.201961
,1,11,https://www.tripadvisor.com.sg/Profile/monika084349,444761764,17-12-2016,5,Lovely views,"Smooth ride, easy access and friendly staff make this a lovely option for travel across Sentosa. We chose a package along with the observation tower and butterfly house. Really worth it.",12-2016,Family,2020-01-29 19:03:39.560264
,1,11,https://www.tripadvisor.com.sg/Profile/FM121,444749053,17-12-2016,5,Family vacation,Friendly staff at the ticket counters. Beautiful views from the cable car. There are stops along the cable route to get out and explore.,12-2016,Family,2020-01-29 19:03:39.879216
,1,11,https://www.tripadvisor.com.sg/Profile/Nikita Y,444676002,16-12-2016,5,High up in the sky..,"A great view around from this cable car, it travels from the mainland to an island. We could view most of the Singapore bay area. We happened to ride right over a cruise docked under.
Going through this cable car can be a little scary for acrophobics, but don't worry just get in and enjoy the view around.",11-2016,Family,2020-01-29 19:03:40.190512
,1,11,https://www.tripadvisor.com.sg/Profile/Cecilia S,444268210,14-12-2016,2,Not that interesting,"There are cheaper options if you’re just trying to get from point A to point B. Yes, the cable cars offer nice views, but other than the theme parks, there’s really not much else to see. Recommended if you are pressed for time and just want to have a quick and easy overview of Sentosa. Otherwise, just stick to the casino and call it a day. Or just skip Sentosa altogether",11-2016,Family,2020-01-29 19:03:40.560745
,1,11,https://www.tripadvisor.com.sg/Profile/andyros2014,444161448,14-12-2016,4,A nice way to go to Sentosa,"We took a return trip to Sentosa Island – it’s great to take a 15 min ride above the port, especially if you like ship spotting. You can also use the cable car to travel along the Island between the various attractions or take the long tour to the mountain. We saw people having lunch in the cars while traveling so it’s another idea of how to enjoy both a meal and a ride in the sky.
We got a day ticket with iVenture pass so admission was free for us.",11-2016,Family,2020-01-29 19:03:40.950575
,1,11,https://www.tripadvisor.com.sg/Profile/neelesh2016,443904275,13-12-2016,4,Easy way to get to Sentosa,Easy way to see parts of Sentosa Island and you can map out where things are. Also the ticketing place has special on for all the activities.,12-2016,Family,2020-01-29 19:03:46.710658
,1,11,https://www.tripadvisor.com.sg/Profile/bigtupai,443623858,12-12-2016,4,Excellent view but short ride,"Took the cable car ride from Mt Faber to Sentosa, we reached around 11am and there was no queue at all. If there is long queue, they will put max 8ppl in 1 cabin, since no queue four of us just took 1 cabin. During the ride from Mt Faber, you can see trees at first, then the harbourfront area with cruise ships and ferries. Passing by the Harbourfront, on the way to Sentosa, you can see apartments, Resort world, sentosa cove and the dolphin lagoon - we were able to see dolphins jumping out of water too. There was no aircond in the cabin, so during sunny hot day, be prepared to sweat and the small fans in the cabin don't have any effect at all. Overall, we enjoy the ride very much.",12-2016,Family,2020-01-29 19:03:47.080962
,1,11,https://www.tripadvisor.com.sg/Profile/helencathcart,442965257,09-12-2016,4,Great views.,Very well run and operated. Great views looking out to Sentosa Island. This is a great family activity.,12-2016,Family,2020-01-29 19:03:47.447401
,1,11,https://www.tripadvisor.com.sg/Profile/sandgrounder1,442590006,07-12-2016,3,Average,Paid for the 3 part journey only to find that the middle part was closed thus lsing the chance for the location attractions,12-2016,Family,2020-01-29 19:03:47.757205
,1,11,https://www.tripadvisor.com.sg/Profile/WoonT,441929038,04-12-2016,4,Good view,"I am living in Singapore and had not ride the cable car since I was a little kid. Took my 6 year old on his cable car ride as he insisted.

It was nice to see familiar scenes from above like the Adventure Cove waterpark.

I bought the Mount Faber and Sentosa line package. We got down at every single station and walk around. Nice way to spend an afternoon. Located different places to visit when I next drive into Sentosa.",12-2016,Family,2020-01-29 19:03:48.070579
,1,11,https://www.tripadvisor.com.sg/Profile/amitabhal,441648332,03-12-2016,4,Efficient and smooth,"It's a cable car linking Sentosa island with the city. Each car can carry upto eight people, although six is more comfortable. It is worth buying a return ticket from Faber peak, although transportation from there is a bit expensive after sundown.",11-2016,Family,2020-01-29 19:03:48.408252
,1,11,https://www.tripadvisor.com.sg/Profile/Admw_uk,440110109,26-11-2016,4,Must do,"On our day to check out Sentosa island we decided to go via cable car as wanted to do before going home. Heading to Mt. Fabled got the chance to see that neighbourhood which was lovely and bought ticket across to Sentosa, there is a stop before that to vivo city. Great views and chance to see Sentosa attractions you may not see or have tickets for. Nice going over the ocean to the island.",11-2016,Family,2020-01-29 19:03:48.750558
,1,11,https://www.tripadvisor.com.sg/Profile/observerThane,439860093,25-11-2016,4,great ride great views,"the ride itself is not too long maybe around 15mts maximum. online booking reference no needed. there is an easy kiosk facility which will deliver all your tickets--of cable car as well as of the entries in sentosa-nice! harbour is a station on the way from mount faber to sentosa. you can get in at harbour or mount faber.while coming back there is some issue. If you get down at mount faber(last stop) sometime you dont get a taxi--you need to walk down and yet it could be a problem. We got down at Harbour but harbour being busy we had to wait in queue for 20-25mts.
the ride is lovely --the view down is awesome!",11-2016,Family,2020-01-29 19:03:49.139490
,1,11,https://www.tripadvisor.com.sg/Profile/Divya B,439855340,25-11-2016,4,Nice but take the shorter ride,"Its one of the many attractions at Sentosa. Ridding many feet above ground in a transparent capsule is thrilling. But do choose between the Tiger Tower, Singapore eye and this if youre on a budget.
If you do enjoy cable cars try the shorter ride should you wish",11-2016,Family,2020-01-29 19:03:49.523767
,1,11,https://www.tripadvisor.com.sg/Profile/Vikas P,439425058,23-11-2016,5,Thrilling experience...,"If you like thrill, you should surely go for this and you should take a ticket for the complete round, thrrough this you would be able to see the whole Singapore from the top.",11-2016,Family,2020-01-29 19:03:49.857381
,1,11,https://www.tripadvisor.com.sg/Profile/Nkocak,438659615,20-11-2016,5,Breathtaking..,"We went to Imbiah Lookout and bought a combined ticket for both lines, one for Mount Faber and one for Sentosa. Both are breath taking. You can have a rest in a nice cafe at the top of Mount Faber and then continue your journey. We fell in love with Sentosa once again when we had this tour. Highly recommended.",11-2016,Family,2020-01-29 19:03:55.747020
,1,11,https://www.tripadvisor.com.sg/Profile/Jazzydzioba,438649256,20-11-2016,2,"If you have been on a cable car, don't bother",This cable car is so expensive for what it is and then you get to Sentosa and have to pay more money again if you want to go on the one there. Totally regretted this decision. I paid online so got it a little cheaper and only used it 1 way as we stayed late on the island and got the train back instead. Save your money for something more worthwhile.,11-2016,Family,2020-01-29 19:03:56.094647
,1,11,https://www.tripadvisor.com.sg/Profile/Ray S,438460224,19-11-2016,5,Great way to access Sentosa,The cable car ride was excellent and very much enjoyed on our visit to Sentosa. We were able to see many places of interest from the air as we travelled. A solid floor on the cars dispelled concerns about heights.,08-2016,Family,2020-01-29 19:03:56.450469
,1,11,https://www.tripadvisor.com.sg/Profile/Vishwas K,438433819,19-11-2016,4,fun for kids and adults,"One of the must do activity, can be used during your travel to santosa, gives good scenic view of harbor and city",11-2016,Family,2020-01-29 19:03:56.813500
,1,11,https://www.tripadvisor.com.sg/Profile/alanleslies2016,438376579,19-11-2016,5,birds eye view,"travel across the harbour to Sentosa Island whilst getting a ,birds eye view of cruise and container ships , as well as the city and waterfront developments.. Cheap and better than rail link",11-2016,Family,2020-01-29 19:03:57.147293
,1,11,https://www.tripadvisor.com.sg/Profile/shehwaz,437681741,16-11-2016,4,Unique,"Travelling by the cable care is a unique way to view the city from above. Travelling from
the hills upto Sentosa Island, you are transported pretty quicky while hanging above the city. I am the only one in my family scared of heights and i was dreading the thought of travelling through it. Thankfully it was very safe and i got a see something new and lovely.
Recommended for a ride.",10-2016,Family,2020-01-29 19:03:57.492608
,1,11,https://www.tripadvisor.com.sg/Profile/AjalP2,437364826,15-11-2016,5,Very Nice,Very Nice Experience of Singapore Cable Car. Family must go through it. which give very nice view of City of Lion. Must See place,11-2016,Family,2020-01-29 19:03:57.818434
,1,11,https://www.tripadvisor.com.sg/Profile/Sumit595,437335461,15-11-2016,5,Great Ride on Singapore Cable Car,Very well managed Cable Car in the Sentosa area. the place is clean and staff helpful. The views from this Cable car is awesome. A must Visit.,11-2016,Family,2020-01-29 19:03:58.211489
,1,11,https://www.tripadvisor.com.sg/Profile/Muzza211,436432663,11-11-2016,5,Great view travelling to Sentosa Island,"Great way to see the sights while travelling across to Sentosa Island. The view of the entire Singapore area was spectacular.
We spent the whole day at Universal Studios and did not see any other part of the island as we ran out of time. We needed at least one more day to see it all.",10-2016,Family,2020-01-29 19:03:58.544398
,1,11,https://www.tripadvisor.com.sg/Profile/Sarah T,436277069,11-11-2016,4,Family Trip,We took the cable car at the end of the day after Universal Studios. Was nice and relaxing and well organised from ticket purchase to ride.,11-2016,Family,2020-01-29 19:03:58.924096
,1,11,https://www.tripadvisor.com.sg/Profile/kuldeep D,435014565,06-11-2016,4,Fairly Good,"This is perhaps better than Singapore flyer. Instead a slow motion movement, this gives a much better view of Singapore from above. All in all an exciting place.",10-2016,Family,2020-01-29 19:04:04.798766
,1,11,https://www.tripadvisor.com.sg/Profile/Priya P,434855297,05-11-2016,5,A great experience,"Take the cable car ride to Sentosa from the main land and you will never regret it. It provides such a beautiful arial view of sentosa, sea and the mainland that you wouldnt want the journey to end. While returning back the lights are a treat. One cable car can accommodate upto 6 people if you want to go in group.",11-2016,Family,2020-01-29 19:04:05.192307
,1,11,https://www.tripadvisor.com.sg/Profile/_rashfeeq,434175625,03-11-2016,5,Great views,"The cable car took us to Mt Fabre then to Sentosa island, we got off had lunch at MT Fabre and a walk to Fabre point. It was nice, we could have done some trekking there, but we didn't have time.",10-2016,Family,2020-01-29 19:04:05.551702
,1,11,https://www.tripadvisor.com.sg/Profile/Jim_Duncan,433815868,02-11-2016,5,Long weekend,Not for the fear of heights kind of people - this is a very nice way to see the surrounding area head to the top and enjoy a cool drink,10-2016,Family,2020-01-29 19:04:05.933818
,1,11,https://www.tripadvisor.com.sg/Profile/iamcrystalmaiden,433616508,01-11-2016,5,"Up, up and away",WOW! I'm actually afraid of heights but with this one you won't feel too scared because it's not shaky or anything. The ride was calm and steady. Plus we had a great view of the city.,05-2016,Family,2020-01-29 19:04:06.299469
,1,11,https://www.tripadvisor.com.sg/Profile/Paul M,432915131,30-10-2016,4,Good views,"The cable car is a must do in Singapore giving great views of sentosa island and the singapore dock area.
The ticket purchase gives you a round trip ticket so you can catch it at mount faber, spend the day on Sentosa island then catch the cable car back in the evening.
I didn't bother with the sentosa line so can't comment on that line, not sure the Sentosa line would be worth it.",10-2016,Family,2020-01-29 19:04:06.640867
,1,11,https://www.tripadvisor.com.sg/Profile/YakoobS2,432326658,28-10-2016,4,Must ride the cable car if you visit Singapore,"If you are visiting Singapore then this ride is a must. You can relax and have a wonderful bird's eye view of the Island. Even though it is little bit expensive, it is worth the price and the memories will stay with you for life.",10-2016,Family,2020-01-29 19:04:06.938882
,1,11,https://www.tripadvisor.com.sg/Profile/wihte_sandy_beach,432279432,28-10-2016,3,"Interesting, but felt like in an oven","Interesting, one can see Harbour Front and Sentosa area from different angle. Certain things only can be seen from high above.

Too bad, I took the ride around late morning or noon. Inside the Cable Car was super hot, felt like in an oven. There is little fan which doesn't really help in hot humid weather of Singapore, especially during summer. That is an area where management could do something to improve it.",08-2016,Family,2020-01-29 19:04:07.255688
,1,11,https://www.tripadvisor.com.sg/Profile/2Bim,431512864,25-10-2016,4,Kids love it,Not only is it a great way to get to or from Sentosa but every child who has gone on it with us have loved it. The views are fantastic and the cable cars are very comfortable and well maintained.,07-2016,Family,2020-01-29 19:04:07.657349
,1,11,https://www.tripadvisor.com.sg/Profile/Mikey H,431494116,25-10-2016,5,"A fun, alternative way to travel in Singapore","We took the cable car from Mount Faber over to Sentosa Island during a recent family holiday to Singapore, the views from the cable car are spectacular and the ride is an enjoyable one, well worth checking out.",10-2016,Family,2020-01-29 19:04:07.930943
,1,11,https://www.tripadvisor.com.sg/Profile/Lovetootravel03,431137074,24-10-2016,4,Relaxing ride,"A lovely way to spend a morning is to ride the cable car in Singapore to Sentosa Island. As we did not have a lot of time, my daughter and I opted not to get off but to simply continue on a round trip just to experience the view and enjoy the ride. We thoroughly enjoyed it and look forward to next visit to Singapore when we can get off at Sentosa and have a look around. Even so we were very happy and would recommend it",10-2016,Family,2020-01-29 19:04:13.684444
,1,11,https://www.tripadvisor.com.sg/Profile/Kavoor,431074641,24-10-2016,4,Its very good worth taking,"We had taken Hongkong cable car with glass bottom that was really amazing . Still this was worth taking . It exciting an good view we used this during 3pm . it was warm and good view . We saw this was operating during night also . I think it was worth ride during night .But not sure . We used this to reach sentosa , which was part of the setosa package",10-2016,Family,2020-01-29 19:04:14.010579
,1,11,https://www.tripadvisor.com.sg/Profile/Mirjana P,429629011,19-10-2016,4,Skyhigh...,"If you are frightened of heights, this is not for you. Otherwise, a nice ride to Sentosa and back. Kids love it.",01-2016,Family,2020-01-29 19:04:14.340663
,1,11,https://www.tripadvisor.com.sg/Profile/yusuf_andry,429052652,18-10-2016,4,Singapore fun cable car ride,Fun day to ride cable car together with family. Starting from mount faber cable car station to sentosa cable car station. in the end back all the way to harbourfront cable car station,10-2016,Family,2020-01-29 19:04:14.644239
,1,11,https://www.tripadvisor.com.sg/Profile/akdow74,428063819,15-10-2016,4,Transport with a view,"The cable car ticket is priced highly but is a great way to look around several places with the one ticket in a hop on, hop off format. Mount Faber, Siloso Point and Sentosa Island are all worth looking around. Each cable car leg provides great views from the elevated position.",10-2016,Family,2020-01-29 19:04:15.004536
,1,11,https://www.tripadvisor.com.sg/Profile/nannieglennis,427451374,13-10-2016,5,Wow,"This was an experience, when we first left the station was very panicked but as the trip progressed the views far out weighed the panic,the return trip at night was truly beautiful seeing all the ships lit up and the city lights everywhere.",10-2016,Family,2020-01-29 19:04:15.309275
,1,11,https://www.tripadvisor.com.sg/Profile/Jamal M,423520056,29-09-2016,5,Amazing Cable Car,"The revamp cable car that connects Sentosa island with the main land provides a new experience compared to the ""old"" ones that we tried back in 2009. The Cable Car is more stable and not very susceptible to wind. Safety features have been enhanced greatly. It is worth a try.

As we stayed at the Festive Hotel within the Universal Studio, the cable car provides transportation to the Harbour Front. Very easy ride and all round availability from Imbiah Station just next to the Merlion Statue helps the tourists to reach the Vivocity for a quick shopping trip.",09-2016,Family,2020-01-29 19:04:15.630994
,1,11,https://www.tripadvisor.com.sg/Profile/DilhanJ,422382272,26-09-2016,4,nice views,took the trips into and on the sentosa island and the views from the cable car are superb. the ride on sentosa had a zip wire going under and we saw some riders on the zip wire too. worth visiting.,08-2016,Family,2020-01-29 19:04:15.930568
,1,11,https://www.tripadvisor.com.sg/Profile/JohanLi70,422335522,26-09-2016,5,Fantastic view!,Fantastic view over central/western Singapore and Sentosa/Keppel. Cars are modern and clean. Pricing model makes it sensible to buy a year card which is abit annoying.,08-2016,Family,2020-01-29 19:04:16.271283
,1,11,https://www.tripadvisor.com.sg/Profile/amarisliu,421352524,23-09-2016,5,Enjoyable Ride,We took our young kids on the cable car ride and they totally enjoyed it. Some of the staff are friendly (but there's room for improvement) and the waiting queue is reasonable.,09-2016,Family,2020-01-29 19:04:16.588129
,1,11,https://www.tripadvisor.com.sg/Profile/wooy,421105703,22-09-2016,5,Excellent,"A wonderful experience, with wonderful views of Singapore and Setosa island. Well worth the price and a must do event.",09-2016,Family,2020-01-29 19:04:22.439582
,1,11,https://www.tripadvisor.com.sg/Profile/Haps101,419866981,18-09-2016,4,cable car to sentosa island,"This is the cable car which takes you to Sentosa island, which is a theme park island, with an aquarium, water parks & a beach. We bought an unlimited cable car ticket, so we could visit both cable car lines as many times as we wanted! The views from the cable car are amazing of Sentosa. The tickets are moderately priced",08-2016,Family,2020-01-29 19:04:22.740878
