REVIEW_INDEX,WEBSITE_INDEX,POI_INDEX,REVIEWER_URL,REVIEW_ID,REVIEW_DATE,REVIEW_RATING,REVIEW_TITLE,REVIEW_BODY,DATE_OF_EXPERIENCE,TRIP_TYPE,REVIEW_CRAWLED_TIME
,1,30,https://www.tripadvisor.com.sg/Profile/Dee S,602011279,02-08-2018,4,Chinese Japanese Garden,"Interesting and peaceful place with some fantastic, and very old, bonsai trees. Surprised by the large monitors wandering around the place And it's free",07-2018,Couples,2020-01-30 05:47:31.179719
,1,30,https://www.tripadvisor.com.sg/Profile/pete p,600304507,28-07-2018,5,Peaceful and relaxing,"5 minute flat walk from the MRT station, take your time and look out for the lizards and squirrels that wander across the pathways. Make sure you visit the turtle museum, really neat experience feeding long beans to turtles. Good view from the tower (lots of steps on a hot humid tho) worth the climb",07-2018,Couples,2020-01-30 05:47:31.546301
,1,30,https://www.tripadvisor.com.sg/Profile/fitnfifty,597205379,18-07-2018,5,WATCH OUT,Enjoyed most of our time at the Chinese Gardens except when the HUGE monitor lizards ran towards me. One was 3 mtr long and huge. I was between them and the lake and they must have been spooked so were running towards me. Apparently they are common all over Singapore well maybe a sign around the gardens would be a great help. So KEEP your eyes open I got quite a fright.,06-2018,Couples,2020-01-30 05:47:31.925024
,1,30,https://www.tripadvisor.com.sg/Profile/208erwinh,595908778,13-07-2018,5,Oasis,"A big, beautiful park with awesome gardens all well maintained. The best is to go explore the park is to take a bike (slow speed) Nearest MRT station: (Green line) EW 25 Chinese Garden Entrance fee. FREE",03-2018,Couples,2020-01-30 05:47:32.266528
,1,30,https://www.tripadvisor.com.sg/Profile/PeterB11369,589099932,20-06-2018,5,Very popular,"Whenever I visit Singapore, I always visit these lovely gardens, so well maintained and very popular, even if it’s free. A credit to the designers and grounds people.",06-2018,Couples,2020-01-30 05:47:32.606317
,1,30,https://www.tripadvisor.com.sg/Profile/ghng2017,588707325,19-06-2018,5,"Good location, nice scenery and F.O.C.!",A tranquil place best visiting during early morning and late evening. Good spot to jog and stroll around the parks. There are fishes and turtles in the ponds. Best is its F.O.C.!,03-2018,Couples,2020-01-30 05:47:38.373627
,1,30,https://www.tripadvisor.com.sg/Profile/ShanmugamPalaniappan,586296687,10-06-2018,5,Don't visit on Sunday,"Chinese garden and Japanese garden both are in the same place. It is very hot place, drinking water and toilet available in many places. Can take some good photos. If you plan to go with family avoid Sunday, because many Romeo will be there it will make embarrass you. If you plan to visit all place then you need at least 3 to 4 hours. There is no entrance fee.",04-2018,Couples,2020-01-30 05:47:38.726788
,1,30,https://www.tripadvisor.com.sg/Profile/gabbyxiu,582829297,26-05-2018,5,Awesome Garden !,"Easy to find. Choose MRT to Jurong and stop in Chinese Garden Station. Walk 10 minutes from station. Free entry! (You can walk or rent bicycle) I recomend you to bring/buy some water. They had 2 long ways (to Japan & to China)
Need 3-5hours tour round & takes photos. Very beautiful garden (onsen inside hehe.. bridge, temple etc)

Love to comeback soon..",05-2018,Couples,2020-01-30 05:47:39.111985
,1,30,https://www.tripadvisor.com.sg/Profile/GeorgieB288,580734309,17-05-2018,4,Lovely Japanese/Chinese style gardens,"This was a lovely place to walk or cycle around. Saw some Monitor Lizards, Otters, Turtles and birdlife. Was very relaxing and gorgeous scenery. Just a shame there is so much construction going on before you actually reach the gardens, had to park at a temporary carpark some distance away. But once in the gardens it was well worth the visit.",05-2018,Couples,2020-01-30 05:47:39.424630
,1,30,https://www.tripadvisor.com.sg/Profile/Kevin B,580717988,17-05-2018,4,Nice Gardens,"A train journey from central stations will take you directly to Chinese Gardens Station, very convenient. It is a walking activity so can be tiring if weather hot and humid. The gardens are extremely well maintained and very nice with the highlight being the bonsai display. Large number of plants and the age of some of them is amazing with one tree still going that was started in 1767. Mind blowing.
Worth a visit at least for the exercise.",05-2018,Couples,2020-01-30 05:47:39.735313
,1,30,https://www.tripadvisor.com.sg/Profile/palace68,566243294,13-03-2018,4,Tranquil gardens,This a free well maintained park. As the names states gardens created from the said areas We saw a monitor water lizard. Worth a trip to get away from the marina Bay Area,03-2018,Couples,2020-01-30 05:47:40.085042
,1,30,https://www.tripadvisor.com.sg/Profile/Helen T,565570199,10-03-2018,5,Superb free entry gardens easily reached from the MRT,"Reached by MRT from the Chinese Garden station strait into the park. These are beautiful gardens with artefacts, statues and lakes and it's all free! There's little shade and only one place to by a drink which is at the entrance so wear sunscreen, a hat and take water.",02-2018,Couples,2020-01-30 05:47:40.417322
,1,30,https://www.tripadvisor.com.sg/Profile/nmontesa,564145426,04-03-2018,5,Excellent venues,Nice place to visit and stroll looking at the peace and tranquility of the gardens. It is a place to renew. Almost like a spiritual place to gather ones thoughts. Very worth experiencing.,02-2018,Couples,2020-01-30 05:47:40.751844
,1,30,https://www.tripadvisor.com.sg/Profile/PeterLanky,563523146,01-03-2018,4,Well manicured gardens,"The gardens are reached most easily by MRT at Chinese Garden station, followed by a short walk. As well as the plants, there is a bonsai garden with a large number of trees of different ages.

There is also a 7 storey pagoda to climb and various other buildings to investigate. There are plenty of toilets and drinking fountains.

The Japanes Garden is reached by crossing a bridge over the lake, but has shorter opening hours than the Chinese Garden.",02-2018,Couples,2020-01-30 05:47:41.153159
,1,30,https://www.tripadvisor.com.sg/Profile/docfun,563269036,28-02-2018,5,Best things in life are free,"Singapore has many green open spaces and this park is one of the best. Its about half an hour from the city and well worth the journey. There are so many different aspects to enjoy. It was lovely to see the locals gathering together to play full size cricket matches, families and lots of groups of young lads having picnics. The pagodas are the focal points, but some of the individual gardens are both beautiful and peaceful. Its a great place to people watch and just relax away from the busy city centre.",02-2018,Couples,2020-01-30 05:47:41.523986
,1,30,https://www.tripadvisor.com.sg/Profile/missywombat,562412593,24-02-2018,5,Unplanned visit,"Our taxi driver dropped us off here instead of the botanic gardens but this turned out to be a little gem. Very calm atmosphere with beautiful pagodas, lakes, and a lovely bonsai garden with some very ancient trees.",02-2018,Couples,2020-01-30 05:47:47.484374
,1,30,https://www.tripadvisor.com.sg/Profile/FindinVietnam,562020780,22-02-2018,5,A discovery. Don't miss!,"These gardens are a wonderful tourist attraction, and still you can see that they are enjoyed by the ordinary people from the neighborhood. They are cozy and fascinating in their architecture.",02-2018,Couples,2020-01-30 05:47:47.835120
,1,30,https://www.tripadvisor.com.sg/Profile/747peliny,561811141,21-02-2018,5,Love these gardens.,"I live near the gardens and I love coming back here, taking a walk or cycling every week. Views are fantastic, it gets crowded but never noisy. People take a walk, run or cycle everywhere in the park. You can spot birds, butterflies and monkeys. Last time we spotted a reptile as big as a young crocodile and it was exciting too! If you live in Singapore, you can come and spend an afternoon here. If you are a tourist and want to get a quiet break from the city life, this is also what you're looking for. Get off the mrt at Chinese garden station and you're there.",02-2018,Couples,2020-01-30 05:47:48.160416
,1,30,https://www.tripadvisor.com.sg/Profile/Coopper29,559901059,12-02-2018,4,Tranquil gardens,"Beautiful gardens just a short hop on the MRT to another world. We saw otters in the river, turtles, and a number of water monitors roaming about. A must see garden.",02-2018,Couples,2020-01-30 05:47:48.528142
,1,30,https://www.tripadvisor.com.sg/Profile/alic1988,559713105,11-02-2018,5,Lovely and tranquil,"Lovely find, so tranquil. Really enjoyed it here. It’s a little MRT ride out but easy enough to get to and a short walk from the tram stop. The gardens are so well maintained",01-2018,Couples,2020-01-30 05:47:48.844429
,1,30,https://www.tripadvisor.com.sg/Profile/ccheo,557011219,29-01-2018,5,Hidden Gem,"So beautiful and tranquil. It's like an oasis of peace in the hustle and bustle of Singapore. We were quite impressed by how well-kept the gardens were, and that is is free entry for everyone.",01-2018,Couples,2020-01-30 05:47:49.196321
,1,30,https://www.tripadvisor.com.sg/Profile/Teresa H,544418663,01-12-2017,5,Just quiet and relaxing in beautiful gardens,"The gardens are easy to get to on the MRT just get off at the Chinese garden stop. It is a short walk into the gardens which are free to get in We also go on a clear sunny day in the afternoon, when the light is fantastic for photographs. The whole area is beautiful and well maintained. Lots to look at and well set out. You can go up the pagoda but just stairs. The bonsai garden is interesting and we actually saw a gardener maintaining one bush, It was a delicate performance.There are lots of seats around to absorb the calming atmosphere. It would be a good place to take a picnic. There are no refreshment kiosksin the gardens only a small one at the entrance, so take plenty of water with you,",09-2017,Couples,2020-01-30 05:47:49.581727
,1,30,https://www.tripadvisor.com.sg/Profile/snelson0929,542313087,21-11-2017,5,Very Nice Garden,"My wife is from Singapore, so she was familiar with the gardens, but it had been many years since she had gone. We had done most of the other parks and open spaces, so we were looking for a new place (at least for me, to walk. I suggested this place and she readily agreed.

We were staying in Central Singapore, near Clarke Quay. Travel to the gardens was quite easy. We took a bus to an MRT station and then the East/West (Green) line to Chinese Garden Station. The Garden is a short walk from the station.

The gardens themselves are beautiful and my wife was amazed at how the area had changed since she was last here. We went to the top of the pagoda (7 stories, only stairs) and got a birds eye view of the gardens. Then we looked around the bonsai garden and went over the bridge into the Japanese Garden. Both were immaculately maintained and very relaxing.

A word to the wise, however. This is probably best experienced in the morning and with adequate hydration. It gets quite warm and the facility is much larger than one would imagine.

But it was a definite go for us.",11-2017,Couples,2020-01-30 05:47:49.925440
,1,30,https://www.tripadvisor.com.sg/Profile/Paul L,538294877,04-11-2017,5,Relaxing park,"This park is not as crowded as the gardens by the bay for example. It's still a nice park to relax and have a walk after a working day.
The japanese garden close at 7pm, and the bonsai garden close at 5pm. If you're not in a hurry, you should go there.",11-2017,Couples,2020-01-30 05:47:50.294770
,1,30,https://www.tripadvisor.com.sg/Profile/95dannif,538189397,04-11-2017,5,If you want peace and tranquillity this is fab! Or family gathering perfect,"This place only fund via research. We had spend the day at the bird park and it was late afternoon before we made it here. We walked around part of the Japanese Gardens and I automatically fell in love. Our experiences in Singapore were all rushed and jammed packed to cram it all in, but when I was here, I automatically felt Zen. I really wished I had more time here and it had s much to offer. Word of advise for those wishing to use the toilets, take toilet paper and be warned, the ones I used, the door was so close to you, that my knees hit the door.. Please note I am a short person. If I am in Singapore ever again. I will make this a must and be spending a lot more time here. Walking distance from train station too. BTW, its FREE!!",08-2017,Couples,2020-01-30 05:47:50.682057
,1,30,https://www.tripadvisor.com.sg/Profile/64Travellerone,537837503,02-11-2017,4,A lot of walking,"Started the day with a trip on the MRT (train) and cab to Chinese Gardens. The gardens are interesting but very large. The Live Turtle and Tortoise Museum was a disgrace.
$5:00 entry to see animals in tanks with no water, huddled at rear of fibreglass boxes trying to get out of the sun and heat. Recommend you do not take children to see this, focus on rest of gardens.
Japanese Gardens, wow those Bonsai are so old and grand. Only complaint, need signs pointing to exit of grounds.",10-2017,Couples,2020-01-30 05:47:56.579343
,1,30,https://www.tripadvisor.com.sg/Profile/SagaloutsTour,535392312,23-10-2017,3,Very Peaceful,"Just opposite the MRT station, the first thing you notice is the beautiful padoga. A lovely place to sit and relax, walk around the lake and admire the warrior statues. Ther are no refeshments available apart from a vending machine, so take plenty of water or buy nearby. Best of all it's free",10-2017,Couples,2020-01-30 05:47:56.930514
,1,30,https://www.tripadvisor.com.sg/Profile/PeachP633,533020445,15-10-2017,4,Peaceful,We read about these gardens in a travel article before coming to Singapore and decided to take the MRT for a visit. They are right by the Chinese Garden MRT station and are well worth a visit. They are situated on a lake and if you are lucky you can see turtles and tortoises. The pagoda is beautiful and the warrior statues interesting. The stand out for us was the Bonsai Garden. Be aware there are no refreshments in the gardens so take water. The gardens are free.,10-2017,Couples,2020-01-30 05:47:57.270646
,1,30,https://www.tripadvisor.com.sg/Profile/Edward_LSL,524899621,16-09-2017,4,Nice Slow Experience,"Visited on a nice Saturday afternoon for a picnic and walk. Had a really great time overall just walking around and admiring the quietness. There's a lot of wild monitor lizards, turtles, and birds, but sadly no feeding of animals is allowed. There's plenty of places to just sit down and have heart-to-heart talks. Also, the turtle museum is a must-see!
Unfortunately, the Japanese garden side is rather empty and boring compared to the Chinese counterpart.",09-2017,Couples,2020-01-30 05:47:57.576695
,1,30,https://www.tripadvisor.com.sg/Profile/DerrickColdstream,522763365,09-09-2017,4,Worth a visit,We spent a very enjoyable couple of hours wandering around. Very impressed with the Bonsai Garden. A little oasis of tranquillity away from the hustle and bustle of Singapore.,09-2017,Couples,2020-01-30 05:47:57.892455
,1,30,https://www.tripadvisor.com.sg/Profile/BenjaminSKKK,517917837,27-08-2017,5,Peace and quite Gardens,I really like this place and been there many many times. not a lot of people and enjoy walking around both Chinese garden and Japanese garden. You can cycle a bicycle around outside of the garden it's really nice but be aware there are also lot of people jogging around. take care each other.,07-2017,Couples,2020-01-30 05:47:58.258453
,1,30,https://www.tripadvisor.com.sg/Profile/sakisgreece,501526504,13-07-2017,5,Sooo beautiful and peacefull,"I wouldnt visit this but thank god i visited it. It is at the mrt station ""chinese gardens"". It takes half an hour to arrive there from city centre .after you going out the train station you will see it. It is Sooo beautiful and peacefull place. There is a beautifull pagoda and chinese and japanese traditional buildings.there is a lake full of turtles that kids will love. There is alive turtle museum here that cost 5 s$.there is also a free entrance bonzai museum(little japanese trees). If you have the time visit it. We was there about 1,5-2 hours.",07-2017,Couples,2020-01-30 05:47:58.648790
,1,30,https://www.tripadvisor.com.sg/Profile/mikedR697DX,492599407,13-06-2017,4,Nice place to relax,"The Chinese Garden is a 13.5-hectare garden that is divided into two sections, the Chinese Garden and the Japanese Garden. There are pathways meandering throughout the park with plenty of shade and places to sit.

There is something to see at every turn, be it foliage, statuary, bridge, or some other structure. It is quite easy to spend a couple of hours in the gardens and the best thing of all is that it is free! There is one place in the garden that has a $5.00 admission and that would be the Live Turtle And Tortoise Museum. It's worth a look, there is a pond inside filled with turtles, they actually follow you around looking for food, luckily there is a food box located at the center of the bridge, each packet costs just $1.00.

Even if you don't want to see the turtles go over there anyway, at the entrance there is a nice koi pond to take a look at and it's good for a photo opp.

The gardens are easy to find, just take the East West MRT to the Chinese Garden Station (EW25), exit and walk 300 meters to the entrance.",07-2016,Couples,2020-01-30 05:47:58.963585
,1,30,https://www.tripadvisor.com.sg/Profile/Gazza222,492341320,12-06-2017,4,Brave the heat and take the train,"We did this on a particularly hot day, however it was well worth the effort the gardens are free to enter a beautiful environment to walk around there are plenty of public toilets and water fountains but nowhere really to buy refreshments so make sure you take them with you if needed. Grab a train on the East West line, or if you like simplicity like me the green line it will take you to the Chinese garden railway station about a 20 minute ride from Dhoby Ghaut interchange then a short walk of five minutes and you are there. View from the top of the Chinese pagoda if you are game to attempt it is really worth the effort.",06-2017,Couples,2020-01-30 05:47:59.292331
,1,30,https://www.tripadvisor.com.sg/Profile/John E,490903711,06-06-2017,4,A Hidden Gem,"I had seen pictures of this, but did not know where it was, until now. Although the gardens are a fair way west out of town, use the MRT takes about 30-40mins but well worth it.Entry is free",03-2017,Couples,2020-01-30 05:47:59.653463
,1,30,https://www.tripadvisor.com.sg/Profile/ioana_TravelFYI,490648876,05-06-2017,4,Peaceful nature,Escaping from the 'city' we had a lovely time strolling through the gardens. Very peaceful and a good place to disconnect.,06-2017,Couples,2020-01-30 05:48:05.514517
,1,30,https://www.tripadvisor.com.sg/Profile/SteveAdamson62,490500950,05-06-2017,5,Hidden in plain view. A must see place.,"For an afternoon's walk, you can't do better than these gardens. Ponds and pagodas. Bonzai displays and lounging lizards. This place has it all. Bring your camera and give yourself a couple of hours (or more) and be transported out the vibe and chaotic energy of the city, into an oasis of tranquility that lies hidden in plain view.",05-2017,Couples,2020-01-30 05:48:05.883671
,1,30,https://www.tripadvisor.com.sg/Profile/thomsontrips,488302205,28-05-2017,5,Beautiful,"Bigger than anticipated, beautiful, peaceful , really easy to get to via mrt. Definitely worth a visit",05-2017,Couples,2020-01-30 05:48:06.230539
,1,30,https://www.tripadvisor.com.sg/Profile/JustLoveToFly,485902799,20-05-2017,5,Free to Public and nice sunset,"The Chinese and Japanese gardens are just next to each other or across the bridge to be precise. It is free to public and i did see someone with a dog so i guessed dogs are allowed. Anyway, didn't seem to see any no pets allowed sign.

The gardens are just a few mins away from the Chinese Garden MRT station (along the green line). Once you exit the station, u will see a path right outside the station with trees lining both sides of the path. The gardens are opened daily from 5.30am to 11pm.

I arrived at around 5pm and visited the Japanese garden 1st as Chinese garden (at the Twin Pagoda) is the place to catch sunset. There is a huge lotus pond at the Japanese garden. The tortoise museum is located in the Chinese garden further down from the Twin Pagoda.

These garden are good for jogging, dating or having a picnic. If the day is not too hot, perhaps should visit from 3pm or 4pm to allow more time to visit both gardens before catching the sunset at the Twin Pagoda.",04-2017,Couples,2020-01-30 05:48:06.598020
,1,30,https://www.tripadvisor.com.sg/Profile/Elle1nad,484785041,17-05-2017,5,Calm to escape the city,"Found this place by total chance and was so glad that I did! My boyfriend and I wanted to explore the local area where we were staying and spotted this on the map. Unfortunately the whole park area isn't open as it's under construction but you can still enjoy the Chinese and Japanese gardens!

The care and up keep of the gardens is really lovely and there is some amazing wildlife in there to see too. We saw a 2 monitor lizards; a baby and a huge one, plenty of tortoises in the water and storks! Can spend hours in here walking around as there is plenty to see & best of all is free! Highly recommended.",05-2017,Couples,2020-01-30 05:48:06.984514
,1,30,https://www.tripadvisor.com.sg/Profile/frend09,479170506,26-04-2017,4,Off the beaten track,Go here for some peace and to see what locals do. The Japanese gardens are especially excellent in this aspect,03-2017,Couples,2020-01-30 05:48:07.374578
,1,30,https://www.tripadvisor.com.sg/Profile/Dhruva A,479170343,26-04-2017,5,Soothing,We visited early morning when the weather was nice and cool. The garden is very pretty and I learnt a lot about Japanese gardens.,02-2017,Couples,2020-01-30 05:48:07.731493
,1,30,https://www.tripadvisor.com.sg/Profile/Jane H,476031415,16-04-2017,5,Well worth a trip,"We visited on a Monday, There were very few visitors no screaming kids etc. So unlike the Botanical gardens which are crowded this place was a pleasant respite from the hustle and bustle that is Singapore. The MRT stops so easily found. It is beautifully maintained and we preferred the Chinese gardens to the Japanese. You can climb the pagodas for far reaching views and there are loads of places to shelter should the heavens open.
The only downside was the lack of anywhere to get a snack and a drink so take your own as you can spend hours here.",04-2017,Couples,2020-01-30 05:48:08.113486
,1,30,https://www.tripadvisor.com.sg/Profile/Kyle M,473808878,09-04-2017,5,Pleasant Surprise,"After visiting some of Singapore's more popular locations, the Singapore Zoo and Universal Studios, my girlfriend and I wanted a break from it all, so we visited the Chinese and Japanese Gardens. The two gardens did not disappoint. The area was absolutely gorgeous. The architecture was stunning and did a great job balancing with nature. It truly felt tranquil, specifically with the Malay Water Monitors moving throughout the area. If you're in Singapore and want to visit a less touristy area for a moment of peace and quiet, I highly suggest visiting the Chinese and Japanese Gardens.",04-2017,Couples,2020-01-30 05:48:08.497205
,1,30,https://www.tripadvisor.com.sg/Profile/Jomax100,470434779,27-03-2017,4,A touch of China,"We were looking for a break from the excellent, but very crowded, better known attractions of Singapore so headed for Chinese Garden on the MRT (EW line) where there is an exit leading through a park right to the eastern entrance to the Jurong Lake Gardens, incorporating Chinese and Japanese Gardens.
The 13.5 hectare park was built in 1975 and the Chinese Garden features bridges, pagodas, statues of Chinese heroes, lakes and ponds, a stone boat and tea house, the live Turtle and Tortoise Museum (admission charge) and a stunningly beautiful Bonsai Garden with over 2 000 examples of the art from all over Asia. Follow the winding paths around and over the lake and stop to enjoy the serenity at one of the many shaded resting areas.
We visited on a Tuesday when it was very quiet but, unfortunately, didn't get as far as the Japanese Garden as it started to rain. This is something to look forward to on our next visit.
Let us hope that the inevitable march of progress and urban redevelopment doesn't gobble up this treasure.
Go early, and avoid weekends. Free entry",02-2017,Couples,2020-01-30 05:48:08.898757
,1,30,https://www.tripadvisor.com.sg/Profile/Brenda010,464520743,04-03-2017,5,stunning,"This a beautiful place the Chinese gardens are quite stunning with lots of lovely red bridges and a large lake in the denture with beautiful traditional teahouses around the edge. Fabulous pagodas to visit and climb.
Our very favourite place was the Japanese gardens, a much more compact area but really stunning. With lits of unique white buildings and intricate roof details. Takes your breathe away, just one building after another round every corner. Particularly liked the bonsai trees and and the fish pond with hundreds of koi fish.
We travelled to the gardens from the city centre by MRT which took about 40 mins. There is a stop right outside the gardens.
A must see attraction with lots of locals",02-2017,Couples,2020-01-30 05:48:14.880647
