REVIEW_INDEX,WEBSITE_INDEX,POI_INDEX,REVIEWER_URL,REVIEW_ID,REVIEW_DATE,REVIEW_RATING,REVIEW_TITLE,REVIEW_BODY,DATE_OF_EXPERIENCE,TRIP_TYPE,REVIEW_CRAWLED_TIME
,1,30,https://www.tripadvisor.com.sg/Profile/rajas977,729929833,01-12-2019,5,Best place in Singapore west..,The renovated Gardens look fabulous and great for a kids and family for a day out. The walking paths and view point decks were so scenic.The garden now houses a variety if trees and also houses many artistic statues.. Morning walkers-best walk paths for you..,11-2019,Family,2020-01-30 05:45:50.714516
,1,30,https://www.tripadvisor.com.sg/Profile/Protr,671285769,04-05-2019,4,New Jurong Lake Garden,"A newly redevelop garden for all to enjoy their morning or evening walks. There is a children’s playground too if one is coming as a family. It’s a place for all occasions. Bird watching, exercise, barbecue, site seeing, etc. Definitely worth a trip with friends and family.",05-2019,Family,2020-01-30 05:45:51.081403
,1,30,https://www.tripadvisor.com.sg/Profile/Gints K,661088923,25-03-2019,5,Superb relaxation,After Jurong birds park this was excellent place to walk and rest and this will definitely like to kids as there are lot of things to see - for us it was different horoscope signs in form of sculptures or benches (great for photos) and bonsai trees (some of them more than 100 years old). Also views from pagoda was very good.,03-2019,Family,2020-01-30 05:45:51.419713
,1,30,https://www.tripadvisor.com.sg/Profile/Happychap103,657012287,07-03-2019,4,A bit off the beaten track but worth it,"What a find ! We travelled on the metro , which is elevated much of the way, so a treat to a visitor.There was hardly any one about mid afternoon, so we just meandered around which was super.The pagoda is just open so we climbed to the top, whilst before we had loved the bonsai collection, we even saw otters on the lawns .",01-2019,Family,2020-01-30 05:45:51.788263
,1,30,https://www.tripadvisor.com.sg/Profile/503sergiym,655612687,01-03-2019,5,Must Be Seen,"It is absolutely magnificent. 7 Stories Pagoda, Twins Pagodas, Bonsai Garden, Chinese New Year Characters Park are on Chinese Park Island and Stone Lantern Exhibition on Japanese Island are worth to be seen as well as small and large bridges. Highly recommended to be seen.",03-2019,Family,2020-01-30 05:45:52.089960
,1,30,https://www.tripadvisor.com.sg/Profile/Allison T,653841394,21-02-2019,4,a nice walk,the gardens are very nice to walk through and see the monitor lizards! it is a nice clean garden to have a picnic in - i would recommend for a nice afternoon or morning walk,07-2018,Family,2020-01-30 05:45:52.460451
,1,30,https://www.tripadvisor.com.sg/Profile/Ranushi J,651992404,13-02-2019,5,Tranquil,"One of the easiest parks to get to. Just get off of the chineese garden mrt and take a short walk to the park and you are there! The park is beautifully laid out and if you are looking for some quiet time this is the place to be. Traveling with a tiny baby under the age of two can be hectic. From fish to birds to lizards they have them all here and it sure keeps the little one entertained. Only drawback though is that the park has no eateries within the vicinity so you have to take your own food. It's best to travel in the morning as some of the trails are quite sunny. The park is free to all. Sadly the bonsai garden was closed during my visit. Most pagodas except for a very few are stroller accessible. Beautiful architecture and stunning craftmanship on the statues! Compaired to the botanical gardens this is quite smaller in size. However, this is one of the most quietest gardens I have been to. Will visit often. I'm a true fan!",02-2019,Family,2020-01-30 05:45:52.817507
,1,30,https://www.tripadvisor.com.sg/Profile/faecelinee,650968268,09-02-2019,3,Peaceful Garden,"We went on a saturday afternoon, it is a bit far from the centre but the long journey is worth it to visit this one of a kind garden, it is very unique, and very photo worthy too and the best part is that this garden is free, no entrance fee, anyone can just enter this garden",10-2018,Family,2020-01-30 05:45:53.140673
,1,30,https://www.tripadvisor.com.sg/Profile/venkymaple,634218543,18-11-2018,4,Pleasing visit to Chinese Garden,"I stayed in Jurong East near Jurong Polyclinic. So, I walked 1.5 km to Chinese garden thru Jurong Swimming complex, Yuhua Hawker centre, cross Boon lay way, took Walking trail near Jurong lake and reached there. There is an area between Chinese Garden MRT and the Garden itself. Its huge enough to play some sports like cricket, football and others. I visited with my Brother who was working there. We were roaming all over the Garden. Please visit at slow pace to enjoy the place. During weekend, too much crowd. Pagoda building was awesome to visit. The Garden was clean and well maintained.",06-2018,Family,2020-01-30 05:45:53.481662
,1,30,https://www.tripadvisor.com.sg/Profile/AquaticHawk,630181266,02-11-2018,5,Very interesting,"The giant Pagoda is beautiful, as well as the Bonsai garden. Great place to see if you are staying in Jurong.",09-2018,Family,2020-01-30 05:45:53.843051
,1,30,https://www.tripadvisor.com.sg/Profile/reginapicaully,629512579,30-10-2018,4,Huge garden at the city,Took off from Chinese Garden MRT station. You can see a tall pagoda. It was very hot so you should bring a hat or umbrella. It's a good visit to relax (even though the weather was super hot),10-2018,Family,2020-01-30 05:45:59.885630
,1,30,https://www.tripadvisor.com.sg/Profile/encik_sama,619071142,24-09-2018,4,No Moon Cake Festival / Mid-Autumn Festival 2018 for chinese garden,"Nearest MRT station is Chinese garden Mrt station (EW25).
Need to walk about 6 to 8 mins to Chinese garden east entrance from Mrt station. There are no shelter along the way and beware of steep sloop along it.
There are people cycle that path and do take of it .

Admission is free and Do aware there are opening hour for Chinese garden.
Visited on 23 Sept 2018 eve of Moon Cake festival around 1900hrs.

Abit disappointed that no Moon cake festival / Mid-Autumn Festival event for 2018 in Chinese garden. It used to have event during moon cake festival.

7 Storey Pagoda :
Last time visited Chinese garden about 7 yrs ago and I walked up this pagoda. That time no lift access it . Do note that pagoda has closing hour.

Toilet:
It is available but need to look for it

Smoking:
NO smoking is allowed inside the Chinese garden
Vending Machines:
Didn’t see any vending machine around.
Locker service:
No locker services

The live turtle & tortoise museum:
It was located at Garden courtyard but cease operation around 2018.

Around 1980 to 1990. Singapore Broadcasting Corporation (SBC ) used this place to film their local drama . They used garden chinese scene background for their ancient drama . Area such as Garden courtyard and white rainbow bridge and stone boat.

Conclusion:
No recommended go around sunny day .",09-2018,Family,2020-01-30 05:46:00.274610
,1,30,https://www.tripadvisor.com.sg/Profile/13_christineliau2015,618814546,23-09-2018,4,"Nature Park, Live Turtle and Tortoise Muzium, Pagoda","A great place you can’t miss if you come to the west of Singapore. The garden have many type of trees such as Bamboo and Pine Trees. Those who love Bonsai can visit their bonsai garden opening from 9am to 5am daily. Some even more that hundreds years. For those who love to visit live turtle and tortoise, there is a muzium which you can explore. Overall is a very tranquil park which you can find many things to do there like Cycling, picnic, jogging, walking. You never get bored to visit the park.",09-2018,Family,2020-01-30 05:46:00.690960
,1,30,https://www.tripadvisor.com.sg/Profile/Yunz27,612137869,30-08-2018,5,Nice place to chill,Love coming here to chill and take pretty photos (on days where it's not super hot). It is just across Chinese Garden MRT station so it is very convenient if you're taking the MRT.,08-2018,Family,2020-01-30 05:46:01.040532
,1,30,https://www.tripadvisor.com.sg/Profile/tripleA1232015,605768221,13-08-2018,5,Great,lots of photo opportunities here great day out for all ages well marked easy to navigate bring water and wear sunblock,06-2018,Family,2020-01-30 05:46:01.413919
,1,30,https://www.tripadvisor.com.sg/Profile/Bells5544,594312651,09-07-2018,4,Immaculate Gardens,"The Gardens themselves are beautiful and immaculately looked after. It is a little way out of the CBD but worth the trip and easy to get to via MRT.

Our family of four went during the middle of the day and it got very very hot and made the experience a little enduring, considering there is such a large area to explore. I would make this activity an early morning or later afternoon activity.",06-2018,Family,2020-01-30 05:46:01.763922
,1,30,https://www.tripadvisor.com.sg/Profile/RajuG5,592309326,02-07-2018,5,A beautiful place filled with plants and wildlife,"The garden is close to a military air base so you can see quite a lot of fighter jets and military helicopters flying overhead. There's also a tall tower and if you climb up to the top of the tower you can see a magnificent view. Overall, the area is well kept and there is also a live turtle and tortoise museum boasting the largest collection of turtles and tortoise.",06-2018,Family,2020-01-30 05:46:02.104977
,1,30,https://www.tripadvisor.com.sg/Profile/PushExplore,580282110,15-05-2018,5,Gorgeous Gardens,"It was quite a long drive away to see these beautiful Chinese and Japanese Gardens, but once you are here you will love it. The Pagodas look amazing and the garden offers a lot of exciting photo opportunities. Do check it out if you have a few hours to spare.",09-2017,Family,2020-01-30 05:46:02.518711
,1,30,https://www.tripadvisor.com.sg/Profile/ektanlain,558497977,05-02-2018,5,"Beautiful park, and it's free","I went to this park at May last year. I went there with my mom and my sister. As a backpacker, of course we looked for cheap or free tourism place, so this garden become one of our list.
We went there by mrt, then walk slowly around 15 minutes to reach the garden. The garden is in front of mrt station, so really easy to find. The gardens is very large, so please prepare your own mineral water, wear hat/umbrella if needed, wear comfortable shoes, bring snack if you want and of course please wear sun block.
There are 2 gardens, chinese and japanese. But Japanese garden was at renovation so i just take picture in front of it. Both of them are sooo beautiful.
It was not popular among traveler that time, so usually only resident near here who visit. When we visit it, it kinda private garden coz only few who came here. My mom was so happy and very enjoy this garden.",05-2017,Family,2020-01-30 05:46:02.822071
,1,30,https://www.tripadvisor.com.sg/Profile/chew eng o,558489929,05-02-2018,5,A Fantastic Garden not to be missed.,"Chinese Garden – Singapore.
The easiest way to the Chinese Garden in Singapore is by MRT that has a station just outside the garden. The station is rightly named Chinese Garden Station. The MRT (mass rapid transit) station entrance or the East Gate where the Red Bridge leads to the garden. The main gate or West Gate at Yuan Ching Road with the Main Arch Building is at the opposite end. The White Rainbow Bridge will take you across to two courtyards, namely the “Early Spring Courtyard” and “Garden Courtyard” and a fishpond in the center which is named the “Fishes Paradise”. The White Rainbow Bridge, a unique 13-arch bridge that was modelled after the famous 17-arch bridge at the Summer Palace in Beijing, China,

Chinese Garden is a large park with an area of 135,000 square meters in Jurong East, built in 1975 and designed by Professor Yuen-chen Yu from Taiwan and modeled on Chinese gardening art of imperial architecture and landscaping. It is opened daily from 6am to 11pm and entrance is free.
From the Garden there is a connecting bridge that leads to the adjacent Japanese Garden. A visit the both the gardens would be a good ideal for the attraction of two contrasting garden concepts. It would however take a strenuous effort of up to two hours of footwork. Many kiosks or huts dotted the both gardens to entertain the weary feet of visitors and to shelter from the hot sun and the unsuspecting rain.
Upon entrance via the MRT entrance a Red Bridge will lead the visitor to a seven floor pagoda that provides a useful lookout point. Four stone lions are stationed at the head of the Red Bridge to welcome the visitors. We found the climb up the pagoda quite fascinating as we navigate and stop at each floor to enjoy the views. The pagoda is actually two stories high per floor which makes the actual height fourteen stories. You can see the entire garden plus a good portion of the Japanese Garden from the top. At the base of the pagoda are statues of eight of the famous heroes of ancient China, seven male and one female, that was the famous lady general Hua Mulan.
You should engage a map or consult the directory posted at both entrance to navigate to all the rich features that the garden has to offer. Apart from the impressive East Entrance and the Main Arch Building, the Pagoda with the features of Heroes of folklore China at the base, the Stone Lion, the lovely White Rainbow Bridge, the Stone Boat and Tea House, the Garden of Abundance, the Bonsai Garden, and Pavilion, Plateau and Tower are the features not to be missed. There is also Live Turtle and Tortoise Museum which a small entrance fee is charged.",10-2017,Family,2020-01-30 05:46:03.170384
,1,30,https://www.tripadvisor.com.sg/Profile/Nkocak,556789583,28-01-2018,5,Tranquility,A hidden gem in West Coast. Peace and tranquility. It takes around 1 hr to walk both gardens. So beautiful. No cafes as such so be prepared and bring some snacks and water with you,01-2018,Family,2020-01-30 05:46:09.072418
,1,30,https://www.tripadvisor.com.sg/Profile/Roshan G,555453649,22-01-2018,4,Scenic place,This is one place where you can appreciate nature and see all the beautiful trees and greenery all around,02-2017,Family,2020-01-30 05:46:09.392470
,1,30,https://www.tripadvisor.com.sg/Profile/vipi0017,554889223,20-01-2018,5,Turtles,Went here because of Turtles museum which my son just loves . Entrance is only 5 S$ . The park itself is nice with small Bonsai trees . Best part is that its not crowded as located bit far from centre,08-2017,Family,2020-01-30 05:46:09.713314
,1,30,https://www.tripadvisor.com.sg/Profile/RaymondTan1014,553409867,12-01-2018,5,Free and interesting place,"It was one of the places of attractions in Singapore that draw huge crowds during CNY and Mooncake Festivals. Now it's more of a place for walks and viewing of turtles, monitor lizards and spaces for kids to run.

Good place to spend the evening with self prepared food and drinks.",12-2017,Family,2020-01-30 05:46:10.106684
,1,30,https://www.tripadvisor.com.sg/Profile/ContinentsExplorer,540911428,14-11-2017,4,Great outdoor beyond the shopping spree,Nice garden though accessibility is a little challenging for those who’s not driving. Nevertheless great outdoor space for visitors wanting to have a different experience beyond shopping.,11-2017,Family,2020-01-30 05:46:10.452448
,1,30,https://www.tripadvisor.com.sg/Profile/tasyaz2015,529822704,04-10-2017,5,Free Entrance and So Peaceful,"I came here just because i was looking something new in singapore (this is my 5th time in sg). Went by mrt, chinese garden mrt station. When we got out of the station it was all greenyard so peaceful except theres cricket game but overall it was nice, when we arrived at the front of the gate, we could see the pagoda, and i was like “this is no singapore at all” i felt like i was in some other east country. Strolling around and took some pictures and it was relaxing.",09-2017,Family,2020-01-30 05:46:10.764123
,1,30,https://www.tripadvisor.com.sg/Profile/KGB777,525051275,17-09-2017,4,Attractive park in the far west,"We came out here again today with the primary intent of visiting the turtles and tortoises, but the park is hard to avoid when here. Unfortunately there seems to be some pretty major construction kicked off in the immediate vicinity of the gardens which detracts a little from the overall experience. But the gardens remain very attractive and not too crowded, even on a Sunday.",09-2017,Family,2020-01-30 05:46:11.164650
,1,30,https://www.tripadvisor.com.sg/Profile/John L,520501747,02-09-2017,3,Very plain and average looking gardens,"Went to the Chinese Gardens on a Friday afternoon and the place was flooded and overcrowded with people (probably a few hundred), and don't expect to see any beautiful scenery/gardens. It's certainly not a place where you can relax, take nice photos or have a pleasant stroll, worse still the gardens were fairly ordinary, unimpressive and not well maintained, with nothing much to write home about. Quite a disappointment really.",09-2017,Family,2020-01-30 05:46:11.487386
,1,30,https://www.tripadvisor.com.sg/Profile/nie0301,497848162,02-07-2017,5,Amazing place,I came here at 11 o'clock....so...it's very hot I recommend if you want to visit...early in the morning or at 4 or 5 o'clock The place is really good...my family really enjoy this place Very beautiful And free of charge,07-2017,Family,2020-01-30 05:46:11.892852
,1,30,https://www.tripadvisor.com.sg/Profile/TjoekFie,497030733,29-06-2017,4,Always good to have a visit here,"This place is free within MRT stop.
So we always have a visit whenever we're in Singapore. It has nice Pagoda to take picture with, nice Chinese structure like bridge and house. Turtle museum is also nice to see.

One thing for our group is the long pathway to walk from MRT stop (Chinese Garden - EW line/green line). We travel with my in-laws (2 elder) and have to slowly walk to the entrance.",06-2017,Family,2020-01-30 05:46:12.290600
,1,30,https://www.tripadvisor.com.sg/Profile/Jothilingam E,495043576,22-06-2017,5,Beautiful gardens,Nice place to visit especially with children and aged parents too Send time with snacks and other any eatables here Nice to play with children,04-2017,Family,2020-01-30 05:46:18.342252
,1,30,https://www.tripadvisor.com.sg/Profile/292ellay,495009080,22-06-2017,4,Great Pagoda,"It is so easy to access this garden. You just need to take MRT and stop in Chinese Garden (green line). then walk around 7mins from the MRT to the garden. Free enterance.
I arrived at around 5 p.m. It was so quiet there. Some people did jogging and exercise. First I decided to visit Japanese garden but it was far to the left side of the garden. Then my mom and I decided to explore the Pagoda instead. We were tired.
Inside the Pagoda there was 7 lvl to be reached. When u reached the top, u could see the view of the garden. Beautiful & quiet for the great evening.",06-2017,Family,2020-01-30 05:46:18.687275
,1,30,https://www.tripadvisor.com.sg/Profile/306ruthd,485358459,18-05-2017,5,Beautifull Garden,There are 2 gardens in this place. The Chinese and the Japanese one. Both garden are intersted. On Chinese Garden you can see twin pagoda and statue of Chinese Hero. On Japanese you can see a red beautifull bridge.,03-2017,Family,2020-01-30 05:46:19.071546
,1,30,https://www.tripadvisor.com.sg/Profile/Jacqui R,484001176,14-05-2017,5,Unexpected gem ...,"After seeing all of the 'normal' highlights in Singapore, I handed the responsibility of picking the days adventure to mum .. she scoured the map and picked this amazing place. Well done mum!!

The gardens are beautiful, the walks easy and OMG .. the bonsai (or should I say Ponsai - did you know that Bonsai's started in China and were actually called Ponsai!!) garden was amazing as were the giant Koi and turtles.

A lovely few hours spent strolling through the gardens ... truly a hidden gem.",05-2017,Family,2020-01-30 05:46:19.430433
,1,30,https://www.tripadvisor.com.sg/Profile/May Y,480226908,30-04-2017,5,Serene gardens with beautiful views,Chinese and Japanese gardens are located near the Jurong lake are the best calming spot in Singapore. The pagodas offer beautiful views of the lake area. They have turtle museum also. A must visit in Singapore.,04-2017,Family,2020-01-30 05:46:19.763298
,1,30,https://www.tripadvisor.com.sg/Profile/Arielleeeee_c,473171632,06-04-2017,5,Hidden gem,"It's a hidden gem located at Jurong East. There are nice architectures and structures. It's really quiet and if you love walking, you can enter Chinese Garden and walk all the way to Japanese garden and back. It's just located outside the Chinese Garden MRT station and it's free!",03-2017,Family,2020-01-30 05:46:20.161505
,1,30,https://www.tripadvisor.com.sg/Profile/Wenox,471652247,31-03-2017,4,Nice tranquil garden,"The garden was located just outside the Chinese Garden MRT station. At first, I was unsure about the place since it was not crowded at all (there were only some locals exercising there, maybe because it was weekday). To my surprise, the Chinese Garden is actually a very nice place. The seven-storey pagoda, Chinese heroes statues, twin pagodas by the water, tea house, bonsai garden, bridge were all very photogenic. The fact that this place had only few visitors made it even better. Unfortunately, I didn't get the time to explore the Japanese Garden because I had to go to another place. If you're planning to visit, don't forget to bring umbrella (as the weather may get very hot and humid during the day) and water bottle (there were lot of drinking water fountains) to keep you hydrated.",03-2017,Family,2020-01-30 05:46:20.514741
,1,30,https://www.tripadvisor.com.sg/Profile/Eva M,467060566,14-03-2017,5,amazingly beautiful and quiet,We took our small kids there and had a lovely afternoon. The garden is incredibly beautiful and much nicer than a lot of other more advertised places in Singapore. The outdoor Turtle Museum was heaps of fun for the kids. They could feed the turtles and even saw a monitor lizzard. A must see in Singapore as it also reflects on Singapore's Chinese heritage that you can lose sight of with all the modern attractions.,03-2017,Family,2020-01-30 05:46:20.844188
,1,30,https://www.tripadvisor.com.sg/Profile/John B,462840146,26-02-2017,4,Stroll through a Chinese and Japanese Garden,"A very large garden with various focal points, Zodiac, Trees, Bonsai, Pagodas, Bridges. If you look carefully near water you may be lucky enough to see crocadile size water monitors.",02-2017,Family,2020-01-30 05:46:21.208889
,1,30,https://www.tripadvisor.com.sg/Profile/tal03,461410765,20-02-2017,5,Something different,If you are interested in Chinese & Japanese culture this is a place you must definitively visit. No entrance fee. Took us at least 2hrs to roam around & take pictures,07-2016,Family,2020-01-30 05:46:21.573354
,1,30,https://www.tripadvisor.com.sg/Profile/yourtravelbuddysg,446868534,27-12-2016,4,Tranquil and serene,"These two gardens have been here for a very long time. The gardens are well maintained over the years. During the evening and early morning, I can see many old folks and residents staying nearby exercising in the park. Very good sceneries around the garden. Certain parts of the gardens really feels like one which we find in china.",12-2016,Family,2020-01-30 05:46:27.515630
,1,30,https://www.tripadvisor.com.sg/Profile/blairkk25,446178675,23-12-2016,4,"Nice Walk and Park with Chinese and Japanese Temples, Pagodas, Bridges, Gates","My wife, two children and I visited the Chinese and Japanese Gardens after our visit to the Jurong Bird Park. The park was a very nice place to walk and had Chinese and Japanese temples, gardens, pagodas, bridges and gates. If you plan to go to Singapore and want another nice place to go, I would go here. The taxi driver told us that there were plans to close the park in 2017 but I am not sure about that.",06-2016,Family,2020-01-30 05:46:27.877442
,1,30,https://www.tripadvisor.com.sg/Profile/guterman45,442124221,05-12-2016,4,Special green place,Easy getting there with bus or mrt its a big beautiful and free entrence. Spent there 2 hours with the kids. The buildings are so nice and its well taken care of. A little bit far from other places but if you need green and quite its a dreamy place to visit. I have never been in a chinese garden before so its look just like in the picture. Very nice.,11-2016,Family,2020-01-30 05:46:28.246028
,1,30,https://www.tripadvisor.com.sg/Profile/benjaminb286,440788374,29-11-2016,4,Chinese and Japenese Gardens,"It's nice to see this big and green garden amidst the densely populated Jurong Town. We can view both gardens conveniently as they are linked via a nice oriental bridge. It's a great place for exercise, phototaking,family bonding, picniking etc. The landscape and architecture befits the culture and history of the two gardens. People can also enjoy the panoramic view of the town of Jurong from the tallest level of the pagoda by climbing the many flights of stairs. If the time is right, you can also spot migratory birds there, which is quite a rare sight. Another plus point is that admission is free.",11-2016,Family,2020-01-30 05:46:28.636985
,1,30,https://www.tripadvisor.com.sg/Profile/EaglevisionLowe,437411368,15-11-2016,3,Evening walk in the gardens,"An older style open park with oriental gardens and buildings. It was one of the first gardens built in Singapore , hence a little dated. Nevertheless it is interesting and a good place for an evening walk .",02-2016,Family,2020-01-30 05:46:28.935876
