REVIEW_INDEX,WEBSITE_INDEX,POI_INDEX,REVIEWER_URL,REVIEW_ID,REVIEW_DATE,REVIEW_RATING,REVIEW_TITLE,REVIEW_BODY,DATE_OF_EXPERIENCE,TRIP_TYPE,REVIEW_CRAWLED_TIME
,1,31,https://www.tripadvisor.com.sg/Profile/RehutaiR,455120531,27-01-2017,4,Great photo opportunities,A great spot to take photos! Fits in well with the surrounding modern architecture and if you happen to be in the area you may as well walk across the bridge.,12-2016,Couples,2020-01-30 06:00:42.288793
,1,31,https://www.tripadvisor.com.sg/Profile/OutnAbout007,454330919,23-01-2017,4,Stunning piece of architecture,"Just along from the equally impressive Marina Bay Sands Hotel, the Helix Bridge is amazing. Walk across at night when it's lit, beautiful. Metal footway so would be slippery when wet.",11-2016,Couples,2020-01-30 06:00:42.647936
,1,31,https://www.tripadvisor.com.sg/Profile/FarAway687774,454059797,22-01-2017,5,Asami,So Big hotel Wonderful place staff so good and smart service Spa so nice want to be back again and agian,02-2016,Couples,2020-01-30 06:00:42.940268
,1,31,https://www.tripadvisor.com.sg/Profile/Sue999029,453487210,20-01-2017,5,Lovely pedestrian bridge enables walk from Gardens to Singapore Flyer passing shopping mall,"Really good route to or from Singapore Flyer/ Gardens on the Bay. Big Marina Sands Mall is awesome for upmarket shopping. Also near to Marina, boat trips and theatre.",01-2017,Couples,2020-01-30 06:00:43.245894
,1,31,https://www.tripadvisor.com.sg/Profile/berenicewatersm,453450562,20-01-2017,5,A great place to view this wonderful iconic building.,A great place to view Marina sands Iconic building and symbol of singapore's modernity and garden city status.,01-2017,Couples,2020-01-30 06:00:43.595967
,1,31,https://www.tripadvisor.com.sg/Profile/Nightwire,453438026,20-01-2017,5,A subtle 'link' of who we all are,"I remember seeing The Helix bridge for the first time and thought simply - how cool..

It is a piece of artwork in itself and as you walk across the bridge other than just being functional, you can see how much thought was put into its design with viewing platforms stretching out giving great views across the bay, and other small details such as the individual floor lights showing part of the makeup of a DNA Helix. Look out for these floor lights with letters as you walk across.

Extremely well thought out displaying subtly a part of who we all are and in a fun way. Reminding us that we are 'linked' to all things :D

Very beautifully lit up at night. Fabulous.",02-2016,Couples,2020-01-30 06:00:43.981254
,1,31,https://www.tripadvisor.com.sg/Profile/2017traveller2017,453218656,19-01-2017,4,Unique,A very unique bridge designed in the shape of a Helix. Take the bridge at night to walk to Marina Bay Sands area.,12-2016,Couples,2020-01-30 06:00:49.803605
,1,31,https://www.tripadvisor.com.sg/Profile/JustLoveToFly,452104212,15-01-2017,4,Nice Bridge for Photo Taking,This is a bridge that is lights up at night. It links people from MBS to Marina Float and verse versa. One can take a nice view of MBS and Art Science Museum from this bridge. It's popular amongst tourists and locals.,01-2017,Couples,2020-01-30 06:00:50.192267
,1,31,https://www.tripadvisor.com.sg/Profile/Brenda B,451839626,14-01-2017,5,Fantastic views but take an umbrella if it's sunny!,"Despite living in Singapore for more than 5 years, I had never walked on this bridge. My bad - the views from the Helix are breathtaking! The only potential downside: it can be incredibly hot as the Helix metal reflects the sun. So you might want to wear sunscreen or take an umbrella foe protection. Also, if you go around 6 pm, the sun is in a beautiful location for some interesting photos.",01-2017,Couples,2020-01-30 06:00:50.574027
,1,31,https://www.tripadvisor.com.sg/Profile/mraiisi,451482127,12-01-2017,5,amazing,"so beautiful at night, its highly recommended for a lovely night walk with your love, dont miss it, full of lights",12-2016,Couples,2020-01-30 06:00:50.898335
,1,31,https://www.tripadvisor.com.sg/Profile/Beth W,451391039,12-01-2017,5,Great Walk,"Well marked, easy to follow route to Marina Sands Hotel complex. Kept remarkably clean...as is all of Singapore. Well lit at night.",12-2016,Couples,2020-01-30 06:00:51.208349
,1,31,https://www.tripadvisor.com.sg/Profile/Toby K,451168699,11-01-2017,3,DNA,"The Helix bridge is super modern structure. A work of art based on the code of DNA, a great structure of polished stainless steel pipe and bracing, stainless steel woven mesh and blue glass provide cover from the sun. It the way to the get to the Marina Bay Sands by foot",01-2017,Couples,2020-01-30 06:00:51.585496
,1,31,https://www.tripadvisor.com.sg/Profile/PaulineGroener,450986506,10-01-2017,5,Shopping time!!,"If you want to sit in a electric boat, or you walk its a good idea to have a few hours left in you stay.",01-2017,Couples,2020-01-30 06:00:51.955181
,1,31,https://www.tripadvisor.com.sg/Profile/ebtenorio,450859802,10-01-2017,5,A Unique Style for a Bridge - a must visit.,"The Helix Bridge is Human DNA-inspired. You see intertwined metals linking pathway to the Marina Bay Sands. It is more elegant at night, where it is beautifully lit.",12-2016,Couples,2020-01-30 06:00:52.330448
,1,31,https://www.tripadvisor.com.sg/Profile/Akshar G,449118448,04-01-2017,4,Better walk on the Bridge then taking a Cab,"The view from this bridge is beautiful, it makes it worth a walk with your better half enjoying the view of Marina Bay Sands.",12-2016,Couples,2020-01-30 06:00:52.630554
,1,31,https://www.tripadvisor.com.sg/Profile/Vishous92,448873324,03-01-2017,3,It is a bridge.,Well it is a bridge with an interesting design. You can have a view of the skyline from there. But it is just a bridge.,01-2017,Couples,2020-01-30 06:00:52.986042
,1,31,https://www.tripadvisor.com.sg/Profile/jnealbrookfield,448689782,03-01-2017,5,A Must Part of the Singapore Experience!,This is in the heart of the best areas of Singapore. Walk in the day and night and savor the experience. Special outcropping allow great photo ops. Safe at any hour.,12-2016,Couples,2020-01-30 06:00:58.858229
,1,31,https://www.tripadvisor.com.sg/Profile/svenbenning,448213848,01-01-2017,5,Nice bridge,It's a really nice bridge between Marina Bay Sands Hotel (and mall) and the Youth Olympic Park. Great location to take interesting pictures from the bridge and Marina Bay Sands Hotel,07-2016,Couples,2020-01-30 06:00:59.214632
,1,31,https://www.tripadvisor.com.sg/Profile/LSSmiami,447899642,31-12-2016,3,Pretty at Night,"The bridge, lit up at night, makes up part of the Marina Sands area. It is pretty to look at but certainly not a destination on its own.",12-2016,Couples,2020-01-30 06:00:59.542512
,1,31,https://www.tripadvisor.com.sg/Profile/EduardoO350,447596610,30-12-2016,3,Beautiful Bridge,Beautiful architecture that serves a good function. This bridge connects two popular places to visit. It is a good link and also good for the eye,11-2016,Couples,2020-01-30 06:00:59.841019
,1,31,https://www.tripadvisor.com.sg/Profile/monaHungary,447191051,28-12-2016,3,crossing the bay in a DNA spiral,it is a bridge of unusual design with some nice photo ops but I wouldn't consider it as a must do...,03-2016,Couples,2020-01-30 06:01:00.212439
,1,31,https://www.tripadvisor.com.sg/Profile/Beverley B,445115646,19-12-2016,4,Great views and a quirky walk,"This spans the freshwater marina and is unique in its appearance. Its a fun thing to walk across with great views across to the Financial district, the 'Eye' and of the Marina. It isn't straight and the bends allow you to appreciate the curves as you traverse it, as do the various viewing platforms on the land side of the bridge. We walked across it as the sun was going down which afforded some great photos. It also meant it was a little cooler! If you do get hot though there are malls very near both ends so you can cool off in the air conditioning or just be grabbing a drink!",12-2016,Couples,2020-01-30 06:01:00.578383
,1,31,https://www.tripadvisor.com.sg/Profile/mynewlifeistravel,444911674,18-12-2016,5,Amazing at night!!!,We walked back to the hotel from the Singapore flyer using the bridge and took some amazing pics of the city and bridge at night.,12-2016,Couples,2020-01-30 06:01:00.922966
,1,31,https://www.tripadvisor.com.sg/Profile/Sarah1303,444862342,17-12-2016,3,Colourful at night,"This is a colourful bridge at night when it is lit up. Makes for good night time photos. There are view points across the bridge that you can look out across the river. If you walk across during the day time it provides a good view of ""The Float"" a football pitch on the river",11-2016,Couples,2020-01-30 06:01:01.234466
,1,31,https://www.tripadvisor.com.sg/Profile/ytranger,443426155,11-12-2016,5,Worked Great!,"The bridge worked as advertised, we were able to walk across the water without getting wet!
Kidding! Really a very cool piece of architecture, we crossed at night, on a sunday, which is promoted as a no car day, so the freeeway next to us was very quiet. Amazing stainless steel work, and lights, definitely worth a look at night, plus we were able to sample durian ice cream on white bread from a vendor on the bridge.....yum?!? Think cold sweet creamy onion flavoured ice cream....",11-2016,Couples,2020-01-30 06:01:01.575981
,1,31,https://www.tripadvisor.com.sg/Profile/Alwaysafan123,442957211,09-12-2016,5,Views forever,The mall itself is an eyeopener..the escalators are a trip in that they are so high..the views are amazing both sides..loooking at the marinabay sands is awesome and the gardens on the other side are equally stunning recommended this as a must see.views of the city beautiful,11-2016,Couples,2020-01-30 06:01:01.945078
,1,31,https://www.tripadvisor.com.sg/Profile/flyguy747,442637634,07-12-2016,4,Night time event only,"We went there during the day it was kinda a non event
The bridge itself is a stainless steel marvel and really doesn't show its best until after dark the lights on the bridge show it off much better that no lights during the day

As for the bridge itself if you look closely whoever built it took care in the finish. The welds are smooth and clean
And polished

We did notice that the design of the bridge was one of looks mostly not function. The bridge wobbles and shakes with foot traffic

Great place for some good Photos
7/10 for photo attraction at night",11-2016,Couples,2020-01-30 06:01:07.928918
,1,31,https://www.tripadvisor.com.sg/Profile/TravelingBytes,442185105,05-12-2016,5,Walkable modern art object,"I was advised to see the Helix Bridge at night when its lights are lit. The bridge was inspired by DNA structure, so the lights were meant to emphasize shapes and curves. I walked the bridge at night and during the day. Interestingly, I liked it better during the daytime. To me, festive lights were distracting from appreciating the genius design and intricate construction. Treat it as an art object that you can explore from within. If you like modern architecture, this is one of not to miss examples.",11-2016,Couples,2020-01-30 06:01:08.306710
,1,31,https://www.tripadvisor.com.sg/Profile/Ehsan N,441862108,04-12-2016,5,unique,"we got off the taxi on raffles ave and went over the bridge at night its been so beautiful and they made it look like DNA , there are lights on the floor with letters in them c and g, as well as a and t which are lit up at night in red and green represent cytosine, guanine, adenine and thymine, the four bases of DNA and they created some viewing spots or decks where you can walk on and have wide view of the the bay and surroundings , great scenery",06-2016,Couples,2020-01-30 06:01:08.604751
,1,31,https://www.tripadvisor.com.sg/Profile/Penticton803,441414419,02-12-2016,4,Something to see ....as part of the Singapore riverfront,The concept of the bridge design is remarkable ....construction is Interesting as it is stainless steel. They light it up at night so it becomes part of singapores amazing river front area .....,11-2016,Couples,2020-01-30 06:01:08.940829
,1,31,https://www.tripadvisor.com.sg/Profile/angelfish2222,440901632,29-11-2016,4,Pretty walkway at night,"This is a really pretty bridge to walk across in the evening & at night when it is lit up. There are street vendors selling ice cream sandwiches (recommended!) on one end to enjoy as you stroll across.
There are also some viewing platforms to stop & look out across the harbour.",10-2016,Couples,2020-01-30 06:01:09.316030
,1,31,https://www.tripadvisor.com.sg/Profile/JulieB3333,440783081,29-11-2016,4,Stainless steel art,A really beautiful working piece of stainless and carbon steel art. The bridge connects the Marina Bay Sands area to Marina South. The four cantilevered viewing platforms provide spectacular views of Marina Bay Sands and the Singapore skyline. It is worth taking a few minutes to really look at the individual components of this structure and admire the engineering and welding. It only takes a few minutes to cross but is well worth your time.,11-2016,Couples,2020-01-30 06:01:09.694484
,1,31,https://www.tripadvisor.com.sg/Profile/lata14,440298437,27-11-2016,5,Beautiful light bridge,At this bridge night time is lovely. The view at the night is good. Lovely place for a walk along the marina.,11-2016,Couples,2020-01-30 06:01:09.985797
,1,31,https://www.tripadvisor.com.sg/Profile/kth79,439627787,24-11-2016,5,Modern and free,"Modern looking bridge, great platforms to get a view of both the hotel and the bay. And it is free and not to busy",11-2016,Couples,2020-01-30 06:01:10.304908
,1,31,https://www.tripadvisor.com.sg/Profile/Webbywabbit,438914907,21-11-2016,4,Excellent Night View,The strategically placed viewing pods are fantastic places to capture scenic pictures of the Marina Bay Sands area. It may seem daunting but turns out to be a very pleasant walk. There is an elevator from Marina Bay Sands to the bridge landing which makes it convenient for those who are wheelchair bound or with strollers.,08-2016,Couples,2020-01-30 06:01:10.642862
,1,31,https://www.tripadvisor.com.sg/Profile/andrewsE9626GX,438574577,19-11-2016,3,Beautifully lit at night!,"Nicely designed pedestrian bridge that has a great DNA helix design, but the best thing is to check it out after dark...Gorgeous lights at night!",11-2016,Couples,2020-01-30 06:01:10.962910
,1,31,https://www.tripadvisor.com.sg/Profile/Jerry W,437379629,15-11-2016,3,Incredible Architecture,"OK, I didn't go in it; didn't have time. The view must be fantastic though, but the attraction is the architecture; very modern and different. You can see it from four different sides and it looks different from each.",11-2016,Couples,2020-01-30 06:01:16.807889
,1,31,https://www.tripadvisor.com.sg/Profile/1TraveltheWorld,437332474,15-11-2016,4,Interesting architecture with water views,"The Helix Bridge is a fairly new construction, less than 6 years old and provides good views over the surrounding river area.

Spanning a connection between the centre and southern parts of the Marina and links the whole walkway between the Marina Bay Sands and the Casino with the Esplanade.

The intriguing, double helix, is a true emulation of a person’s DNA.",12-2015,Couples,2020-01-30 06:01:17.218300
,1,31,https://www.tripadvisor.com.sg/Profile/littedup,437266821,15-11-2016,3,It's just a bridge,"There's nothing spectacular about it, it's just a bridge that is lit up. It's really pretty to look at from afar but nothing special when you actually cross it by foot. It does offer a pretty view at night and you can stop to take photos.",09-2016,Couples,2020-01-30 06:01:17.584059
,1,31,https://www.tripadvisor.com.sg/Profile/Indori_Wonder,436501907,12-11-2016,3,Good at night,"You come across this bridge either while coming form Gardens by the bay or Marina Bay sands Casino . This is just a walkover kind of and if you have good camera, you can get pictures of Singapore Flyer, Marina bay sands and Gardens by the bay exterior from here.",01-2016,Couples,2020-01-30 06:01:17.942238
,1,31,https://www.tripadvisor.com.sg/Profile/Mary Rose H,436158024,10-11-2016,5,Light display,The engineering feat is incredible and the light display is magical. Wonderful place to leisurely explore. Don't forget to stop and enjoy a cup of coffee at one of the cafes.,02-2016,Couples,2020-01-30 06:01:18.248531
,1,31,https://www.tripadvisor.com.sg/Profile/Meharibear,435408538,07-11-2016,5,"Well worth a stroll, even in the notorious Singapore humidity!","This a bridge is a real engineering work of art and I advise anyone who visits it to look at the sheer beauty of the engineering design and construction. if you walk up from the Gardens by the Bay and through the incredibly buildings and on across this bridge back to the ""mainland"", turn around and look and the amazing view back to where you have just come from. Best of all, it's free!",10-2016,Couples,2020-01-30 06:01:18.673602
,1,31,https://www.tripadvisor.com.sg/Profile/Tony P,434983075,06-11-2016,5,The Helix Bridge,"We experienced the Helix Bridge walking back to our hotel after visiting Gardens on the Bay. At the time it was raining but did dampen the spirits,",10-2016,Couples,2020-01-30 06:01:19.069678
,1,31,https://www.tripadvisor.com.sg/Profile/MerliesMum,434503718,04-11-2016,5,Bridge with Amazing Views,"This bridge links Marina Bay with the incredible Marina Shopping centre. It is glass with metal ""double helix"" supports giving it a very modern feel. There is a plaque at one end explaining the design and idea behind it. Its well used and affords the most amazing views over the bay and also the Singapore Flyer and over towards the Botanical gardens.",09-2016,Couples,2020-01-30 06:01:19.439069
,1,31,https://www.tripadvisor.com.sg/Profile/AgnieszkaWojcik,434198718,03-11-2016,5,Unusual bridge,"Very smart construction and very beautiful, especially at night whit all the lights. Great place to make nice pictures!",10-2016,Couples,2020-01-30 06:01:19.771121
,1,31,https://www.tripadvisor.com.sg/Profile/Ali921,433521764,01-11-2016,4,Has good views and a tremendous design.,"Well you can't miss it if you go to the Bayfront as you have to walk over to it, unless you take the metro. Even if you do, you will want to walk to it to take pictures from it as it has a couple of extending balconies for that purpose which prove very popular with photographers. Great design and if you're a scientist you can explain what it actually represents to those that don't.",10-2016,Couples,2020-01-30 06:01:20.147679
,1,31,https://www.tripadvisor.com.sg/Profile/Tom P,433422854,01-11-2016,4,DNA Bridge,"The helix bridge is cool to walk over to get to Marina Sands, and offers great views of the city. End of the day it's just a pedestrian bridge though, but still a good one at that.",10-2016,Couples,2020-01-30 06:01:25.963615
,1,31,https://www.tripadvisor.com.sg/Profile/Boldon2013,433378956,01-11-2016,5,Helix bridge - great piece of modern sculpture,Lovely to walk across this fine bridge which affords excellent view of Singapore and brings you to the foot of the Science Museum. Looks great lit up at night too.,10-2016,Couples,2020-01-30 06:01:26.273596
,1,31,https://www.tripadvisor.com.sg/Profile/mrp3sky76,433259719,31-10-2016,5,An Interesting Bridge,"They have built this Double Helix bridge to represent a strand of DNA and the heart of Singapore, worth seeing all lit up.",09-2016,Couples,2020-01-30 06:01:26.633126
,1,31,https://www.tripadvisor.com.sg/Profile/Brandylady,433249631,31-10-2016,4,Unusual,"We first saw this bridge at night from a taxi from the airport en route to Marina Bay Sands Hotel and were quite intrigued and followed our curiosity next day by walking across the road from Marina Bay Sands to the shopping centre then straight out the other side and we were there. Well worth a visit as it is so unusual - very ""arty"" and different from normal bridges as based on the structure for DNA.",10-2016,Couples,2020-01-30 06:01:27.007838
,1,31,https://www.tripadvisor.com.sg/Profile/amandapD2282GI,432606523,29-10-2016,5,Part of the Promanade,If you're walking by the bay... You can't miss it. It's a beautiful walk and you can snag some nice pics,10-2016,Couples,2020-01-30 06:01:27.372461
,1,31,https://www.tripadvisor.com.sg/Profile/colinf296,432274523,28-10-2016,5,Great for photographs,We walked along one side of the waterfront then crossed over on the helix bridge. It is a remarkable structure which provides amazing views of the waterfront and the many notable buildings.,10-2016,Couples,2020-01-30 06:01:27.727981
,1,31,https://www.tripadvisor.com.sg/Profile/Ross S,429532431,19-10-2016,4,A lovely walk,This Helix design bridge is a great piece of modern work connecting Marina Bay to Near our Hotel. waling it of a day is great but of a night even better,10-2016,Couples,2020-01-30 06:01:28.076302
,1,31,https://www.tripadvisor.com.sg/Profile/Harker69,428630213,17-10-2016,5,great piece of architechture,"we walked over the bridge in the day and then later in the evening, at it really came to life with local joggers, tourists,photographers even a wedding photo shoot. nicely illuminated and well planned.",10-2016,Couples,2020-01-30 06:01:28.387357
,1,31,https://www.tripadvisor.com.sg/Profile/Khin Q,428596315,17-10-2016,4,Beautifully designed bridge,You get to cross the Helix Bridge if you walk from Marina Bay Sands to the Marina Square area. Both daytime and nighttime views are lovely.,10-2016,Couples,2020-01-30 06:01:28.766920
,1,31,https://www.tripadvisor.com.sg/Profile/Krispyyy,428429392,16-10-2016,5,Beautiful,"One of the most beautiful bridges I've ever crossed - it's the only way to get to MBS if you're planning to go on foot. The view from the bridge is beautiful and on a good night, you'd be able to score pretty rad photos of the cityscape!",10-2016,Couples,2020-01-30 06:01:29.194403
,1,31,https://www.tripadvisor.com.sg/Profile/bcheong,428413633,16-10-2016,3,It's just a bridge,"It's interesting in that it's shaped like a DNA double helix, but that's about it. It links Marina Bay Sands /art science musem at 1 end and the Floating platform at the other end",10-2016,Couples,2020-01-30 06:01:35.055924
,1,31,https://www.tripadvisor.com.sg/Profile/TheEddiesduo,427429205,13-10-2016,4,Another example of Modern Singapore architecture,The Singaporeans love their modern architecture and this is another great example. Great at night when lit up but also during the day it's a pleasant walk with Marina Bay in the background. If you're walking the Bay then this is worth the crossover.,09-2016,Couples,2020-01-30 06:01:35.371495
,1,31,https://www.tripadvisor.com.sg/Profile/karen6490,425504415,06-10-2016,4,Nice when lit up at night,"We walked across the bridge during the day and then crossed back over it at night when it was all lit up. It certainly is nice to see when it is all aglow.
Lots of room for people to walk in both directions without feeling cramped.
It fits in well with the rest of the area that is all lit up at night.",10-2016,Couples,2020-01-30 06:01:35.679874
,1,31,https://www.tripadvisor.com.sg/Profile/hem0116,424367017,02-10-2016,5,Best seen at night,"A pedestrian only bridge adjacent to the main traffic route over the Singapore River with great views , especially at night",09-2016,Couples,2020-01-30 06:01:36.002732
,1,31,https://www.tripadvisor.com.sg/Profile/Phillips2011,423791444,30-09-2016,5,Unique bridge providing some fantastic views of the area,An interesting walk from the Singapore Flyer bus stop across the bridge to the Marina Bay Sands shopping complex and through to the Gardens by the Bay. The pedestrian bridge has several viewing platforms providing good photo opportunities along the way. The design of the bridge is quite amazing.,09-2016,Couples,2020-01-30 06:01:36.369119
,1,31,https://www.tripadvisor.com.sg/Profile/Harvee121,423429250,29-09-2016,4,Spectacular at Night,"The Helix bridge is a pedestrian bridge, and a great way to approach and appreciate the size of the Marina Bay Sands complex from the Singapore Flyer. It looks great at night. There are four viewing platforms along the bridge where you can pause to drink in the spectacular scenery of Marina Bay.",09-2016,Couples,2020-01-30 06:01:36.709550
,1,31,https://www.tripadvisor.com.sg/Profile/AllenH1971,423069113,28-09-2016,3,Looks amazing,Worth a trip up for the view. This is not utilized well at all for tourism. It could be so much more.,09-2016,Couples,2020-01-30 06:01:37.076604
,1,31,https://www.tripadvisor.com.sg/Profile/John E,421953863,25-09-2016,4,Eye-catching,We used this bridge to arrive at the Marina Bay Sands Hotel from the Singapore Flyer. This stainless steel bridge is unusual in is design and worth visiting if you like enginering,04-2016,Couples,2020-01-30 06:01:37.431430
,1,31,https://www.tripadvisor.com.sg/Profile/Simon P,421005184,22-09-2016,4,Great View,Great view of Marina Bay and the Sands. Lovely to walk along in the evening and see the lights of the City.,09-2016,Couples,2020-01-30 06:01:37.769586
,1,31,https://www.tripadvisor.com.sg/Profile/Snowman781,419957831,19-09-2016,5,What a bridge,From the moment you step onto the bridge you can see and experience a bridge structure which can only be described as amazing. You have to experience this bridge which is certainly an icon of perfection.,09-2016,Couples,2020-01-30 06:01:38.124054
,1,31,https://www.tripadvisor.com.sg/Profile/Dao1949,419130610,16-09-2016,5,Fantastic Pedestrian Bridge in Singapore,"It was amazing and the design is really like a strand of DNA as the actual bridge forms spiral and twist to create this amazing structure. At night the bridge is enhanced with lights, crating a dazzling effect. The bridge leads directly off from the Marina Bay Sands area.",09-2016,Couples,2020-01-30 06:01:43.954506
