REVIEW_INDEX,WEBSITE_INDEX,POI_INDEX,REVIEWER_URL,REVIEW_ID,REVIEW_DATE,REVIEW_RATING,REVIEW_TITLE,REVIEW_BODY,DATE_OF_EXPERIENCE,TRIP_TYPE,REVIEW_CRAWLED_TIME
,1,31,https://www.tripadvisor.com.sg/Profile/saic629,618757355,23-09-2018,3,Not Quite an attraction,"This can be at bottom of your priority. This is just a bridge. Even the view might not be that attractive. I am surprised that this is listed as an attraction. You may find the architecture of bridge quite attractive. Other than that, nothing much to spend your time here.",09-2018,Solo,2020-01-30 06:04:18.714127
,1,31,https://www.tripadvisor.com.sg/Profile/AMD391,616996559,16-09-2018,5,Stunning architecture,"I love bridge architecture and this was stunning. Looks amazing at night. Go, see it! Very romantic walk!",09-2018,Solo,2020-01-30 06:04:19.036047
,1,31,https://www.tripadvisor.com.sg/Profile/Mohamed S,612593815,31-08-2018,4,Modern design,"A very nice stailess steel bridge in the shape of the DNA overwatching the Bay and the gardens by the bay! By night, you can clearly see lit up the 4 letters, c g a & t, which represent the 4 bases of the DNA, (the a stands for adenine, but you can search for the other 3). So as usual it is much fun enjoying your time over the bridge in the night time lights and of course the weather would be much nicer. But still the views from the bridge are not bad at all in the morning. I can't say it is a must place to visit but I'm quite sure it is on your way visiting the area anyway, so enjoy it.",09-2017,Solo,2020-01-30 06:04:19.460308
,1,31,https://www.tripadvisor.com.sg/Profile/Kamila2013,612333279,30-08-2018,5,Beautiful,Loved walking over the bridge in the daytime as well as at night time. The views around are so beautiful!,09-2017,Solo,2020-01-30 06:04:19.832572
,1,31,https://www.tripadvisor.com.sg/Profile/Melina2523,609967198,24-08-2018,5,Good views,Love walking the Helix Bridge. It's not too long but you can get some great pictures of the surrounding area. It's beautiful at night all lit up. It's a spectacular architectural bridge. It reminded me of the bridge in London in the Harry Potter movie.,08-2018,Solo,2020-01-30 06:04:25.611397
,1,31,https://www.tripadvisor.com.sg/Profile/Mazmannan,604159638,08-08-2018,4,Amazing engineering,"The Helix bridge was opened in 2010. It is an amazing piece of engineering based on the DNA double helix model.

It is 280 metres long and connects Marina centre with the Marina Bay complex area. You have to see it to believe it. The bridge is for pedestrians.

From the bridge you get a fantastic view of Singapore's skyline.",04-2018,Solo,2020-01-30 06:04:25.951493
,1,31,https://www.tripadvisor.com.sg/Profile/Janetcui,596300213,15-07-2018,5,Must visit place for first time coming to Singapore,"After 5pm, this place is more and more crowded, live bands, good resaurants and night club are all around,even the famous jumbo seafood is also walkbale in a few minutes. A shopping mall the Central is just upper the mrt station. Very popular place by tourists.",06-2018,Solo,2020-01-30 06:04:26.260295
,1,31,https://www.tripadvisor.com.sg/Profile/Wingecarribee,592869846,04-07-2018,4,Nice night and day,Enables you to walk around Marina Bay. An architecturally nicely designed footbridge. Includes several viewing platforms to view the sites and take great photos of nearby attractions like Marina Bay Sands as well as views across the Bay. Attractive during the day and colourfully lit at night.,06-2018,Solo,2020-01-30 06:04:26.661305
,1,31,https://www.tripadvisor.com.sg/Profile/AMsays,584513238,02-06-2018,5,"Another ""First"" for Singapore","This is the world’s first double helix curved bridge. At night is when the bridge is at its most notable. Glass and steel and spirals configure with the lights - blue and white to make quite the spectacle. Walking or driving is an unique experience and the views are outstanding. When you look at the bridge from the other side of Marina Bay, it sort of blends in to all the buildings and skyscrapers around the Bay. When you you get inside though, and walk the length, you realize just how very special this bridge is - an engineering marvel...",05-2018,Solo,2020-01-30 06:04:27.011075
,1,31,https://www.tripadvisor.com.sg/Profile/fariduzzamanr,583749576,30-05-2018,5,"Futuristic Architecture, Amazing Structure",The bridge connects to Marina Bay sands to the Gallery by the bay. Its a still and glass structured bridge. The Futuristic design make it unique. You can take good photographs with good vie of marina bay are from here.,08-2017,Solo,2020-01-30 06:04:27.351586
,1,31,https://www.tripadvisor.com.sg/Profile/andyliem88,581422203,20-05-2018,5,Excellent bridge,"Excellent bridge, design. Bridge from Merlion to Marina Bay with beautiful lighting at night. And it's very nice to walk",05-2018,Solo,2020-01-30 06:04:27.704208
,1,31,https://www.tripadvisor.com.sg/Profile/Jeanette M,581287008,20-05-2018,5,"Pedestrian bridge; easy walk, even with a stroller, great views","This is a very new addition to Singapore. Apparently if you look closely you can see the DNA letters: ACGT 'woven' into the steel parapet. I couldn't find any of the letters! There are several little viewing pods sticking out from the bridge for your photo ops. At the far end of the bridge you arrive at The Shops at Marina Bay Sands; an over the top shopping centre, but you may as well have a look. There's a sort of canal with something like a cross between gondolas and punts that you can have a ride on. Little kids love the billions of LEDs which hang 4 storeys high and twinkle and change, creating a sort of splash effect on the floor below. The kiddies can run and jump on this surface and make the lights change, flow, splash, etc.",04-2018,Solo,2020-01-30 06:04:28.092903
,1,31,https://www.tripadvisor.com.sg/Profile/reem e,581064775,18-05-2018,5,Amazing for jogging,"If you want to enjoy a beautiful scene while making your favourite sport, jogging, this place is the best for you. If you want to have a long walk with a friend or life partner, this place will be the best for you also.",04-2018,Solo,2020-01-30 06:04:28.436711
,1,31,https://www.tripadvisor.com.sg/Profile/JohnSverre,571400002,06-04-2018,4,Great run,Recommended to run over this bridge to get to the Marina Sand Bay Hotel. Formed as a dna helix. Pretty cool!,04-2018,Solo,2020-01-30 06:04:28.810325
,1,31,https://www.tripadvisor.com.sg/Profile/Lauren S,570958866,04-04-2018,5,Nicely designed and convenient,Used the bridge to walk from Gardens by the Bay to The Flyer. No other convenient way to get between the two. Was a scenic stroll across and made it so easy to visit both attractions on the same day.,04-2018,Solo,2020-01-30 06:04:34.799668
,1,31,https://www.tripadvisor.com.sg/Profile/DebraT957,567547482,20-03-2018,4,Clever design,Clever spiral design with three good viewing platforms looking out over Marina Bay. Lights up at night adding another sparkling dimension reflected in the water,03-2018,Solo,2020-01-30 06:04:35.153026
,1,31,https://www.tripadvisor.com.sg/Profile/Julie1962Qatar,566774742,16-03-2018,5,Unusual Design,This is basically a bridge which connects 2 areas of the marina bay. You get a lovely view of the Marina from the bridge. I'd estimate the length of the bridge is about 200m.,03-2018,Solo,2020-01-30 06:04:35.506371
,1,31,https://www.tripadvisor.com.sg/Profile/envirotte,565985986,12-03-2018,4,Nice bridge at night,"The bridge look beautiful at night (because of the lighting), but just look average at noon. You can use this bridge to move from merlion area to marina area.",06-2017,Solo,2020-01-30 06:04:35.851538
,1,31,https://www.tripadvisor.com.sg/Profile/Kalmec,560706560,16-02-2018,5,Must see,"One of the top thing to see in Singapore. Prefer walking on the bridge by night, the purple color plus the marina bay sand behind is simply gorgeous! The walk is of course free",02-2018,Solo,2020-01-30 06:04:36.243557
,1,31,https://www.tripadvisor.com.sg/Profile/redsilver22,560538705,15-02-2018,5,Trendy Transit,Hopping across to Gardens by the Bay via this bridge.... loved the architecture of construction making it a destination in itself.,01-2018,Solo,2020-01-30 06:04:36.609815
,1,31,https://www.tripadvisor.com.sg/Profile/Julie B,556997874,29-01-2018,4,Cool bridge,Very interesting pedestrian bridge linking the Singapore Flyer with the Gardens by the Bay and Marina Sands hotel,12-2017,Solo,2020-01-30 06:04:36.953115
,1,31,https://www.tripadvisor.com.sg/Profile/bukagirl,554118991,16-01-2018,4,Great design,"Very cool and clever,Singapore has many bridges but thus one stands out in it's unique design and very appealing to the eye.",01-2018,Solo,2020-01-30 06:04:37.315871
,1,31,https://www.tripadvisor.com.sg/Profile/thubelihlen,550098639,30-12-2017,4,It was so beautiful the city comes to life at night .. the light the food the view . Definitely a must to see when Singa,Perfect. Perfect . It’s definitely a must see while in Singapore . The city comes to life at night . It gorgeous really enjoyed it,08-2017,Solo,2020-01-30 06:04:37.648045
,1,31,https://www.tripadvisor.com.sg/Profile/519fabianas,547786149,18-12-2017,5,The light of the night!,For those who already read my reviews this is not news but for the others I'll tell you that my favorite time of the day to visit a city is actually at night. And The Helix Bridge is the true example of why. During the day is nice but at night with its color gives light to the city and brings magic to it!,12-2017,Solo,2020-01-30 06:04:38.019218
,1,31,https://www.tripadvisor.com.sg/Profile/Ishan A,547214217,14-12-2017,5,Architecture at its best,This bridge connects to Marina Bay sand from The olympic Park. This Bridge is spiral Bridge which is designed amazingly & it looks beautiful All Time.. Lovely place.. Do stop for a Photshot,09-2017,Solo,2020-01-30 06:04:43.819452
,1,31,https://www.tripadvisor.com.sg/Profile/RachtheMage,538844291,07-11-2017,5,Good Picture of the Marina Bay Skypark,"The Helix Bridge is a structure with a shape of DNA helix, hence the helix bridge. It offers a very good view of the Marina Bay Skypark at night and the lotus shaped building on the side. Highly recommend to come after dark to catch the best view when the buildings around light up! Recommend time to spend on bridge 10-15 minutes for pictures. Recommend time to spend in the Marina Bay area 4-5 hours.",11-2017,Solo,2020-01-30 06:04:44.221396
,1,31,https://www.tripadvisor.com.sg/Profile/rajit80,537801618,02-11-2017,5,Interesting structure,Very interesting metallic structure! I found two wedding couples taking their wedding pictures on the bridge with their wedding bridge!! I would recommend to visit this place at night to enjoy the lighting and Marina Bay Sand. It will take hardly 5-10 minutes to cross the bridge by walk.,10-2017,Solo,2020-01-30 06:04:44.570419
,1,31,https://www.tripadvisor.com.sg/Profile/Edelweiss909,527147603,25-09-2017,5,Exciting,"Linking bridges, linking people and places here in Singapore is a great way of connecting. Come and experience it.",09-2017,Solo,2020-01-30 06:04:44.879667
,1,31,https://www.tripadvisor.com.sg/Profile/rajenkg,526363511,22-09-2017,5,Bridge connects to Marina Bay Sands,"It's special engineering designed architectural bridge. It's a must walk for tourists. There are 3 scenic view point within the bridge to see the beautiful city skyscraper buildings and also the Marina Bay Sands.

We could reach here by MRT by alighting at Promenade Station and exit towards Exit A towards Helix Bridge. Or if you at Suntec City or at Esplanade then you can walk all the way to the bridge with map.

This bridge illuminates with lights at night so visiting the place during dusk will give you great view. Sometime there are some performance going at sides of bridge.",09-2017,Solo,2020-01-30 06:04:45.165468
,1,31,https://www.tripadvisor.com.sg/Profile/Rich D,521573113,06-09-2017,4,Amazing walking bridge at night,"If you are staying anywhere near the Suntec convention center and many of its luxury hotels, it is a nice walk to cross over to the Marina Bay Resort, its shopping malls, casinos and all the attractions, using this bridge. It really looks nice just before sunset and after when it's lit.

Very popular with a selfie crowd;)",09-2017,Solo,2020-01-30 06:04:45.601190
,1,31,https://www.tripadvisor.com.sg/Profile/hart277,520670464,03-09-2017,4,In the marina area,It's a very cool pedestrian bridge that has great photo areas of the marina area. It just connects from the floating soccer field area to the marina mall.,09-2017,Solo,2020-01-30 06:04:45.957475
,1,31,https://www.tripadvisor.com.sg/Profile/daricesulemane,515953475,21-08-2017,5,Modern architecture,The Helix Bridge is a pedestrian bridge on Marina Bay. The bridge takes the shape of a double helix (DNA) and is illuminated at night. It serves as a great location to take some amazing night shots of Marina Bay Sands and the surrounding area.,08-2017,Solo,2020-01-30 06:04:46.300325
,1,31,https://www.tripadvisor.com.sg/Profile/minimize940314,515038438,19-08-2017,4,Nice structure,The bridge is literally a helix. It was a cool experience going through the light. It connects esplande and marina bay.,06-2017,Solo,2020-01-30 06:04:46.667521
,1,31,https://www.tripadvisor.com.sg/Profile/buffalv,513064224,15-08-2017,4,Good place to take photo,"It's a good place to take photo of Marina Bay Sands and Singapore skyline, especially during sunset.",08-2017,Solo,2020-01-30 06:04:46.982650
,1,31,https://www.tripadvisor.com.sg/Profile/piotrh1982,495206660,22-06-2017,5,Views are great,The bridge is quite interesting. You can admire the views to Marina Bay. But you can also go the parallel way - there is a highway with a pavement and you can admire another way of the bay from above. I think it is better!,05-2017,Solo,2020-01-30 06:04:52.848930
,1,31,https://www.tripadvisor.com.sg/Profile/JAYANTBISWAS,494731977,21-06-2017,5,Good Link,A wonderful idea to link pedestrians from the Promenade to the Marina Bay Snads. very well thought out and made for tourist comfort providing ample space for photography specially selfies!!,06-2017,Solo,2020-01-30 06:04:53.159335
,1,31,https://www.tripadvisor.com.sg/Profile/Ghaida93,485535844,19-05-2017,5,Wonder and light,"Few spots to have amazing pictures of the city,mesmerising architeact .The steel and harsh design adds to its charm and mageistic look",05-2017,Solo,2020-01-30 06:04:53.548427
,1,31,https://www.tripadvisor.com.sg/Profile/hisyam03,482350217,07-05-2017,4,Put It In Motion,"It was April 25, 2017 when I visited the helix bridge. To me it is a regular bridge, yet I agree that the architecture was incredible. The spiral ceiling is intriguing in a delicate manner. I was there during the day, so I was feeling so so with my surrounding. At first, I thought the bridge not as pleasant as the night time. Until I accidentally found a way to enjoy the most of the bridge during the day.

I was trying to not be on my phone to take pictures while I was there because I try to connect myself with the surrounding. However, the boredom of the place gradually increase up to the point I took my phone try to taking pictures. I am using android phone and there is this hyperlapse mode to take video, so I try it. I walked from one end of the bridge to the other end while recording the ceiling in that mode. Surprisingly, I could see the beauty of those helixes from other perspective.

By put the view in certain speed of motion, you could see how those helixes were intertwined and seemingly alive.",04-2017,Solo,2020-01-30 06:04:53.903529
,1,31,https://www.tripadvisor.com.sg/Profile/CraigL2278,482264609,07-05-2017,4,Good Link Across Marina Bay,Handy interestingly designed bridge that links Marina Bay Sands to the Singapore Flyer and Merlion Park. At night the colours look fantastic.,05-2017,Solo,2020-01-30 06:04:54.254785
,1,31,https://www.tripadvisor.com.sg/Profile/Flibbix55,481606184,04-05-2017,3,Nice view,The DNA bridge overlooks the merlion and bay which is nice and has designated viewing platforms. It is quite striking to look at,04-2017,Solo,2020-01-30 06:04:54.565153
,1,31,https://www.tripadvisor.com.sg/Profile/JoyShurjo,480465480,01-05-2017,5,Beautiful both in day and in night,This bridge is located near Marina bay. It is better to get off at Marina Bay sand if travelling by metro. The bridge looks great both in daylight and in night.,06-2016,Solo,2020-01-30 06:04:54.868481
,1,31,https://www.tripadvisor.com.sg/Profile/adrian-kpk,479335143,27-04-2017,5,Modern architecture at its best,Be there not to admire is architecture but also the surrounding architecture at the Marina Bay. Visit at night which you would be amazed by the beautiful lights all around the Marina Bay area. There are photo spots on the bridge which you can take awesome picture of the view.,04-2017,Solo,2020-01-30 06:04:55.250962
,1,31,https://www.tripadvisor.com.sg/Profile/KonThom59,474909082,12-04-2017,4,The design with creative,"The Helix Bridge design very beautiful and and it is a good place to take selfies. Especially, at night time the view very nice.",05-2016,Solo,2020-01-30 06:04:55.616278
,1,31,https://www.tripadvisor.com.sg/Profile/Stephan G,473393319,07-04-2017,4,Intersting architecture,"As usual, in Singapore, the Architecture is ... wow ! Now, it's nothing more than a bridge, offering a great view on the marina and the Merlion.",04-2017,Solo,2020-01-30 06:04:55.964782
,1,31,https://www.tripadvisor.com.sg/Profile/tollo652,472517187,04-04-2017,4,Interesting bridge,Another interesting Singapore experience. There are several platforms along the way where you can take photos. Interesting architecture and very different.,04-2017,Solo,2020-01-30 06:05:01.673775
,1,31,https://www.tripadvisor.com.sg/Profile/Merilyn_S_12,472005413,02-04-2017,3,An historic bridge,The Helix Bridge was many both architechtural and historical aspects to it. But unfortunately I cannot remember the detail! A lovely bridge to walk across. Another one of many countless walks you could do in Singapore.,07-2016,Solo,2020-01-30 06:05:02.040438
,1,31,https://www.tripadvisor.com.sg/Profile/Parthiban r,469777182,24-03-2017,5,romantica at night,"its good in night ,can have a walk with night lights and at the river light show its the best place to see all in one ,well time spent its good with your loved ones",03-2017,Solo,2020-01-30 06:05:02.394780
,1,31,https://www.tripadvisor.com.sg/Profile/Martin R,468211498,18-03-2017,5,A memorable walk on Marina Bay and across the Singapore River.,I took a walk one evening from my Hotel (the Marina Mandarin) over The Helix Bridge to The Shoppes At Marina Bay Sands... The walk over the illuminated Helix Bridge was a pure delight... A great atmosphere of tourists and locals all out to enjoy the walk and the magnificent and highly memorable views of the Marina Bay and the beautifully illuminates building that surround the bay. Especially the dynamic light show on the beautifully sculptured Artscience Museum building. It's great to stand on one of the viewing platforms along the Helix Bridge and watch this brilliant spectacle. Certainly worth doing one evening when in Singapore.,03-2017,Solo,2020-01-30 06:05:02.776583
,1,31,https://www.tripadvisor.com.sg/Profile/abundanceworld,467573218,15-03-2017,5,It does look like the bridge from the Harry Potter Movies !!!!!!!!!,"In the night, it looks magical. This is right next to MBS, Marina Bay sands. I recommend you take a slow stroll and take the ambiance in and enjoy the scenery.",02-2017,Solo,2020-01-30 06:05:03.147395
,1,31,https://www.tripadvisor.com.sg/Profile/MarjorieKeek,466785742,13-03-2017,5,Beautiful,"A great way to get to Marina Bay Sands and to the Marina Shoppes, the lights on the bridge at night look really wonderful.

There are also mini decks where you can stand to get some lovely photos of the Business District and Marina Bay Sands itself.",01-2017,Solo,2020-01-30 06:05:03.521475
,1,31,https://www.tripadvisor.com.sg/Profile/Michael M,465659296,09-03-2017,5,Fun part of a great walk,"Singapore has a great transit system, but when I visit a place I love to walk, Singapore is a great walking city. The bridge leads to Marina Bay and is a great vantage point to check out all the water activity/",02-2017,Solo,2020-01-30 06:05:03.952372
,1,31,https://www.tripadvisor.com.sg/Profile/bjoern_rici,464058254,02-03-2017,5,"Really cool bridge, especially at night",Beautiful bridge especially when lit in purple colors at night. With the bridge in front and the Marina Sands in the back its really cool and a great evening walk after visiting the hawkers,02-2017,Solo,2020-01-30 06:05:04.246955
,1,31,https://www.tripadvisor.com.sg/Profile/lagomaggiore2013,463442869,28-02-2017,5,Iconic bridge spanning the Singapore river,"This beautiful bridge completes the Marina Bay circuit a 5k walking/running track that circles the Marina Bay. The bridge itself gives great views of the Artscience museum (shaped like a Lotus flower. Most of the locals take pictures from the 1st platform, you can even pose so that it looks like the Lotus flower is sitting in your hand.",02-2017,Solo,2020-01-30 06:05:04.628844
,1,31,https://www.tripadvisor.com.sg/Profile/MichaelBrianT,462630647,25-02-2017,5,A bridge that connects Marina Bay to the Esplanade,"Catch it in the evening when the lights are alive. A very unique structure, and you get some amazing views. It just compliments the walk through the city during the evening.",02-2017,Solo,2020-01-30 06:05:04.994190
,1,31,https://www.tripadvisor.com.sg/Profile/HugoColle,460638867,17-02-2017,4,Typical Singapore,A smal walking bridge that goes over the river to the Marina bay Mall and also the part of the gardens of the bay. Every country would make a normal walking bridge but Singapore makes a design bridge. Nice to have a walk here at night when its lighted. Small platforms goves you the chance to enjoy the skyline of Marina Bay and take pictures..,05-2016,Solo,2020-01-30 06:05:10.871249
,1,31,https://www.tripadvisor.com.sg/Profile/FrancescaEB7,453868105,22-01-2017,5,Walk the whole bay!,"Walked round the whole bay including the bridge, great views! However beware it is very slippery in the rain! Must see especially at night!",01-2017,Solo,2020-01-30 06:05:11.215890
,1,31,https://www.tripadvisor.com.sg/Profile/NicoLgdls,451704813,13-01-2017,5,Great spot for panoramic photos,I don't usually write reviews for bridges ahah but i must say that it is a perfect one to cross the bay !! The design itself is amazing and integrates perfectly into the scenery. I highly recommend going there as it offers a truly unique view of the Marina Bay Sands as well as the downtown skyscrapers and the the whole bay. The perfect spot for a panorama photo !!,01-2017,Solo,2020-01-30 06:05:11.596644
,1,31,https://www.tripadvisor.com.sg/Profile/BulbusFinger,450578165,09-01-2017,5,Great views,"Great views, and a fun walk. Easy way to get around using this bridge, and it is very well crafted. The views of MBS from the platforms really give a unique perspective.",09-2016,Solo,2020-01-30 06:05:11.909381
,1,31,https://www.tripadvisor.com.sg/Profile/mycle22,448713396,03-01-2017,4,Use the bridge instead of a cab,Walked from the Shoppes mall back to the Conrad. The views across the water are terrific and there are some decks you can walk out to take excellent pictures.,11-2016,Solo,2020-01-30 06:05:12.273216
,1,31,https://www.tripadvisor.com.sg/Profile/Micannjon,448404048,02-01-2017,5,Beautiful,"This beautifully designed bridge is a great example of the clever architecture of Singapore. It's a lovely walk that leads to the Marina Bay complex, the Art Science Museum and Gardens by the Bay.",12-2016,Solo,2020-01-30 06:05:12.614605
,1,31,https://www.tripadvisor.com.sg/Profile/Awakeyourappetite,448378301,02-01-2017,5,A bridge with an architectural twist,Very modern and different. It's pretty much just another attraction in Singapore. The aim is to get a pic standing in middle with the bridge behind you. Nice walk to the Singapore Science Museum or Gardens by the Bay.,10-2016,Solo,2020-01-30 06:05:12.953387
,1,31,https://www.tripadvisor.com.sg/Profile/ashoknpulliyerengi,447063824,28-12-2016,4,helix bridge,looks like space age bridge at night ...type of smooth space curved tunnel linking Marina Centre with Marina South in the Marina Bay area....evening stroll is always lively here and is the longest pedestrian bridge in Singapore. ....,12-2016,Solo,2020-01-30 06:05:13.334300
,1,31,https://www.tripadvisor.com.sg/Profile/yourtravelbuddysg,446800526,27-12-2016,4,Beautiful walk,This bridge is futuristic looking and connects marina bay sands to the other areas like marina square and the other hotels around marina region. A good walk overlooking at the skyline of the central business district and marina reservoir.,12-2016,Solo,2020-01-30 06:05:13.668903
,1,31,https://www.tripadvisor.com.sg/Profile/LolaGo1,442572397,07-12-2016,4,"Beautiful,short bridge","I crossed this bridge to walk from the park where I visited a museum, cultural center, Singapore River etc. to the Marina Bay areas. Instead of this bridge, there is an underpass that connects both areas.",12-2016,Solo,2020-01-30 06:05:14.057890
,1,31,https://www.tripadvisor.com.sg/Profile/bennyvectra,440890461,29-11-2016,4,Excellent place for evening stroll,"Excellent place for evening stroll. Beautiful bridge. Beautiful view of MBS, Singapore River, and Esplanade",11-2016,Solo,2020-01-30 06:05:20.019084
,1,31,https://www.tripadvisor.com.sg/Profile/Tim S,440247617,27-11-2016,5,Helix Bridge Walk,"Cool, artistic bridge. Worthy of some photos. On one hand this is just a bridge that one may use to get from point A to point B, yet on the other hand I can't say that I have crossed another bridge like this one.",11-2016,Solo,2020-01-30 06:05:20.330358
