REVIEW_INDEX,WEBSITE_INDEX,POI_INDEX,REVIEWER_URL,REVIEW_ID,REVIEW_DATE,REVIEW_RATING,REVIEW_TITLE,REVIEW_BODY,DATE_OF_EXPERIENCE,TRIP_TYPE,REVIEW_CRAWLED_TIME
,1,31,https://www.tripadvisor.com.sg/Profile/lindahJ6614HC,658221237,13-03-2019,5,Best photos of the city from here,Start at promenade and walk across in the eveni9ng for the best photo opportunities that youll get ..Totally beautiful! Allow at least 45 min to soak up the views.,03-2019,Couples,2020-01-30 05:56:33.614930
,1,31,https://www.tripadvisor.com.sg/Profile/midwaytoheaven,657754666,11-03-2019,5,STAINLESS STEEL Superstructure Walking Bridge. 5-STAR,"This is one of the most beautiful pedestrian only bridges in the world. You really need to see this amazing architectural stainless steel structure. No, it is not a ""must see"" things in Singapore, but you can easily see it when visiting the Marina Bay Sands Hotel and by river cruse boat.

BOTTOM LINE: Loved seeing this unique walking bridge. Worth you while to see and/or walk. Beautiful! MY RATING: 9/10.",03-2019,Couples,2020-01-30 05:56:33.955332
,1,31,https://www.tripadvisor.com.sg/Profile/Rossendale22,657387232,09-03-2019,3,Great Bay Views from low level,Good walking link from Marina Bay to Stafford Road via Turns 17 & 18 of the Formula 1 Grand Prix circuit.,02-2019,Couples,2020-01-30 05:56:34.276915
,1,31,https://www.tripadvisor.com.sg/Profile/garyc320,657000533,07-03-2019,5,beautiful sight,we viewed it in the daytime and at night when it is all light up in a beautiful blue color. There are gardens and an infinity pool at the top as well as restaurants and bars. Truly amazing.,02-2019,Couples,2020-01-30 05:56:34.600205
,1,31,https://www.tripadvisor.com.sg/Profile/Christopher S,656737612,06-03-2019,5,Great view from the top of the building,If you have a head for heights and the time go up in the lift to the swimming pool height and look out over Singapore which is free.,02-2019,Couples,2020-01-30 05:56:40.542513
,1,31,https://www.tripadvisor.com.sg/Profile/wendy h,656706162,06-03-2019,4,An interesting structure,The engineering behind this bridge is interesting. We crossed it at night when it was illuminated. Very attractive.,02-2019,Couples,2020-01-30 05:56:40.918646
,1,31,https://www.tripadvisor.com.sg/Profile/Hendrik_NL,655061032,27-02-2019,4,Eye catching engineering,"This new bridge, part of the futuristic development op the Singapore Marine is constructed with eye catching engineering. Take a moment to view this bridge, even if you won't cross it. See picture.",02-2019,Couples,2020-01-30 05:56:41.241954
,1,31,https://www.tripadvisor.com.sg/Profile/tasannie,653398148,19-02-2019,5,We walked across the Helix many times,"Loved the design of this bridge which is a main walkway to get to the Marina Bay Sands Hotel.
Depending on the time of day this pedestrian bridge can be quite busy,it’s a photographers delight to get photos at night the design and lighting is superb.",02-2019,Couples,2020-01-30 05:56:41.592164
,1,31,https://www.tripadvisor.com.sg/Profile/Mrs Gail L D,652527805,15-02-2019,5,Great walk,An easy walk with great views. Used the viewing platforms along it's stretch to watch the firework display in the Marina. A safe walk between the Marina and the Sands Bay Hotel.,01-2019,Couples,2020-01-30 05:56:41.956446
,1,31,https://www.tripadvisor.com.sg/Profile/tr8v2l3r,650558307,06-02-2019,5,Night stroll,Walked over having left the mall. Some really terriffic views. The bridge wasnt lit up when we visited but still amazing. Great ice creams for sale on the bridge also!,02-2019,Couples,2020-01-30 05:56:42.244595
,1,31,https://www.tripadvisor.com.sg/Profile/greatcats,650155959,04-02-2019,5,Links the Marina Bay Sands with the Marina Center,Very upscale shops in the center with a wonderful food court; great place to avoid the high prices of the restaurants.,01-2019,Couples,2020-01-30 05:56:42.616002
,1,31,https://www.tripadvisor.com.sg/Profile/TALuis,649293490,31-01-2019,5,"Wow, such an impressive building.","This architectural wonder is just incredible. When you visit the Botsnical Gardens by the BAY, THE BUILDING SITE JUST IN FRONT OF THE ENTRANCE.",01-2019,Couples,2020-01-30 05:56:42.989098
,1,31,https://www.tripadvisor.com.sg/Profile/sanjo349,647687730,23-01-2019,5,Fab at night,Gets very busy of an evening with people walking to numerous attractions. Seen it day and night and much preferred it at night when it was all lit up.,12-2018,Couples,2020-01-30 05:56:43.280041
,1,31,https://www.tripadvisor.com.sg/Profile/GlasgowBaywatchbabe,646950478,19-01-2019,5,Fab,What a fantastic bridge. Went for a walk along it and was great. Much better than walking along the road with cars whizzing around.,12-2018,Couples,2020-01-30 05:56:43.634006
,1,31,https://www.tripadvisor.com.sg/Profile/Chris F,646928583,19-01-2019,5,Very interesting design,One of the things that makes Singapore interesting is some of the architecture and the Helix Bridge is one those things. If you take a walk around Marina Bay you will come across it. As the name suggests the bridge has been modelled on the double helix structure of DNA. It is an interesting structure and worth a look particularly if you want to have a view back over the bay to the city.,10-2018,Couples,2020-01-30 05:56:49.545455
,1,31,https://www.tripadvisor.com.sg/Profile/judy_a_bell,646716736,18-01-2019,5,Very picturesque bridge,"This is a great way to walk from the City to Marina Bay. It looks spectacular when lit up at night. If you are looking for a place to run, cross this and run right along the front of Marina Bay Sands and back to the City.",01-2019,Couples,2020-01-30 05:56:49.893753
,1,31,https://www.tripadvisor.com.sg/Profile/Daiseaview,645121463,11-01-2019,5,A Walk around the lake,The bridge is structurally very interesting and must have cost a fortune and is a lovely part of a walk around the lake.,12-2018,Couples,2020-01-30 05:56:50.197793
,1,31,https://www.tripadvisor.com.sg/Profile/Explorer811240,644868348,10-01-2019,4,An interesting stroll to Marina Bay via the Helix Bridge,If you plan to walk around the city what better place than to walk over Helix Bridge from the Mandarin Oriental Hotel side of the Bay across to the Marina Bay Hotel vis the Helix Bridge. Great view across the harbour.,12-2018,Couples,2020-01-30 05:56:50.585517
,1,31,https://www.tripadvisor.com.sg/Profile/janerob55,644851633,10-01-2019,5,Helix Bridge,Walked across the bridge to Gardens by the Bay. Shaded and great spot to take photos of the surrounding area. Came back at night and lighting makes the experience totally different,12-2018,Couples,2020-01-30 05:56:50.965214
,1,31,https://www.tripadvisor.com.sg/Profile/kpiddy,644643931,09-01-2019,4,The longest pedestrian bridge in Singapore,"It was in Madrid years ago that we got to see our first helix bridge, the second is in Singapore. The design of the bridge is based on the structure of DNA and at 280 metres long is the longest pedestrian bridge in Singapore. The bridge connects Marina Bay Sands to the City Hall area and provides great views over the river back towards the CBD.

Before crossing over to Marina Bay Sands we stopped for an icecream from a mobile cart and checked out an art installation wall titled 'Friendship' which showcases images of over 3000 athletes who formed friendships during the Singapore 2010 Youth Olympic Games. There's also a nice small garden next door with outdoor art installations.",12-2018,Couples,2020-01-30 05:56:51.306940
,1,31,https://www.tripadvisor.com.sg/Profile/kellyx112017,644308430,07-01-2019,4,Panoramic views,"Imitating the human dna, such a great creation!Lovely panoramic views,you can actually see almost all the marina bay. Has at points places you get outside the bridge for photos etc.Prefer to visit at night! Often you happen upon wedding photoshoots, fun to watch!",01-2019,Couples,2020-01-30 05:56:51.694358
,1,31,https://www.tripadvisor.com.sg/Profile/Sandip K,644307814,07-01-2019,5,enjoyed walking through this bridge,We walked from Marlion park to Marina bay and we walked through this bridge. A very cool view around evening with lighting and from here the river + city view is amazing...,10-2018,Couples,2020-01-30 05:56:52.034049
,1,31,https://www.tripadvisor.com.sg/Profile/KarlaDGO,644049790,06-01-2019,5,Beautiful design,"We decided to walk along the bridge during night time so it was not too hot. That was a great idea, as it also allowed us to see the lights around this structure.",12-2018,Couples,2020-01-30 05:56:52.380211
,1,31,https://www.tripadvisor.com.sg/Profile/JPY,641838147,27-12-2018,5,See it at night,This bridge links Marina Square to the Bay and is best seen at night when it's illuminated. Also an interesting architectural sight.,10-2018,Couples,2020-01-30 05:56:52.736601
,1,31,https://www.tripadvisor.com.sg/Profile/DTrainTravels,640947347,22-12-2018,4,Use The Bridge At Night For Great Views of Marina Bay,"A unique piece of engineering, this allows you to walk around the bay. Great photo spots at night, and is also illuminated to add to the atmosphere.",12-2018,Couples,2020-01-30 05:56:58.730425
,1,31,https://www.tripadvisor.com.sg/Profile/Dunnersfireman64,640641657,20-12-2018,5,Great Engineer,The Helix bridge is a wonderful piece of engineering. It sparkles in the daylight sun and lights up with multi colored lights during the night.,12-2018,Couples,2020-01-30 05:56:59.070802
,1,31,https://www.tripadvisor.com.sg/Profile/Michael K,640585628,20-12-2018,5,"""just"" a bridge","A way for pedestrians to cross the bay, just an elegant structure with shaded areas and also with little ""peninsulas"" to walk out on for viewing. Also lighted in brilliant red at night. Very nice!",11-2018,Couples,2020-01-30 05:56:59.414921
,1,31,https://www.tripadvisor.com.sg/Profile/Holz64,640426516,19-12-2018,4,Interesting Design,"As well as being pretty to look at, the bridge is a great to walk along and take photos from. There are viewing points to stop at along the way and great photos to be taken",12-2018,Couples,2020-01-30 05:56:59.718275
,1,31,https://www.tripadvisor.com.sg/Profile/RahulMD,639920044,16-12-2018,5,Great bridge,Really cool bridge linking the Singapore flyer to the rest of the marina. Really cool views from here. Just hang out there for a little bit and take it all in.,11-2018,Couples,2020-01-30 05:57:00.018892
,1,31,https://www.tripadvisor.com.sg/Profile/Twobucks,639684044,15-12-2018,5,A Masterpiece...,Take a walk across this masterpiece of engineering design and let your imagination marvel at its construction... It truly is a wonderful piece of architectural design.,09-2018,Couples,2020-01-30 05:57:00.401782
,1,31,https://www.tripadvisor.com.sg/Profile/moonlight_20,637746898,06-12-2018,5,Great architecture,The bridge is even better when at night and lite up. Great way to see the amazing architecture that Singapore offers.,12-2018,Couples,2020-01-30 05:57:00.780915
,1,31,https://www.tripadvisor.com.sg/Profile/mo_aiguille,636590046,30-11-2018,5,Great helix bridge!!,Definitely worth visiting and walking across. The architecture is amazing and would definitely recommend to visit and take great pictures. You can get the Marina Bay sands in the background,11-2018,Couples,2020-01-30 05:57:01.154149
,1,31,https://www.tripadvisor.com.sg/Profile/Smart_Traveller_Aust,636443686,29-11-2018,5,Walking to the future,Such a beautiful walk during the day and at night! The bridge is futuristic in design and illuminated at night with LED lights. So clean and safe and a really nice area of Singapore. Beautiful photo opportunities during the day and at night.,01-2018,Couples,2020-01-30 05:57:01.511138
,1,31,https://www.tripadvisor.com.sg/Profile/InspiredReviewer,636092551,28-11-2018,5,Amazing Design,The footbridge form is unique and is an excellent feature that leads you towards the Marina Sands Retail complex. By day the complexity of the form is stunning and at night it the lighting brings the bridge alive and can be enjoyed as a special place for viewing the bay and taking photographs. The elegance and simplicity of the structural is a testament to the structural engineers Arup. This adds to the iconic statement of Marina Bay.,11-2018,Couples,2020-01-30 05:57:01.913240
,1,31,https://www.tripadvisor.com.sg/Profile/Alvin D,635475437,25-11-2018,5,Walking on water,This is a stunning walking path between Marina Sands and the other side of the Marina. Bridge is wee lite and very pedestrian friendly,11-2018,Couples,2020-01-30 05:57:07.668304
,1,31,https://www.tripadvisor.com.sg/Profile/Iain H,632310290,10-11-2018,5,Beautiful Bridge,The bridge is illuminated each night and at Christmas it is dressed in sparkling lights which are lovely. From here the views toward either Marina Bay of the Marina Bay Sands area are fantastic. It is a great place to take some lovely photos.,11-2018,Couples,2020-01-30 05:57:08.034824
,1,31,https://www.tripadvisor.com.sg/Profile/Emanuel S,629579812,30-10-2018,4,Best way from Esplanade to Gardens by the Bay,"To get quickly from Esplanade by the Bay to Gardens by the Bay, this is the best way to do it.The bridge has some panorama places to take superb photos with Marina Bay and all the building.",10-2018,Couples,2020-01-30 05:57:08.412191
,1,31,https://www.tripadvisor.com.sg/Profile/187brianm,629370480,29-10-2018,5,Beautiful bridge,This is well worth a visit just to see the intricate design. The bridge go from the Marina Bay grandstand over to the Gardens by the Bay.,10-2018,Couples,2020-01-30 05:57:08.735943
,1,31,https://www.tripadvisor.com.sg/Profile/Dan L,628017595,25-10-2018,4,Unique Bridge Design,The bridge was opened in 2010 and links the Marina Centre with the Marina South. Its designed as a series of spirals with canopies made of fritted-glass and perforated steel mesh providing shade for pedestrians. There are four viewing platforms included in the design. Great views. Pass by after dark and it is transformed by the lighting that is incorporated in the structure.,10-2018,Couples,2020-01-30 05:57:09.107507
,1,31,https://www.tripadvisor.com.sg/Profile/Chump57,627817281,25-10-2018,4,Good looking bridge,As the name suggest this is a helix design.Great views of the marina bay area are afforded from the bridge which has refuges where you can stop and admire the scenery. Even more impressive when lit up at night.,10-2018,Couples,2020-01-30 05:57:09.469825
,1,31,https://www.tripadvisor.com.sg/Profile/mccorquinn,625275906,16-10-2018,5,Those amazing views- and that fantastic architecture!,"The site - on reclaimed land formerly a large part of Marina Bay - enables you to look out over great swathes of this vibrant island nation. To get to the top takes seemingly seconds and, as you'd expect, it's a smooth, flawless ride, with expert congestion control of ingress and egress. You may feel your ears ""pop""as you swiftly ascend. It's not cheap but I wasn't paying! And you will be lost in admiration with all those views. We were dining the next day at the venerable Singapore Cricket Club and from where we stood, looking down, it seemed minute. The views on either side will entrance you by day and - from what I've seen of it - also (or especially) at night. There are restaurants and bars to lighten your wallet/purse and - if you are so inclined- those vertiginous swim-up bars with that infinity feel. The breezes at the top somehow don't seem to bring heat, only relief in the renowned Singaporean humidity. This is, rightly, an iconic attraction and one that should be on EVERY visitor's ""Bucket List"".",10-2018,Couples,2020-01-30 05:57:09.785104
,1,31,https://www.tripadvisor.com.sg/Profile/Neil D,625264926,16-10-2018,5,Interesting stainless steel structure,Worth visiting as a means of crossing over the river in the Marina area. Constructed of stainless steel in a DNA sdouble helix structure. Illuminated at night to ilight ncrease its character.,10-2018,Couples,2020-01-30 05:57:10.136318
,1,31,https://www.tripadvisor.com.sg/Profile/mark l,622904508,07-10-2018,5,Best walking bridge,As walking bridges go this is pretty stunning. The views of Singapore are fantastic from here which has several viewing areas.,09-2018,Couples,2020-01-30 05:57:10.433582
,1,31,https://www.tripadvisor.com.sg/Profile/Roy F,621735380,03-10-2018,4,Great photo moment location,"By the day and night, a great location to get the view of the bay and the Central Business District skyline of Singapore. It is even more beautiful at night when the bridge is lit up.",09-2018,Couples,2020-01-30 05:57:10.795927
,1,31,https://www.tripadvisor.com.sg/Profile/constanttraveler2014,621259719,02-10-2018,3,It's a... bridge,"Get to the Sands hotel from Singapore Flyer by walking this bridge. Other than that, it's hard to see why this would be considered a sight.",09-2018,Couples,2020-01-30 05:57:14.581455
,1,31,https://www.tripadvisor.com.sg/Profile/MarieB854,619828427,27-09-2018,5,A must visit day and night,"Great views of the city in the day and night, as well as being a beautiful bridge. I'd like it more if it was called the DNA bridge ;)",09-2018,Couples,2020-01-30 05:57:14.946553
,1,31,https://www.tripadvisor.com.sg/Profile/MsFebs,619766387,26-09-2018,3,Beautiful architecture,Great to go for a short walk while in the area. The helix bridge offered a great scenic point to take pictures of the bay and the surrounding sights.,09-2018,Couples,2020-01-30 05:57:15.326801
,1,31,https://www.tripadvisor.com.sg/Profile/Gul C,619665010,26-09-2018,5,İnteresting Architecture,This bridge links Marina bay to marina Bay sands and has an interesting architecture. Good location for pictures.,08-2018,Couples,2020-01-30 05:57:15.689495
,1,31,https://www.tripadvisor.com.sg/Profile/coord47,618646213,22-09-2018,5,Wow!,This amazing foot bridge links across the Marina Bay to The Marina Bay Sands hotel. I think it is built based on DNA and is so impressive at night.,09-2018,Couples,2020-01-30 05:57:16.014419
,1,31,https://www.tripadvisor.com.sg/Profile/KENNY1000,617647744,18-09-2018,5,Impressive,Nice bridge with great views of marina bay. Good place for a photo stop if walking from town to marina sands,05-2018,Couples,2020-01-30 05:57:16.329591
,1,31,https://www.tripadvisor.com.sg/Profile/ecmenendez,617559154,18-09-2018,4,Interesting Bridge,A great way to get from The Singapore Flyer to Marina Sands and Gardens by the Bay. Crossing the bay on the pedestrian bridge gives you many opportunities to take pictures of the city skyline and the bay,09-2018,Couples,2020-01-30 05:57:16.640823
,1,31,https://www.tripadvisor.com.sg/Profile/secpat,617130732,17-09-2018,5,Great views of the Singapore skyline.,Have a quiet stroke along this feature walkway bridge. With great photo opportunities. Special viewing areas for fabulous back drops.,09-2018,Couples,2020-01-30 05:57:16.990460
,1,31,https://www.tripadvisor.com.sg/Profile/David H,614422080,06-09-2018,4,an unusual bridge.looks great at night.,"crossing the singapore river,dwarfed by the impressive buildings around it,is this unusual bridge.it is a footbridge with a veiwing point looking over the river and at theatre on the river.at night it is lit up and looks good.",08-2018,Couples,2020-01-30 05:57:17.299244
,1,31,https://www.tripadvisor.com.sg/Profile/LeilaCunningham,611353506,28-08-2018,5,Best time ever,"Spending time walking and having some snacks or drink is the best thing you can do in Singapore and specially if you go to Marina Bay. So relaxing, so beautiful!",08-2018,Couples,2020-01-30 05:57:17.659374
,1,31,https://www.tripadvisor.com.sg/Profile/GaneshBharadwaj,608221804,20-08-2018,5,Nice place to walk around at night,"The place is very nice to walk around and see the city. I believe 8 years back, when I came to Singapore, this was not there, but came later.",09-2017,Couples,2020-01-30 05:57:23.437361
,1,31,https://www.tripadvisor.com.sg/Profile/Sandra310,603733652,07-08-2018,5,Gorgeous!!,This is an awesome bridge! Very handy and its so pretty at night all lit up. Everyone wandering around enjoying the sites and totally safe.,07-2018,Couples,2020-01-30 05:57:23.738694
,1,31,https://www.tripadvisor.com.sg/Profile/worldtraveller610,601485519,31-07-2018,5,Well designed and stunning to see with lights on at night.,It's a beautifully designed bridge. The views of Singapore river and Marina Bay are simply stunning. Once you cross the bridge you can enter Marina Bay shops. Which are beautiful to visit.,07-2018,Couples,2020-01-30 05:57:24.115385
,1,31,https://www.tripadvisor.com.sg/Profile/del0802,599464726,25-07-2018,3,Nothing special,The bridge lights up with colourful lights but that is it. There's nothing much to see here and I wasn't too impressed with the bridge itself,06-2018,Couples,2020-01-30 05:57:24.469906
,1,31,https://www.tripadvisor.com.sg/Profile/subwayrider13,599080511,24-07-2018,3,Just a bridge,"It’s just a bridge, nothing to go out of your way and see. We ended up crossing it a lot to get between the mall and our hotel during our stay.",07-2018,Couples,2020-01-30 05:57:24.825275
,1,31,https://www.tripadvisor.com.sg/Profile/fitnfifty,597204896,18-07-2018,5,Do At Night,This bridge should be walked across at night . It is lit up with lots of coloured lights and then you have the lights of Marina Bay as well . Can get very busy here especially before and after the Laser Light Show but do not let that stop you,06-2018,Couples,2020-01-30 05:57:25.206212
,1,31,https://www.tripadvisor.com.sg/Profile/timd655,597197957,18-07-2018,5,Enjoy the walk.,"Our first morning in Singapore saw us walking around Marina Bay and crossing this bridge provided a wonderful and different aspect to the city views. My only regret was not going back here at night as well, so that will be on the list for next time.",07-2018,Couples,2020-01-30 05:57:25.580537
,1,31,https://www.tripadvisor.com.sg/Profile/vasavapr,596095766,14-07-2018,4,Slow stroll enjoying the view,"While walking around the esplanade, we took a slow stroll on this interestingly designed bridge. The design of the bridge is based on human DNA. The intricate pattern of lights on the bridge make is more beautiful to look at night. While walking on the bridge one can enjoy viewing Singapore skyline. A very interesting must-visit place in Singapore.",06-2018,Couples,2020-01-30 05:57:25.941290
,1,31,https://www.tripadvisor.com.sg/Profile/Ellie1145,595684196,13-07-2018,4,Interesting design,We walked across this interestingly designed bridge from the Singapore Flyer to the Marina Bay Sands complex. It gives great views of Singapore and makes for easy access to the shopping mall. It’s very pretty at night when it’s lit up.,01-2018,Couples,2020-01-30 05:57:26.275175
,1,31,https://www.tripadvisor.com.sg/Profile/844Duchess,592841286,04-07-2018,5,Em's on Tour,A fascinating structure. Well worth the walk across and offers great photo opportunities of the Marina area and The Lotus - ArtScience Museum.,06-2018,Couples,2020-01-30 05:57:26.639019
,1,31,https://www.tripadvisor.com.sg/Profile/Douro K,592222997,02-07-2018,5,A different bridge,Since I enjoy different designs and especially I like bridges I had t see this DNA bridge and I was quite pleased. It is not the easiest to fine walking from the Marina Sands but just.,06-2018,Couples,2020-01-30 05:57:32.535012
,1,31,https://www.tripadvisor.com.sg/Profile/hkoza,591968630,01-07-2018,5,"View of singapore in Night from this bridge,","Bridge is near by Marina Bay sand hotel, take visit of this bridge after 7 pm and enjoy night view of Merlin square and other areas of singapore, beautiful picture you can take from this bridge in night, there is no fee for this bridge, 24x7 it's open, but i suggest take visit in night only i.e after 7 pm",04-2018,Couples,2020-01-30 05:57:32.911085
,1,31,https://www.tripadvisor.com.sg/Profile/Krissydidit,590430902,25-06-2018,3,Bridge walk,Stayed at Marina Bay Sands so used the Helix bridge to get to the other side of the river. Easy walk with some good photo opportunities both during the day and night.,06-2018,Couples,2020-01-30 05:57:33.248827
,1,31,https://www.tripadvisor.com.sg/Profile/lucasng29,590254183,24-06-2018,4,Nice pictures at night,Free to go. Best viewed at night. As a local. I have been there many times. Till now I still love the night lights of the bridge,04-2018,Couples,2020-01-30 05:57:33.563971
,1,31,https://www.tripadvisor.com.sg/Profile/AndCo77,590100956,24-06-2018,5,Worth the walk,Took a walk on the Helix Bridge at night to get to Marina Bay Sands from the Fairmont...fantastic views from here over to the Merlion. Not a difficult walk but comfy runners a must.,06-2018,Couples,2020-01-30 05:57:33.929459
,1,31,https://www.tripadvisor.com.sg/Profile/SunnyP7272,588246811,18-06-2018,4,An Amazing Bit of Engineering,"I thought this bridge looked great during the day but it is even better at night when it is all lit up. If you think what a strand of DNA looks like, then this is exactly what the bridge looks like.",06-2018,Couples,2020-01-30 05:57:34.271790
,1,31,https://www.tripadvisor.com.sg/Profile/Travelmad237,587496752,15-06-2018,5,Amazing example of engineering,Make sure you get to see this incredible bridge. A fascinating design & a real feat of engineering. Provides a link to the Marina Bay shopping centre & beyond. Looks great lit up at nighttime,05-2018,Couples,2020-01-30 05:57:34.591118
,1,31,https://www.tripadvisor.com.sg/Profile/alisdairt,584814635,03-06-2018,4,great at night.,"The bridge is easy accessed and it great when lit up at night, great views over the bay area and great for photo as well. Its woth just walking over to admire its amazing structure and the concept of it",05-2018,Couples,2020-01-30 05:57:34.959637
