REVIEW_INDEX,WEBSITE_INDEX,POI_INDEX,REVIEWER_NAME,REVIEW_RATING,REVIEW_DATE,REVIEW_TIME,REVIEW_BODY,ATTRIBUTES_CRAWLED_TIME
,2,202,素素77,5.0,2019-07-13,Not Available,乌敏岛是新加坡的离岛，保持了新加坡最初的原始风貌。交通十分便利，从樟宜村出发乘坐快艇，5分钟即可到达乌敏岛。岛上十分原生态，热带雨林十分茂密，还有榴莲树和菠萝蜜树。游客们可以租一辆自行车骑行，欣赏沿途的美景。,2020-02-16 17:45:53.582811
,2,202,co****ean,5.0,2019-05-12,Not Available,新加坡的户外运动爱好者真是太幸福了，有很多公园都为户外运动爱好者提供便利，有徒步有骑行有慢跑有登山，功能性很强，科普型很高，乐趣性很大～,2020-02-16 17:45:53.589598
,2,202,肥肥安大王,4.0,2017-03-05,Not Available,樟宜码头出发，3新币船费，10分钟左右抵达乌敏岛。很多租自行车的摊位，有单人、双人车，有上下坡，有些路不太平，要小心。环岛一周3小时左右,2020-02-16 17:45:53.594429
,2,202,玖玖蓝天儿,4.0,2019-05-31,Not Available,骑车上坡下坡，很能锻炼身体呀！下坡的时候还能感受下风驰电掣！休闲度日的好地方！呼吸新鲜空气！还能看到野猪咧！幸亏是有围栏的！,2020-02-16 17:45:53.598885
,2,202,coldwar,5.0,2017-10-19,Not Available,去乌敏岛需要从樟宜客运码头坐渡轮，一定要带上防晒霜和杀虫剂。我们也租了最便宜的自行车，到处都是丘陵地带，我们不得不步行，一旦到了岛上，就可以租用一天15美元的自行车。一辆自行车能让你看到整个岛。重点包括珍稀野生动物和保护环境。,2020-02-16 17:45:53.603298
,2,202,Mary_Kiky_Zhu,5.0,2017-10-24,Not Available,乌敏岛骑行非常适合家庭旅行，此行程包括导游服务与自行车租赁服务，途径富有乡土气息的农舍，可以遇见友好的村民。,2020-02-16 17:45:53.607609
,2,202,_ceai****5795,4.0,2017-11-16,Not Available,放飞心情，没有城市的压抑感和窒息度。,2020-02-16 17:45:53.611548
