新加坡被誉为“花园城市”果然名副其实，这次旅行深有体会，而对滨海湾花园尤为印象深刻。地理位置离金沙酒店很近，也可从bayfront站出来根据标示很容易找到。整个花园很大，远远就能看到宛若阿凡达世界里的supertree，到了晚上，这些“参天大树”会亮起映衬夜色的灯光，并且在指定时间开始震撼的音乐灯光秀。另外，我们去了两个室内冷气玻璃花园，分别叫cloud forest 和flower dome，室内冷气十足，一边感受着阳光透过玻璃落下来，一边吹着强冷气，很特别的体验。cloud forest主要亮点是从人造山和植物间倾泻而下的巨大瀑布，据说是世界最高的室内瀑布，很有气势。室内两条空中走廊，可以近距离观赏瀑布和拍照。flower dome 是以热带花卉和植物为主，其中不乏可爱的元素点缀，适合拍照。在supertree周围有一条空中走廊，需要另买票，分批放行游客乘电梯上去体验。走上去能感觉到轻微晃动，但视野很棒，能看到摩天轮和金沙。到了晚上，大量游客会选择supertree周围的空地上坐下等待灯光秀，第一场是七点四十五开始。灯光和音乐相互衬托制造了一场非常浪漫的show，好像到了童话世界。,,,,,
三日新加坡，在狮城度一个有趣又好吃的周末 #带着旅拍去旅行#三日详细攻略如下：Day 1:松发肉骨茶 ► 红点设计博物馆 ► 滨海湾花园 ► 温室花房/云雾森林 ► 超级树灯光秀 ► 金沙酒店重点推荐：睡醒出门吃个早午餐。松发肉骨茶是很有名的一家连锁。肉骨茶的精髓在汤，松发家的汤是可以加续的。推荐骨肉茶、猪肚汤、腐竹凤爪，强烈推荐薏米水。冰冰凉+淡淡的甜味，口感很棒。临走的时候还可以买调料包回家制作。滨海湾花园只有一个字可形容：美。上万种植物品种以富有设计感的造型与极富意境的概念名称进行修饰，让人与自然的距离拉近。还有超大的室内瀑布。在晚间19:45与20:45，分别有两场超级树灯光音乐秀。在温润的夜晚，躺在地上，仰望超级树霓虹闪烁，旁边就是闪亮的地标建筑金沙酒店，超有意境。一场美轮美奂的灯光秀让人瞬间觉得值回了所有票价。不过如果不购票，也是可以散步滨海湾花园，观看灯光秀的。Day 2: 亚坤咖椰吐司 ► 圣淘沙 ► 亚洲大陆最南端 ► 环球影城 ► 珍宝海鲜 ► 克拉码头重点推荐：在环球影城一下午能量消耗得差不多了，正好晚餐珍宝海鲜走起。它家生意很好，属于新加坡必吃，最好提前拿号。香辣蟹（或者黑胡椒蟹）、麦片虾都好吃得无话可说。蟹肉肥嫩，酱汁可口，恨不得把香辣蟹的汤汁打包第二天拌饭。价格小贵，不过还是强烈强烈推荐。Day 3:牛车水唐人街 ► 了凡油鸡饭 ► 鱼尾狮公园 ► 国家美术馆 ► 哈芝巷 ► 乌节路 ► 樟宜机场重点推荐：牛车水可以看见很多新加坡式的中国元素，好似90年代的复古风貌。在这里有所谓的全球最便宜的一家米其林一星——了凡油鸡饭，只要不到4元新币就可以买一份油鸡饭，人民币不到20元，鸡肉又香又嫩，略带一点烧腊的甜香。11点开门的小店10:30便排起了长队。美术馆融合了西方古典与现代艺术的特色，整座建筑由老旧的国会大赛与高等法院改建而成。比起藏品，艺术本身之美，更为突出。这可能是见过建筑风格最美的国家美术馆。,,,,,
"来了几次新加坡，一直没好好逛过「新加坡滨海湾花园」，这次终于来打卡啦～这个超级花园可以说是新加坡的城市绿洲，里面到处都是花草树木，让人有种穿越到热带奇幻森林的赶脚！整个滨海湾花园里最醒目的标志就是擎天树了，这些巨大的钢筋混凝土“大树”灵感来自热带雨林，不但有树的造型，还模拟了树木的生态功能，上面装置了太阳能电池板和雨水收集器，可以保证周围植物的生长。到了晚上擎天树还可以亮灯表演灯光秀，简直是自然和科技完美合体！滨海湾今年4月又新开了一个奇幻花园，这个花花世界颜值也太高了吧！里面有四个不同主题，拍照最好看的是“花之舞”鲜花长廊，从头顶垂下来的鲜花瀑布特别梦幻，拍人像后期加个烟雾特效秒变仙境！现在奇幻花园比云雾林还火，已经成为新加坡新晋网红拍照地啦！逛完奇幻花园可以去旁边的Cafe Aster歇歇脚，这个cafe也是个小花园，里面都是花花草草，很日系小清新的感觉，逛累了来这里喝喝冰饮吃冰淇淋还是灰常惬意滴～「新加坡滨海湾花园」地址：18 Marina Garden Drive, Singapore",,,,,
singapore小暑天气越来越热让人内心也不由的有些浮躁不过不要慌来新加坡滨海湾花园过个清凉解暑的夏天吧！有个景点的温度总是保持在体感舒适的23-25&#176;C漫步其中除了满眼青葱的绿意外还有定时喷洒的水雾让你感到丝丝凉意,,,,,
体验新加坡政府斥资10亿新币打造的滨海湾花园的两个植物冷室（ 23-25 ℃），分别是：花穹（flower dome）；雾林（cloud forest）“云雾林”（占地0.8 公顷）和“花穹”（占地1.2 公顷）——冷室还原了热带山地地区凉爽潮湿的气候和地中海及半干旱、亚热带地区凉爽干燥的气候。,,,,,
花园本身还不错，两个温室，花穹没意思去不去都行，云雾那个不错，ocbc建议现成买票，不过也一般最重要的事，电子票链接是一个pdf，iphone的 safari是打不开的要在pc上打开保存一下，到时候刷条形码就完了，不用打印预定里没有任何相关的提示，如果你现场订就等着傻眼吧,,,,,
其实云雾林里同样有天桥，还不用另外付上桥费，还可以看6层楼高的人工瀑布。花穹有点鸡肋，不少植物目测都蔫了，但两个馆必须一起买票，所以有点被绑架的意思。其实馆里面也没那么冷，忍忍就适应了。总之呢，花穹一般般，云雾林很赞，天空树跑到跟前看看拍照就好了,,,,,
我们拿到7:40进去的时间票，正好快上去的时候有超级树的灯光秀，我们毅然决然直接上去，想想上面应该有别样的风景，但在上面看到的景色没有下面的好看（在空中走廊看到下面全是人，都躺着地上看，空中走廊真的走起来很刺激，偶尔有风吹，但可以看到金沙酒店全貌、摩天轮，也算是大场景）,,,,,
滨海湾花园是来新加坡必须要打卡的一个景点。门票30多新币，还是有点贵，其实里面就是一些人造的景点，随便逛逛即可，意思不大，逛完出来后晚上了。发现夜景非常漂亮啊，觉得其实完全可以不进去，就在外面看看夜景就可以了。,,,,,
如果说环球影城是我到新加坡的第一目标，那么滨海湾花园就是第二目标了。滨海湾花园是新加坡市中心的超级花园，以10亿元造价成为新加坡最新的地标。园区共分成三个部分：&#160;滨海南花园、滨海东花园，以及衔接二者的滨海中花园。,,,,,
世界各地华人多的地方通常年味反而比国内更浓。新加坡就是一个很适合过年过冬的地方。那里是太热。年味太浓。bay of islands 里都是游客，夜景比较好看，配合着灯光音乐，如果没那么多人，感觉会更好。这地方跟米兰世博会里的灯光树很像，不知道是谁抄谁的。,,,,,
天哪在新加坡带了一年出吧，居然去了5次，哈哈，没次去都是不一样的感觉不一样的花花草草，除了云雾林，隔段时间去都会更新……值得去哟，拍照忒别美,,,,,
打印门票带过去，就直接扫码进场，很方便。这个花园（花穹、云雾林）真的很值得去看看，里面的花和多肉都非常美，布局有新意。我已经是第二次去了，依然看得很开心。花园外面，晚上19:45、20:45各有一场灯光秀，十分钟左右，不算精彩，但也算多一个看点了。,,,,,
灯光秀很震撼，感受到大自然的神奇和伟大，云雾穹更棒，瀑布超美，就是里面太冷了，10度左右的气温吧，穿了长袖依然很冷。,,,,,
不愧是花园国家，自然与现代建筑的结合,,,,,
网上订好买票后直接扫码进入就可以了，建议先玩植物花卉园，然后再玩云雾林，设计的很有特色，跟着指示走就可以了，很方便！,,,,,
网上订好买票后直接扫码进入就可以了，建议先玩植物花卉园，然后再玩云雾林，设计的很有特色，跟着指示走就可以了，很方便！,,,,,
滨海湾花园强烈推荐，大概是新加坡我最爱的景点了。两个馆云雾林跟花穹，摄影爱好者一定要去，里面的花状态非常好，所以每一朵都很适合拍。出馆的时候让工作人员盖个戳可以一天内多次出入。,,,,,
滨海湾花园是新加坡的新地标，怎么可以错过。[调皮]三大景点：花穹、云雾林和超级树。另外，闻名遐迩的金沙酒店就在旁边，让人无限向往的酒店啊！[色],,,,,
和期望的一样。夜间和白天两种美感。,,,,,
虽然是人工景点，但很漂亮，值得一去,,,,,
不错的景点，夜晚灯光秀非常赞。个人认为呢是新加坡必须去的景点。先去双园，然后走走空中走廊，晚上灯光秀一次15分钟！,,,,,
很美，可惜没时间进里面，夜景更美。,,,,,
作为新加坡的标志性景点，非常美，非常赞，景色好，没什么可玩的，但是很漂亮，植物各种，千奇百怪，瀑布令人震撼，值得一去，赞(/≧▽≦/),,,,,
春节的滨海湾花园装饰的很漂亮，完全感受不到这是在国外，中国年的元素很多。,,,,,
很不错的地方，适合傍晚的时候去，十一人也不是很多，可以先逛金沙再逛花园，最后晚上去迷雾森林和花穹，这样比较合理。,,,,,
真是好美的花园，也许对于这个森林城市的人来说，绿色不稀奇，但对于国人来说，真的好美，值得一去，大瀑布也很壮观，可以拍不出感觉，现场看很震撼，空中花园本来是最期待的，不过晃晃悠悠的，就要扣分了～,,,,,
花穹和云雾林两个项目都比较有特色，但是更适合夜间观赏，配合光影才体现出极致设计，相比较而言，supper tree及露天音乐会更让人喜欢，配合阿凡达的光影设计，也许更让人印象深刻。,,,,,
携程的电子票，凭二维码在景点售票处最右边窗口取票，很方便，价格确实优惠！景区内的花草是漂亮，只是它本身门票的定价偏高，性价比偏低。,,,,,
很值得逛逛，室内很凉快，还需要穿外套。在这么热的新加坡白天也只能去去这些凉快的室内景点走走看看了，不然要晒死。,,,,,
还不错 里面的花花草草很漂亮！照相也很美丽 小朋友也喜欢 有个小半天时间足够了！,,,,,
新加坡滨海湾花园是一个将城市打造成花园式城市的创举，这个海湾花园的景色超级美，设计也非常有特色，令人耳目一新。,,,,,
因为新加坡非常热，所以很喜欢这个地方，室内非常凉爽～看看植物花卉，参观云雾林最好加个薄外套～晚上有两场超级树灯光秀，值得一看！,,,,,
新加坡必去的景点，有鉴于新加坡炎热的天气，所以夜景更值得欣赏，本人文笔较差，描述不出那里的漂亮夜景，希望照片可以补足文字的不足。,,,,,
花园很大，风景很美，里面有摩拜单车和一种电动车可以骑，走路还是有点远,,,,,
新加坡是一个森林城市，滨海湾花园就是城市中的大花园。有两个花园馆和一个空中走廊，晚上8点开始灯光秀。每天晚上7:45及8:45 有超级树灯光秀，免费入场，最好的观赏方式是躺着看。,,,,,
花园里的植物很美，建议下午进去，晚上出来。因为晚上有超级树的灯光表演，非常美。室内温度较低，最好带上外套。,,,,,
非常棒！各种珍惜植物，晚上的灯光秀超级漂亮，刚好碰到中秋节前夕，惊喜的是节日气氛居然不比国内差，非常意外！,,,,,
滨海湾花园建议玩2次，一场白天可以看到好多植物；白天建议带好防嗮用具，一场夜晚可以边吹着海风边欣赏灯光秀。,,,,,
美不胜收，值回票价！两个冷室里面的植物真的是太多太美了，都不知道用什么词形容，，人工瀑布很震撼，但真的是有点冷，新加坡真的是不愧于花园城市的称号！,,,,,
flower dome和cloud forest超级漂亮 一定要亲身感受一下,,,,,
分为两个馆，花穹和云雾森林。室内的，凉爽舒适。花穹里都是按地域分的植物，可以科普，适合带孩子。云雾森林就是那个带瀑布的地方，人和自然融合的感觉。,,,,,
预定使用都很方便，晚上还有灯光秀。整个环境和景观都很好。滨海湾还有一个新的花室，希望携程也能预定门票。,,,,,
取票很简单便捷！从金沙后面穿过去大约10分钟就到了，非常值！园内的花花草草非常好看！路标很醒目，很好找,,,,,
新加坡滨海湾花园，空中走廊灯光秀打卡，每天19:40/20:40可以过来免费欣赏，白天来可能会很热，最好是去两个室内场馆会比较舒适。,,,,,
滨海湾花园两园连票要在一天内用完。我们因为买了连票没有用完第二次再去就作废了，只能重新购买。里面的环境舒适，如果你不赶时间，可以在里面坐下来慢慢欣赏。特别适合带上孩子和老人一同前往。,,,,,
滨海湾花园非常值得去，晚上灯光秀很漂亮！植物都很赏心悦目，愉悦身心，溜溜呆了一天，室内的瀑布做的非常好,,,,,
很美很美，必去打卡景点！下午五点左右去合适，不用去太早，否则等灯光秀要等很久，两个温室各一小时够了！,,,,,
太让人惊艳了，居然有这么美丽这么大的公园，室内的大瀑布一进门就让人非常震撼，佩服设计师的设计，值得来,,,,,
超级好用，有效期很长，我们8点多才到，工作人员说可以第二天来，晚上可以看灯光秀，很大，正好有中秋灯展,,,,,
滨海湾花园是新加坡最出名的景点之一。就在滨海湾一带，离金沙酒店也是非常的近，可以直接从酒店那边走过去。里面的话，那个植物园啦，非常的经典，可以玩很久，而且几根大柱子可以走来走去，可以穿行很久很久。来新加坡，这是一个必然要打卡的景点之一。,,,,,
晚上7點45分有燈光秀，個人感覺在天橋上以及天橋下的親水平台處遠距離觀看較為適合。燈光秀是免費的，結束後會有大量人流從場內湧出，請注意安全。,,,,,
超级方便，景区现场取票。比直接现场买便宜不少还不用排长队。之前没注意，买到的票是景区外取票的，联系携程也很快给解决了，赞一个。出国在外，还是用携程靠谱些！,,,,,
看得出是花巨资打造的，里面有很多花花草草。之前看图片还以为是在伞树里行走，其实是在另外的大阳光房里观赏，由此对新加坡重视环境保护、重视绿化的程度可见一斑，还是一个值得一去的景点。,,,,,
总体来说还是不错的，里面的植物也很多，花也开得很灿烂，但是不够特别。晚上的灯光秀很不错，值得一看。,,,,,
超好，一眼看见很震惊，长见识了，园区规划和景致基本做到极致了，花卉等保养维护的很好，晚上躺在树下，配着欧洲大歌剧音乐的灯光大秀，震撼心灵！,,,,,
一个超级大的人造花园！里面有各个大洲的各种植物及花卉，很壮观很美，里面各种色彩各种景色，拍照好去处，能玩一天，晚上有灯光秀，住帆船酒店的话可以看到的，进去很冷记得带外套！切记！,,,,,
滨海湾花园是新加坡花10亿元打造的超级花园，其中云雾林馆有全球最高的人工瀑布；花穹馆有超25万棵奇花异草。漫步在花穹馆，各式各样的花草让人目不暇接、大开眼界。非常棒的一个景点。,,,,,
电影场景很舒服的地方，在花园走走也很棒，不一定要付费上去看。晚上的灯光秀也很棒，很值得来。免入场费。可以从金沙饭店天桥走过去,,,,,
花园嘛真的一般般，跟国内植物园比太小。没见过的种类也和很少。去的时候有一个馆还维修，看不到。晚上等灯光秀，也还可以。但没有很震撼的感觉。,,,,,
景点超级好很美，双馆有3新币的小车可以直接到门口 ，走路也就10分钟，除了热之外其实没大问题，到了馆里很冷。但是我觉得新加坡最美的景点就是滨海湾花园了！下次还去！！,,,,,
超喜欢这里，有雨林花园，有汇聚不同风格的植物园，有变化灯光的光伞... 总之美不胜收,,,,,
场馆分为两个，一个看花一个看植物，里面的景色很美，一定要预留2小时的时间去看，里面很大，我也算是走得比较快的，也快2 小时才出来，最好吃了正餐再去，里面的消费偏贵。,,,,,
很值得去看的地方，景色很美，还有很多我们都不认识的花花草草，我们去的时间有点晚了，结果没法登上瀑布顶去看，晚上的灯光秀不负我此行的最终目的，！！记住要带件长袖去，真冷，里面。,,,,,
携程下单比较方便，电子凭证直接扫码入场，不需换票，景点是新加坡必须去的景点，人比较多，下午五六点去，比较好，可以看到白天的场景，在里面逛了一下，天黑了，又能看到有灯光的场景。,,,,,
超美在里面玩了一天，特别是夜晚的灯光秀，刚好配合到时间，灯光秀的时候在桥上，但是！在地面看上去更震撼更美啊。下次去新加坡还要去看！！！,,,,,
我们下午5点多入场，先逛小花园，黑咕隆咚的看不清啥，走马观花的进入到大花园，里面尽然控流，我排队排了半小时果断退出不玩了，出去本想上空中桥看看，过去8点过了，不让上，请改天,,,,,
提前携程上购买的门票，一行4人，坐地铁到空中花园那一站，下来以后从酒店里走到滨海花园。顺便看了下空中park。建筑真是人工创造的奇迹,,,,,
下午5点左右待到晚上听完晚上的音乐表演在离开，音乐表演很震撼，天还亮的时候去走走廊道拍拍照。,,,,,
非常享受的一段旅行。旅途过程令人惊喜。每张照片都像明信片一样。热带的植物奇花异草特别多，拍了很多的照片。如有机会还会再带家人过来观光。建筑非常的有特色。大瀑布的设计很独特。,,,,,
躺在滨海湾花园的草坪上看场灯光秀真的是个不错的选择…… 最美大树[挤眼]  ​​​！！感觉真的很是kool.very lovely.,,,,,
非常值得去的地方，一定要买票去看云雾林和花穹。里面的景色很漂亮，冷气也没有那么冷，我们是中午去的，正好进去避暑。没有看夜景，很遗憾。,,,,,
新加坡的新地标，曾赢得了2012年世界最佳建筑奖由温室(花穹和云雾林)、18棵超级树、文化遗产花园、植物世界、蜻蜓湖和翠鸟湖等组成。,,,,,
不错不错！,,,,,
风景很漂亮、值得一去。买票很方便，直接扫码就能进去,,,,,
买完没能换票入园，8：00停止换票你们7：59还可以卖，没来得及细看，还不能退。提示一下这好，真是一次糟糕的体检，只能外面看看了。,,,,,
网上买了双馆+空中走廊门票。一定要在网上看好双馆开放时间，以免走空。完全就是和图片里见到的一样，带爸爸妈妈出门的旅行，吃的好玩的好，老人家很满意，表示这样的旅行多多益善。,,,,,
还可以吧，就是进门有个瀑布，可以坐电梯到上面看看,,,,,
两个馆值得一去，天空树实在是懒得等到天黑开灯了。,,,,,
好用，扫二维码直接就可以进景点。好用，扫二维码直接就可以进景点。好用，扫二维码直接就可以进景点。好用，扫二维码直接就可以进景点。,,,,,
滨海湾花园中的人造＂超级大树＂，有凌空而架的弧形走道供游客登高观景。滨海湾花园是一个林木茂盛，鲜花盛开的美丽公园。此处于2012年建成，建于填海土地上，占地101公顷。,,,,,
人山人海奥 挪动前进 走马观花 灯光秀现场看好没劲 不如视频或照片唯美 空中走廊提前去约时间 不然排到很晚,,,,,
方便，快捷。携程上买票非常好，不用换纸质票，刷二维码直接进去，方便快捷。以后出去买票首选携程，服务也没得说，都是第一时间答复。,,,,,
方便，快捷。携程上买票非常好，不用换纸质票，刷二维码直接进去，方便快捷。以后出去买票首选携程，服务也没得说，都是第一时间答复。,,,,,
滨海湾花园很漂亮，晚上和白天完全是不同的感觉，特别喜欢花穹，真是植物王国呀，各种兰花，肉肉植物……真是让人大开眼界，叹为观止，,,,,,
不懂花花草草，在花穹里面完全是看个新鲜。雾林的瀑布令人意外的震撼！窗外的夜景也是非常不错。其实植物山的本身，外行只能看看热闹了,,,,,
花园植物品种繁多，布置的很漂亮。另一个里面有很高的瀑布和空中走廊，两个都冷气十足，需外套。晚上的灯光表演不容错过，的确好看。,,,,,
花园植物品种繁多，布置的很漂亮。另一个里面有很高的瀑布和空中走廊，两个都冷气十足，需外套。晚上的灯光表演不容错过，蛮好看的。,,,,,
花园植物品种繁多，布置的很漂亮。另一个里面有很高的瀑布和空中走廊，两个都冷气十足，需外套。晚上的灯光表演不容错过，蛮震撼的。,,,,,
滨海湾公园很漂亮，两个馆里各有特色，各种植物和花卉，是拍照打卡圣地，而且走进去特别凉爽。晚上灯亮起来的时候巨漂亮，伴着音乐，还能登上去看落日余晖中的金沙，值得一游。,,,,,
任性，新加坡有錢就是任性，人性的人面，好多地方都給人方面，人情又好，城市建築非常到位，真不愧為四小龍之首，為新加坡的政府點讚,,,,,
新加坡必打卡的地方，巨大的植物园内景色颇丰，宛若巨大贝壳的温室，超过20万株的800种植物在受保护的环境中欣欣向荣。夜晚可以看到迷人的灯光秀和金沙酒店交融的风景。,,,,,
【景色】特好【趣味】适合带宝宝去【性价比】景点门票价格便宜,,,,,
晚上和白天各区了一次，不同的感受。晚上灯光秀很精彩，白天上去走走犹如空中漫步。再去新加坡一定还要去去。两个室内景点也很棒！,,,,,
很值的去的一个景点，小朋友很喜欢，太美了！,,,,,
一定要来的一个地方！新加坡必打卡经典之一！很美很震撼！3岁以上的儿童就要开始买票了，不是1.2米噢！带孩子来绝对值得！！！,,,,,
两个花园都去看过了感觉室内的瀑布很大，景色很美也很壮观，花花草草而已，也没有那么想象中那么好灯光秀，因为太晚了没有去看，人很多，园区里还有免费小车不错，很方便。,,,,,
猜！华为和苹果手机拍夜景谁赢了每次旅行我都带个大单反，但其实大部分时间都用手机拍现在的手机拍照功能越来越强大，连夜景都十分优秀去了新加坡大名鼎鼎的滨海湾花园免费灯光秀，太梦幻了，像烟花一样璀璨绚烂，但是更环保。-奉上攻略时间每晚两场7:45pm和8:45pm 每场10分钟地点地铁站“bayfront” 步行10分钟左右 指示牌清晰 跟着走就行设备华为p20pro和苹果xs（华为略胜一筹）辅助设备：三脚架后期vsco和snapseed（vsco易上手，适合新手）,,,,,
花穹的花太多了，可以好好看看，都不舍得走了，毎朵花都想拍一下，强推！室内有点冷，要带个薄外套，建议每个时长1.5小时。（花穹的照片还没整理，拿个植物园的凑一下）,,,,,
加坡滨海湾花园（Gardens by the Bay）由滨海南花园、滨海东花园和滨海中花园三个风格各异的水岸花园连接而成。该花园占地101公顷，位于滨海湾亲水黄金位置，是整个滨海湾项目的组成部分之一。海湾花园为新加坡下一步建设国际化城市战略占有中心位置，是新加坡打造“花园中的城市”愿景不可分割的一部分。新加坡政府希望通过此计划将所在岛屿打造为绿草茵茵、树木葱茏、花卉争艳的“花园中的城市”。,,,,,
滨海湾花园，环境非常优美，对面能看见金沙酒店，另外最推荐的是flower dome和cloud forest，花穹拥有上万种植物，很多花卉都是只有在新加坡花穹里面，才能看到的，五彩缤纷，姿态万千。夜晚的景色更加迷人,,,,,
打卡坡县我最爱的滨海湾花园万紫千红尽收眼底荡漾在花海好幸福~两馆室内空调温度很低建议带宝宝的家长给孩子准备好外套挨着有个儿童戏水公园超棒，一定要去哟记得带好泳衣和毛巾有小朋友换衣服冲温水的地儿,,,,,
