新加坡被誉为“花园城市”果然名副其实，这次旅行深有体会，而对滨海湾花园尤为印象深刻。地理位置离金沙酒店很近，也可从bayfront站出来根据标示很容易找到。整个花园很大，远远就能看到宛若阿凡达世界里的supertree，到了晚上，这些“参天大树”会亮起映衬夜色的灯光，并且在指定时间开始震撼的音乐灯光秀。另外，我们去了两个室内冷气玻璃花园，分别叫cloud forest 和flower dome，室内冷气十足，一边感受着阳光透过玻璃落下来，一边吹着强冷气，很特别的体验。cloud forest主要亮点是从人造山和植物间倾泻而下的巨大瀑布，据说是世界最高的室内瀑布，很有气势。室内两条空中走廊，可以近距离观赏瀑布和拍照。flower dome 是以热带花卉和植物为主，其中不乏可爱的元素点缀，适合拍照。在supertree周围有一条空中走廊，需要另买票，分批放行游客乘电梯上去体验。走上去能感觉到轻微晃动，但视野很棒，能看到摩天轮和金沙。到了晚上，大量游客会选择supertree周围的空地上坐下等待灯光秀，第一场是七点四十五开始。灯光和音乐相互衬托制造了一场非常浪漫的show，好像到了童话世界。,,,,,
滨海湾这个地方是来新加坡怎么都绕不开的地方了，不论是去景点打卡，金沙购物吃饭还是乘车经过都看到那些经常出现在风景照片里巨大的钢铁树，没错就是滨海湾花园的标志了，当然这些摩天树区域是免费开放的，真正售票的是那两大温室，个人更喜欢那个有瀑布的，里面的植物更漂亮状态更好，也更有特色，另外那个平面温室感觉一般，虽然也还不错，但是并没惊艳感觉，温室里面的温度很宜人，对比外面三四十度的高温，简直太舒服了，值得多花些时间,,,,,
滨海湾花园内有两个植物温室，以钢铁和玻璃为主要结构，最大程度上优化了观景视野，并加强了陆地和海洋之间的连系。这两个节能的建筑使用了最新的可持续性建筑技术，配备水流收集和过滤系统。温室内培育有22.6万个植物，来自全球各个大洲(南极洲除外)，温室穹顶是建筑、环境和园艺文化三者的结合。,,,,,
海湾花园是新加坡的最新地标，也是城市花园和节能设计的典型代表。前一天晚上，住在金沙酒店，欣赏了花园美轮美奂的夜景，第二天上午，就来到了花园里头。据说，逾25万棵珍稀植物，特别是18棵超级大的树，小朋友叫他“树屋”，站在树顶可以鸟瞰整个花园景色。,,,,,
这个公园平时是不要门票的，但12月12号到圣诞节期间的晚上，由于有圣诞夜市所以需要单独购买门票。说是夜市，也就几个摊位买小吃的，主要还是来看这个灯光秀吧，每天晚上两场亮灯仪式，第一场7：45分，还是挺值得看的。热带人民对雪的期盼只能用肥皂泡泡来满足了,,,,,
滨海湾花园是新加坡市中心的超级花园，是新加坡最新的地标。园区共分成三个部分： 滨海南花园、滨海东花园，以及衔接二者的滨海中花园。游客可在花园中巨大的半球形温室里观赏到超过25万棵奇花异草，和全球最大的室内瀑布。,,,,,
新加坡滨海湾花园是新加坡的新地标，这里位于金沙大酒店的后方，有着十几棵高大的人造大树。另外还有三个拱形的温室 你连种植着来自寒带热带等各个地区的植物，甚至还有一处有着一个人造瀑布，非常的壮观，绝对是来新加坡旅游必来的地方，千万不要错过。,,,,,
已抵达花园就可以看到赚饱眼球的天空步道 来的时候可以先去登记登塔的时间 游客都很多 先安排好行程接下来也比较轻松 旁边的两个大贝壳 一个是热带雨林 另一边是花园 两个巨大温室里面的冷气都非常强劲 可以让你扫去室外的黏腻感 但旅客人数很多,,,,,
新加坡美丽的滨海花园是著名的网红打卡地之一，在这里植被茂盛，繁花似锦，无处不充满着浓郁的东南亚风情。而SuperTree by IndoChine餐吧就位于滨海花园中最大的天空之树顶层，在这个不大的露天餐吧里，可以把新加坡的城市风景尽收眼底。一边是金沙酒店在城市skyline的衬托下高耸入云，一边是花园景观连着海岸线郁郁葱葱，可谓是拥有绝佳的地理位置。不仅如此，这里也提供许多东南亚菜系的美食，有新加坡、马来西亚，泰国和越南等地的融合菜，让你一边欣赏美景，一边品尝东南亚美食，体验觉对棒棒的！光临了2次IndoChine都是在夜晚，如果不想吃正餐，顶楼有一个小型的吧台，20新币的入门券，包含一杯酒水饮料，在露天的树顶喝着小酒，吹着海风，欣赏着新加坡的无敌夜景，也是美不胜收。,,,,,
这个去的真的很值，一定要买空中走廊！两个馆感觉很一般，其中有个馆都是多肉。。而且都是普货，我家阳台的品种都比他们丰富。。好在还有可爱的迪士尼娃娃拯救了，拍照留念一下。另一个馆感觉没有想象中的震撼，不过拍照还是不错的，也是感觉一般般。室内馆没有想象中的那么冷，每个人的体感温度不一样，当天中午去的，我穿着防晒衣感觉要热死了。一开始到了超级树那边真的超级失望，和网图不一样啊？？？十脸懵逼，大下午的的也不能去中央走廊上晒太阳吧，于是跟麻麻吃了个附近的麦当劳正好有圣诞节园内还有很多那种玩游戏得娃娃的那种小摊（感觉在中国都不常见了。。）竟然有很多在玩的外国人。。还有造雪的机器，好多人玩的不亦乐乎，身为一个刚从冬天逃过来的北方人觉得自己好幸运。。可以见到真的雪。。。于是这么多废话中终于等到了傍晚，跟妈妈一起去空中走廊看落日，真的超美，还看了表演，（照片拍不出来，实景真的太美啦）这波不亏,,,,,
平安夜去滨海湾花园庆祝，意外发现一排鸡蛋，原来他们大有来头，晚上很美的灯光秀，用手触碰，鸡蛋还会变色，这个装修会一直延续到明年3月15日。有空去看看哦，免费的，从港湾站地铁站出来走不远即到。,,,,,
滨海湾花园，非常多的植物，很多游客来参观。有惊天大树，特别高大，装饰了很多灯饰，特别是晚上，每晚的19：40有音乐表演，跟着音乐的节奏，五颜六色的灯光非常震撼，美极了。,,,,,
新加坡旧称“星洲”或“星岛”，别称“獅城”，它的獅身鱼尾像就是它的象征：一个岛国以航运为主业，就象大海里的鱼儿一样来去自如，亚洲四小龙之一的经济就象狮子一个威武。新加坡滨海花园的夜景也是十分漂亮。,,,,,
"滨海湾花园分为两部分,都是玻璃屋罩着,里面非常凉爽.逛雨林的时间要多于花穹;除了很多植物,还有具有教育意义的科普讲解,是一个大人小孩都适合的景点.晚上的时候,在花园外面,还有精彩的灯光秀.",,,,,
一直不知道他的首都就叫新加坡，一个城市国家，整个国家就只有新加坡这一座城市，所以新加坡既是一个国家，也是首都。新加坡是一个城邦国家，故无省市之分，奇特的好地方。,,,,,
新加坡真的不大哦，滨海湾公园是到新加坡必打卡的点，入住酒店后，傍晚和晚上到这里逛逛，感觉真好啊！灯光开启的刹那间，实在是太美啦！[色] 住在这个酒店的好处是可以俯视整个公园的全景啦[得意]所以贵点也值，哈哈！,,,,,
天气热却想观光的好去处，2个温室内以温带呈现，植物种类多，十分凉爽，有高桥可走和室内瀑布，购票时要一起买，房客或搭MRT来金沙都穿过金沙酒店天桥走路3分钟，如无小孩和老人建议可跳过付费接驳车走路约10-15分到温室。园区里有熟食中心。,,,,,
这里的花很漂亮，品种也很多。四周环境及布置都十分有趣。晚上的表演好看，与不同游客一起躺着或坐下，感觉很大同，很和谐，很美妙。大家可由左面入口进入，较方便行毕全馆。花园日夜的景色各有不同，大家宜预留足够的时间游花园。,,,,,
不管是从正门走进来还是从金沙饭店走天桥过来， 其实都有一段距离， 接驳车的资讯在官网上也没有写得非常清楚，， 我们去的时候因为很晚所以连接驳车也没有， 还好是晚上，不然白天大太阳应该会走得很辛苦。 可能很欣赏的兴致都没有了。,,,,,
滨海湾花园的的钢筋树应该算新加坡的新地标吧，连摘金奇缘里面都反复出现，夜晚灯光秀开始前有很多人在户外的餐厅和酒吧甚至草坪上聚集，虽然很干净不过还是太热了吧,,,,,
时间不够 没法专门去参观新加坡滨海湾花园 ，但是住在金沙的海景房，阳台上可以看到花园，夜里登上空中花园，俯瞰花园夜景，简直奇幻,,,,,
原来在什么地方有人这样描写新加坡的卫生状况，实在有些夸张。1988年带着这种意识来到新加坡，不免有些失望。但是，新加坡确实干净，由于面积小，所以便于管理，搞好卫生那还是容易的。绿化是第一流的，由于得天独厚的地理环境，雨水充沛，在加上本来就是“巴掌”块的地方，所以到处绿树成阴，鲜花盛开，整个城市是立体化的绿化，因此就成了花园城市。管理是第一流的，在街上，经常可以看到穿着黄马甲的扫地，这些人就是由于毁坏环境，而被罚打扫卫生的，如果有人随地吐痰，那就更加严重了，一般来说没有人敢。,,,,,
当天逛累了可以重复多次进出两个花园，只要出门时候找工作人员在手臂上敲个章。内部就是满眼的植物，珍稀的单独有个玻璃柜子，看描述都是野外已经灭绝的超稀有存在，特别适合带着小孩一起,,,,,
热带生态的好环境，建议一定要购票进入cloud forest参观，非常值得，整个园区非常大，个人认为非常适合亲子之景点，晚间也有灯光秀，白天夜晚都有不同景致,,,,,
就在金沙酒店的附近～新加坡必打卡景点之一～推荐大家可以上午在金沙里面各种shopping～下午参观滨海湾花园的双馆～晚上再去空中花园看夜景！这样的一天就灰常完美了！,,,,,
新加坡滨海湾花园晚上有两场音乐秀，吃完晚饭早早过来占位啦～有蚊子，注意防蚊～免费～所以挺多人，走的时候一大波人。在新加坡待几天的话可以来～,,,,,
携程网上订了云雾林和花穹两个馆的门票，在售票处很方便就兑换到了纸质票。一张门票117元，超值啊！真是进入了花的仙境，各种奇花异草，目不暇接，大大超出游览前的心理预期。馆内温度较低，可以多穿些衣服。凉爽湿润的空气，好解乏呀！,,,,,
新加坡新晋的知名景点、是一个可以早中晚任意时间都来欣赏的景点，非常特别也非常漂亮。滨海湾花园位于金沙酒店后方，从滨海金沙酒店四楼有廊桥链接滨海湾花园，滨海湾花园的门票有分很多种，包括穹顶、花园和天空步道的，一般可选前2或3个都选。穹顶和花园都是室内的，有最大的室内瀑布、观景花艺和林艺，适当的室内温度不会让游客众多的情况下闷热，真的很人性化，也很漂亮。天空步道是连接了好多天空树得布道，可以选择参观时间场次，每场15分钟，可以在天空树的顶端漫步欣赏景色，也可以仰头看金沙，很赞！,,,,,
因为个人原因，虽然不是很喜欢新加坡这座城市，但是不得不说这确实是一座很干净很整洁，并且很有秩序的的城市。Gardens by the Bay有两座大建筑和超级树组成。由于时间关系只去了植物园，在全空调环境下看成千上万的植物也是一种神奇的感受！主要是全透明的玻璃，看到外面的景色太美了！看着这么特别的花园心里有点柠檬！很希望国内也有这么特别的地方，国内真的可以学习一下，把细节都做好！我们有这个实力的！一定能超过新加坡！,,,,,
滨海花园还是挺美的，值得去看看，从地铁海湾站出来大约有10分钟，携程上买的票出票很快，需要换票，换票地点不是是在花园正门售票处，而是要走10分钟到里花穹的售票处换实体票。新加坡很热，能在室内有空调舒舒服服看下花还是不错的！,,,,,
个人觉得云雾林比花穹好 花穹里都是花有些都是常见的 ，云雾林有瀑布很凉快 还可以走上去 但是都不大 ，因为下雨晚上外面灯光秀就远处看看 也没想象的好很一般,,,,,
滨海湾花园是滨海湾项目的组成部分之一，是新加坡打造“花园中的城市”目标的显著标志，这个地区独立运作，有南花园、东花园、中华园多个部分组成，整体不大，毕竟新加坡就很小。灯光秀很好，建议四五点先到花园的冷室看看植物，看到夜幕降临，就可以去找个好角度看灯光了。,,,,,
新加坡是没有什么自然景观的国家，大多是人造景观，滨海湾花园中著名的空中走廊也是人靠景观之一，如果想上走廊走走，可以去买票或在网上买票，我们的安排是下午上空中走廊去，从高处看风景。晚上就在下面的草地上，等待看晚上的灯光音乐秀。还是值得一看的。就是看完后要回酒店，排队等出租车，等了1个多小时。,,,,,
新加坡滨海湾花园打造出令人摒息的美景。正中央巨型擎天大树巍然耸立，夜晚点灯后更为滨海湾花园添增了不少色彩。两座花穹和雾林植物冷室，分别模拟不同气候。在这里可以观赏到超过百万棵奇花异草，和世界最大的室内瀑布。,,,,,
今天看了三个展，逛了两个室内巨型冷室花园。花园里有2219未来展，本以为是各种酷炫高科技，原来是特别丧的环保展，2219年因为温室效应海平面上升海水升温，控制地球的生物已经不是人类而是水母，人类住在地下，淡水缺乏，需要自己用太阳能灯养植物，因为没有了树木，所以就堆些绿色玻璃瓶怀念过往的绿色丛林。,,,,,
白天到滨河湾花园玩，推荐来这个花穹里面看看，主要是凉爽，哈哈，我去的时候赶上荷兰郁金香花主题展，挺有意思的，分为两层，主要展览都在一层，二层是局部，展现不同地方的花的特色和人文主义，对于常驻在北方的人们，看看挺有感触的！,,,,,
超级树的灯光秀太美了，音乐好多都是中国的，我们躺在树下看的，很美妙的体验。我们去的那天空中走廊检修不开，没上去，比较遗憾。云雾林和花穹里面太冷了，但是植物超级漂亮，很多国内没有见过的植物，真是长见识了。恰逢中秋前夕，公园里扎了彩灯，还放音乐。,,,,,
"带你进入花穹及冷雾林冷室，被誉为新加坡必看美景的18棵擎天树，以及璀璨华丽灯光秀! 全球领先旅游体验预订平台。无需排队 扫码即入场。优惠价格保证。中英文客服支援。积分可折抵现金。极速预订 即买即用。类型: 景点门票, 导赏团, 美食券, 交通票, 上网卡。",,,,,
新加坡金沙滨海空中花园一探超级擎天树与夜晚璀璨灯光秀 | 带你进入花穹及冷雾林冷室，被誉为新加坡必看美景的18棵擎天树，以及璀璨华丽灯光秀!,,,,,
新加坡印象最深刻的地儿之一…建议票子可以点评购买最划算，实在不行当场买也比淘宝便宜呢…门票含双馆，花穹和云雾林，花穹馆是个很大的室内植物园，里面有各种花卉，可以集齐彩虹七色了，有些名贵的花花是会放在玻璃房里的，大家可以拍照，但是不要用手去触碰哦。这个地方还蛮适合练习摄影的，随便拍都是好构图，如果找到一面植物墙，那简直可以拍写真啦…另一个馆是云雾林，进去就有很高的瀑布，然后就是空中走廊，下面有部分是透明的，小伙伴有点腿软，我倒是觉得很好玩…温馨提示：1、馆内气温较低，建议带个外套。2、晚上的灯光秀必看！！！谁看谁知道有多好看，每天晚上7:45和8:45各有一场，不用提前很早到，广场任意找个地方躺下，接下来就是静静欣赏即可，灯光秀是免费的，时长一刻钟吧…3、建议下午五点多去，这样两个馆兜好差不多七点半左右就可以看灯光秀咯。,,,,,
滨海湾花园，新加坡地标之一，由于离酒店比较近，就步行，其实从金沙走过去也要20分钟。去的早人比较少，不过正好碰到小学生上户外教学科。滨海湾花园分为2个馆，Flower Dome、Cloud Forest；先去得云雾林，去得早的好处就是人少，但是里面冷气十足，请穿长裤带好外套；分好几层可以坐电梯至最高层，一路往下；花穹馆犹如置身在花园中；各种花朵绽放，色彩缤纷。参观完后本想走一下空中走廊，但天空不作美下雨了，只好晚上再来，真好看灯光秀，晚上人比较多，电梯一般也就7个人放行。总体来说还是值得一看。,,,,,
这里室外花园是免费的，“花穹”和“云雾林”两个区域是收费的室内区域。里面比较冷，建议去的时候带一件长袖的衣服。“花穹”里种植着来自全球各地的多种植物以及珍稀植物。超多的仙人掌、仙人球和软萌的多肉植物。在植物丛中还有很多精美雕像，龙啊，马啊，羊啊等等。还有一片充满童话色彩的郁金香花园，各类各色的郁金香争奇斗艳，美不胜收。“云雾林”一进门就看到这35米高人造瀑布，很是壮观。之后坐个电梯上去，在一个像是顶楼花园的地方，这里有兰花、猪笼草、无种子的蕨类植物等。之后漫步“云中步道”，对于恐高的我来说有点吓人。不过景色还是很不错的。,,,,,
夜景很美，我们买了可以参观2个room的票，20多新币一个人。第一个就是一个室内花园，对于我这种带小孩来逛逛的并且不懂植物的，表示一般般。第二个就是有瀑布的这个感觉还可以。也算是到新加坡必须打卡的地方了,,,,,
滨海湾花园毗邻著名的金沙酒店，这里有植物温室——花穹和云雾林冷室，还有数颗超级树组成的森林，充满了科技感，同时又与环境合二为一。花穹里是各种温室植物，有各种多肉和各种叫不出名字的花卉，还有几颗猴面包树，植物名牌全是英文。。看不懂。冷室模拟了高山不同气候，一座巨型瀑布贯穿了上下七层，推荐游览方式是坐直梯上到顶层，然后沿着高空长廊一层一层观赏。超级树，钢铁的枝丫向天空延伸，树干上缠满了藤蔓，充满科幻感，仿佛到了潘多拉的星球，超级树内部顶上有个餐厅，可以在里面用餐，来超级树一定要上去走一走空中走廊，粗粗的钢索在树中间架起的空中长廊，有风吹过的时候会微微晃动，很有意思，而且景色也很美哦，不过黄昏时为了安全空中走廊会关闭，所以要尽早去。,,,,,
【景色】太值得去的地方了 非常美 我们没有把户外部分看完 单纯玻璃屋内的就游览很久 晚上看了两次灯光秀 结束后院子里没有人了还是很恐怖的,,,,,
从金沙酒店乘搭电梯，经过天桥便到达滨海湾花园。若晚上参观这里，一定不能错过晚上只有两场的灯光秀！擎天树的灯光十分美丽，随着音乐闪烁，使人惊叹万分。,,,,,
最喜欢的地方白天跟晚上看的感觉很不一样，两种风格都很喜欢。夜晚的灯光秀也是来新加坡必看的，很壮观很美！看几次都不会腻，值得前来游玩。,,,,,
滨海湾花园晚上的灯光秀是免费看的，所以预了一定多人。灯光秀配合灯光及音乐，把树弄得非常好看，不过一完了灯光秀，这片园区就没有什么特别好看了。,,,,,
随性的新加坡之行，本没有把这个&quot;俗套的热门景点&quot;列入其中，然而在出租车司机的力荐下，最后一天选择去了这里。携程上直接买的优惠票，特别方便，当天早晨买了，当天用，扫电子码即可入园。1. 带厚衣服厚衣服，非常的冷啊，感觉20度左右，因为植物需要，所以人比较冷！2. 被空中植物园美呆！竟然可以一层层上去欣赏的，设计感很赞！3. 花卉植物园也非常的专业，各种多肉和常见，珍稀花卉，绿植，大开眼界，有很大的郁金香园，非常适合拍照。4. 带孩子是很好的学习体验机会哦！不要错过，大人花友也受益良多。在此感受到新加坡的精致，文化之美。不错！,,,,,
带着6岁的娃，一路停停走走，拍拍照赏赏花。很多热带的植物宝宝之前都没见过很新奇的样子。需要注意的是馆内的冷气特别足，一定要带一件薄外套~,,,,,
超级大的室内花园厉害的新加坡，在室内培育了许多种类的植物，且冷气随着侦测改变，在各个地方的植物，几乎都能在这个花园里面看到,,,,,
这里是新加坡最具标志性的地方，这里有喷水狮子的雕塑，是狮城的象征，也是来新加坡必须打卡的地方，新加坡虽然不大，但是管理很好，很精致。,,,,,
新加坡滨海湾花园，真的超级大，最外面一圈是免费的，可以慢跑散步，靠着江。里面的空中走廊和室内花圃是收费的，但是也值得票价，非常惊艳。,,,,,
新加坡滨海花园坐落于金沙酒店隔壁。这里除了可以观赏阿凡达电影中描绘的树木，还可以付费参观温室植物和瀑布。另外，这里还有一个花钟哦！,,,,,
这夏夜，迷之有色，幻之有梦，坐在这super tree下面，就像拥有超级魔力那样，甘之沉醉其中，生出岁月静好的感觉~~~,,,,,
下一站波兰｜女孩子的三十而立，是把风景都看透我是Nicole，一个非典型女程序员。她是yoyo，一个擅长kpop dance的金融工程硕士。18岁一起拿奖学金出国留学23岁找到人生第一份体面的工作26岁跟男朋友一起存钱付下第一套房子的首付28岁自己花钱、设计并办了梦想中的婚礼30岁，等待我们的是什么呢？生活变得平淡，事业不温不火，我们的三十岁，也同样有着焦虑和危机。    三十岁的自己，好像跟曾经幻想的不太一样。作为理科生，我也有想当科学家‍的时候，那时候同学录里偶像一栏写的是居里夫人，而yoyo说小时候在家辛苦弹肖邦练习曲的时候，一直以为自己长大会成为艺术家，大概就是第二个重庆李云迪吧。谁不是来自山川湖海，却囿于昼夜、厨房与爱。人生的不确定性，总让计划和现实出现偏差，我们不得不向生活妥协。但是只要初心不妥协，偏差也会是美好。就像涅槃重生的波兰一样，在妥协和不妥协中重新找回最初的模样，然后一路向前。     作为第一个允许中国公民使用电子方式申请签证的申根国家，波兰有讲不完的悲壮历史。几百年的被征服与反抗的日子里，波兰人有无数妥协和溃败，百多年的消亡史却没有埋藏波兰人的民族气节，哪怕华沙85%的建筑在二战中被毁，波兰人也毫不妥协的重新建立起战前的华沙老城模样，如今已是世界文化遗产之一。想去波兰，想让三十而立的人生从波兰拉开美好的第一站，让我们的生活除了眼前的苟且还有远方的诗。想去波兰，因为那里是儿时偶像的故乡。去居里夫人博物馆参观，去哥白尼纪念碑仰望，再沿着肖邦之路前行.......好像这样，就可以离童年的妄想近一些。想去波兰，去缅怀二战沉重的历史。犹记得中学时候全班一起看《辛德勒名单》，每个人哭的稀里哗啦，在多走十几年人生路后亲临辛德勒工厂和奥斯维辛，那份沉重应该会有不同分量。想去波兰，在一家地道波兰饭馆尝尝正宗波兰饺子pierogi想去波兰，去扎科帕内探索冰雪世界，去格但斯克参加莎士比亚戏剧节，去波兹南看可爱的彩色房子，去索波特体验超实惠的海边别墅......如果有幸成为旅游大使，那我们就用我们的故事激励大家在人生的妥协与不妥协中保持初心。三十岁，抛开焦虑和危机，让我们带着初心重新上路，再把风景都看透。,,,,,
