REVIEW_ID,WEBSITE_INDEX,POI_INDEX,REVIEWER_NAME,REVIEW_RATING,REVIEW_DATE,REVIEW_TIME,REVIEW_BODY,ATTRIBUTES_CRAWLED_TIME
66405,2,293,juki235,5.0,2019-06-15,Not Available,新加坡海底世界比起圣淘沙的海洋馆略微的小一点，但这里也饲养着许多的海洋生物。在巨大的水族缸里，描绘着东海龙宫的场景，鲨鱼和各种海洋珍稀动物在这里畅游，真的非常的梦幻好看。,2020-02-16 18:25:05.877766
66406,2,293,whoisangel,5.0,2019-04-15,Not Available,这海底世界的面积还是非常大的，真的是特别适合带小朋友来这里游玩。你能够看到各种各样非常神奇的海底生物，推荐看看这里的珊瑚，真的是特别的美丽，各种各样大小不同，颜色不同种类的珊瑚应有尽有。不得不感叹大自然的鬼斧神工动物世界，还真的是特别的奇妙呀。,2020-02-16 18:25:05.886584
66407,2,293,whoisangel,5.0,2019-04-14,Not Available,这里专门的水母展览区域。特别惊叹大自然的神奇。能够看到粉红色的水母。听说这种水母没有毒的，哪怕手碰上去也不会被折腾。但是如果大家真的在海里游泳，还是与水母，保持距离。大多数的水母还是有毒的会被蜇的。总体来说，这个海底世界还是特别棒的，特别适合带小朋友来这里游玩，真的是非常好的一个游玩感受。,2020-02-16 18:25:05.894632
66408,2,293,素素77,4.0,2019-07-22,Not Available,在新加坡海底世界，可以看到很多珍贵稀奇的海洋生物，尤其是各种漂亮的水母，十分令人难忘。很多家长带着孩子前来观看游玩，因为游客较多，所以十分热闹。,2020-02-16 18:25:05.901136
66409,2,293,whoisangel,5.0,2019-04-13,Not Available,真的非常不错的一个海底世界，在这里，你能够看得到很多各种各样的珊瑚，还有各种各样的小丑鱼，真的是不得不感叹海洋生物的奇妙。特别适合带小朋友来这里观光真的是让人打开眼界呀。,2020-02-16 18:25:05.907394
66410,2,293,whoisangel,0.0,2019-04-14,Not Available,这里专门的水母展览区域。特别惊叹大自然的神奇。能够看到粉红色的水母。听说这种水母没有毒的，哪怕手碰上去也不会被折腾。但是如果大家真的在海里游泳，还是与水母，保持距离。大多数的水母还是有毒的会被蜇的。总体来说，这个海底世界还是特别棒的，特别适合带小朋友来这里游玩，真的是非常好的一个游玩感受。,2020-02-16 18:25:05.913326
66411,2,293,达达和妮妮,5.0,2018-12-18,Not Available,对于喜欢进行海洋探索的朋友来说，这里的海底世界真的很棒,2020-02-16 18:25:05.919122
66412,2,293,望天树宝贝,4.0,2018-06-15,Not Available,不错，所有的海豚会根据指导员的音调跳舞，舞蹈和跳跃让游客很开心。和海豚拍照需要35新加坡元。总体来说，这是一个好地方,2020-02-16 18:25:05.925013
66413,2,293,sunnycccc,5.0,2019-02-13,Not Available,还是比较好玩哦 有很多小鱼儿哦,2020-02-16 18:25:05.929888
66414,2,293,阿里巴第二代,5.0,2018-08-21,Not Available,海底世界的门票很值得。这里除了有许许多多漂亮的鱼，还有大鲨鱼，带孩子们来这里既可以学知识也可以陶冶身心打开眼界挺适合的。,2020-02-16 18:25:05.933991
66415,2,293,Wchzhn,4.0,2018-06-13,Not Available,海底世界大探索。最爱找我们来玩的是阿扁鱼先生～,2020-02-16 18:25:11.526942
66416,2,293,杨坤,4.0,2018-08-25,Not Available,海底世界是很漂亮的地方，里面有很多小鱼。,2020-02-16 18:25:11.531709
66417,2,293,_WeCh****995193,1.0,2018-07-16,Not Available,大家不要在携程上订票了，我在携程上定的机票，由于携程没有提示短信，导致误机，造成我们损失五千多元，服务实在是太差了,2020-02-16 18:25:11.536230
66418,2,293,_M13****2480,5.0,2018-06-24,Not Available,值得去，光怪陆离，孩子的乐园，也是大人的乐园，流连忘返，一整天都不够。,2020-02-16 18:25:11.540689
66419,2,293,M13****519,5.0,2018-08-18,Not Available,绝对值得游完的好地方，是我见过最好的海底世界,2020-02-16 18:25:11.544910
66420,2,293,M15****577,5.0,2018-06-21,Not Available,海底世界总是充满了无穷的乐趣与奥妙。,2020-02-16 18:25:11.548900
66421,2,293,smrzhao,0.0,2015-08-05,Not Available,"新加坡海底世界,Underwater World Singapore 地址：80 Siloso Road Island Singapore 098969（也是在圣淘沙小岛上，建议去玩环球影城就去海底世界，很近，一天可以搞定） 时间：每天10:00-19:00 网址：http://www.underwaterworld.com.sg 交通：在圣淘沙名胜世界乘坐圣淘沙巴士1号、2号,到西乐索景点下车。 票价:票价含海豚表演,成人29.9新币,儿童(3-12岁)20.6新币。 介绍 这里集合了很多有意思的项目,不仅仅是一个观看海底生物的水族馆,还可以尝试水下进餐或者到Magic-T 上感受一下突然离心失重的刺激,也可以 和爱人牵手徜徉于海底隧道中,共享浪漫时光。海底世界更是适合全家一起游玩的景点,在这里可以和海洋生物亲密接触,如与鲨鱼一起潜水(Dive with The Sharks,每人120新币),或与海豚一起游泳(Swim with the Dolohins,每人170新币),不过,雨天会取消表演。 【个人感受】 海底世界真的很美，可惜没有录像，很多时候觉得静态的美是无法呈现的，强烈建议去的时候带一个dv, 或者手机要留够内存，补录视频太可惜了，真的，对比了日本的海底世界和香港的海洋公园，发现新加坡的真的是最美的，可能是热带的原因，热带鱼真的很漂亮~ 海底世界是我在新加坡最喜欢最惊艳的地方，真的挺好玩的，很多很多非常漂亮的鱼。而且还有那种纪念币DIY机器，好像是自己投硬币进去然后搅一搅就会弹出来一个海底世界纪念币，挺有意思的。",2020-02-16 18:25:11.552641
66422,2,293,周常在,0.0,2014-02-07,Not Available,"这里集合了很多有意思的项目，不仅仅是一个观看海底生物的水族馆，还可以尝试水下进餐，或者到Magic-T 上感受一下突然离心失重的刺激，也可以和爱人牵手徜徉于海底隧道中，共享浪漫时光。 地址：Palawan Beach, Sentosa Island, Singapore 099981 交通：从Harbour Front先坐轮渡到圣淘沙（Sentosa），海底世界位于圣淘沙的西北角。 开放时间：9:00-21:00 门票：成人：25.90 元；儿童票（3-12）：17.60 元",2020-02-16 18:25:11.556171
