REVIEW_ID,WEBSITE_INDEX,POI_INDEX,REVIEWER_NAME,REVIEW_RATING,REVIEW_DATE,REVIEW_TIME,REVIEW_BODY,ATTRIBUTES_CRAWLED_TIME
67074,2,412,coldwar,4.0,2017-10-22,Not Available,冷溪祖传的博物馆是一个老式的房子，就像德国或奥地利的大别墅，但设计不同。它有一个古老的英裔美国人的设计。有一个传统的明代舞蹈和器乐演奏，一个关于中国氏族的传奇故事。,2020-02-16 19:02:31.034195
67075,2,412,社会阿杰,5.0,2019-06-13,Not Available,景色还不错 有时间的朋友 可以来走一走看一看 还是蛮好的,2020-02-16 19:02:31.040219
67076,2,412,sunnycccc,5.0,2019-02-10,Not Available,环境很不错的 游客也比较多的哦,2020-02-16 19:02:31.046422
67077,2,412,_ceai****5795,4.0,2018-01-30,Not Available,欧式小别墅的外观，另类的博物馆。,2020-02-16 19:02:31.052824
67078,2,412,sunnycccc,5.0,2018-01-04,Not Available,这里的环境超级棒的哎 真的好漂亮哦,2020-02-16 19:02:31.059229
67079,2,412,达达和妮妮,5.0,2018-06-27,Not Available,太喜欢这间博物馆了，虽然占地面积不大，却有很多惊喜的发现,2020-02-16 19:02:31.065527
67080,2,412,sunnycccc,5.0,2018-09-21,Not Available,博物馆周边的环境很棒 来的人挺多的,2020-02-16 19:02:31.071566
67081,2,412,M21****710,4.0,2018-06-20,Not Available,虽然是小型的博物馆，但是园林环境很好。,2020-02-16 19:02:31.077921
67082,2,412,M15****577,5.0,2018-06-12,Not Available,博物馆很不错，很有看头，环境好,2020-02-16 19:02:31.082982
