REVIEW_ID,WEBSITE_INDEX,POI_INDEX,REVIEWER_NAME,REVIEW_RATING,REVIEW_DATE,REVIEW_TIME,REVIEW_BODY,ATTRIBUTES_CRAWLED_TIME
67210,2,435,co****ean,5.0,2019-05-08,Not Available,Singapore Maritime Gallery是新加坡海事展览馆，面积挺大，特别丰富，科技感十足，生动详尽介绍新加坡的海运业如何一步步发展！,2020-02-16 19:09:21.308906
67211,2,435,coldwar,4.0,2017-10-24,Not Available,新加坡还有画廊对海洋的任何兴趣的人可以去参观，反正也不要门票，一个专门的儿童区，有丰富的游戏和谜题。对于老一辈的人来说，展览包括一个电脑化的船舶处理区域，有大屏幕来跟踪你的进展，有许多复杂的船舶和石油钻机模型等。,2020-02-16 19:09:21.313521
67212,2,435,刀刀,4.0,2015-11-09,Not Available,滨海湾，景色很美，但这次去竟然有点小小的雾霾，但是不影响它的美丽。有很多有趣的设施，可以供孩子玩耍，值得去哦,2020-02-16 19:09:21.318113
67213,2,435,飞屋环游007,5.0,2016-08-13,Not Available,滨海湾，景色很美，但这次去竟然有点小小的雾霾，但是不影响它的美丽。有很多有趣的设施，可以供孩子玩耍，值得去哦,2020-02-16 19:09:21.322435
67214,2,435,138****3432,5.0,2016-11-30,Not Available,清新的空气，熙熙攘攘的人群，只想说一个字计给人以视觉上的冲击力，动感十足旅途中还能吃到很美味的食物，很开心,2020-02-16 19:09:21.326631
67215,2,435,_ceai****5795,4.0,2018-02-05,Not Available,娱乐设施还不少，性价比蛮高的。,2020-02-16 19:09:21.330368
67216,2,435,泉泉227676,4.0,2015-09-30,Not Available,这里是一个海事博物馆一样，展览和介绍了很多航海方面的知识，也有些互动的项目。,2020-02-16 19:09:21.334164
67217,2,435,tai****000,5.0,2016-10-18,Not Available,这里是一个很不错的画廊，这里的很多收藏都非常的有价值，有很多画作都是关于海事方面的，展示了新加坡的海运事业的发展历程，画廊就在繁华的滨海湾，值得细心的逛一逛。,2020-02-16 19:09:21.337966
