REVIEW_ID,WEBSITE_INDEX,POI_INDEX,REVIEWER_NAME,REVIEW_RATING,REVIEW_DATE,REVIEW_TIME,REVIEW_BODY,ATTRIBUTES_CRAWLED_TIME
58918,2,92,endlesssummer,5.0,2017-07-26,14:13,蜡像馆不是很好找，问了当地好多人才找到的。坐了个很长的电梯在一座小山顶上，但上去了就能看到。我门票是淘宝订的比现场买便宜的多，电子票柜台上需换票的。蜡像馆还包括新加坡精神船的票，坐小船里面可以看到迷你版的许多新加坡景点，很可爱，挺有特色的。蜡像馆不是特别大，但世界各行名人都蛮全的，还有许多中国名人身影好有亲切感哈哈蜡像馆里有些地方是有人免费帮你拍照的，还有电子互动屏在足球明星那一块可以玩点球，建议大家在圣淘沙时间充裕的话可以去看看，带小孩的粑粑麻麻都可以考虑,2020-02-16 16:25:18.435857
58919,2,92,山水人生,5.0,2016-12-20,19:20,走过节庆大道，在观赏“云梦湖”和鱼尾狮的景观中，搭乘电动扶梯上山找到杜莎夫人蜡像馆。用提前国内旅游网站付款预定门票的订单邮件换取门票后进入蜡像馆，先是搭乘小船在观赏新加坡城市变迁的背景和人物蜡像中开始参观。随后登陆验票进入展厅，这样的入场方式挺别致，新加坡人在旅游方面很有创意。走进蜡像馆首先看到的人物是三位政治家，一位是新加坡第一任总统，我们没听说过；一位是马来西亚前总统，我们在很多年前就知道他；再一位是我们非常熟悉的毛泽东主席。这三位政治家在蜡像馆门口登场看起来很富有新加坡历史特色。 随后登场的政治任务是英国女皇和新加坡过去和现在的领导人，在这里友情出场的有美国总统奥巴马和印度的圣雄甘地，属于世界大国和亚洲大国的领导人代表。这里最引人注目的是李光耀总理和夫人老年的合影照片，作为新加坡杰出优秀的领导人，曾经率领新加坡人民缔造国家繁荣富裕神奇的领导者，在这里与爱情的身份出场更有亲民的元素。恰逢一群孩子在蜡像馆参观，顿时让这座游客不多的空间充满了喧闹，孩子们摆出各种姿态与蜡像馆中的人物合影，那种真情流露与蜡像人物的逼真形成了遥相呼应的写真。游客也都会选择自己的偶像与之合影，整个蜡像馆里真假混编笑容各异。我们在观赏蜡像和查看人物介绍中，欣赏着这里现实与记忆的融合，有了这群活蹦乱跳的孩子们，让这座看似没有生机的蜡像馆充满了欢声笑语和栩栩如生的生机。,2020-02-16 16:25:18.452865
58920,2,92,BetTerDAY,5.0,2020-01-24,23:55,新加坡杜莎夫人蜡像馆是一个意料之外的景点，那天本来只是为了游玩新加坡环球影城，但是下午下了暴雨，只能选择一个室内的景点，于是就临时买票去了蜡像馆躲雨，顺便拍了不少照片,2020-02-16 16:25:18.462606
58921,2,92,M30****3276,5.0,2019-09-25,17:08,看到了我们的主席，这是之前在北京和曼谷没有看到的，还是比较兴奋，另外有一个万象新加坡，讲述新加坡是如何从一个小渔村变成今天的花园城市的，全程英文，工作人员还是很投入的，只是语速很快，英文不好的还是不要参与了。,2020-02-16 16:25:18.469318
58922,2,92,BetTerDAY,5.0,2020-02-03,21:58,新加坡杜莎夫人蜡像馆不仅拥有栩栩如生的名人蜡像，更有万象新加坡LIVE秀，展现新加坡的精彩发展史，以及新加坡精神游船，是观览今日新加坡盛景的一个绝佳去处。,2020-02-16 16:25:18.473901
58923,2,92,朝霞浮萍,5.0,2019-11-24,16:23,新加坡杜莎夫人蜡像馆位于圣淘沙岛上。在圣淘沙的鱼尾狮后面。在一个小山上。在携程买票比较划算。在门口卖要80新币。杜莎夫人蜡像馆有好几个设施。不仅有蜡像馆还有新加坡的历史展览。很不错的体验。,2020-02-16 16:25:18.478130
58924,2,92,BetTerDAY,5.0,2019-12-02,12:44,新加坡杜莎夫人蜡像馆比上海杜莎夫人蜡像馆小的多，但庙不在大，关键要有大菩萨，新加坡有在大陆绝对看不到的蜡像，也正是为了他，我才千米迢迢来到蜡像馆,2020-02-16 16:25:18.483953
58925,2,92,M30****8811,5.0,2019-09-25,17:24,按照谷歌地图，需要坐一站圣淘沙的轻轨（圣淘沙轻轨免费的），到imbiah站下，再坐3层扶手电梯上山顶即可。杜莎夫人蜡像馆现场买的票，成人32新币，儿童28新币&#183;。,2020-02-16 16:25:18.487818
58926,2,92,BetTerDAY,5.0,2019-11-21,05:31,新加坡杜莎夫人蜡像馆是圣淘沙旅程的bonus，本来没打算专程去，后来赶上新加坡数月不遇的大雨，就去那边打了个卡，还见到了总书记,2020-02-16 16:25:18.491317
58927,2,92,M30****5169,5.0,2019-09-25,19:46,临出门前，会有一个合成照片的地方，好像是新加坡的一些标志性建筑，要20新币一张。豆妈觉得不好玩儿，而且换算成人民币也不大值得~！,2020-02-16 16:25:18.495008
58928,2,92,M30****2342,9.0,2019-09-25,10:22,新加坡杜莎夫人蜡像馆很特别，不但有名人蜡像，还有一个Image of Singapore的真人秀，带游客了解新加坡200百年来的历史。演员很投入和幽默。,2020-02-16 16:25:20.731954
58929,2,92,辉哥_,5.0,2020-01-23,23:17,这座位于圣淘沙山顶的蜡像馆看上去不大。蜡像馆对出的平台可以远眺新加坡的市区。馆再往前走就是缆车站和划车的千灯湖，十分方便。,2020-02-16 16:25:20.735156
58930,2,92,阿滋楠,4.0,2019-07-25,16:18,VLGO | 漫威迷福利，在这里和漫威英雄们来个亲密接触 嗨玩新加坡，在圣淘沙的杜莎夫人蜡像馆里竟然能发现了这样的一个漫威空间，可以尽情的来个亲密接触。有逼真的模型可以拍摄还可以看4D电影。,2020-02-16 16:25:20.738224
58931,2,92,杰杰陶TAO,9.0,2019-12-07,09:51,新加坡杜莎夫人蜡像馆位于圣淘沙岛上。蜡像馆离著名的新加坡环球影城非常近，走路过去也就只要15分钟左右的时间。新加坡杜莎夫人蜡像馆非常大，里面有将近5个项目。超级推荐在携程上买好套票。然后提供订单号就可以直接在入口处取票了，非常方便。如果当天在门口买票要将近80新币的价格，真心很贵的价格，一点都不划算。第一部分是给看一下新加坡的发展历史变迁，第二部分是坐一艘船然后看影响新加坡的各个伟人和名人。第三部分就是重头戏，蜡像馆了！蜡像馆一进去第一个看到的是现任新加坡总理，李显龙。后面展示的有很多世界上著名的政要。接下来的部分分为体坛明星，影视明星等。因为新加坡是一个多民族融合的国家。所以展示的明星和政要也基本是本地的、中国的、印度的明星。总的来说还是蛮不错的一个蜡像馆。如果有时间，不妨来看看哦！,2020-02-16 16:25:20.741354
58932,2,92,羊外婆,9.0,2019-09-30,17:46,圣淘沙的杜莎夫人蜡像馆虽然规模不大，但还是有自己的特点，且是套票，可根据自己的情况选择，我们是家庭亲友团，选择了蜡像馆+游船+宝莱坞影星互动，玩的很开心，是适合成年人和老年人的项目。,2020-02-16 16:25:20.744367
58933,2,92,熊猫夏,4.0,2020-01-26,22:05,意外的无聊。。。。前面很拖沓。看工作人员戏精上身各种介绍历史。坐游船的部分也很没劲。到了蜡像馆部分有些蜡像也不像。4D电影也很一般，都是早几年前就有的东西。这么些内容拼凑一起也就差不多这个价钱吧。,2020-02-16 16:25:20.747415
58934,2,92,M29****5648,3.0,2019-09-25,07:29,杜莎夫人蜡像馆现场买的票，成人32新币，儿童28新币&#183;。规模应该没有香港的大，不过新加坡的附带了一个漫威4D电影，一个室内漂流项目，看新加坡的一些模型。,2020-02-16 16:25:20.750463
58935,2,92,纯粹的小蝴蝶,5.0,2019-07-17,00:00,强烈推荐！新加坡的亲子游！ 新加坡是一个神奇的城市，虽然不大但是井井有条，发展可怕，最主要的是离我们不远，坐飞机不用飞太久，而且有很多中国文化影响，算是一个出国交流还不算太困难的城市啦，所以，这个地方非常适合亲子游。 新加坡后花园——民丹旅游区 民丹旅游区是新加坡的后花园，从新加坡出发，坐船过去大概一个小时左右，路途比较近，景色也不错。这里是重点打造的休闲旅游区，主要是民丹岛。这座小岛景色宜人，是特色的热带风光，白沙铺底，碧波荡漾，蓝天空旷，海鸟飞翔。除了这样优美的自然风光外，这里的游乐设施也很完善，皮划艇，潜水，沙滩游乐项目，好吃的好喝的应有尽有 建议游玩时长：半天 门票：免费。 3D世界——新加坡环球影城 新加坡是一个现代化很高的城市和国家。在这里，有一座花费了几十亿打造的超级实景式的电影世界——新加坡环球影城。这里有七个以电影不同主题命名和设置的游乐设施和景点，每一个都有十分鲜明额主题，比如古埃及，好莱坞大道等。双轨过山车，传说中最刺激的游乐项目，有胆量的人可以试试，至于为什么最刺激，亲身感受的人就明白啦。 建议游玩时长：3小时 门票：成人每位79新加坡元，儿童每位59新加坡元。 水底世界——S.E.A.海洋馆 作为一个海滨城市，拥有种类丰富的海洋馆似乎是很正常的事情。在新加坡，想要感受海洋的魅力的，可以到S.E.A.海洋馆来。这个海洋馆里有品种多样的海洋生物，并且整个馆的排列都是别具匠心的，它是按照海洋的地理位置来排列的，哪一片海洋有哪些特色的海洋生物，都一目了然，这一点是其他海洋馆不具备的。这里是世界最大的海洋馆，其中有一块地方，一面巨大的玻璃展示了水中的一切，人站在面前显得那么渺小。 建议游玩时长：3小时 门票：90元左右。 历史悠久，文化深厚——蝴蝶公园与昆虫王国 还记得还珠格格里的香妃吗？她可以吸引蝴蝶，小燕子为了也吸引蝴蝶，就用花来泡澡，结果引来一大堆的蜜蜂。其实呀，想要被蝴蝶青睐，不用泡花瓣澡，直接来新加坡的蝴蝶公园和昆虫王国吧。这里有超过一万五千只蝴蝶，当你静静的置身在公园里，感觉自己就是蝴蝶仙子，也会有大胆的蝴蝶停在你的身上哦。这里还有三千多种稀有的昆虫，可是难得的昆虫世界的学习教材呀 建议游玩时长：3小时 门票：五十左右。 神奇的蜡——新加坡杜莎夫人蜡像馆 新加坡杜莎夫人蜡像馆应该是世界蜡像馆里面比较出名的一个了，这里收藏了很多著名人物的蜡像。如果有喜欢的明星但是一直见不到本人的，其实可以退而求其次来这里满足一下自己的愿望，哈哈！这里有超过60名名人蜡像，而且有赫本女神的蜡像！真是人间仙女啊！拍照合影什么的都是常识啦，近距离观看蜡像才会被它的那种特别像真的的感觉震撼到，这是我们平时点的蜡吗？不敢想象。 建议游玩时长：2小时 门票：成人39新加坡币，儿童29新加坡币。 不管是休闲惬意的沙滩岛国风光，还是现代震撼的影视感官，不管是蝴蝶昆虫还是海洋生物，不管是活的，还是不动的蜡像，这些地方都有亲子游可以找到每一个家庭成员喜欢的景色，一起旅游一起玩耍才是最幸福的亲子游。,2020-02-16 16:25:20.753509
58936,2,92,小魅力蘑菇,9.0,2019-08-14,23:04,蜡像馆真的太逼真了，蛮不错的，就是票价有点小贵。,2020-02-16 16:25:20.756469
58937,2,92,_M13****7760,5.0,2020-01-24,22:14,兑换取票不是很方便，首先山顶4G信号差，电子确认单出不来很尴尬，其次售票处对此项业务不熟悉，费了不少功夫。胜在性价比给力！,2020-02-16 16:25:20.759477
58938,2,92,吴先生666,9.0,2019-08-04,15:07,不错有意思。。。。。。。。。。。。。不错有意思。。。。。。。。。。。。。不错有意思。。。。。。。。。。。。。,2020-02-16 16:25:22.827917
58939,2,92,WF二氧化硅,5.0,2019-08-03,11:58,很多人觉得蜡像馆没意思，我觉得仁者见仁智者见智吧。特喜欢拍照的小哥哥小姐姐一定要来打卡，因为蜡像做的实在是很棒，推荐买所有景点的通票，价格不高。,2020-02-16 16:25:22.831187
58940,2,92,弱冠年华,5.0,2018-12-24,21:42,在圣淘沙也可以看杜莎夫人蜡像馆了！在这展览里各种名人蜡像，买了套票可以同时观看新加坡万象live，全程有演员英文演说。 作为全球最受欢迎的蜡像馆，杜莎夫人蜡像馆以其栩栩如生的蜡像和现代化的特殊场馆布置，为各年龄层的游客带来非同凡响的体验，在这里也能与明星近距离接触。这里的蜡像馆有个特色，游客也可体验新增的游船河之旅，探索新加坡的发展历史。 除了国外明星，也有不少国内的，比如刘德华、姚明、邓丽君等。,2020-02-16 16:25:22.834198
58941,2,92,M23****8635,9.0,2019-08-24,20:49,一般般，时间紧就不要去了，规模不大,2020-02-16 16:25:22.837604
58942,2,92,M515shunyi1618,3.0,2019-06-10,20:30,新加坡图莎夫人蜡像馆可以看到很多新加坡名人的蜡像，做的都非常的逼真，而且还可以看到中很多中国明星像李小龙的蜡像。,2020-02-16 16:25:22.840744
58943,2,92,M30****8293,5.0,2019-03-03,18:16,刚进杜莎的时候，有个大概20分钟左右的小剧场，NPC们会带着大家做游戏，看一下以前的发展历程。这是属于戏精的天堂，蜡像很逼真，有世界明星和东南亚名人。,2020-02-16 16:25:22.843938
58944,2,92,mallet2074,5.0,2019-10-07,16:44,还凑合吧 有大大和彭麻麻 但是感觉做的不是那么像,2020-02-16 16:25:22.847036
58945,2,92,JustineQiu,4.0,2017-05-18,21:26,开始以为里面只有蜡像，后来发现原来还有其他2个项目，有个小游船，很有趣，然后万象新加坡能让人知道新加坡的历史，很不错。这里还准备了一些小道具，让人和蜡像照相的时候可以带上，服务真的很细致。,2020-02-16 16:25:22.850153
58946,2,92,258****120,5.0,2019-06-29,00:11,景点内项目都又短又没意思，其实只买一张大门票看看名人蜡像就可以了。注意携程订票的取票时限性和门票有效期！,2020-02-16 16:25:22.853207
58947,2,92,翱翔的大鲨鱼,3.0,2018-12-07,23:46,新加坡的杜莎夫人蜡像馆就在圣淘沙岛上面。在捷运第二站下车，根据路牌就可以找到了。这里有很多当地演艺明星的蜡像。也看到大大的蜡像。,2020-02-16 16:25:22.856265
58948,2,92,王木木,5.0,2019-05-29,16:20,在山上，比较小，而且里面有一个关于历史的讲解是英文的，不太好，主意听不懂，在圣淘沙岛上，继续上行需要乘坐缆车，大家带着孩子来哦,2020-02-16 16:25:26.336190
58949,2,92,M30****3276,5.0,2019-03-03,20:05,全世界的杜莎夫人蜡像馆都一样吧，因为没去过，感觉还可以，但是去过之后可能就不会再去了。感觉最美的三位分别的习大大彭麻麻和赫本。,2020-02-16 16:25:26.339420
58950,2,92,M54****087,5.0,2019-12-26,09:36,很棒！蜡像就很逼真！最后的4D电影也很好看。,2020-02-16 16:25:26.342486
58951,2,92,de****416,5.0,2019-08-12,12:55,使用方便，第一次去的话还是值得去看看的,2020-02-16 16:25:26.345506
58952,2,92,M30****6151,5.0,2019-03-03,19:49,新加坡精神游船就在蜡像馆内，其实就是乘着小船绕着模型走一圈，模型有华人雕梁画柱，也有印度人的神像，摩天轮、擎天树、F1赛车等，大约10分钟就结束了。,2020-02-16 16:25:26.348483
58953,2,92,J_Pan,5.0,2019-01-17,00:09,因为有你 值得一去，去了之后就念念不忘的国家,2020-02-16 16:25:26.351622
58954,2,92,yb654321,3.0,2018-02-10,10:59,蜡像馆有些小，但很值得玩一圈！差评打算送给携程！携程页面上留不了新加坡当地手机号！只好留中国手机号！但中国手机卡已经从手机中换出去了！通常电子票都发到邮箱就好了！可是此次发到邮箱的内容竟然是要求携带短信到门票点取票！到达景点后才发现这个问题！联系网络客服，告知目前收不到短信，只有网络订单与邮箱订票内容，但客服只是一个劲的强调得拿短信取票！在我强烈要求下，客服才说那就拿邮箱订票内容试试吧！还好工作人员让进了！携程在国外售票需要加强！,2020-02-16 16:25:26.354639
58955,2,92,M59****121,5.0,2018-02-26,21:01,还可以吧，冲着杜莎夫人四个字去的,2020-02-16 16:25:26.357660
58956,2,92,Kevin,4.0,2018-01-29,10:39,在圣淘沙买的联票，包好了杜莎夫人蜡像馆，所以就进去看看，里面新加坡名人林俊杰肯定会有，还有姚明，还有英国女王，随意看看不错。,2020-02-16 16:25:26.360621
58957,2,92,M42****956,5.0,2019-01-06,22:43,蜡像馆很不错，百分之百推荐！携程的票还是便宜。万象馆是回顾新加坡发展的，表演人员也很卖力！,2020-02-16 16:25:26.363862
58958,2,92,M25****9651,5.0,2019-09-10,10:25,馆里不是很大，蜡像制作精美，4D电影感受不错（漫威系列），携程价格便宜，出票方便快捷。,2020-02-16 16:25:28.914222
58959,2,92,汤姆猫大王,4.0,2016-12-10,21:11,杜莎夫人蜡像馆，去过已经多次了。如果不是陪某些人去，真的不想再去了。但是看过以后觉得这个是最好看的。价格也不是很贵，比国内要便宜一些。游客不少，想要合影需要排队。,2020-02-16 16:25:28.917541
58960,2,92,Uncle_hey,5.0,2017-03-20,03:24,去过两次，新加坡的杜莎一定要看看燕姿和JJ。最近貌似有了大大和妈妈两位大人物哦！ 新加坡的馆附带了一个了解新加坡历史的馆 只可惜全英文，国人的体验感估计会打折扣吧。 重点是可以在里面免费体验一把做手膜的感觉。,2020-02-16 16:25:28.920587
58961,2,92,yzk888,5.0,2019-10-07,17:10,非常不错，都是名人，做工挺好，工作人员热情，携程定方便！！！,2020-02-16 16:25:28.923583
58962,2,92,M44****533,5.0,2019-08-01,02:34,感觉面积没有香港的杜莎夫人蜡像馆大，但是排列紧凑，大部分做的很逼真，最后还有一小段游船，算是特色吧。,2020-02-16 16:25:28.926576
58963,2,92,王婉菲,5.0,2019-02-25,23:28,秒出票，比现场购票要便宜一半还多，给力,2020-02-16 16:25:28.929562
58964,2,92,_WeCh****28713,5.0,2019-07-31,09:57,就买个蜡像馆的门票就行了，坐船之类的就没有必要了,2020-02-16 16:25:28.932546
58965,2,92,xierita,5.0,2017-07-03,06:05,一路楼梯上山，路过蜡像馆，穿越森林步道，遇到好多来上野外植物课。这里游客不多，热带雨林区域也很野趣，徒步路线都很短，不错。,2020-02-16 16:25:28.935585
58966,2,92,cheeryhappy,5.0,2017-07-17,21:25,比直接购买便宜很多，直接用短信就可以进入，蜡像很不错，华人明星占多数 ，喜欢,2020-02-16 16:25:28.938577
58967,2,92,_WeCh****314096,5.0,2019-10-11,13:20,服务好，快捷，方便！很开心！赞,2020-02-16 16:25:28.941608
58968,2,92,_WeCh****314096,5.0,2019-10-11,13:19,服务好，方便，快捷！很开心！赞,2020-02-16 16:25:32.121233
58969,2,92,_ZFB20****7522452,5.0,2019-10-28,22:00,感觉华人都没有欧洲人更像,2020-02-16 16:25:32.124488
58970,2,92,01****558,4.0,2019-08-09,17:25,这是我到过的最小的一个杜莎夫人蜡像馆。但是很有点特色。万象馆的员工挺搞笑的，还有一个很小很小的游船最后的4D电影很不错，总体推荐吧。,2020-02-16 16:25:32.127509
58971,2,92,M25****4240,4.0,2018-09-18,21:05,网上订票换票还是很方便的，蜡像馆里说实话有些人认识有些还真不认识，跟着大家一起凑了凑热闹，不过这里性价比还是很高的，还有一些娱乐项目,2020-02-16 16:25:32.130566
58972,2,92,画中世界春暖花开,5.0,2019-07-17,01:19,管理人员非常热情、耐心，非常喜欢美丽的新加坡。,2020-02-16 16:25:32.133579
58973,2,92,_WeCh****63834,5.0,2017-07-05,23:58,在圣淘沙上面一个不错的地方，不仅可以看，还可以感受新加坡的历史文化，值得一去的地方。,2020-02-16 16:25:32.136539
58974,2,92,lq****01,5.0,2017-08-29,22:51,今天去圣淘沙，重点参观杜莎夫人蜡像馆，虽然门票并不便宜，但感觉物有所值，蜡像栩栩如生，惟妙惟肖，令人叹为观止，制造者真是巧夺天工啊 新加坡历史的表演也很生动活泼，真人表演加上高科技的声色交集在一起，十分风趣幽默,2020-02-16 16:25:32.139595
58975,2,92,飞来飞去的椰子,5.0,2017-08-17,03:33,和上海的差不多，但好像没有上海排队的人多,2020-02-16 16:25:32.142721
58976,2,92,lanyang0520,5.0,2019-01-29,19:23,有的比较像。买票后左边是全英语的新加坡历史，不想听的可以直接走右边是蜡像馆。,2020-02-16 16:25:32.145915
58977,2,92,300****564,4.0,2019-03-15,18:28,坐船沒什麼意思，还是主题蜡象馆吧，可以去看，很多，中外名人都有。,2020-02-16 16:25:32.148923
58978,2,92,啦啦AAA,4.0,2015-10-21,11:52,通过蜡像的形象，向游客展现了新加坡的历史与发展。还介绍了马来、印尼、中国的传统节日和习俗。与各路明星会面合影时间……足足玩了一小时。,2020-02-16 16:25:35.122241
58979,2,92,M25****4707,5.0,2019-05-14,09:34,杜莎夫人蜡像馆以展览名人蜡像为卖点，是国际知名的旅游景点。设于圣淘沙的新加坡杜莎夫人蜡像馆是亚洲的第七家分馆，也是东南亚第二家。,2020-02-16 16:25:35.125528
58980,2,92,M22****8484,4.0,2017-08-10,22:52,杜莎夫人蜡像馆很凉爽，各种名人蜡像，适合照相！,2020-02-16 16:25:35.128552
58981,2,92,whatever,5.0,2018-01-01,09:50,新加坡的杜莎夫人蜡像馆比上海的要小一些，可以看到很多来自全世界的名人，都非常逼真。,2020-02-16 16:25:35.131606
58982,2,92,tai****000,5.0,2016-10-16,15:09,新加坡杜莎夫人蜡像馆就位于著名的旅游胜地圣淘沙岛上，在一个小山上，如果坐圣淘沙捷运的话，那就在第二站下车，然后走电动扶梯很快就可以上去了，这里有很多全世界知名人士的蜡像。,2020-02-16 16:25:35.134638
58983,2,92,灰姑娘的南瓜车,5.0,2015-12-31,21:24,新加坡杜莎夫人蜡像馆的蜡像略很好看，大牌云集，玩high了。不同之处还是有的，比如进馆之前乘小船畅游于新加坡标志性景物之中。,2020-02-16 16:25:35.137756
58984,2,92,M24****891,5.0,2019-07-12,14:53,取票很方便，不用等待。而且价格是最便宜的了，这个是很棒的！！,2020-02-16 16:25:35.140772
58985,2,92,M21****383,4.0,2019-01-26,12:54,"总体还好, 蜡像挺逼真的, 不过规模不大",2020-02-16 16:25:35.143945
58986,2,92,hikaru8,4.0,2019-06-25,12:48,一般般 拍照的好地方，什么小船和漫威4d挺无聊的,2020-02-16 16:25:35.147192
58987,2,92,_M13****2480,5.0,2018-03-04,11:57,旁边有个新加坡万象的表演与展览非常好，几个小姑娘惟妙惟肖的表演，展现了新加坡发展的百姓历史，不虚此行，只是讲英文，听着有些吃力。,2020-02-16 16:25:35.150341
58988,2,92,_CFT01****1211081,9.0,2015-08-16,12:47,是万象馆和杜莎一起玩耍的万象馆很有趣有情景剧了解新加坡历史的同时也很开心蜡像馆就是一般的蜡像馆额。。。。图片花了点。。。姚明还是很高的。。。,2020-02-16 16:25:38.408055
58989,2,92,happy young,5.0,2019-04-13,22:51,有时间的话还是值得一去的地方，各个地方的蜡像馆其实差不多啦，去一两个感受一下就行啦,2020-02-16 16:25:38.411338
