REVIEW_INDEX,WEBSITE_INDEX,POI_INDEX,REVIEWER_URL,REVIEW_ID,REVIEW_DATE,REVIEW_RATING,REVIEW_TITLE,REVIEW_BODY,DATE_OF_EXPERIENCE,TRIP_TYPE,REVIEW_CRAWLED_TIME
,1,65,https://www.tripadvisor.com.sg/Profile/alexamor2015,563601050,02-03-2018,4,"""Singapore by Cable Car to Sentosa""","From the overseas tourist perspective. Spectacular views in summary. For the extended view, starting at the Mount Faber peak is a family must do. In staying in the city precinct, suggest you catch taxi to Mount Faber which is not expensive and at the end of the day, on your return leg on the cable car stop at the harbour-front station, and a catch a taxi back to the city from Vivo-City shopping mall, which in itself is a good retail experience. Return taxis to the city from the Mount Faber station may be at a premium at day's end.",02-2018,Couples,2020-01-31 10:22:24.020582
,1,65,https://www.tripadvisor.com.sg/Profile/Dino W,562253053,23-02-2018,3,Green hill with a few sights,"You can take the slow cable car to go to mount faber or a taxi. On this hill you can walk around and take a picture with the bell of happiness. But besides that? Not much, in my opinion.",12-2017,Couples,2020-01-31 10:22:24.376713
,1,65,https://www.tripadvisor.com.sg/Profile/Ilmar T,557726180,01-02-2018,5,Great views of Singapore,"The view from Mt Faber is fantastic, well worth the effort to get to. There are a number of ways to come, but I always enjoyed the walk more than driving. It is a short climb from the Vivo shopping complex, or you could come any number of ways from Telok Blangah, including via Henderson waves from Telok Blangah Hill park. The view to Sentosa is great, as is the view of the harbour and the city. Worth a few hours at least, including a meal and /or drink at the cable car station.",02-2018,Couples,2020-01-31 10:22:30.244327
,1,65,https://www.tripadvisor.com.sg/Profile/konstandy,532054327,11-10-2017,4,1 of the better attractions in Singapore,"I got married to my wife here on Mount Faber: do visit at night which is more romantic & stroll around to catch the nice views of the surrounding areas. This is one of the better natural ""attractions"" in Singapore which is very lacking! Will visit again in future to take some nice photos!!",11-2016,Couples,2020-01-31 10:22:30.619194
,1,65,https://www.tripadvisor.com.sg/Profile/GemmaB1507,527946162,28-09-2017,1,Terrible - avoid at all costs,"Currently stood waiting to get a refund for tickets pre-purchased online. The line is closed today but they won't give us a refund. Apparently we can use the tickets any time in the next 3 months - great, but we leave Singapore today!

Total cowboys, avoid at all costs. 1 star because I have to!",09-2017,Couples,2020-01-31 10:22:30.998900
,1,65,https://www.tripadvisor.com.sg/Profile/GeorginaF198,526883039,24-09-2017,1,Total waste of time!,"Started off at Santosa island, it took us 30 mins to find the cable car entrance it was all very poorly sign posted. When we finally reached the ticket office we payed $84 for three of us to go up. The cable car took about 5 mins to reach mount Faber, after reading such good reviews we thought we should definitely visit, when we got off we were thoroughly disappointed we alighted straight into a restaurant, we walked through the restaurant as there was no other way of getting out, we were hoping maybe we would see a lovely view from the other side but there was nothing?! Literally nothing, no view either side and no clear walk ways. We didn't want to come hiking so I guess unless you wanted to hike here this was a complete waste of time and money! We got one picture in the restaurant of a bell and that was it! Stayed for 10 mins and headed back down.",09-2017,Couples,2020-01-31 10:22:31.351704
,1,65,https://www.tripadvisor.com.sg/Profile/Pranav N,517711363,26-08-2017,4,Great views of the harbour,"The port of singapore is hardly visible from other parts of the city, here its quite nice to look out to. Also can take the cable car from here to sentosa, though quite expensive.",04-2017,Couples,2020-01-31 10:22:31.708739
,1,65,https://www.tripadvisor.com.sg/Profile/Quinnedy,516463334,23-08-2017,5,Beautiful Views of Singapore and the Straits,A beautiful scenic visit to scan the magnificent panoramic views of Singapore. Not to be missed on you itinerary - you will not be disappointed,12-2016,Couples,2020-01-31 10:22:32.078679
,1,65,https://www.tripadvisor.com.sg/Profile/HertsNeil,478479787,24-04-2017,4,Great views,Worth getting the cable car from here to Sentosa as the views are great from the top both to Sentosa and the CPD. Good views also on the cable car.,04-2017,Couples,2020-01-31 10:22:32.427391
,1,65,https://www.tripadvisor.com.sg/Profile/ankeet_sinha,473308500,07-04-2017,4,Nice Unique Experience,"We visited Mt. Faber as we had a day to kill and thankfully we were not disappointed. It gives a different view of Singapore and it houses the Faber Peak from where you can get cable cars to Sentosa, Bell of Happiness and also small bells which are tied there. You can also see a small Merlion there and visit a unique bridge.

You can either hike it up which is exhausting (about 35 floors) or take a cab and start walking once you are at the top.

Good views to be had and it is a must visit.",03-2017,Couples,2020-01-31 10:22:32.808452
,1,65,https://www.tripadvisor.com.sg/Profile/55DavidG,471029496,29-03-2017,4,Great and different view of Singapore,"Friends took us at night, which I would say is best. Otherwise you can get the Faber/Sentosa cable car and get off at the top before you go back across to Sentosa. Cooler up there as well.",03-2017,Couples,2020-01-31 10:22:33.190819
,1,65,https://www.tripadvisor.com.sg/Profile/390mehdiv,469958654,25-03-2017,4,Top of singapour,The highest point of Singapore. And the third is Singapore Cable car station. The mountains around trees. And be careful there are no taxis in,03-2017,Couples,2020-01-31 10:22:33.552256
,1,65,https://www.tripadvisor.com.sg/Profile/mugiaj,469261419,22-03-2017,4,View the city from the mountain,Use the cable car to reach the peak after that take a walk to faber point and downhill to hudson wave boardwalk. Best if you arrive in the morning.,03-2017,Couples,2020-01-31 10:22:39.573313
,1,65,https://www.tripadvisor.com.sg/Profile/Laulund62,459646584,14-02-2017,4,Quiet get-away,Take a stroll on Mount Faber and see the fabulous Henderson Waves boardwalk. A really nice and tranquil walk in height with the treetops.,02-2017,Couples,2020-01-31 10:22:39.929554
,1,65,https://www.tripadvisor.com.sg/Profile/garregw,446888350,27-12-2016,4,Stunning views,Stunning views with a touch of history. Worth walking around the canopy below the main mount to read and see some of Singapore's history. Not the best if locations for those with difficulty in walking.,12-2016,Couples,2020-01-31 10:22:40.294480
,1,65,https://www.tripadvisor.com.sg/Profile/allspice502016,439953255,25-11-2016,4,Great Nature Walk,"One of the oldest parks, Mt. Faber is only 105 metres high. A popular tourist destination Mt. Faber offers visitors cable car rides to Harbourfront and Sentosa Island. A pleasant walking nature reserve with great panoramic views of the southern part of Singapore and islands. The night time views are even more spectacular. There are footpaths, a road, stairs and trails leading up to the hill. A small Merlion statue sits in one of the lookout points. At another point in the park a mural depicts scenes of local historical events. Ring the “Bell of Happiness” at the Jewel Box, it is believed that when you strike the bell it will bring you happiness! There is also a restaurant and trendy bar at the peak where one can enjoy the views, especially at night. Being directly behind our hotel (the Bay Hotel), our 15 minute walk each day made our early morning walks very pleasant.",10-2016,Couples,2020-01-31 10:22:40.691053
,1,65,https://www.tripadvisor.com.sg/Profile/jgm005,393797775,18-07-2016,4,Great views,We went up to Mount Faber and took the cable car to Sentosa island. We had a great time going over and back. Best to get off at Harbour center on the return to be able to catch a taxi.,07-2016,Couples,2020-01-31 10:22:41.066695
,1,65,https://www.tripadvisor.com.sg/Profile/johnkS7647SM,379863961,05-06-2016,5,Multiple times and love it,"I've been up here probably 4 times. I love it each time. The views are beautiful and it's a nice scenic walk. I've walked up the hill and that is a bit of a hike that I don't recommend unless you like uphill hikes. I recommend taking a taxi or driving up there. Once you're up there, there's a place that has like a compass and each direction tells you where certain aspects of Singapore are located in that direction. This is a place I definitely try to bring anyone who visits me.",02-2016,Couples,2020-01-31 10:22:41.456431
,1,65,https://www.tripadvisor.com.sg/Profile/rHeaa33,372237060,12-05-2016,4,A hill not a mountain,"It is hardly a mountain for avid mountaineer. It is more like a hill or elevated place where you can see Singapore from higher point. It does not even have a cool environment expected for a mountain. You can make a wish on the wishing bell, then write and hang your small wishing bell. The walk is quite fun but really not much else to do. The lychee singapore sling at the restaurant near the bell is quite good, sweet and the alcohol taste is barely there.",05-2016,Couples,2020-01-31 10:22:41.808455
,1,65,https://www.tripadvisor.com.sg/Profile/malini_s16,358601599,26-03-2016,2,Not a must visit,Surrounding views are ok. You can another merlion here. Nothing much to see. You can board the cable car to sentosa from here.,02-2016,Couples,2020-01-31 10:22:42.205100
,1,65,https://www.tripadvisor.com.sg/Profile/HeatSeekerWrexham_UK,348822781,18-02-2016,4,Great park with splendid views of Singapore,"We normally go by cable-car. It’s also possible to walk up the path from Harbourfront, or take a taxi.
From the summit, you get great views of much of the south of Singapore and Sentosa. Often there’s a nice cool breeze!
In my opinion, the best views are seen by turning right on exiting the cable-car station. Follow the road, then the obvious path, with views at various places. Don’t miss the free binoculars, they are powerful and show detail you’ll miss without magnification. In addition to the views, watch out for birds, as well as enjoying the many trees.
Most visitors turn left from the station, and head for the peak. Views in this direction are not as good, and there are too many steps without handrails for my liking. The brown signs show toilets in this direction, and I do remember them, but I think they were closed years ago. I haven’t seen them for ages, and on this visit met somebody else also hunting for them!
The only toilets are at the cable-car station as far as I know. They’re not easy to find. If necessary ask for help.
The disabled will find the summit reasonably flat. There's a lift from the cable-car, and if you go the route I suggest, not many steps.
We’d love to have a meal here. But we go for the peace of the hilltop, and don’t like the music in the restaurants.
Overall, it’s a lovely place to spend an hour or two. However if your time in Singapore is limited, I wouldn’t rate it as a top priority. If you have the time, I’m sure you’ll love it.",02-2016,Couples,2020-01-31 10:22:42.565031
,1,65,https://www.tripadvisor.com.sg/Profile/celestemay17,348065630,16-02-2016,4,Good half day outing,"This place is a good half day outing in Singapore. We visited this place in the evening. The nearest MRT station is Harbour front. It takes hardly 15 min to reach to the top. The view is amazing, one side you can see the Sentosa island and the other side you can see the city. The cable car station to Sentosa is just ahead of the viewing point. There is a bistro here which is good quiet place for dinner.",12-2015,Couples,2020-01-31 10:22:42.938344
,1,65,https://www.tripadvisor.com.sg/Profile/Pete_Gill_W,341343471,20-01-2016,3,Nice enough - but perhaps not a priority to visit,"We have visited the Botanic Gardens, Gardens on the Bay and Fort Canning Park and rate these much higher if you are visiting Singapore with limited time.
Mount Faber is worth a visit for exercise and is free if you walk. Views back are to the docks and the Sentosa theme park, not the city or Marina Bay. It took us about 90 minutes to walk up from Vivo City and back, taking a detour to cross the Helix Bridge on the way.
Initially we thought we would take the cable car up, but this is only an option if you purchase a ticket that includes entrance to Sentosa Island, minimum SGD$26pp; you cannot buy a Mount Faber only cable car ticket and in our opinion the view from the top is not worth SGD$26 - go to one of the other gardens instead; they are better and free!",01-2016,Couples,2020-01-31 10:22:48.862691
,1,65,https://www.tripadvisor.com.sg/Profile/KylieIsTravelling,736529489,03-01-2020,5,Great views,"Mount Faber provides fantastic views over the city and the harbour, in a lush surrounding of colourful flowers. Well worth the effort to see the views at the top of Mount Faber.

Note that it does get busy with tour bus crowds - I got there after lunch and it was fairly quiet with only a few walkers around before the tour bus arrived.",12-2019,Solo,2020-01-31 10:23:14.879636
,1,65,https://www.tripadvisor.com.sg/Profile/justinrZ3902UR,723719152,04-11-2019,4,Worth a visit for the views,"I climbed Mt. Faber today and although it was hot and humid and my legs are a bit sore, it was lovely to see the city from so high up. If you find your way here, I recommend the Terrace Garden and the Forest Walk.",11-2019,Solo,2020-01-31 10:23:15.261488
,1,65,https://www.tripadvisor.com.sg/Profile/ChronicMike,636721984,30-11-2018,5,Great views of the city,"I spent a few hours walking around this park, which feels like a sanctuary away from all the noise. Through the trees you get great views of the city. Definitely recommend this park if you are looking for a change of pace.",04-2018,Solo,2020-01-31 10:23:15.632083
,1,65,https://www.tripadvisor.com.sg/Profile/goodguyjas,616618626,15-09-2018,3,Not that spectacular but decent enough views,"Hardly the spectacle our guide was building this up to but a reasonable viewing point which in part is obscured by trees but does allow for views of the Singapore skyline but not the main downtown area. The buildings are similar in nature and mostly white so nothing special. The other side is better with the dock area and cable cars going to Sentosa island, which can also be clearly seen. There is a lot more up here than just that view and of course - the cable car is here as well as the lush greenery and park area. Plus places to eat and drink. So the area as a whole is a good visit. Just don’t expect much from the view.",09-2018,Solo,2020-01-31 10:23:16.036328
,1,65,https://www.tripadvisor.com.sg/Profile/leandroabcede,581432366,20-05-2018,5,awesome and memorable!!,one of the greatest place i ever visited. get their via cable car and the ride is amazing. the peak itself is wonderful. i just wish i have someone with me lol. to share the moment with. the view is awesome!! i walked going to the peak and it was great the scenery around!!,05-2018,Solo,2020-01-31 10:23:16.383066
,1,65,https://www.tripadvisor.com.sg/Profile/stpn_fz,535514111,24-10-2017,4,Best n the Morning.,"- Easily accessible from Harbourfront MRT station.
- The cable car to Sentosa runs from here.
- Good viees of the southern parts of Singapore from various lookout points.
- Great place for some ""hill"" running, cycling, and walking.
- A pleasant walk to Henderson Waves and Alexandra Arch from here, where you may be greeted by the occasional squirrel or two.
- Faber Peak near the Cable Car Station has a romantic ambience.
- Several tour buses ply the route up Mount Faber, do be patient when driving.",10-2017,Solo,2020-01-31 10:23:16.771947
,1,65,https://www.tripadvisor.com.sg/Profile/Rich D,521574537,06-09-2017,3,A quick stop is fine for this tourist trap...,"You can get there the hard way, either by walking from the VivoCity shopping mall, via the Marang trail, a steep uphill, and from the other side via the Southern Ridges walkway continuing onto the Henderson Waves Bridge via Forest Walk, which is slightly easier, mostly downhill, but longer... Or the easy way, via Sentosa - Mount Faber cable car, if you are a sucker for the views;)

If you have more time and are not completely out of shape, I highly recommend getting yourself to the beginning of the Southern Ridges, to the bus stop near Alexandra and Depot roads and make a nice walking, or running, trip to combine all the interesting sights between the Southern Ridges and the VivoCity mall. The whole walk isn't that long... 4-5 kilometers, I think, manageable for almost anybody.

The Mount Faber, is very touristy spot, with decent hill views of tropical vegetation below, Sentosa island to the one side and the Singapore's downtown skyline to the other.

There is a ""Bell of Happiness"", a definite photo op for all the Instagram and selfie fiends;)

To spend 10 minutes here is too many, unless you want sit down and get something to eat...",09-2017,Solo,2020-01-31 10:23:17.155300
,1,65,https://www.tripadvisor.com.sg/Profile/minimize940314,515048592,19-08-2017,4,Via cablecar,I visited mount faber via cablecar. I bought 2 unlimited pass for both sentosa and mount faber cable car lines. I visited at night and I could look down the whole city. It was beautiful.,06-2017,Solo,2020-01-31 10:23:17.532835
,1,65,https://www.tripadvisor.com.sg/Profile/LiamSteadman,486332736,22-05-2017,3,Nice Views Only,"Sunday morning bright and early I decided to walk to the summit of Mt Faber starting opposite Harbour Front. Not as difficult as I expected, around 20 to 25 minutes to the top. Other than spectacular views, there is nothing else to do there. I would not recommend with young children.",05-2017,Solo,2020-01-31 10:23:17.888283
,1,65,https://www.tripadvisor.com.sg/Profile/175ryusukem,482283874,07-05-2017,4,Another Merlion Here,"You can find another Merlion here. Actually this one of the five official Merlions in Singapore recognized by the Singapore Tourism Board, who owns the copyright of the Merlion.",03-2017,Solo,2020-01-31 10:23:18.253942
,1,65,https://www.tripadvisor.com.sg/Profile/KrisI_12,473225141,07-04-2017,3,"Great views of Singapore, the port, and Sentosa","There's not much to do on Mount Faber, but the views are great. It warrants a quick stop through to get the views, but I wouldn't plan much time here. The cable cars are a great way to connect this with a trip to Sentosa.",03-2017,Solo,2020-01-31 10:23:24.242619
,1,65,https://www.tripadvisor.com.sg/Profile/nufc19791979,460314773,16-02-2017,5,Good view of the city from above,"You can see the city from above. It's a nice place to walk, you'll need a lot of stamina, because it's kinda steep to walk to.",02-2017,Solo,2020-01-31 10:23:24.598010
,1,65,https://www.tripadvisor.com.sg/Profile/Frank G,458670999,11-02-2017,4,"Nice ""views from the hill""",Took the cable car from Sentosa. Nice tip: after 6 pm only 18 instead of 29 SD. Nice short walk to some viewpoints. No MRT there so go back to Harbour Front afterwards! Or take a bus...,02-2017,Solo,2020-01-31 10:23:24.966475
,1,65,https://www.tripadvisor.com.sg/Profile/Waty K,446001827,22-12-2016,5,Be prepare to climb up high..,"didn't expect it will be quite high, for a first timer to hike, u really need to take ur timine and enjoy the nature.. the beautiful view once ur at the top, its Amazing !!! Try ur best okie, no regrets !! =')",10-2016,Solo,2020-01-31 10:23:25.347568
,1,65,https://www.tripadvisor.com.sg/Profile/MartinLeman,437460025,15-11-2016,5,nice place for relaxing,this is not somekind of mountain in the usual way. It is already 'modernized' and it is more like a park actually. But this is you could walk or jog in the morning and feel the different situation than the usual singapore.,11-2016,Solo,2020-01-31 10:23:25.709895
,1,65,https://www.tripadvisor.com.sg/Profile/MVI888,429066556,18-10-2016,3,Nothing spectacular,"Mount Faber is in fact the highest peak in all of Singapore (which is quite significant), Surrounding views are ok. Nothing much to see. But it is also a gateway over to the resort style island of Singapore, Sentosa Island. Mount Faber is located on the south side of Singapore, and forms a perfect line past the Singapore Cruise terminal and Sentosa Island.
At the top of Mount Faber, it’s great to take a few pictures, and when you are done you can take the cable-car ride to the SENTOSA Island. Nothing spectacular.",10-2016,Solo,2020-01-31 10:23:26.097406
,1,65,https://www.tripadvisor.com.sg/Profile/pinoytraveller2,427718658,14-10-2016,4,Had Our Cable Car Ride to Sentosa from Mount Faber,This review is quite late. We wanted to experience the cable car ride to Sentosa so we went to Mount Faber where we boarded the cable car. It was amazing to see the traffic and streets below us.,11-2015,Solo,2020-01-31 10:23:26.453820
,1,65,https://www.tripadvisor.com.sg/Profile/Jenanime,383717105,18-06-2016,4,Absolutely stunning views of Harbourfront and Sentosa! :),"I spent an hour and a half taking pictures and hiking from Mount Faber to Hort Park after getting off the cable car at Mount Faber station. The view at the top of Faber Point, the highest point of the park, was simply stunning and offered a wonderfully picturesque view of Harbourfront and Sentosa.

There is plenty of gorgeous greenery and wildlife such as monkeys to explore along the way (I managed to get a good photo of a cute squirrel). Do make sure to bring some mosquito spray with you as unfortunately they are part of the wildlife as well! Drinking fountains are available along the hiking trail if you want to fill up your water bottle or you forgot to bring one in the first place and need to quench your thirst.

On my walk, I passed through the artistic Henderson Waves bridge, which is the highest pedestrian bridge in Singapore (274m in length and 36m above ground). There were plenty of benches here to relax and rest my feet for a while. Further along, there is an awesome forest walk where you can admire the lush green scenery below and around you. Alexandra Arch, located just before Hort Park, has an interesting shape just like an open leaf. I definitely recommend the journey from Mount Faber to Hort Park for nature lovers! :)",06-2016,Solo,2020-01-31 10:23:26.847022
,1,65,https://www.tripadvisor.com.sg/Profile/SihYing,368448180,28-04-2016,4,A bird's eye view of Singapore,"Whenever I travel to a foreign place, I often appreciate seeing the country/place from a bird's eye view - and enjoy its panoramic view...

Here at Mount Faber, you will be surprised by a lovely panoramic view of Singapore - it's a world of its own!

Come to Mount Faber and have a look from the top!

Enjoy your visit to Singapore - even if it's for a day or two!",05-2015,Solo,2020-01-31 10:23:27.234235
,1,65,https://www.tripadvisor.com.sg/Profile/Jase127,355912734,16-03-2016,4,Nice view of surroundings,Went for a short 6km run and stopped to enjoy the view on top of Mt Faber. Its quite a walk but its worth a walk.,03-2016,Solo,2020-01-31 10:23:27.612579
,1,65,https://www.tripadvisor.com.sg/Profile/TheoSox10,352267599,02-03-2016,4,Great place to run,"I found out about this place via Trioadvisor, so I thought I would come here and see it. I ran from Hort Park across The Southern ridges, over Henderson waves and up here, great views along the way, overlooking Singapore. There is also a bar at the top for refreshments.",03-2016,Solo,2020-01-31 10:23:33.515669
,1,65,https://www.tripadvisor.com.sg/Profile/lynnette l,640137273,17-12-2018,4,"Ate at the restaurant Arbora, with beautiful scenery","Beautiful view of the hillside and sentosa, but quite inaccessible by public transport (and difficult to find private hire transport out as well). Didn't manage to take the cable car, but the food was quite good.",12-2018,Business,2020-01-31 10:23:58.991419
,1,65,https://www.tripadvisor.com.sg/Profile/Ashukla1980,572360858,10-04-2018,5,Enjoyed the View and Cable car ride,"Dear Readers,

Don't forget to buy cable car tickets if you are planning to visit Sentosa. You will be getting a round trip ticket in about SGD 30 which will allow you to board any station in the route and come back to that point. I prefer to board cable car at Mount Faber so that I can end my journey back at this point and then take MRT for the city.

The view from the cable car was breath-taking and it was even more fun due to drizzle. At Mount Faber station, you can walk in the park and be with nature for some time. I and my business partner visited a cafe/bar (I forgot the name) and enjoyed our beers for couple of hours.

Conclusion - It is a relaxing trip. Must-visit sort of place

Enjoy the Singapore trip and Travel the world.",03-2018,Business,2020-01-31 10:23:59.370825
,1,65,https://www.tripadvisor.com.sg/Profile/Idabayuni,452638287,17-01-2017,4,Bell of Happiness! My cup of tea!,"Aha! This is new to me! Look at all those bells of happiness tied together with lovely background view of Mount Faber.

At this spot, you will see a large Bell of Happiness, and then small bells with your happy wishes written on those bells, who knows your happy wishes may come true.

So I had a go, I made my happy wishes, a few of them, and optimistic that my wishes may come true - I'm open for positive things in life ;)

At this cafe here, I could enjoy the view, so scenic, picture perfect. I had my usual cup of coffee, my colleague had a piece of cheese cake, which looked delicious.

Before going on the cable car to get back to the lower ground, I was tempted with those cute souvenirs, and so bought some to take home.

A refreshing trip to this spot. Actually we also had a meeting here, talking about work.",01-2017,Business,2020-01-31 10:23:59.773278
