REVIEW_INDEX,WEBSITE_INDEX,POI_INDEX,REVIEWER_URL,REVIEW_ID,REVIEW_DATE,REVIEW_RATING,REVIEW_TITLE,REVIEW_BODY,DATE_OF_EXPERIENCE,TRIP_TYPE,REVIEW_CRAWLED_TIME
,1,65,https://www.tripadvisor.com.sg/Profile/relaxtripp,695360683,04-08-2019,3,Brisk Walk,Cant find much interesting here. I hope this is the only mount available in Singapore. Only attraction i can see is we can have a view of Indonesia from here using the telescopes available there in the park.,07-2019,Family,2020-01-31 10:21:09.037887
,1,65,https://www.tripadvisor.com.sg/Profile/srikanthav94,687359126,07-07-2019,4,Greenery,A very nice green space with in the city to hangout and also get wonderful views of the city. You can zoom in to the views using the telescope placed there. You can understand why Singapore is called a city in a garden. I went there by the cable car. You can also reach there by bus/car. Or even take a hike from downhill. The views and atmosphere is certainly worth it.,07-2019,Family,2020-01-31 10:21:09.427910
,1,65,https://www.tripadvisor.com.sg/Profile/Ram V,667769384,20-04-2019,4,Pleasant place to walk around,Mt Faber is a pleasant place to have a wander and the views are superb. It is best to get there by cable car. There is also the Bell of Happiness which is near the cable car station. Worth a visit.,04-2019,Family,2020-01-31 10:21:09.809608
,1,65,https://www.tripadvisor.com.sg/Profile/erickson4048,662197159,30-03-2019,5,Very Trilling Mount Faber,"Im not really into heigh, but how could u reach here, without using the cable car! But once u get there everything is so nice, u must try the cafe, food is delicious",03-2019,Family,2020-01-31 10:21:10.214697
,1,65,https://www.tripadvisor.com.sg/Profile/Gints K,661084919,25-03-2019,5,Good views over city,This is final destination if you walked along Southern Ridges - best free views over city and if you want then can take cable car to Sentosa. We saw one gigantic spider but otherwise Central Water Catchment walking trails have much more fun.,03-2019,Family,2020-01-31 10:21:10.614189
,1,65,https://www.tripadvisor.com.sg/Profile/Mala V,660495653,23-03-2019,4,My son's graduation celebration,"Going to Arbour next Sunday for lunch with my family of 14 to celebrate my son's graduation. I hope food will be good, just like the view and everyone will have an enjoyable afternoon. Will update more, after our visit.",03-2019,Family,2020-01-31 10:21:10.975776
,1,65,https://www.tripadvisor.com.sg/Profile/div106,641927157,28-12-2018,4,Good for trekking,"Mount Faber is good for trekking, hiking and long walks. One must visit the place and get a glimpse of the city from a height.",06-2018,Family,2020-01-31 10:21:11.352324
,1,65,https://www.tripadvisor.com.sg/Profile/Rahul U,641270150,24-12-2018,4,"High, natural & beautiful",This place can give you scope for relaxing with nature. Area is quite green & can be visited for one to two hours.,09-2018,Family,2020-01-31 10:21:11.724040
,1,65,https://www.tripadvisor.com.sg/Profile/RahulU1980,641255093,24-12-2018,4,Natural high point in Singapore,"It is the small hill in comparison with other mountains. However, in Singapore it is rare. This place is maintained well & can be visited for few hours.",09-2018,Family,2020-01-31 10:21:12.070162
,1,65,https://www.tripadvisor.com.sg/Profile/Pasan A,615700703,11-09-2018,5,Must visit this place,Amazing breath taking views from the top. You have to use the Singapore cable car line to get to the top from Harbourfront station. you can f=buy cheap tickets for the cable car online thru websites like KLOOK which i used. enjoy,09-2018,Family,2020-01-31 10:21:12.429883
,1,65,https://www.tripadvisor.com.sg/Profile/Thinh_Nguyen_Phuoc,615282523,10-09-2018,3,Panorama view,"Good place to have a wide view to the city, Sentosa and the sea. There's not thing much to do but taking photos.",08-2018,Family,2020-01-31 10:21:18.445279
,1,65,https://www.tripadvisor.com.sg/Profile/David C,603617862,07-08-2018,4,Scenic location,A great place for hiking and enjoy the fresh air and scenic view. The new bridge give another great view where you may find breathe taking discoveries. There is cable car station where you can take to travel to Sentosa island. A convenient and provide a bird eye view.,12-2017,Family,2020-01-31 10:21:18.798619
,1,65,https://www.tripadvisor.com.sg/Profile/SR148Kandy,602449682,03-08-2018,4,Superb location.Great view.,"Loved the restaurant around the tree, and the amazing views over Sentosa and the harbour. Great start to the cable car-sentosa-harbour front experience. Have a look at the quirky railing of bells, reminds you of the love bridge in Paris.",08-2018,Family,2020-01-31 10:21:19.154776
,1,65,https://www.tripadvisor.com.sg/Profile/B1538MOcamillec,599587501,25-07-2018,3,View from the top,Took the cable car from the harbour up to mount Faber. Very pleasant and ate at the restaurant with a beautiful view.,07-2018,Family,2020-01-31 10:21:19.526501
,1,65,https://www.tripadvisor.com.sg/Profile/MikeC2237,595395652,12-07-2018,4,Great views - catch the cable car to Sentosa Island,We took a taxi to the top of Mount Faber and took in the views of Sentosa Island and Singapore. Great views in early morning. The cable car ticket office opened at 8:45am. Took the cable car to Sentosa Island for the day. Returned to Harbour Front cable car station as better option to catch a taxi. Definitely worth a look.,07-2018,Family,2020-01-31 10:21:19.901733
,1,65,https://www.tripadvisor.com.sg/Profile/kiwimh,590807760,26-06-2018,5,Great view over the city & Sentosa Island,"We took the gondola up to Mt Fabor. Great views and they had a cute terrace hung with wishing bells. If you venture further through their garden at the top, you will come to an original old sailing ship’s bell which is meant to grant lifelong happiness when couples ring it together. If you walk up to the top of the mountain, you get great views of Sentosa Island, the original Merlion (the sign for prosperity) which guards over the trading ship harbor, and views of Singapore city.
You can then take the gondola on a round trip to Sentosa Island which has a uniqueness including an alley towards the beach which you would think Gaudi had developed and designed! Definitely worth the trip!",06-2018,Family,2020-01-31 10:21:20.317014
,1,65,https://www.tripadvisor.com.sg/Profile/wanet2015,589133364,20-06-2018,5,Daily acitivity,"Glad to know this place for daily acitivty to do relaxation, Viewing and exercise running/walking. We are take cable car from sentosa to stop at Mount Faber",04-2018,Family,2020-01-31 10:21:20.712673
,1,65,https://www.tripadvisor.com.sg/Profile/chewyjuice,574942907,22-04-2018,4,Do the faber license!,"I have a faber Licence, that is, the one that gives me unlimited rides on all cable cars in Singapore. My 16 month old loves the rides, and I find it gives her a bird's eye view, a different perspective to her environment.

We eventually made it to try dusk restaurant at dusk hah! Didn't watch the sunset as we left early to head home to put little one to bed after a tiring afternoon at sentosa. Very expensive tapas! Good quality but small portions. The dusk promotion is awesome for wines though. The moscato was good!",04-2018,Family,2020-01-31 10:21:21.079642
,1,65,https://www.tripadvisor.com.sg/Profile/OzYuval,571321977,05-04-2018,4,Good View and CableCar,"The park has very good panoramuc view and has cablecar transport to Sentosa. Walk to Faber point it is only 7 minutes walk from cablecar station. It definitely worth it.
At this point you can take a picture with Merlion statue.
Don't miss the Happiness Bell at the back of the cablecar station.
We bought tickets (one direction is not available) to Sentosa. We took tickets for in-island circle (i think it is unnecessary).
You can walk or take shuttle to ""Wave house"". Free if you use the atraction (highly recommended) or eat at the restaurant.
The view from the cablecar is unic and you can order VIP meal.
start at morning. you can spend all day at Sentosa (look for 'Sentosa').",04-2018,Family,2020-01-31 10:21:21.476718
,1,65,https://www.tripadvisor.com.sg/Profile/RowdyMonster,549661432,28-12-2017,5,No regrets coming,"Free car parks and good exercise

There are different car parks at different sites too.

Henderson wave is nearest to car park D

Worthwhile to visit the cable car building where there is a nice gift shop and beautiful photo spots. There is also bell of happiness and the ‘wishing’ bells

Wear sport shoes and comfy clothes",12-2017,Family,2020-01-31 10:21:21.866529
,1,65,https://www.tripadvisor.com.sg/Profile/rohanpillai1,538249698,04-11-2017,4,Great view,This is one of the best place to get a good view of Singapore. Make sure you visit it in either the morning hours or the evening. The view is worth the trip.,10-2017,Family,2020-01-31 10:21:27.726643
,1,65,https://www.tripadvisor.com.sg/Profile/Mukta2016,528060686,28-09-2017,4,Nice Views,Mount Faber is located close to the Vivo City mall and one can take the cable car ride from here to Sentosa island. It is preferable to take a cab to Mount Faber as there is no bus service to the top. The views from atop the peak are good and offer great background for good photos.,06-2017,Family,2020-01-31 10:21:28.115520
,1,65,https://www.tripadvisor.com.sg/Profile/abutaiyab,519719488,31-08-2017,3,Cable car- highest peak,"This is supposedly the highest peak of Singapore which is not too high in normal standard. But even then it offers a very good panoramic view of the city, u can take the cable car to Sentosa from here which is why most people visit it.",06-2017,Family,2020-01-31 10:21:28.486110
,1,65,https://www.tripadvisor.com.sg/Profile/KGB777,507631602,01-08-2017,4,Nice views,"Came here again on the weekend with the kids. Great views out over Sentosa and the city. A bit of a pain to get to by public transport, but easy by taxi or your own car. We come here fairly regularly as it's the boarding point for the cable car to Sentosa.",08-2017,Family,2020-01-31 10:21:28.887744
,1,65,https://www.tripadvisor.com.sg/Profile/raghu67,495558486,24-06-2017,4,A view worth limbing for !,A walk up to the top is compensated with the magnificent view of Singapore City. The peak is surrounded with a large park where one can go for a walk or jog.There are a few options to have a bite if needed.And one can take a Cable Car ride from here.,05-2017,Family,2020-01-31 10:21:29.299033
,1,65,https://www.tripadvisor.com.sg/Profile/Debra R,492837010,14-06-2017,5,Worth It for the Panoramic Views,"I love views and this is a great spot for just that. The view is panoramic, overlooking southern Singapore, the cable cars, Sentosa Island, and over to Indonesia. There are many lookout points with telescopes that provide for a closer view. We went with a guide for a tour of the island so we drove to the top. It is a great photo opportunity. Photos and View!",05-2017,Family,2020-01-31 10:21:29.683950
,1,65,https://www.tripadvisor.com.sg/Profile/rcsdev,479009183,26-04-2017,5,View of singapore and indonesia,The mount in the island city Singapore is attractive in its kind near Harbourfront surrounded by forest area a very good atraction. If you have time you nay visit by cable car. There is a viewing gallery on the top of the mount from where the whole island can be seen it is said you can see the border of indonesia.,04-2017,Family,2020-01-31 10:21:30.072352
,1,65,https://www.tripadvisor.com.sg/Profile/DrGallivanter,472640443,04-04-2017,5,Bell of Happiness is here!,Mount Faber Peak is where you can find an old bridge full of little bells with wishes written on them. The bell of happiness is then rang to answer your wishes. This was a great experience and yes I definitely made a wish on a bell. This is located just behind the cable cars so you cannot miss it.,07-2016,Family,2020-01-31 10:21:30.458880
,1,65,https://www.tripadvisor.com.sg/Profile/s_aakassh,464911506,06-03-2017,5,Breathtaking Views...!,Kids loved the cable car rides and views from the top... This is a must go on your way to Sentosa and gives a good view of the entire theme park...!!!,02-2017,Family,2020-01-31 10:21:30.856140
,1,65,https://www.tripadvisor.com.sg/Profile/abdulrahman542,460493444,17-02-2017,4,Nice Romantic Mount,Romantic mount for all ages you can see Singapore from up with nice road teaching the TOP enjoying the beauty of the nature and sea view Good experience,02-2017,Family,2020-01-31 10:21:31.242812
,1,65,https://www.tripadvisor.com.sg/Profile/vipi0017,446385499,24-12-2016,4,cable car to Sentosa,Think its the highest peak in Singapore and you can take a cable car from here to Sentosa Island . Also you can have nice views from the top,04-2016,Family,2020-01-31 10:21:37.087078
,1,65,https://www.tripadvisor.com.sg/Profile/Larry W,428946709,18-10-2016,5,Only way to visit Sentosa Island,This is easily the best way to visit Sentosa Island. Get on at the Mt Faber entry point and purchase a ticket which includes both cable cars on offer and includes return. You alight right in the heart of the action on Sentosa island. Once on the island you can get on the other cable car which takes you from Merlion station up to the fort at one end of the island. Beats the long walk and what a great view of the beaches and harbour with all the cargo ships.The views in all direction on bothe cable cars are breathtaking. it is well worth the outlay.,10-2016,Family,2020-01-31 10:21:37.455414
,1,65,https://www.tripadvisor.com.sg/Profile/jainneha,423509143,29-09-2016,5,Mount faber,This is the highest point from where we can see the Sentosa island in full picture post card view . From here the cable cars to Sentosa island starts . It is really beautiful on a clear day to view the whole city . And nice to walk on a cool Breeze day .,09-2016,Family,2020-01-31 10:21:37.872944
,1,65,https://www.tripadvisor.com.sg/Profile/J E,401543717,05-08-2016,4,"Great place for an easy morning hike, with amazing view from an unlikely spot","This was a nice place to take an easy hike even with young children. It the was raining lightly the day we went, but still enjoyed the visit. One of the Singapore Cable Car stations is located here. The kids enjoyed the koi pond as other reviews mentioned, and we saw the array of happiness bells. I encountered the best view of the Singapore Cable Cars from an unexpected place - inside the ladies' restroom! Sure enough, other visitors to the restroom stood in front of the floor to ceiling window facing Sentosa exclaiming over the view. And might I add, the arrangement of modern pedestal sinks in a circle with the large fish tank off to the side was pretty photogenic too. (I cannot comment on the views from the men's room, but it is right next door).",07-2016,Family,2020-01-31 10:21:38.228311
,1,65,https://www.tripadvisor.com.sg/Profile/keltzar,393562341,17-07-2016,3,Another park but on a hill,"By itself, it's basically a park to walk around and see the western side of Singapore from atop the hill. Nothing much special for tourists.",01-2016,Family,2020-01-31 10:21:38.573661
,1,65,https://www.tripadvisor.com.sg/Profile/pazza71,391957623,13-07-2016,3,Birds eye view of Singapore,It is free and easy to get to. You get a good view of the city and Sentosa island. Suitable for budget travelers who dont want to use the cable car.,07-2016,Family,2020-01-31 10:21:38.956501
,1,65,https://www.tripadvisor.com.sg/Profile/HotelCritic17,371930526,11-05-2016,3,World's Most Iconic Toilet?,Mount Faber has a great view of Sentosa and the city (even seeing Marina Bay Sands). There are a few nice restaurants and a nice cafe as well. There is of course the world's most iconic toilet which have also a good view of the city.,05-2016,Family,2020-01-31 10:21:39.300994
,1,65,https://www.tripadvisor.com.sg/Profile/susantay27,349633358,21-02-2016,4,Wonderful breeze and views of surroundings,"This is the highest point in Singapore, Bukit Timah Hill. This location offers a
Surround view of 360 degrees, from the pier to the surrounding estates. Many coach buses stop here. Just about 100m down the path is a pub restaurant. It offers great sunset views and especially later into the night with the night lights. Romantic for couples to take a walk here",02-2016,Family,2020-01-31 10:21:39.707660
,1,65,https://www.tripadvisor.com.sg/Profile/I5730PBrebeccaw,347773639,15-02-2016,3,Only views,"Parked here and caught the cable car to Sentosa Island. Glad I didn't go only for Mt Faber. Yes you an see a long way, either the docks or Sentosa Island. Would be great place to walk or run for exercise, but for a tourist attraction there's nothing there.",02-2016,Family,2020-01-31 10:21:40.066384
,1,65,https://www.tripadvisor.com.sg/Profile/KerryG771,338792560,10-01-2016,4,Great Views from Cable Car,"We caught the Cable Car from Mount Faber to Sentosa Island. We caught a cab from our hotel to Mount Faber.

This is a great way to see a lot.

The Cable Cars are not air conditioned, but you can open windows to let air in.

We loved the view.

Staff were also good.

They do take your photo so be prepared at the other end when they show you your photo, it was either $25 or $35 for the photo - you don't have to buy it.",01-2016,Family,2020-01-31 10:21:40.447920
,1,65,https://www.tripadvisor.com.sg/Profile/Goldbunny123,691281740,21-07-2019,4,Great service,"We took the cable car in the evening to enjoy the views. We had booked tickets on my phone and had trouble opening our e-tickets at the ticket booth. The young man serving, Kelvin, was so very helpful and allowed us to hotspot his phone to get better internet to open our tickets. Very kind and a great service! The view from the main cable car is wonderful on sunset and in the evening but we were a bit disappointed in the island cable cars. They are very hot (even after dark, no fans!) and are so heavily tinted that there isn’t much of a view. We think it’s definitely worth the trip from Faber to Sentosa and back though, the view is awesome!",07-2019,Couples,2020-01-31 10:22:11.626188
,1,65,https://www.tripadvisor.com.sg/Profile/nickandangels,673107438,11-05-2019,4,High Point!,"Mount Faber is the highest point in Singapore! It sits on the Southern Ridges with fantastic views to the south. We walked up, but you can catch a cable car to the top of the hill!",03-2019,Couples,2020-01-31 10:22:12.015618
,1,65,https://www.tripadvisor.com.sg/Profile/yourtravelbuddysg,665050759,09-04-2019,4,Great views at the top,One of the hills found on this small island called Singapore. There are a number of restaurants located here. The cable car to sentosa also starts here. The views at the top is mesmerizing.,04-2019,Couples,2020-01-31 10:22:12.362320
,1,65,https://www.tripadvisor.com.sg/Profile/Dilip P,654211803,23-02-2019,4,Great place for the city view,It is an excellent location for viewing the city. There is lot of opportunity to walk around if you enjoy walking,01-2019,Couples,2020-01-31 10:22:12.741346
,1,65,https://www.tripadvisor.com.sg/Profile/lifenadventure,654201648,23-02-2019,4,Lovely views.,This is a great place to come for some really nice views of the city. We didn’t take the cable car but there was still loads to see especially at Faber point which was beautiful and gave you 360 views of the city.,02-2019,Couples,2020-01-31 10:22:13.159433
,1,65,https://www.tripadvisor.com.sg/Profile/Johnathon T,651883877,13-02-2019,5,Great cablecar ride,If you are visiting Singapore then I highly recommend the cablecar amazing views plus a great way to visit all the attractions on Sentosa island.,02-2019,Couples,2020-01-31 10:22:13.542892
,1,65,https://www.tripadvisor.com.sg/Profile/Allan B,646321084,16-01-2019,3,Excellent View,"Mount Faber offers an excellent view over Singapore. It has manicured lawns and garden. However, unfortunately we were given incorrect information to get to the summit. On alighting from our public transport bus, we were faced (without being warned) with a very long walk up a steep gradient. Not good for the elderly or people, like me, with breathing difficulty. I'm uncertain what alternative access there is. In summary, I would recommend Mount Faber for those reasonably fit, or those who must catch the Sentosa Cable Car there. There is a much more accessible Cable Car Station at the Harbour Front.",12-2018,Couples,2020-01-31 10:22:13.901202
,1,65,https://www.tripadvisor.com.sg/Profile/Elizabeth9007,636793398,01-12-2018,4,A must see!,Lovely restaurant at the top which is great for a drink and views of the harbour front. Accessible from the cable car or southern ridges walk. Peaceful and clean. Really under-rated!,12-2018,Couples,2020-01-31 10:22:14.270205
,1,65,https://www.tripadvisor.com.sg/Profile/Dan L,627647153,24-10-2018,4,Great Views,"Years ago I visited Mount Faber; Much has changed, a better access road, more development, bars, restaurants, hiking trails, and still great views over parts of the Island. It's one of the oldest parks in Singapore and the location where you take the cable-car to Sentosa Island.",10-2018,Couples,2020-01-31 10:22:14.650942
,1,65,https://www.tripadvisor.com.sg/Profile/ih716,625371525,16-10-2018,5,High Spot,Great views from this mountain before getting the cable car over to Sentosa. The view over the harbour and the island are sensational,10-2018,Couples,2020-01-31 10:22:15.030793
,1,65,https://www.tripadvisor.com.sg/Profile/adrianohhjr,621332710,02-10-2018,4,Good view with decent food,Breath taking views of sentosa before the sun set and food was promptly served. The server was friendly and approachable. Advisable to book the tables in advance to enjoy a better view with lesser obstructions. A clearer signboard could be in place for better directions to the restaurant.,08-2018,Couples,2020-01-31 10:22:21.051195
,1,65,https://www.tripadvisor.com.sg/Profile/Pavitra C,612225677,30-08-2018,5,beautiful view and good place,Beautiful place and view. The platter was good and was full just by having that. It is a nice place to bring ur loved ones to on a special place. Scenic view and at night with all the lights and the cable car view was very nice. There was a outdoor n indoor place.,08-2018,Couples,2020-01-31 10:22:21.419950
,1,65,https://www.tripadvisor.com.sg/Profile/Mashed_Pot_78,603011550,05-08-2018,5,Nice place to dine and chill,"This place has got a nice view. A place that can be considered for any occasions, be it a romantic dinner, to a wedding or corporate events. Great food and service. Worth the trip up the winding road. Will definitely be back again.",09-2017,Couples,2020-01-31 10:22:21.739352
,1,65,https://www.tripadvisor.com.sg/Profile/fitnfifty,597203349,18-07-2018,5,Lots of Exercise,Took the taxi to the top of Mt Faber and then did the walk right round and back out the other side. Lots of steps and hills and amazing views from all sides of Singapore. Tree top walks a great way to get your daily steps and more in,06-2018,Couples,2020-01-31 10:22:22.139450
,1,65,https://www.tripadvisor.com.sg/Profile/TassiaI,577631235,03-05-2018,5,Wonderful cable car rose,"We walked to Mount Faber through the southern ridges walk, then took the cable car to Sentosa Island. We precooked online so got a discounted rate. We paid for both cable car lines which was well worth it as you got to see more of the island. The organisation and staff were brilliant, such an interesting and different way to see singapore!",05-2018,Couples,2020-01-31 10:22:22.557521
,1,65,https://www.tripadvisor.com.sg/Profile/NehaA758,577159097,01-05-2018,4,All you need to know about Scenic mount Faber,"* Singapore has two cable car lines and most popular one starts from Mount Faber to Sentosa via Harboutfront
* This place is well known for its natural beauty and wonderful restaurants who provide good food along with amazing view.
* There are many picture perfect points where you can take amazing pictures and selfies
* There is one bell of happiness whose beauty and glory will definitely bring smile on your face
* Not so popular tourist destination but it offers a lot to your memories
* It does not come on must visit list but definitely one of my favourites in Singapore . If you cherish nature and peace then definitely visit this place.",05-2018,Couples,2020-01-31 10:22:22.897065
,1,65,https://www.tripadvisor.com.sg/Profile/Camille M,565249974,08-03-2018,5,Cable car to Mt Faber,It was a short ride up to Mt Faber and the view was amazing. It started raining but it was still warm and the rain didn't last long.,03-2018,Couples,2020-01-31 10:22:23.264665
,1,65,https://www.tripadvisor.com.sg/Profile/annettelaurie,564263065,04-03-2018,4,Stunning view and a lovely ride,"Mount Faber cable car – A great way to look around.
We arrived in Singapore late at night and so took the next day to travel by MRT to Mount Faber Park and its cable cars. Just take the MRT to The Harbourfront. The tickets are surprisingly cheap, especially when doubled up with the Sentosa Island ticket – a steal at S$22 each or about £12 each. The cable cars go really high up the mountain to a restaurant and some shops and offer some fantastic views both of the docks and waterfront and across to Sentosa and Singapore in the other direction. They are incredibly smooth cables – no rocking or jolting, and like everything in Singapore – very, very clean. You can get out at the top and spend time in the park a well.",03-2018,Couples,2020-01-31 10:22:23.646192
