REVIEW_INDEX,WEBSITE_INDEX,POI_INDEX,REVIEWER_URL,REVIEW_ID,REVIEW_DATE,REVIEW_RATING,REVIEW_TITLE,REVIEW_BODY,DATE_OF_EXPERIENCE,TRIP_TYPE,REVIEW_CRAWLED_TIME
,1,65,https://www.tripadvisor.com.sg/Profile/Bert T,360099229,30-03-2016,4,Cable Car to Sentosa HQ,This is where you go to catch the cable car to Sentosa. A great way to see Singapore and the southern coast. It's a stiff walk up the hill and in the Singapore heat I recommend a Taxi.,01-2016,Business,2020-01-31 10:24:00.123550
,1,65,https://www.tripadvisor.com.sg/Profile/pshurd,665679411,12-04-2019,5,Lovely overview of Singapore Harbor area,"We took the Mt Faber cable car & really enjoyed the city views & also the views of the Sentosa Island resorts. It was quite a beautiful area. We didn't have time to take advantage of any of the walking paths, but that looked great also. Don't miss the Toilette with a View! It's great!",04-2019,Friends,2020-01-31 10:24:25.567104
,1,65,https://www.tripadvisor.com.sg/Profile/Cath G,652927253,17-02-2019,5,"Views, views, views","If you can take the mrt to patong Pasir and walk the southern ridges
About 3 hours to Faber point and the cable car, not at all effortfull if you can cope with heat and humidity! Fabulous views and worth stopping for a at the Arboria at the end!",02-2019,Friends,2020-01-31 10:24:25.946293
,1,65,https://www.tripadvisor.com.sg/Profile/alwaystravellin33,643546292,04-01-2019,1,Woeful experience,"Poor food, dreadful service ... went on New Years Eve, a disaster of a meal...greasy, overpriced and the service so slow it was almost self serve. I wouldn't go here again if you paid me. Also, for 6 people with no alcohol, for lunch it was nearly $500. NOTHING good about this place except the view.",12-2018,Friends,2020-01-31 10:24:26.342349
,1,65,https://www.tripadvisor.com.sg/Profile/CountVanCount,639164920,12-12-2018,4,Starting point for Cable Car,Went here only to catch a ride to Sentosa Island and were surprised by the nice surroundings. Worth checking out (even if you're not there for the cable car).,06-2018,Friends,2020-01-31 10:24:26.733593
,1,65,https://www.tripadvisor.com.sg/Profile/Protr,636777748,01-12-2018,4,Morning Walk up “Mountain” in Singapore,It was a challenging but rewarding walk up a “Mountain” from a different starting point. We started from Kampong Bahru Road this time. The initial start was a steep slope up but it was good. There were a many cyclists that took this way up and could see them struggling with their pedals. Will do it again.,12-2018,Friends,2020-01-31 10:24:27.129323
,1,65,https://www.tripadvisor.com.sg/Profile/KGB777,605601824,12-08-2018,3,Nice views over SIngapore,"This is a good place to visit for the views, but there's not really much in the way of places to escape the traffic and crowds. The walkway down to Harbourfront was closed for repairs when I visited on the weekend and so we had to take a detour via a slightly longer route (and less interesting too as it was along the road rather than through the jungle).",08-2018,Friends,2020-01-31 10:24:27.527269
,1,65,https://www.tripadvisor.com.sg/Profile/Richard F,601429967,31-07-2018,4,Peaceful Spot to see the whole of Sentosa,Mount Faber Park is one of the stops on the Sentosa Cable car. It was a really nice ride. Once you reach the stop there is a park and a restaurant to relax. It has a koi pond and it is really amazing to interact with the fish. Pets are allowed at this spot.,01-2018,Friends,2020-01-31 10:24:27.905174
,1,65,https://www.tripadvisor.com.sg/Profile/Christopher_SNZ,575747017,26-04-2018,5,Great Cempedak (Jackfruit) Pudding,"There are few things that really stand out for me, so much that I feel I have to give it a special review on its own: you simply must try the cempedak pudding at Spuds & Aprons - it's like nothing I've ever had before, well balanced flavour, served with ice cream, it's worth a visit just to try this.

Also there's the cable car, but I think most locals already know this. They've also recently opened Dusk restaurant with their amazing view. Worth a revisit for old timers who've not been to Faber Peak in a long while!",04-2018,Friends,2020-01-31 10:24:28.265220
,1,65,https://www.tripadvisor.com.sg/Profile/A8327BTaa,562249747,23-02-2018,4,Great views,Great to drive up or walk up for great views of the city and cable car to Sentosa. Quiet and green - good spot and not crowded with tourists.,02-2018,Friends,2020-01-31 10:24:28.629683
,1,65,https://www.tripadvisor.com.sg/Profile/bridgeways,553743353,14-01-2018,4,Drinks with a view,"It was my second visit to Mount Faber and this time was on a rainy Saturday afternoon!

We went there by car and had a drink at Dusk which opened at 4pm.

Lovely place to hang out with friends, while having a drink! We can also enjoy the magnificent view!",01-2018,Friends,2020-01-31 10:24:28.991699
,1,65,https://www.tripadvisor.com.sg/Profile/Cele-be-rate,506627165,29-07-2017,4,Singapore 🇸🇬 by Night..,After dinner ride up to Mount Fabre.. which one does not notice during the day .. I stood rooted looking at the twinkling lights .. singapore 🇸🇬..a fairy land.. breathtaking view ..go there at night..,08-2016,Friends,2020-01-31 10:24:34.948542
,1,65,https://www.tripadvisor.com.sg/Profile/Bob M,488761863,29-05-2017,5,Great views and a bit of history,"views out to sea over the Singapore strait to Indonesia and the other side to the City. The complex around the cable car station has some touristy restaurants but there is a nice bar a little further towards the TOP of the hill. It's a sweaty but worth it walk up the footpath from HarbourFront station. On the way down a nice alternative to the road to Lower Delta is to take the footpath on the city side of the hill. At the bottom is Radin Mas site of a Malay legend around the tragic death of a princess. Google it!

you can also do Mt Faber as part of the hilltop path connecting to Kent ridge. Impressive footbridge and a reasonable attempt at an urban canopy walk.",05-2017,Friends,2020-01-31 10:24:35.303063
,1,65,https://www.tripadvisor.com.sg/Profile/joanadventure,486101516,21-05-2017,4,Mount Faber,This is a place to see the view opposite of Sentosa island and there is a good restaurant and the toilet can take Sentosa island photos too.,12-2016,Friends,2020-01-31 10:24:35.660836
,1,65,https://www.tripadvisor.com.sg/Profile/erikamix,459596883,14-02-2017,4,Pretty good view,It was pretty higher more than I thought. It was good view and not many people that I can relax and see many things:),02-2017,Friends,2020-01-31 10:24:36.031693
,1,65,https://www.tripadvisor.com.sg/Profile/ElvenaP1,458773769,12-02-2017,3,See singapore from above,"I've visited singapore several times. But this was my first visit to mount faber. At first i didn't have a clue about faber peak. And at my first step after landing there via cable car i thougt the place is only dome kind of restaurant. Unsurely i walked along the road and i found that this is the place to see singapore from above!! Well, i like high places. We can see the trees combine with high rise buiding and the sea from faber peak. The view is great. There is also a merlion statue at faber peak too!! If you don't want to have mainstream photo with merlion beside the river, well you should go to mount faber and have some picture with the merlion.",12-2016,Friends,2020-01-31 10:24:36.429809
,1,65,https://www.tripadvisor.com.sg/Profile/samrox5,454154874,23-01-2017,4,Great Views,This visit was part of a tour we were on. Very popular spot for locals walking & exercising. Bring the camera for some good shots,12-2016,Friends,2020-01-31 10:24:36.812871
,1,65,https://www.tripadvisor.com.sg/Profile/linweisingapore,451402952,12-01-2017,4,Mount Faber By Night,"On 11 January 2017, a Slovenian friend was in town. Took him to Sentosa and Mount Faber. Few of the must do attractions.

Ascend to Mount Faber by car. Shown him the 2 scenic lookouts. The city view and Sentosa (cable car) view. The glittering lights in the city at night were really vibrant. Quiet and peaceful place to witness the city lights. Clear sky, no star and weather was humid (28 degrees celsius) that night.

Enjoy this visit.",01-2017,Friends,2020-01-31 10:24:37.184917
,1,65,https://www.tripadvisor.com.sg/Profile/JustLoveToFly,436708511,13-11-2016,4,Nice Views. Quaint,"Located at Telok Blangah, this is a pretty quiet place for leisure walk. There' nice views at the TOP where one can see sunset. It's also here where you can take the cable car to Sentosa. Good for kids and adults.",11-2016,Friends,2020-01-31 10:24:37.601284
,1,65,https://www.tripadvisor.com.sg/Profile/David B,416753874,10-09-2016,4,City Green Belt,"Mount Faber is a secondary growth forest that forms part of several interconnecting parks that run along the top of Singapore's Southern Ridges.

It is one of Singapore's oldest parks and is very popular with locals for jogging, exercise, and just a romantic stroll in the evening with you boyfriend or girlfriend.

It is also popular for bird watching and we were fortunate enough to see a green, brightly colored kingfisher high up in the boughs of a large tree.

Faber Point, at 106 m above sea level, is the highest point on the walk.",09-2016,Friends,2020-01-31 10:24:37.982994
,1,65,https://www.tripadvisor.com.sg/Profile/Topher Q,415276065,06-09-2016,5,Splendid view from the top,"To start off the visit to Sentosa, the view from the cable cars is magnificent. Me and my friends had great time taking pictures.",10-2015,Friends,2020-01-31 10:24:38.387985
,1,65,https://www.tripadvisor.com.sg/Profile/linweisingapore,388590544,03-07-2016,4,Faber Peak,"Visited Mount Faber today.

Climbed up to Faber Peak, where's the station for the Sentosa cablecar is located. No much crowd this day.

There's a little souvenir shop and a restaurant. Restaurant offers good view of Sentosa and cablecar. People bought bells to declare their wishes. Also a little pond where koi fishes swimming about.

There's also a Bistro nearby. Limited parking space available.

Peaceful and lovely place to witness the city lights at night. Enjoyed.",07-2016,Friends,2020-01-31 10:24:44.235865
,1,65,https://www.tripadvisor.com.sg/Profile/Emmanuel N,384492669,21-06-2016,3,Free View of Singapore,"If you are on a budget, and still like to have a sky view of singapore without going on a cable car, or the Singapore Flyer, or MBS Skypark, then this is THE BUDGET place for you!
On this hill (yah, NOT MOUNTAIN), you can get to see some cool landscapes of Singapore. Day and Night views are different, so do come up if you can find the time.
And if you HAVE money to burn, take the cable car into Sentosa!",06-2016,Friends,2020-01-31 10:24:44.606357
,1,65,https://www.tripadvisor.com.sg/Profile/ajhurst6,376153717,24-05-2016,5,Holiday,Brilliant place to visit ride on a cable car the scenery absolutely stunning. When we were there a ship was In we went over top of it. Stunning views of beaches and docks area. Loads of photos taken plenty to look.,05-2016,Friends,2020-01-31 10:24:44.974806
,1,65,https://www.tripadvisor.com.sg/Profile/Waritorn J,366001246,21-04-2016,5,Great park across from Sentosa island,"It is good to walk in a Mount Faber Park across from Sentosa island, less people to walk hiking here. It was surrounding with all natures, tree, and had a good spot on the top of mountain to see view of Singapore city.",04-2016,Friends,2020-01-31 10:24:45.386164
,1,65,https://www.tripadvisor.com.sg/Profile/cweitat,353757286,08-03-2016,5,Great place to reward yourself,"Is quite a distance to walk to the top but once you reach the top, the view is breathtaking! you can take the cable car from here or grab a meal at the restaurants.",04-2015,Friends,2020-01-31 10:24:45.793892
,1,65,https://www.tripadvisor.com.sg/Profile/KGB777,345552316,07-02-2016,4,Good views,"I've been here many times over the years whilst living in Singapore and I still enjoy the views out towards the city and over Sentosa. The most recent visit was as part of the Southern Ridges walk, this time starting at Kent Ridge mrt and then finishing 9km later at Harbourfront mrt. The walk down through the jungle to Harbourfront mrt is also quite nice, especially later in the day when there aren't too many people about.",02-2016,Friends,2020-01-31 10:24:46.181685
