REVIEW_INDEX,WEBSITE_INDEX,POI_INDEX,REVIEWER_URL,REVIEW_RATING,REVIEW_DATE,REVIEW_BODY,REVIEW_CRAWLED_TIME
,4,6,//www.qyer.com/u/2235953,4,2015-05-20,新加坡夜生活的聚居点之一，晚上灯光映衬下挺梦幻的，但白天就感觉很一般了,2020-02-15 21:24:36.870987
,4,6,//www.qyer.com/u/705220,4,2015-05-20,夜景很漂亮，找个酒吧，坐下来喝一杯，有些还有坐唱，可以点歌。还有不少美女帅哥,2020-02-15 21:24:36.874971
,4,6,//www.qyer.com/u/1559985,3,2015-05-20,晚上去感受一下夜生活还是不错，其他感觉也没有什么特点，新加坡毕竟就只有那样大,2020-02-15 21:24:36.878961
,4,6,//www.qyer.com/u/3163710,5,2015-05-13,很多小酒吧，有一家德国酒馆啤酒做的棒极了，满满的麦芽香味！！！还可以坐船游河，晚上去会非常浪漫风情~珍宝楼也在这。,2020-02-15 21:24:36.883316
,4,6,//www.qyer.com/u/5775244,4,2015-05-11,感觉就是新加坡的后海嘛。很多唱歌的喝酒的，虽然说新加坡法律规定十点以后不能喝酒。,2020-02-15 21:24:39.478603
,4,6,//www.qyer.com/u/5293477,5,2015-05-09,周末夜晚去和新加坡人一起嗨，很有意思，很漂亮。我很喜欢。gggg,2020-02-15 21:24:39.494105
,4,6,//www.qyer.com/u/5667428,4,2015-05-08,一条繁华的酒吧街，晚上去，可以感受不同国家的酒吧文化,2020-02-15 21:24:39.508108
,4,6,//www.qyer.com/u/3228049,5,2015-05-05,新加坡最喜欢的就是这里，有恋人就是圣地！喝杯新加坡司令（我承认我俗气）风吹微醺，刺激的可以去蹦极，河畔有灯火，往来各色人,2020-02-15 21:24:39.515647
,4,6,//www.qyer.com/u/1230825,4,2015-05-05,晚上很热闹很美，河边有一对对男女静静坐着聊天吹风，浪漫一丝丝。,2020-02-15 21:24:39.521473
,4,6,//www.qyer.com/u/5916507,3,2015-04-30,感觉一般，没有让人眼前一亮的感觉,2020-02-15 21:24:39.526421
,4,6,//www.qyer.com/u/5740821,4,2015-04-30,为了吃jumbo螃蟹才过去的，新加坡河其实不怎么好看，但是晚上有风很凉快，适合散步,2020-02-15 21:24:39.531224
,4,6,//www.qyer.com/u/5910263,5,2015-04-28,一定要去这里买醉，就着晚风，就着夜船的星火，喝掉一杯又一杯的酒。,2020-02-15 21:24:39.535065
,4,6,//www.qyer.com/u/2383928,3,2015-04-24,着实感觉一般，也是因为出名才来，感觉似乎不如上海外滩。但是既然有名还是来看看吧。,2020-02-15 21:24:39.538641
,4,6,//www.qyer.com/u/3323995,5,2015-04-23,新加坡 一个港口国家，也是亚洲的唯独的2个发达国家中的一个。各个方面都坐的非常的好。很喜欢这个地方、,2020-02-15 21:24:39.542001
,4,6,//www.qyer.com/u/3590978,5,2015-04-23,晚上坐了游船，非常值得，跨过5座桥，从克拉码头直到滨海湾金沙，摩天轮。。。应该算新加坡最美的地方，克拉码头是吃喝玩乐必去的地方，攻略上推荐的美食店酒吧这边都有，只是消费太高唉,2020-02-15 21:24:42.958387
,4,6,//www.qyer.com/u/5748149,3,2015-04-19,地方很小 有很多特色的小酒吧.喜欢喝酒的朋友可以来这里做一做.,2020-02-15 21:24:42.962253
,4,6,//www.qyer.com/u/2001730,4,2015-04-15,著名的酒吧一条街 旁边有个GX5 胆子够大的可以去尝试下啊 可以再克拉码头坐游船 游船会取鱼尾狮那边绕一圈回来,2020-02-15 21:24:42.966165
,4,6,//www.qyer.com/u/2581490,4,2015-04-14,在克拉码头吃了黑胡椒螃蟹，7点去的，到9点多才吃到，点了一个黑胡椒螃蟹，一个麦片虾，两个菜加上服务费，80多新币,2020-02-15 21:24:42.969793
,4,6,//www.qyer.com/u/3680281,4,2015-04-13,酒吧一条街，晚上营业，什么码头就是小河而已。,2020-02-15 21:24:42.973195
,4,6,//www.qyer.com/u/1881299,5,2015-04-12,很美的夜景和夜生活，活色生香，我喜欢，白天很安静，也可以去走一下，感受一下不一样的,2020-02-15 21:24:42.976564
,4,6,//www.qyer.com/u/2227060,5,2015-04-12,夜晚的码头很美，棒棒哒,2020-02-15 21:24:42.979967
,4,6,//www.qyer.com/u/1867538,5,2015-04-10,酒吧一条街，不过周日的晚上为什么人不多，等走的时候也有很多酒吧都很空,2020-02-15 21:24:42.983331
,4,6,//www.qyer.com/u/2459090,5,2015-04-10,酒吧一条街，很贵的。。我都喝不起。就和几个朋友坐在旁边的桥上买啤酒喝了。。啤酒也是很贵。1瓶喜力大概。6-新币、，贵惨了,2020-02-15 21:24:42.986712
,4,6,//www.qyer.com/u/1054627,4,2015-04-08,河水一般，不是很清澈，但码头沿线美食餐馆众多，休闲聚会的好地方,2020-02-15 21:24:42.990092
,4,6,//www.qyer.com/u/5205407,5,2015-04-07,晚上有灯光非常的漂亮,2020-02-15 21:24:46.188164
,4,6,//www.qyer.com/u/5662409,5,2015-04-02,码头附近有家松骨肉，老字号了，人也多，味道好！不要错过！,2020-02-15 21:24:46.203197
,4,6,//www.qyer.com/u/3298977,5,2015-03-30,彩色粉嫩的排排房，沿河全是酒吧餐厅，拍照的不错去处，就是酒水偏贵了点……还有游船可以坐。,2020-02-15 21:24:46.215119
,4,6,//www.qyer.com/u/2690216,4,2015-03-27,酒吧一条街，晚上到克拉码头逛一圈，体验一下各式风情的酒吧文化，非常有意思,2020-02-15 21:24:46.222269
,4,6,//www.qyer.com/u/465907,5,2015-03-27,新加坡最能满足游客口腹之欲的地方，酒楼餐吧遍地都是，而且都属于中高档的装潢，风景不错，口味一般来说也都不会差到哪里，值得来尝尝看。,2020-02-15 21:24:46.227808
,4,6,//www.qyer.com/u/5740426,5,2015-03-25,"我公司楼下，大家要想和啤酒，推荐最好的地方是Central下面，好喝而且Happy Hour时非常便宜，买一送一。对面Clarke quay，那里贵而且人多。推荐啤酒：Stella Artois（三星推荐）, Hoegaarden（4星推荐）,K'Blanc(5星推荐)！可以抽烟A_A",2020-02-15 21:24:46.232496
,4,6,//www.qyer.com/u/5729748,5,2015-03-22,夜景很美，还有酒吧街。晚上散步的好去处~,2020-02-15 21:24:46.236623
,4,6,//www.qyer.com/u/1198369,2,2015-03-18,感觉没有三里屯，工体热闹，但是仍然是夜生活的好地方，交通也很方便,2020-02-15 21:24:46.240390
,4,6,//www.qyer.com/u/1923632,4,2015-03-16,Quay is nice but the most exciting must be the bars,2020-02-15 21:24:46.243984
,4,6,//www.qyer.com/u/41750,3,2015-03-15,天啦，貌似新加坡的8天，好都去了蛮多地方,2020-02-15 21:24:46.247349
,4,6,//www.qyer.com/u/5651620,3,2015-03-13,在这附近住了两晚，才知道这还是一景点。 晚上景色是挺好， 也热闹，还以为新加坡的夜生活就这样。,2020-02-15 21:24:47.938648
,4,6,//www.qyer.com/u/5675343,5,2015-03-13,美食美酒集中地！在河边一边欣赏狮城美景一边享受美味佳肴，真可谓是人生一大乐事！,2020-02-15 21:24:47.942009
,4,6,//www.qyer.com/u/1080649,4,2015-03-11,酒吧一条街。周末的时候非常热闹，到处都是各种肤色的人。平常人就少一些。,2020-02-15 21:24:47.945382
,4,6,//www.qyer.com/u/2438352,5,2015-03-10,漫步在河边，欣赏晴朗的天空下的美景，哪里都觉得是天堂。那个海鲜酒楼就在克拉马头,2020-02-15 21:24:47.948735
,4,6,//www.qyer.com/u/4362483,5,2015-03-10,夜景很美~适合散步和看夜景...走累了就随便选一家酒吧进去点一杯喝的然后听听歌..里面的驻唱歌手都很赞哦！,2020-02-15 21:24:47.952324
,4,6,//www.qyer.com/u/1740847,3,2015-03-02,属于比较小的一个地方，晚上还是比较热。因为不在边上晚餐，所以谈不上喜欢。,2020-02-15 21:24:47.955682
,4,6,//www.qyer.com/u/5578064,5,2015-03-01,新加坡最喜欢的地方就是克拉码头和旁边的新加坡河。 从前功课不忙时和三五好友坐在河边吹着夜风喝小酒是最美好的回忆。 不过新加坡刚刚推出法令夜间不再允许在公共场所喝酒：（ 不过你还是可以在新加坡河沿岸的小酒吧喝两杯，新加坡的酒吧很安全，很多都很安静并有乐队演奏，价格还适中。 还有地铁有一个出站口的肉骨茶很正宗，如果想吃中餐，推荐陕西名店金德来（羊肉泡馍大盘鸡）和 海底捞（24小时营业，不知道为什么觉得比国内的种类多还好吃，不过也贵）,2020-02-15 21:24:47.959026
,4,6,//www.qyer.com/u/5621142,5,2015-03-01,plenty of bars along the singapore river.,2020-02-15 21:24:47.962424
,4,6,//www.qyer.com/u/2202943,5,2015-02-26,就住在瑞士茂昌阁，晚上很热闹,2020-02-15 21:24:47.965822
,4,6,//www.qyer.com/u/1581413,5,2015-02-23,喜欢这里 喜欢安静的可以来河边吹风 喜欢热闹的可以来这里感受酒吧文化交朋友~,2020-02-15 21:24:47.969324
,4,6,//www.qyer.com/u/1566093,5,2015-02-18,早晨一杯咖啡，码头边坐坐，远离烦心事，一个人静静地放空。。。,2020-02-15 21:24:49.741058
,4,6,//www.qyer.com/u/5572255,3,2015-02-16,这地儿怎么说呢，不同年龄段的体会会有很大差距。,2020-02-15 21:24:49.755190
,4,6,//www.qyer.com/u/3126710,3,2015-02-16,傍晚吃的珍宝海鲜，吃完沿着码头走了一圈。周边的酒吧和西餐厅很多。因为挨着几座银行大厦，这边的饭点儿都是欧美的西装男。,2020-02-15 21:24:49.763953
,4,6,//www.qyer.com/u/2539966,4,2015-02-13,夜幕下的克拉码头简直不能更美，码头边上清一色的食肆，坐在码头边用餐，吹着新加坡河的微风，品尝美食，真是人生一大乐事~~~~,2020-02-15 21:24:49.770212
,4,6,//www.qyer.com/u/5481516,4,2015-02-06,晚上很漂亮，坐在码头边，吹着风，听着歌声，真是一种享受！码头白天很静。,2020-02-15 21:24:49.775334
,4,6,//www.qyer.com/u/3287032,5,2015-02-06,我是带孩子去的，所以白天参观克拉克码头没太多的现代化感觉，反而坐在河边的茶吧喝个饮料吹着小风，看着风景还是很惬意的。白天最吸引眼球的是“海底捞火锅”太熟悉了。晚上这里就是不夜城了，夜景很美。,2020-02-15 21:24:49.779767
,4,6,//www.qyer.com/u/1997230,5,2015-02-06,克拉码头的白天和夜晚是两种味道，个人觉得白天更好看，人少，色彩鲜艳。,2020-02-15 21:24:49.783778
,4,6,//www.qyer.com/u/2010900,4,2015-02-04,新加坡迷人的夜景可以在这里找到。河两岸的酒吧在晚上就会特别的热闹。大家聊天喝酒畅谈生活。,2020-02-15 21:24:49.787508
,4,6,//www.qyer.com/u/409242,3,2015-02-03,还成 就那样 乱哄哄 酒吧倒是有的 随便转转。。。。。。。。,2020-02-15 21:24:49.790965
,4,6,//www.qyer.com/u/5421612,4,2015-02-03,"老的新加坡码头改造的集餐饮和酒吧聚集的休闲场所,由于是白天去的可能有些冷清,晚上应该就是一番不同的场景了吧.",2020-02-15 21:24:49.794350
,4,6,//www.qyer.com/u/1239829,5,2015-02-02,最喜欢的就是在旱季的晚上，一整天的暑气终于退却，和朋友坐在码头边，聊天吃东西喝酒,2020-02-15 21:24:53.773214
,4,6,//www.qyer.com/u/5453719,4,2015-02-02,克拉码头很多美食 是好吃狗的天堂 尤其辣椒螃蟹大爱 回家还买了两袋调料,2020-02-15 21:24:53.776581
,4,6,//www.qyer.com/u/5475579,5,2015-02-01,克拉码头真是新加坡的不夜城，一家接一家的饭馆和酒吧，把这里的夜装扮的很热闹，美食让人流连，美景也很赞！,2020-02-15 21:24:53.779987
,4,6,//www.qyer.com/u/3366443,3,2015-01-29,没啥，感觉跟外滩差不多。晚上全是吃饭的地方，目测都不是小吃，有西餐等，都很贵的样子哦。和男朋友来靠河边吃个晚饭欣赏个夜景是不错。。单身狗飘走。。 对了，一定要绕一圈，走过吃饭的地方就是很干净的河边，可以坐一会吹吹风。不远处还有一个桥，那边有一个很有意思的雕塑，就是几个小hai在河边玩耍的。我是走过去才发现有的，大家不要错过哦。而且桥后面就有一个地铁站，方便散完步会宾馆。。,2020-02-15 21:24:53.783376
,4,6,//www.qyer.com/u/1510361,4,2015-01-29,迷路走了4遍到克拉码头，干净整洁的街道还不错，晚上灯光还不错,2020-02-15 21:24:53.786767
,4,6,//www.qyer.com/u/5185777,5,2015-01-27,可以在克拉码头上穿游新加坡河，当时住的金沙酒店，刚好酒店前面有个码头可以到，很方便。,2020-02-15 21:24:53.790143
,4,6,//www.qyer.com/u/2554922,5,2015-01-27,这里还不错的 有很多酒吧 夜店 晚上的时候老外在路边喝酒 有好多妹纸,2020-02-15 21:24:53.793520
,4,6,//www.qyer.com/u/1236949,3,2015-01-25,晚上挺热闹的，沿河一条餐馆街道。附近还有酒吧街,2020-02-15 21:24:53.796954
,4,6,//www.qyer.com/u/4400661,4,2015-01-21,夜晚的时候，新加坡最热的地方之一，这个是酒吧区，而且是呆在新加坡的外国人喜欢去的酒吧区，里面可以看到跳肚皮舞的舞娘，也可以看到性感火辣的酒吧姑娘。 不妨晚上去喝一杯，感受一下热烈的气氛,2020-02-15 21:24:53.800334
,4,6,//www.qyer.com/u/1881495,4,2015-01-21,延路闲逛到这里的，晚上的灯色好漂亮。,2020-02-15 21:24:53.803765
,4,6,//www.qyer.com/u/2859936,5,2015-01-21,非常热闹，凌晨3点多还有人在PARTY。喜欢夜生活的年轻人可以去玩玩。,2020-02-15 21:24:56.753144
,4,6,//www.qyer.com/u/1121350,5,2015-01-20,港湾的凉风袭来，坐在一家海鲜餐厅里，慢慢吮吸沙冰里传递来的水果香，晚上的星星很美,2020-02-15 21:24:56.756451
,4,6,//www.qyer.com/u/915830,5,2015-01-17,恰好住在克拉码头的诺富特酒店，每当夜幕降临，那里的夜生活才刚刚开始，，，，是个浪漫的地方,2020-02-15 21:24:56.759966
,4,6,//www.qyer.com/u/3420981,3,2015-01-12,酒吧餐厅都不少，随便看看夜景可以，其他印象不是很深，跟其他大城市的码头区别也不大。,2020-02-15 21:24:56.763454
,4,6,//www.qyer.com/u/41241,5,2015-01-09,对这个码头的名字不敏感，更喜爱的是旁边的吃的。这里有jumbo，有小红楼，全是我所好！,2020-02-15 21:24:56.766851
,4,6,//www.qyer.com/u/4510321,3,2015-01-01,克拉码头其实是酒吧、饭店云集的一个码头，比较热闹，到了晚上这里就更加舒适了，因为新加坡的气温非常适宜,2020-02-15 21:24:56.770252
,4,6,//www.qyer.com/u/1693372,5,2014-12-31,晚上来游玩的，灯光夜景不错，还品尝了土耳其冰淇淋，互动式的搞笑方式，蛮好玩的。,2020-02-15 21:24:56.773637
,4,6,//www.qyer.com/u/1038174,3,2014-12-27,晚上夜景不错，白天就比较一般，吃的东西夜蛮贵的，毕竟算事热门景点,2020-02-15 21:24:56.777016
,4,6,//www.qyer.com/u/429972,4,2014-12-24,夜景很漂亮，坐在河边喝杯酒，吹吹风，还是很赞的，不过没有很特别的地方,2020-02-15 21:24:56.780404
,4,6,//www.qyer.com/u/1811673,3,2014-12-23,只记得吃的好吃螃蟹了。,2020-02-15 21:24:56.783794
,4,6,//www.qyer.com/u/4945592,5,2014-12-22,晚上去非常美麗，許多異國酒吧在此，非常熱鬧! 許多人在玩G-Max，看的心驚膽跳。,2020-02-15 21:24:59.813745
,4,6,//www.qyer.com/u/5225954,4,2014-12-21,白天远观，已经隐约感受到夜晚的热闹。以后有机会，一定夜晚来一次，感受它的氛围。,2020-02-15 21:24:59.828920
,4,6,//www.qyer.com/u/5361359,5,2014-12-21,晚上去夜景很美，附近有很多酒吧。还有类似蹦极的，很想尝试，但是不敢一个人坐。,2020-02-15 21:24:59.843045
,4,6,//www.qyer.com/u/5332886,4,2014-12-20,夜景很美~ 运河旁边餐厅选择多样化!! 搭船游河 还可以看到金沙的灯光秀沿着河边走~ 吹吹风 欣赏完夜景 再回去休息是很好的选择,2020-02-15 21:24:59.850681
,4,6,//www.qyer.com/u/5025663,4,2014-12-19,的铁站一出商城就是了，夜景美美的，就算在河对岸也能听到蹦极的尖叫声,2020-02-15 21:24:59.856696
,4,6,//www.qyer.com/u/5029657,4,2014-12-17,夜景很好，看了挑战蹦极的人，还看见了海底捞，就在街中央，兴奋了半天,2020-02-15 21:24:59.862236
,4,6,//www.qyer.com/u/5316417,4,2014-12-10,喝酒好地方~酒吧一条街~夜幕降临时，这里才开始，很多老外都喜欢在这里喝酒，酒吧风格很不错哦。,2020-02-15 21:24:59.866503
,4,6,//www.qyer.com/u/1862915,5,2014-12-09,白天和夜晚都各具风情！闲暇时来码头静静地坐一下，但是晚上没办法安静，呵呵!,2020-02-15 21:24:59.870305
,4,6,//www.qyer.com/u/1067460,4,2014-12-05,晚上还挺浪漫的，有娱乐设施,2020-02-15 21:24:59.873914
,4,6,//www.qyer.com/u/3417113,4,2014-12-03,双休日晚上简直不能太棒,2020-02-15 21:24:59.877322
,4,6,//www.qyer.com/u/4863771,5,2014-12-03,去的时候是白天，人很少，彩色的房子也很漂亮,2020-02-15 21:25:02.832140
,4,6,//www.qyer.com/u/5289634,5,2014-12-02,吹吹晚风，喝点小酒，吃吃东南亚美食，棒棒哒,2020-02-15 21:25:02.835504
,4,6,//www.qyer.com/u/1560190,3,2014-12-01,边上有很多吃饭的地方，有些座位就是设在船上，吃饭价格还好，选择很多，还可以看看两边五颜六色的街景。,2020-02-15 21:25:02.839039
,4,6,//www.qyer.com/u/1084314,5,2014-11-30,晚上很热闹，类似北京后海酒吧街。喝酒、吃饭都有了。新加坡河、两岸的灯火辉煌的大厦，想想也是醉了。,2020-02-15 21:25:02.842530
,4,6,//www.qyer.com/u/5272102,4,2014-11-30,克拉码头每晚20:00能在码头上看到对面金沙酒店的激光秀，在海边喝着酒吹着海风的感觉真的特别爽!,2020-02-15 21:25:02.845973
,4,6,//www.qyer.com/u/3804183,4,2014-11-28,跑去吃了海底捞…晚上好热闹，可是我不喜欢酒吧，匆匆掠过,2020-02-15 21:25:02.849421
,4,6,//www.qyer.com/u/5242849,5,2014-11-27,盛夏的夜晚，来到克拉码头溜溜，在桥边做做，点上一杯新加坡司令，特别惬意！喜欢这里的夜生活，不是很吵杂，但是很有情调~,2020-02-15 21:25:02.852807
,4,6,//www.qyer.com/u/4949020,3,2014-11-26,餐饮酒吧街～没啥特别的,2020-02-15 21:25:02.856197
,4,6,//www.qyer.com/u/764332,4,2014-11-21,现代建筑，旧码头，有些情怀。克拉码头 Clarke Quay,2020-02-15 21:25:02.859596
,4,6,//www.qyer.com/u/2874200,4,2014-11-20,刚出地铁站就开始狂风暴雨，码头不算大，有很多酒吧，很多歪果仁在这里过夜生活。还有……这边的性工作者是合法的……,2020-02-15 21:25:02.863118
,4,6,//www.qyer.com/u/5218507,4,2014-11-18,白天路过，可能没有晚上热闹吧。有几座有意思的桥,2020-02-15 21:25:04.935184
,4,6,//www.qyer.com/u/3040303,5,2014-11-18,晚上灯光很漂亮，人多热闹。 值得一逛。很多酒吧。购物吃东西都很方便。,2020-02-15 21:25:04.938500
,4,6,//www.qyer.com/u/5216389,5,2014-11-18,喜欢那里晚上临风临水喝一杯的氛围，夜景也赞，第一次去的时候独自一人坐在河边静静看河对岸的各家pub、bistro，宁静、喧嚣似乎出奇的和谐。,2020-02-15 21:25:04.942073
,4,6,//www.qyer.com/u/2571731,5,2014-11-16,五星并非因为那里的设施或美景 而是因为时间留下的不可复制的回忆,2020-02-15 21:25:04.945586
,4,6,//www.qyer.com/u/2124070,5,2014-11-15,酒吧餐厅一条街，有点像北京的后海，风景不错，把酒言欢，不醉不归,2020-02-15 21:25:04.949670
,4,6,//www.qyer.com/u/4406763,4,2014-11-14,如果要来克拉码头的话建议晚上的时候来，夜晚的克拉码头还是很美的，吃的也不错。,2020-02-15 21:25:04.953524
,4,6,//www.qyer.com/u/2769855,4,2014-11-12,这里晚上来夜色不错，有很多人卖艺，还有一些游玩项目。值得晚上去看看,2020-02-15 21:25:04.957372
,4,6,//www.qyer.com/u/3660880,4,2014-11-12,在旁边的jumbo吃的饭 晚上很多本地人在河两边休息聊天 风吹得很舒服  要看紧自己的钱包哈 因为人来人往 蹦极和能吸引眼球,2020-02-15 21:25:04.961359
,4,6,//www.qyer.com/u/4690255,4,2014-11-11,晚上吹吹风，喝喝就，打打望，甚是惬意,2020-02-15 21:25:04.965173
,4,6,//www.qyer.com/u/2519276,4,2014-11-07,晚上去看还是不错的，灯火阑珊，而且周边酒吧多餐馆多，可以感受一下当地的夜生活氛围。,2020-02-15 21:25:04.968976
,4,6,//www.qyer.com/u/3209518,5,2014-11-07,晚上去看夜景是不错的选择。坐在岸边或桥头，吹着晚风，喝着啤酒，看河上游船划过，对岸灯火阑珊，是不是很放松呢。,2020-02-15 21:25:08.899028
,4,6,//www.qyer.com/u/3321729,5,2014-11-01,非常推荐晚上去，热闹，风景也好,2020-02-15 21:25:08.902622
,4,6,//www.qyer.com/u/1510202,5,2014-10-31,人-真的是非常多了，不过我不是喜欢在酒吧逗留的人，只是在这繁华里走走罢了,2020-02-15 21:25:08.906314
,4,6,//www.qyer.com/u/3147764,5,2014-10-26,胆子大可以在旁边玩游戏，就是坐在球形绑椅里弹到半空... 超有气氛，在河对岸坐着看热闹的酒吧也是另一种感觉。,2020-02-15 21:25:08.909950
,4,6,//www.qyer.com/u/1826493,5,2014-10-25,这里气氛很好的说，到处都是充满了小资情调，我们是来这里的夜店嗨的，感觉就算没有去夜店，也可以来这里散散步，坐坐聊聊天什么的,2020-02-15 21:25:08.913584
,4,6,//www.qyer.com/u/1767118,4,2014-10-23,可惜没尝试边上的两个刺激项目,2020-02-15 21:25:08.917213
,4,6,//www.qyer.com/u/3740059,4,2014-10-23,傍晚时分去的，已经蛮多人了，感觉整个环境都很休闲，喝酒聊天看风景。,2020-02-15 21:25:08.920840
,4,6,//www.qyer.com/u/2975851,5,2014-10-22,晚上酒吧气氛超好，临河而坐与朋友喝酒聊天超有感觉！附近有家披萨店味道不错~,2020-02-15 21:25:08.924480
,4,6,//www.qyer.com/u/4680559,5,2014-10-19,螃蟹很好吃，有很多餐厅和酒吧。喜欢夜生活的人值得一去！,2020-02-15 21:25:08.928087
,4,6,//www.qyer.com/u/4410910,4,2014-10-15,Riverside沿路是新加坡比较高级的一排餐厅和酒吧，在这里可以尝到世界各地的美食，喜欢泡吧的可以去，晚上景色非常不错,2020-02-15 21:25:08.931438
,4,6,//www.qyer.com/u/1329844,4,2014-10-15,上个月去的新加坡，之前搜集了好多资料，知道这个地方是必去的。不过说实话，没有我们预计的有惊喜。也可能是我们只去了其中的一边。另外一边是酒吧，我们就没去。靠近商场的这边有好多人，吹着风感觉很好，也有好多情侣。灯光很昏暗，有点情调～可以去逛逛,2020-02-15 21:25:12.636101
,4,6,//www.qyer.com/u/1385466,4,2014-10-15,克拉克码头是古老新加坡的象征了，码头附近有很多老建筑，融合了西化风格，现在被开发保护的比较得当,2020-02-15 21:25:12.639490
,4,6,//www.qyer.com/u/4872448,4,2014-10-14,河边的酒吧氛围很好，反式蹦极还挺好玩的,2020-02-15 21:25:12.643009
,4,6,//www.qyer.com/u/4563442,4,2014-10-13,虽然他们的房子跟周围的高楼大厦不相符，但我觉得这样才有他们自己的特色，到处都是酒吧和餐馆，白天人很少，慢慢走可以慢慢看。,2020-02-15 21:25:12.646391
,4,6,//www.qyer.com/u/1857218,4,2014-10-11,夜游克拉码头是个不错的选择，可惜我们带着孩子，就没有进去酒吧,2020-02-15 21:25:12.649752
,4,6,//www.qyer.com/u/5065524,5,2014-10-10,克拉码头是新加坡最有名的观光地之一，以前是一个卸货的小码头，现在这里不仅有许多的餐馆酒吧，还有潮流的店铺，很独具一格！,2020-02-15 21:25:12.653303
,4,6,//www.qyer.com/u/3816810,4,2014-10-08,去的时候正好遇上F1，到处是各种宣传标语，周边有不少餐馆酒吧的，估计入夜会更热闹,2020-02-15 21:25:12.656690
,4,6,//www.qyer.com/u/2837398,5,2014-10-07,黄昏时到的，可以在河边、桥上拍照。码头边的餐厅生意都很好，环境也不错，还有吃火锅的！附近有天桥，可以连接到福康宁公园。,2020-02-15 21:25:12.660117
,4,6,//www.qyer.com/u/1208739,4,2014-10-06,没有去看夜景，白天去来往船只比较多。估计晚上去会比较好看，白天就还可以~珍宝就在哪里，可以去吃海鲜~,2020-02-15 21:25:12.663628
,4,6,//www.qyer.com/u/32282,5,2014-10-05,白天去，只有游船，晚上去比较好，非常热闹，很多年轻人拿着啤酒坐在桥的栏杆儿上边儿喝？,2020-02-15 21:25:12.667021
,4,6,//www.qyer.com/u/934386,4,2014-10-02,夜晚的确很赞 有个特别的酒吧大排长队 可惜不喝酒,2020-02-15 21:25:15.463201
,4,6,//www.qyer.com/u/3681452,3,2014-10-02,白天去的，没看到有多风光,2020-02-15 21:25:15.478242
,4,6,//www.qyer.com/u/4952478,5,2014-09-29,坐在船上！喝点酒！别有风味哦！,2020-02-15 21:25:15.490347
,4,6,//www.qyer.com/u/5019896,5,2014-09-27,夜景特别漂亮，珍宝很有名,2020-02-15 21:25:15.497647
,4,6,//www.qyer.com/u/1177855,4,2014-09-27,白天去的，很多店铺都还没开，晚上在河边小酌一杯应该很有意境,2020-02-15 21:25:15.503226
,4,6,//www.qyer.com/u/1448466,5,2014-09-26,夜景超棒的，码头有很多酒吧，在岸边的静吧坐下欣赏夜景十分享受,2020-02-15 21:25:15.508492
,4,6,//www.qyer.com/u/1200964,4,2014-09-25,夜晚才是克拉码头最活跃的时候。 太阳下去，可以乘船在新加坡河中间感受咸咸的海风，在喧闹的城市中找寻一份宁静。可以玩蹦极，放肆的尖叫，玩累了，不用费力气就能找到一个你喜欢的酒吧喝杯小酒。在克拉码头的妹子，可不是一般的美，各种气质和国家民族的哦。买东西还可以去central商场。 万圣节的时候，整条街都是扮怪的年轻人。,2020-02-15 21:25:15.512836
,4,6,//www.qyer.com/u/4994849,5,2014-09-24,晚上去非常漂亮！坐在河边吹吹风，聊聊天，很舒服！珍宝海鲜必吃啊，就在附近。,2020-02-15 21:25:15.516512
,4,6,//www.qyer.com/u/1934820,5,2014-09-24,夜生活的最佳选择，热闹非凡,2020-02-15 21:25:15.519987
