REVIEW_INDEX,WEBSITE_INDEX,POI_INDEX,REVIEWER_URL,REVIEW_RATING,REVIEW_DATE,REVIEW_BODY,REVIEW_CRAWLED_TIME
,4,19,//www.qyer.com/u/1469157,4,2013-07-17,裡面確實是富麗堂皇，不過我的愛人（新加坡人）她和我講裡面的佛牙不是真的，倒也沒關係，參觀一下然後拜拜就好，倒是Maxwell熟食中心就在佛牙寺對面，可以去吃天天海南雞飯，呵呵,2020-02-03 21:49:08.453304
,4,19,//www.qyer.com/u/1031619,4,2013-04-28,沿着马里安曼兴都庙门口的大街（South Bridge Road)往下一直走，不多远就看到新加坡佛牙寺龙华院~寺院跟国内的佛教寺庙不太一样，更像是古代的堡垒，层层耸立很有气势！,2020-02-03 21:49:08.456775
,4,19,//www.qyer.com/u/123409,4,2013-04-28,佛牙寺龙华院Buddha Tooth Relic Temple见证了新加坡多元种族和睦相处的一面。,2020-02-03 21:49:08.460130
,4,19,//www.qyer.com/u/1508800,4,2013-04-28,出了詹美回教堂，继续往马里安曼兴都庙的方向走（自己在转圈圈玩儿。。不过万幸的是离着都不算太远）十分钟，新加坡佛牙寺龙华院就映入眼帘了。比马里安曼兴都庙和詹美回教堂的规模都要大，更加宏伟，四五层的样子，有电梯。进门右侧有一筐大小不一、颜色不同的布，可以根据自己的着装来选择大块儿布或小块儿不来遮挡自己裸露的肌肤。我干脆选了最大的一款，围在腰间，当个大长裙……,2020-02-03 21:49:08.463537
,4,19,//www.qyer.com/u/1206597,3,2013-03-14,对宗教不太感冒的说，路过,2020-02-03 21:49:08.467183
,4,19,//www.qyer.com/u/1684027,5,2013-01-31,供奉着佛祖舍利，香火鼎盛，而且真的是金碧辉煌，庄严宏大,2020-02-03 21:49:10.269690
,4,19,//www.qyer.com/u/1186193,4,2012-07-05,女生记得穿长裙哦~~~~~,2020-02-03 21:49:10.284849
