POI_INDEX,REVIEW_ID,REVIEWER_NAME,REVIEW_RATING,REVIEW_DATE,REVIEW_BODY
C3-4,15642,我是热带鱼,5,2020-02-08,锦里的白天和夜晚是完全不同的两种景色，所以我们特地下午比较晚才去的，两种都可以看到！锦里很大，人特别多，一边走一边拍一边吃，非常不错！锦里离武侯祠不远，可以一并游览！
C3-4,15643,自驾走四方,5,2020-02-07,紧挨武侯祠，很有古成都味道了。
C3-4,15644,自驾走四方,5,2020-02-06,游客好多哟，从这里感受古成都味
C3-4,15645,规划师眼中的版图,4,2020-02-05,有很多小吃，茶馆里面还有变脸表演，走一路吃一路
C3-4,15646,爱睡觉的猪01,5,2020-02-05,金陵古街这儿还是非常值得去的地方啊，这边呢就是有很多的文物，而且说据说是汉朝开始就有这样的这个古街啊，还有它的香客文化，虽然现在商业化气息很浓啊，但是依稀还能够看到过去时候的一些样子。
C3-4,15647,来往天涯,3,2020-02-05,值得一去，很有特色，去过好几次了
C3-4,15648,大张无敌哥,5,2020-02-04,去年年前去的，非常漂亮的地方，人超级多，吃的业超级多，但景色太漂亮了， 尤其是晚上，一排排的灯笼，太靓丽了，逛古街，尝美食，这一趟锦里没有白来，以后有时间还去，哈哈，
C3-4,15649,黑白糖果树,3,2020-02-03,很有特色的一个地方，本地人相对较少，游客比较多…两旁的小店鳞次栉比…有很多好吃的个好玩的，没有去过的去一下也是推荐的……
C3-4,15650,偶滴个神来,5,2020-02-02,锦里古街挨着武侯祠，这里有各种可爱的玩意儿，小食、工艺品琳琅满目。 集结成都美食、民俗和文艺的地方，与大多城市的古镇古街差不多的经营模式
C3-4,15651,中吉仔,4,2020-02-02,值得一去，人潮拥挤，很是热闹。
C3-4,15652,danwangqi,5,2020-01-31,同样，人太多，景就被遮掩了许多，要想看好，早上早点去最好哦！
C3-4,15653,蓝海清风1号,0,2020-01-31,成都锦里古街打卡攻略 景点名：锦里古街 推荐理由： 古色古香的锦里街道在晚上亮灯时很美， 有着西蜀第一街之美誉。 玩法： 在这吃成都当地美食小吃， 看锦里灯笼夜景， 体验成都特色民俗文化， 逛旁边三国文化武侯祠。 交通：地铁3号线到高升桥站D口出
C3-4,15654,ustcapei,5,2020-01-30,商业化较严重 不过值得一来 不来可惜
C3-4,15655,池田町刘湛,5,2020-01-30,风景特别美！很有韵味，购物逛街美食等一体
C3-4,15656,爱梦媛,4,2020-01-29,锦里古街，成都必须打卡的网红地，每天游人如织。这里最好晚上来，非常漂亮，很有当地的特色，里面好多卖小吃的，可以吃到很多地道美食！
C3-4,15657,yanc****uf1,5,2020-01-28,来了这么多次成都，来了多这么多次锦里古街，这一次才是真正的理解到了锦里，成都的生活方式这句话。 无意间发现了这位老人，和其他的摊主不同，他不会主动的去迎合每一个消费者。而是专心的去制作他手中的这个工艺品，无论身边的人多么的多，或者多么的嘈杂，都没有打乱他的专注。或许他认为他的作品是最好的吸引者。 红色的灯笼是整个锦里古街的主打色，在河边你不仅可以看到红色的灯笼，还可以看到水中的灯笼。在酒吧一个人坐着，看着窗外的灯笼和来回的人群独享的安静。 这就是你不懂的成都慢生活了。
C3-4,15658,Susan2019,4,2020-01-28,古街的房子已经租出去做生意，各种各样的货品，有当地的特色的，可以逛一逛，但是已经没有了兴趣去探古街了。
C3-4,15659,westlifeweiwei,3,2020-01-27,到了成都，反正锦里和宽窄巷子是还是要去打卡一下的，虽然个人对于这种一点也不感冒。 2018年5月4日，游客还是非常的多的，白天去的，很是一般！个人觉得这种商业街还是晚上去的好，晚上各种各色的灯光，肯定养眼好看的！有一些店门口还有人穿着川剧的服装在招揽生意，这个到还是稍微的有跟其他城市比起来比如上海有些当地特色的咧！ 一圈一般的话大概一个小时足够了！
C3-4,15660,好人一生平安好好,5,2020-01-26,这里是年轻人去的地方，热闹拥挤，商业气息浓厚，老年人更喜欢自然风景名胜古迹。
