POI_INDEX,REVIEW_ID,REVIEWER_NAME,REVIEW_RATING,REVIEW_DATE,REVIEW_BODY
C3-5,15661,hihihihihihihi1,5,2020-04-18,不错 有历史感，很多典故，值得一去
C3-5,15662,青岛青年,5,2020-04-18,很久以前去的，虽然很喜欢诸葛亮，但是还是没有那种感觉。
C3-5,15663,停留不下的脚步,5,2020-04-15,非常不错哦，值得一去的地方，了解历史
C3-5,15664,赤怜,5,2020-04-14,还可以的 年龄大的还免费
C3-5,15665,M26****2031,5,2020-04-14,方便 性价比高
C3-5,15666,zhengyan,5,2020-04-13,真的是很值得去的地方，尤其是秋天的时候，黄的绿的红的 颜色对比特别美丽鲜艳。拍照一定买能出大片，不过美中不足的地方是人太多了😂😂😂。
C3-5,15667,AILee11,5,2020-04-12,很不错的一次出游体验，了解三国文化
C3-5,15668,無名钢管,5,2020-04-12,还不错。👍👍👍👍👍👍👍👍👍👍👍👍👍👍👍👍👍👍👍👍👍👍👍👍👍👍👍👍👍👍
C3-5,15669,行摄九州,5,2020-04-12,成都武侯祠，是一个古老的景点，这里表现了古代的发展和人文历史，这里有成都蜀国文化的继承，还有对巴蜀地区人们的记载，这里不仅有历史文化，还有许多著名的巴蜀小吃，成都小吃都是非常诱人的，价格不贵，到这里来也非常方便，这里的住宿在周边也是很多的。
C3-5,15670,sha****anna,5,2020-04-11,必须给满分，讲的特别好，内容具体，详略得当，语速也不错，讲述全面声音优美，性价比很高，特别的推荐这种模式的导游讲解，太赞了！！
C3-5,15671,爱睡觉的猪01,5,2020-04-11,这是纪念英雄的地方啊。嗯，武侯的这边的贡献确实真的是非常大，嗯，不光是这个啊，辅佐这个汉帝啊，而且就是他本身也是作为人们聪明智慧的一种象征吧，为后世众人所赞扬。
C3-5,15672,青岛大胡子斑马,0,2020-04-10,"来成都游玩的游客 景点有很多选择 周边也有特别多的地方可以游玩 有一个中国唯一的一座君臣合祀祠庙你知道么？ 那就是武侯祠[糖果] 也叫做汉昭烈墓（刘备的墓地） [糖果]推荐理由： 他也是一座国家级的博物馆 也是全国影响最大的三国遗迹博物馆 耳闻不如眼见 走，我们去看看 武侯祠现占地15万平方米 由[糖果]三国历史遗迹区（文物区） 这里是收费的50元/人 可以人工购买也可以自助售票 自助售票机不需要排队 很方便滴[糖果] 价格还算可以个人觉得值得进去瞧瞧 [糖果]西区（三国文化体验区）没过去 应该是不收费的 以及[糖果]锦里民俗区（锦里）这里是一条民俗街 有卖吃的有各种艺人 能分清楚哪个是公狮子么？踩着绣球的！ 路线 我推荐的路线是从文物区大门进入 沿着主路一路向北 首先是唐碑和明碑 然后是恐怖的出师表 有蜀国的文臣和武官 然后就是汉昭烈庙也就是刘备 再往前走就是武侯祠 在往前走就是三义庙 再左拐去盆景园 孔明苑 最后去惠陵从红廊出来 去锦里古街吃小吃[糖果] 三绝碑 一进大门就是一些碑文 东侧是三绝碑 西侧是一个明碑造型很独特 三绝碑是哪三绝呢？ 首先是诸葛亮的功绩 大家有目共睹 其次是柳公绰的书法是刚劲有力 第三则是唐代宰相的文章 是传世之作 文武阁 再往前走就到了文武阁 蜀国的重要人物都有塑像 刘备、关羽、张飞、诸葛亮都有自己的专殿 其他的重要文将武将都在文武廊内 东边是文管廊 西边是武将廊 首先映入眼帘的就是初中噩梦 出师表 今当远离，临表涕零，不知所言。 都是雕像没有拍照 文官以庞统凤雏为首 武官当然是赵子龙还有黄忠 经常打三国杀的我也有一些人物不了解 刘备殿 沿着主线一直走 过了二门就来到了 刘备殿（昭烈庙） 殿的正中就是刘备的贴金塑像 很高大足有3米之高[糖果] 刘备的仪容丰满庄重，耳大垂肩 胳膊据说也是特别长 左侧陪祀的是他的孙子北地王刘湛的雕像 刘备像侧原有其子蜀汉后主刘婵的雕像 因阿斗昏庸无能，不能守基业 所以在宋代就给撤除了 偏殿还有关羽和张飞的雕像 关羽殿里面还有他的儿子和周仓 张飞殿里面是子孙三代 年纪不大就战死沙场[糖果] 武侯祠 通过刘备殿后就来到了武侯祠 武侯祠是为了纪念三国时蜀汉丞相 武乡侯诸葛亮的祠堂 诸葛亮生前封“武乡侯”，死后谥号“忠武”， 故纪念他的祠堂称作“武侯祠”。 诸葛亮殿悬挂着“名垂宇宙”匾额 让人印象深刻 正殿中供奉着诸葛亮祖孙三代的塑像 殿内正中有诸葛亮头戴纶巾、 手执羽扇的贴金塑像 诸葛亮写给儿子诸葛瞻《诫子书》中 “非澹泊无以明志,非宁静无以致远” （不看轻世俗的名利就不能明确自己的志向， 不是身心宁静就不能实现远大的理想） 很适合我们这些年轻人[糖果] [图钉]实用tips： 门票和武侯祠通票50元 交通状况：公交：1、10、57、 82、301、334、335、123、521、901、904路"
C3-5,15673,M39****0843,4,2020-04-09,🍃成都-武侯祠-锦里🍃 第一次来成都，查了很多攻略，最后决定去武侯祠走一走，为了避开网上大家说的人流，为了拍到最美红色城墙，我不会告诉你我六点多就起床滴滴过去了，七点五十多分到达，发现其实没有几个人，学生记得带学生证半票即可。个人觉得还是很值的。八点准时入院。为了防止出现人多的情况我并没有按照导览一步步走，而是先找到了红城墙，发现还没有人，于是一个人很爽的静静的享受拍照了二十多分钟。（当然前提是你和我一样喜欢摄影），然后走进了盆景园也是非常漂亮，就这样静静的拍了一个小时照片，人流开始慢慢多了起来，而我也已经满足了。于是打开微信导览，从武侯祠正门开始，从头欣赏到尾，感受三国风貌。
C3-5,15674,qiao****699,5,2020-04-09,很不错，很漂亮
C3-5,15675,M34****1226,5,2020-04-09,第一来这，风景很不错，。。。。。
C3-5,15676,凭什么飞,4,2020-04-08,刘备的衣冠冢所在地哦 巴蜀文化
C3-5,15677,nyn216,5,2020-04-07,武侯祠修葺得很壮观，很华丽，比较高大上，主要是作为一种文化的象征而存在着，可以比较系统的了解杜甫。在这点上，杜甫草堂是没法比的。
C3-5,15678,M39****7204,5,2020-04-07,很不错的地方，可以去看看~~~
C3-5,15679,徐淦,5,2020-04-06,千载谁堪伯仲间，诸葛丞相一门忠烈啊
C3-5,15680,大老陈陈,5,2020-04-06,武候祠不是重点，重点是锦里，非常非常有成都的味道！
C3-5,15681,206****320,5,2020-04-05,非常好，让我感觉重新回到了学生时代，好好学习历史文化👍👍👍👍👍👍👍👍👍👍👍👍👍👍👍👍👍👍👍👍👍👍👍👍👍👍👍👍👍👍👍👍👍👍👍👍👍👍👍👍👍👍👍👍👍👍👍👍👍👍👍👍👍👍👍👍👍👍👍👍👍👍👍👍👍👍👍👍👍👍👍👍👍
C3-5,15682,320****356,5,2020-04-03,讲解员讲解详细。OK的很。
C3-5,15683,Q清婵,5,2020-04-02,好多人，当真是疫情稍微松一点了，不带口罩的人很多，看了还是很害怕。
C3-5,15684,110****191,4,2020-04-02,对喜欢三国文化的游客是不错的选择
C3-5,15685,爱睡觉的猪01,5,2020-04-02,武侯祠真的是一个非常棒的景点啊，这边看一看过去整个蜀汉三国时期刘备直下来发生过的很多故事，啊，这才知道很多文臣武将都干了一些很了不起的事情吧。
C3-5,15686,当地向导蔡子,0,2020-03-31,从武侯祠出来，漫步在成都最老的商业街，据说1800多年的历史了。从古老，到现代，喝杯茶，看生活在水边的益州城。坐等老杜的，映阶碧草自春色，隔叶黄鹂空好音。可惜了刘备的宏图大业，留在了这古柏祠堂！！！！ 锦里古街
C3-5,15687,M18****732,5,2020-03-31,生动有趣详细
C3-5,15688,国宝宝熊猫猫,5,2020-03-30,三国的精彩纷呈再一次展现出来，诸葛孔明的武侯祠记录了他一生的荣耀与心酸。刘备关羽张飞从桃园三结义到最后先后死去，三国也就渐渐没落了。
C3-5,15689,国宝宝熊猫猫,5,2020-03-30,三国的精彩纷呈再一次展现出来，诸葛孔明的武侯祠记录了他一生的荣耀与心酸。刘备关羽张飞从桃园三结义到最后先后死去，三国也就渐渐没落了。
C3-5,15690,花骨朵儿123,4,2020-03-30,天我有事弄哭
C3-5,15691,花骨朵儿123,4,2020-03-30,把家里考虑
C3-5,15692,囧囧有神5685,3,2020-03-28,武侯祠是纪念中国三国时期蜀汉丞相诸葛亮的祠堂，武侯祠因诸葛亮生前被封为武乡侯而得名。 公元二三四年八月，诸葛亮因积劳成疾，病卒于北伐前线的五丈原（今陕西省宝鸡市岐山县城南约20公里），时年五十四岁。诸葛亮为蜀汉丞相，生前曾被封为“武乡侯”，死后又被蜀汉后主刘禅追谥为“忠武侯”，因此历史上尊称其祠庙为“武侯祠”。全国最早的武侯祠在陕西省汉中的勉县（沔县），但最有影响的是成都武侯祠。据《三国志》的记载，刘备于公元223年病故白帝城之后，灵柩运回成都，下葬于此，史称惠陵。而按照汉制，有陵必有庙，所以在同时期，就有了汉昭烈庙诞生。大约在南北朝时期，成都武侯祠与惠陵、汉昭烈庙合并一处。
C3-5,15693,旅游是很开心滴,5,2020-03-26,成都有名的旅游景点之一，是中国唯一的一座君臣合饲祠庙。与锦里为邻。
C3-5,15694,窨子山人,4,2020-03-26,武侯祠是纪念诸葛亮的，无人不知无人不晓
C3-5,15695,索尼克azu,5,2020-03-24,充满历史气息的地方，感受到了浓浓的三国文化，景区设施齐全，学习到了很多新的知识，十分值得推荐。
C3-5,15696,mmmmaa1,5,2020-03-23,非常值得逛的地方，尤其每年过年的时候都得热闹非凡，更是有意思的好地方，到处可以耍一耍
C3-5,15697,288****757,5,2020-03-23,第一次来这个地方，感觉不错，很有意思很喜欢这的景色1
C3-5,15698,用户118,5,2020-03-22,夜市一个。去一次挺有意思。再去就没啥了。
C3-5,15699,小猕猴他姐,5,2020-03-22,武侯祠真的特别值得一去，尤其是喜欢三国故事的人，在武侯祠，你可以了解到传统的川派文化。重点是它外面的老妈蹄花，真的一绝，哈哈。只想着吃了。
C3-5,15700,潇洒1哥,5,2020-03-21,武侯祠里忆古将，文化氛围浓厚之地。
C3-5,15701,紫依慢游,4,2020-03-21,也属于成都对的必游景点。环境不错，还可以复习一下三国史。很喜欢的地方
C3-5,15702,亮亮,4,2020-03-20,反应三国时期的著名景点，来四川成都的打卡必选景点。这个景点的人文气息比较浓厚，需要静下心来慢慢感受它悠久的历史文化底蕴。
C3-5,15703,亮亮,4,2020-03-19,宁学桃源三结义，不学瓦岗一炉香。桃园三结义的三位兄弟，一直是被世人所传诵的。所以在武侯祠里也是三兄弟一起供奉的神相，永远在一起，不分开。
C3-5,15704,海阔天空lyflx,5,2020-03-19,锦官城外
C3-5,15705,78****919,4,2020-03-19,还是值得去看看的，有历史的沉淀，怀念诸葛亮和三国，还可以逛逛锦里
C3-5,15706,爱睡觉的猪01,5,2020-03-18,这儿确实是非常经典的景点了，在这边啊还是非常好好的一个地方各种各样的景色啊，嗯，瞻仰一下过去古人的这些风光吧，让人看上去觉得非常的带劲。
C3-5,15707,我想遇到你,3,2020-03-16,这种地方走下来就觉得非常的安静，能够让人静下心来看看这里的美景，除了很多寺庙之外还有很多古老的建筑，都可以了解一下当时的历史。
C3-5,15708,288****887,5,2020-03-16,武侯祠里的建筑以及文化底蕴都很好，蜀国历史。
C3-5,15709,亮亮,4,2020-03-14,武侯祠，明洪武二十四年（1391年），蜀献王朱椿对武侯祠和汉昭烈庙进行了一次全面的修缮和整合，废除原在汉昭烈庙西侧的武侯祠，把诸葛亮像移入汉昭烈庙内刘备像东侧，关羽、张飞像排列于西。
C3-5,15710,M33****3814,5,2020-03-14,感觉不错，还会再来
C3-5,15711,亮亮,4,2020-03-13,武侯祠是纪念中国三国时期蜀汉丞相诸葛亮的祠堂，因诸葛亮生前被封为武乡侯而得名。 公元二三四年八月，诸葛亮因积劳成疾，病卒于北伐前线的五丈原，时年五十四岁。
C3-5,15712,停留不下的脚步,5,2020-03-13,去成都可以去看看哦，非常有历史的感觉
C3-5,15713,亮亮,4,2020-03-12,久游巴子国，屡入武侯祠。 竹日斜虚寝，溪风满薄帷。 它是中国唯一的一座君臣合祀祠庙和最负盛名的诸葛亮、刘备及蜀汉英雄纪念地，也是全国影响最大的三国遗迹博物馆。
C3-5,15714,zxmytr,4,2020-03-12,成都市有名的景区，诸葛孔明的庙宇。
C3-5,15715,老黄1971,5,2020-03-11,成都经典打卡圣地，游文化名祠，品三国文化 推荐附近锦鲤美食街，张飞牛肉首选，好好吃 武侯祠（汉昭烈庙），全国重点文物保护单位，国家AAAA级旅游景区，国家一级博物馆。 武侯祠位于四川省成都市武侯区，肇始于公元223年修建刘备惠陵时，它是中国唯一的一座君臣合祀祠庙和最负盛名的诸葛亮、刘备及蜀汉英雄纪念地，也是全国影响最大的三国遗迹博物馆。1961年国务院公布为首批全国重点文物保护单位，2008年评选为首批国家一级博物馆。 成都武侯祠现占地15万平方米，由三国历史遗迹区（文物区）、西区（三国文化体验区）以及锦里民俗区（锦里）三部分组成，享有“三国圣地”的美誉。
C3-5,15716,138****3377,5,2020-03-11,导游还不错
C3-5,15717,M28****3697,5,2020-03-10,比较好，三国游！！！
C3-5,15718,张亚书,0,2020-03-10,武侯祠是成都的地标性打卡地，它是中国唯一的君臣合祀祠庙，由刘备、诸葛亮蜀汉君臣合祀祠宇以及惠陵组成，被誉为三国圣地。 祠堂正门处的匾额为“汉昭烈庙”，走入其中满眼尽是郁郁葱葱，一派幽深宁静之感。二门之后则是刘备殿，正中有高三米的刘备贴金塑像，左侧陪祀的是其孙北地王刘谌像。据说刘备像的旁边原有其子蜀汉后主刘禅像，但因其昏庸无能，在宋真宗时被地方官员撤除，后无再塑。 值得一提的是在正殿的西壁上挂有《出师表》木刻，据说为岳飞所书。此文一方面是诸葛亮以恳切委婉的言辞劝勉后主要广开言路、严明赏罚、亲贤远佞，以此兴复汉室，同时也表达了自己以身许国，忠贞不二的思想，为后人所称颂缅怀。
C3-5,15719,pingping321,5,2020-03-09,武侯祠里面人挺多的。建议来之前自己做一下三国文化的功课，或者跟一个导游，否则就看一下园林景观也没什么意思。 景区里面的周边店的纪念品都好看又实用，很有创意！ 旁边就是锦里了，人更多！
C3-5,15720,不如没有好,3,2020-03-09,喜欢历史的人都回来这里转一转看一看，其实里边做的景色还是挺好的，找一个导游给你讲解一下，当时的历史还是蛮长见识的，俗话说的好，读书万卷不如行走千里。
C3-5,15721,Mr_伊凡,5,2020-03-08,武侯祠（汉昭烈庙），全国重点文物保护单位，国家AAAA级旅游景区，国家一级博物馆。 武侯祠位于四川省成都市武侯区，肇始于公元223年修建刘备惠陵时，它是中国唯一的一座君臣合祀祠庙和最负盛名的诸葛亮、刘备及蜀汉英雄纪念地，也是全国影响最大的三国遗迹博物馆。1961年国务院公布为首批全国重点文物保护单位，2008年评选为首批国家一级博物馆。 成都武侯祠现占地15万平方米，由三国历史遗迹区（文物区）、西区（三国文化体验区）以及锦里民俗区（锦里）三部分组成，享有“三国圣地”的美誉。
C3-5,15722,105****802,5,2020-03-07,非常喜欢这个节目我去过那里感觉不错
C3-5,15723,Willxuchunhe,5,2020-03-06,不出去就可以领略想去的景点，而且有知识可以学，好！
C3-5,15724,趴在墙头,3,2020-03-06,最早的时候特别喜欢看三国演义，现在来说也特别喜欢，所以说来到这个地方之后，先去了武侯祠来参观一下，了解一下当时的历史环境！
C3-5,15725,M16****308,5,2020-03-05,四川成都武侯祠，一代名相诸葛孔明，三国故事美名传！成都中国旅游好去处！
C3-5,15726,xia****kai,5,2020-03-05,非常棒
C3-5,15727,小蜜蜂Rc,5,2020-03-05,悠久历史的体现，诸葛亮历史的重要意义。
C3-5,15728,M26****6551,5,2020-03-02,不错，性价比高
C3-5,15729,montagna,5,2020-03-01,有历史典故的名胜古迹，可以学知识。
C3-5,15730,晓寒居,5,2020-02-29,语音讲解真的太方便了，之前出游时，都是凭借自己以往的知识游览景点，有些景点和地方，因为不甚了解，难免走马观花，游完下来，有一些景点或者环节还是一知半解，团队导游有时候人多吵杂，有时候也听不清楚，如今这个线上景点讲解，不仅详细，还很清楚，听一个景点下来，能够完全清楚所游地方的人文背景，美景美食及历史沿革，真的很棒，很方便。
C3-5,15731,ncutzm,5,2020-02-29,武侯祠很大，过年去的，碰上变脸表演，很精彩！
C3-5,15732,自在GUAN,0,2020-02-26,【记录生活美一刻】 武侯祠 竹影弄红墙 色迷迷 远客戏幽篁 成都是三国蜀汉建都之地。 诸葛亮庙（也称武侯祠）位于城西北。这里柏树成荫，高大茂密，红墙绿竹，一派静谧肃穆的气氛。 与历史上青年时代的诸葛亮“躬耕于南阳”“三顾茅庐”的初出之地— “南阳武侯祠”不同，成都武侯祠是诸葛亮和刘备的归宿之处。 初建时二者的祠宇相邻，明朝初年合并，成为中国唯一的君臣合祀祠庙。 蜀相诸葛亮一生志业，六出祁山，五丈原头，秋风瑟瑟，鞠躬尽瘁，死而后已。 历代咏诸葛亮的诗篇中，当以杜甫的《蜀相》为绝唱。“出师未捷身先死，长使英雄泪满襟”当真是字字千钧之重…… 当年的荒庭古庙，而今变成游人拜谒、追思之余的休闲所在。同属武侯祠的“锦里”，与武侯祠毗邻，更是年轻人追捧的打卡地。 武侯祠的“红墙竹影”是成都名片式的存在。 早上开门第一批进入，几乎没什么游客，可以尽情地拍照，当阳光透过竹林映在红墙之上，那份美好让人陶醉得紧…… ：5.1-10.31日。08:00-20:00 11.1-4.30日。08:00-18:30
C3-5,15733,抹茶白桃乌龙,5,2020-02-26,疫情期间特殊的云旅游
C3-5,15734,锋泉风尚,3,2020-02-26,地方不大，就几个建筑，现场没什么好看的。门票价格偏高
C3-5,15735,M17****433,5,2020-02-25,武侯祠是纪念诸葛亮的，但里面也有刘备的墓，这是唯一一个君臣同在的地方，去武侯祠要请个导游，否则一会儿就游览完毕，却无甚收获。
C3-5,15736,Mr_伊凡,5,2020-02-20,成都武侯祠位置很好，人很多，也很热闹！一进去满满的三国风，对于桃园三结义本人还是蛮喜欢的，我觉得值得去看看！拜拜关老爷！
C3-5,15737,M22****4422,5,2020-02-17,武侯祠（成都武侯祠博物馆）位于四川省成都市武侯区，国家4A级旅游景区、国家一级博物馆、全国第一批重点文物保护单位[1]，是中国唯一的君臣合祀祠庙，最负盛名的诸葛亮、刘备及蜀汉英雄纪念地、三国遗迹博物馆，享有“三国圣地”之美誉。 博物馆占地37000平方米，建筑面积9200平方米。武侯祠于西晋末年建造，初与蜀国先主刘备的昭烈庙相邻。明初，武侯祠并入昭烈庙，故大门横额书“汉昭烈庙”。
C3-5,15738,行走的田小爬,5,2020-02-16,成都武侯祠是成都著名景点，不错的地方，旁边的锦里古街很有特色，都不错
C3-5,15739,大汉老公,1,2020-02-16,极度差劲，骗想买票的人
C3-5,15740,yyzsu,4,2020-02-16,很不错的景点，没想到里面还不小
C3-5,15741,马户行天下,5,2020-02-16,历史文化圣地，看古知今，意义重大！
C3-5,15742,weihan1103,5,2020-02-13,成都武侯祠历史悠久，很有教育意义，游客众多。
C3-5,15743,照莹映雪,5,2020-02-13,三国时期蜀国文化在此展现，想了解历史的发展值得去看看，坐地铁非常方便
C3-5,15744,sha****anna,4,2020-02-08,武侯祠，成都旅游必须打卡的地方，真是仿佛回到了蜀汉时期，特别的有历史文化意义。来这里的游客很多，整体氛围很庄严，突出了蜀地特色，非常推荐！
C3-5,15745,我是热带鱼,5,2020-02-08,唯一君臣同祠的祠堂，带娃去玩还是不错的！既可以让孩子学习三国的历史文化，又可以欣赏蜀中美景，还可以在文创店购买非常有特色的纪念品！
C3-5,15746,自驾走八方,5,2020-02-07,中国历史唯一的帝相同祠的古祠堂
C3-5,15747,杰依,3,2020-02-05,没有根据游览位置自动播放讲解。
C3-5,15748,_WeCh****18169,4,2020-02-03,整体感觉不错，最好有解说员，否则只能看风景及打卡了，不了解故事！
C3-5,15749,好久没遇见,5,2020-02-02,去过武侯祠对于景区里面人文根本没了解 只是觉得里面的绿植确实很不错 跟了团 听了小易的讲解收获了很多的知识 对于武侯祠是强力推荐 但是必须要有讲解哦 不然可能会觉得索然无味
C3-5,15750,M31****8441,5,2020-02-01,感受古人文化，值得去学习的地方。
C3-5,15751,呵呵爸爸,5,2020-01-31,抱歉没有记住导游讲解的名字，普通话很标准，戴眼镜很瘦的美女。终于来到名扬西蜀的武侯祠，注意这个不含门票门口电子50一人购买。作为刘家后人心中充满了敬意，一个个鲜活的历史人物活灵活现的浮现眼前，一段段传奇故事通过讲解再次温习，尽管已经大概了解了三国故事还是要和三国演义小说区别开来，呈现在眼前的也大概就是后人对他们最大的敬意。刘备的创业是如此的幸运充满传奇色彩，各武将悲壮凄惨的结局让人唏嘘。我们不会忘记历史，警醒后人，奋勇向前！感谢讲解员！红墙很美！
C3-5,15752,筱风姿,4,2020-01-31,成都必逛景点攻略｜武侯祠博物馆 ⛩景点简介：武侯祠不是单指武侯祠堂，他是由刘备、诸葛亮等蜀汉君臣合祀祠宇以及惠凌组成，肇始于公元223年，享有“三国圣地”的美誉。 景区划分：武侯祠西区（园林区）+武侯祠文物区+武侯祠锦里 其中也只有武侯祠文物区需要门票，其他地区都是免费参观的； 文物区包含哪些景点？ 三国文化陈列室、惠陵、三义庙、武侯祠、汉昭烈庙、文臣廊、武将廊、唐碑、明碑、二门 推荐线路：直接西门进入，沿着中轴线从大门一直走到三义庙，不用走回头路，然后出门直接就是锦里。 坐标：武侯区武侯祠大街231号 交通：推荐搭乘成都景区直通车，穿梭于各个景点之间，市区内的单程¥2.00 门票：¥50.00 ⏰游览时间：2-3小时 推荐理由：国家一级博物馆，环境优美、非常的清雅，而且这里是了解三国蜀都文化的好地方，走一走千百年前的大道。 ⚠️tips：注意开放时间，不要太晚过来；如果需要网上购票的请提早购买；景区有4个门，西门算是正门。
C3-5,15753,gbviking,5,2020-01-30,刘备和诸葛亮君臣同享一祠的地方，熟悉喜欢历史的人应该来看看。
C3-5,15754,_WeCh****57673,5,2020-01-29,成都必打卡地之一，旁边就是锦鲤著名小吃街，很方便 这里是中国历史上唯一一座君臣共祀的殿庙，其实刘备是皇帝，但是历史流传的故事更多是诸葛亮，所以人们很多以为这里只有诸葛亮，进门两边是有很长历史的参天大树，里边是一进一进的院子，里边有很多网红的打卡地，拍照也很好看，进门处，一杆写着汉字的大旗迎风招展，仿佛给我们带去了三国时候的战火纷飞，英雄气概
C3-5,15755,cdaisy,5,2020-01-28,买了携程的讲解，很不错，讲解员很年轻，可是讲解特别到位！9点到的，人不多，隔壁锦里先逛了一圈，可惜太早，店都没开。里面听讲解才知道很多知识，不然很快就逛完了。网红红墙那里很多人的，拍照得有耐心哦。
C3-5,15756,l77****311,5,2020-01-28,武侯祠可以和锦鲤景区一起游览。
C3-5,15757,grobb,5,2020-01-28,武侯祠蜀汉三国文化，感兴趣的可以去了解
C3-5,15758,320****363,5,2020-01-27,讲解详细，非常实用
C3-5,15759,蓝色布鲁克斯,5,2020-01-27,三国时代诸葛军师的祠堂，坐落于四川省成都市
C3-5,15760,wz****x,5,2020-01-26,蛮好的呀哈哈，很有文化底蕴。看着凝重的祠堂，感觉封建也好，无奈也罢的祠堂文化。给人有点压抑凄美的感觉。建筑很有内涵。希望有空大家可以去看看
