POI_INDEX,REVIEW_ID,REVIEWER_NAME,REVIEW_RATING,REVIEW_DATE,REVIEW_BODY
C3-6,15904,莞邑虎岭,5,2020-02-03,青城山（Mount Qingcheng），世界文化遗产青城山-都江堰的主体景区、全国重点文物保护单位、国家重点风景名胜区、国家AAAAA级旅游景区、全真龙门派圣地，十大洞天之一，中国四大道教名山之一，五大仙山之一，成都十景之一。
C3-6,15905,若隐29,3,2020-02-03,都说问道青城山，整体感觉还是不错的！
C3-6,15906,M28****5118,5,2020-02-02,很多人，很好看！青城山，空气好，锻炼身体健康快乐动起来吧！很好看！
C3-6,15907,行者,5,2020-01-31,道教文化还是可以好好看看的
C3-6,15908,我是携行者,5,2020-01-31,这里山色青青，绿林荫荫，负氧离子极为丰富，适于中老年爬山健身
C3-6,15909,M27****3035,3,2020-01-30,山很高，夏天去更好
C3-6,15910,Luckie,5,2020-01-29,非常好，赞一个
