REVIEW_INDEX,WEBSITE_INDEX,POI_INDEX,REVIEWER_NAME,REVIEW_RATING,REVIEW_DATE,REVIEW_TIME,REVIEW_BODY,ATTRIBUTES_CRAWLED_TIME
,2,177,馨馨宁宁,4.0,2019-03-20,Not Available,哈查花蒂玛清真寺位于甘榜格南的中心位置，建于十九世纪中期， 哈查花蒂玛是一位著名的新加坡女士，曾经住在清真寺所在的位置，她的遗嘱就是在这里建造了一座清真寺。,2020-02-16 17:30:42.488840
,2,177,M44****533,5.0,2019-08-02,Not Available,哈查花蒂玛清真寺偏向英式的设计，看起来颇有历史感，整体规模很小，宣礼塔都矮矮的，路过的话可以看看。,2020-02-16 17:30:42.493796
,2,177,杨坤,4.0,2018-11-21,Not Available,清真寺也是伊斯兰教的象征，礼拜堂，这里有很多市民在做礼拜，清真寺还是很古老的，能看出有很多东西都是很古老的，很喜欢这里。,2020-02-16 17:30:42.498961
,2,177,夏洛,3.0,2015-09-22,Not Available,"继续寻找我的哈查花蒂玛清真寺（Hajjah Fatimah Mossque），出地铁站就去问一个摆小摊的老人，当我手中的地址递到他面前时，他连忙说“我不识字，不识字，别问我“。真是尴尬！！我不得不读出清真寺的详细地址“4001 Beach Road”,他抬起胳膊，用流利的华语给我讲Beach路在那边的那边，晕！还好我看到不远处的警察署，一个值勤模样的人在那儿搬东西，急急忙忙拿着地址过去问，他居然不知道这个清真寺呢！但告诉我怎么去Beach路，还特意叮嘱我一定是车流量大的主路，并指明标志建筑。绕了几条街，问了一位中年女士，又问了一位中年先生（那先生长得不象本地人，象华人，皮肤蛮好），顺利找到目的地，可惜只可远观，不可入访！（因为我穿的短裤）",2020-02-16 17:30:42.503912
,2,177,_ceai****5795,4.0,2018-01-08,Not Available,木制结构，传统复古的建筑类型。,2020-02-16 17:30:42.508604
,2,177,M17****984,4.0,2015-11-17,Not Available,听说这里是个比较特别的景区，就来这里转了转，建筑风格属于十八世纪西欧建筑风格，很美很悠闲的一个地方,2020-02-16 17:30:42.512837
,2,177,wei****ucy,4.0,2016-09-28,Not Available,伊斯兰和欧洲建筑的混合体，与其他回教堂不同。有特色。,2020-02-16 17:30:42.516768
,2,177,IBABY99,4.0,2016-07-27,Not Available,这个清真寺是非常棒的，但是不懂伊斯兰教，所以经常从这里坐车能够看到，就远远的看着。,2020-02-16 17:30:42.520462
,2,177,yifulan,5.0,2016-10-31,Not Available,非常显眼，逛街的时候基本不会错过 总是听到清真寺念经的声音，很好听，但是听不懂,2020-02-16 17:30:42.523987
,2,177,豌豆豆,3.0,2015-11-26,Not Available,坐MRT到EW11 Lavender下车，免费参观，但请注意着装。回族，大家懂得。听说塔是有点倾斜，我一点都没看出来。,2020-02-16 17:30:42.527324
,2,177,鹄立头,4.0,2016-10-30,Not Available,这里值得看一看 不懂伊斯兰教，经常从这里坐车回看到。非常有特色，宗教氛围浓,2020-02-16 17:30:46.590039
,2,177,爱爱李,4.0,2016-01-20,Not Available,哈查花蒂玛清真寺不是很好玩，穿着短裤去的，不让进还，要求把裤子档上，还要拖鞋，真是太麻烦了，去的时候近的注意下。,2020-02-16 17:30:46.594918
,2,177,虎哥jkc,4.0,2017-11-25,Not Available,这清真寺建筑造型独特，也有一定的年载了。,2020-02-16 17:30:46.599856
,2,177,破坏死光,4.0,2016-09-09,Not Available,建筑风格属典型的欧式建筑，每到了做礼拜的时候，听着诵经声，仿佛得到了神灵的眷顾,2020-02-16 17:30:46.604703
,2,177,小二B日月,4.0,2016-07-25,Not Available,哈查花蒂玛清真寺游客并不多，宁静而舒服，在其他的清真寺中没看到这这样子的 不错哦,2020-02-16 17:30:46.609542
,2,177,达达和妮妮,5.0,2017-05-24,Not Available,这次寺庙在新加坡，属于当地的圣庙。,2020-02-16 17:30:46.614259
,2,177,虎哥jkc,3.0,2017-02-27,Not Available,这个清真寺有一定年载了，好看。,2020-02-16 17:30:46.618274
,2,177,吴豆豆wjp,4.0,2016-12-27,Not Available,还不错外观建筑很有特色很独特。,2020-02-16 17:30:46.622278
,2,177,_BAID****4831,4.0,2015-08-13,Not Available,这个寺庙很有意思，以一位马六甲妇女的名字命名。这座清真寺的外观设计以英式为主，并结合了不同的建筑风格，推荐。,2020-02-16 17:30:46.625866
,2,177,正入鞋途,4.0,2015-04-24,Not Available,不晓得，在哪里？我倒是听说有一种药材，叫这个名字，据说对女人，很好。,2020-02-16 17:30:46.629217
,2,177,星野弥生,4.0,2015-08-03,Not Available,哈查花蒂玛清真寺是用一位妇女的名字命名的，而且宣礼塔和比萨斜塔似的有角度，但是并没有那么倾斜。,2020-02-16 17:30:49.949407
,2,177,coldwar,4.0,2017-10-17,Not Available,哈查花蒂玛清真寺不是一座普通的清真寺，马来传统文化馆和哈芝巷都在附近的。非常传统古老的设计，彩色玻璃、木质窗户。在清真寺的院子里甚至有一个小的附属建筑，非常复古，就像一个门廊，而传统的是木质百叶窗。,2020-02-16 17:30:49.960314
,2,177,猫111,4.0,2015-07-31,Not Available,哈查花蒂玛清真寺附近有地铁站，交通方便，这是座回族教堂，规模不是很大。,2020-02-16 17:30:49.969385
,2,177,游在这方天地,5.0,2015-10-04,Not Available,哈査花蒂清真寺，是以一位马六甲妇女命名，英式的建筑，有很多和平鸽。,2020-02-16 17:30:49.975411
,2,177,cd****ei,4.0,2015-08-29,Not Available,哈查花蒂玛清真寺偏向英式的设计，门前有许多的白鸽，很适合拍照。,2020-02-16 17:30:49.985182
,2,177,牛牛jack,5.0,2015-09-11,Not Available,英式结构的清真寺，看起来颇有历史感，这里门口有不少和平鸽,2020-02-16 17:30:49.995800
,2,177,185****7075,5.0,2018-05-06,Not Available,好漂亮啊 哈哈 作为一个回民 特别喜欢,2020-02-16 17:30:50.000848
,2,177,M15****577,5.0,2018-06-20,Not Available,新加坡是多国文化的一个融合体，在这里也能见到漂亮的清真寺。,2020-02-16 17:30:50.004908
,2,177,吴豆豆wjp,5.0,2017-03-24,Not Available,很不错的一个地方从我很喜欢这里。,2020-02-16 17:30:50.008433
,2,177,tai****000,5.0,2016-10-16,Not Available,哈查花蒂玛清真寺建成至今已经有一百五十多年的历史了，整个建筑都透露着历史的沧桑，它的外观是典型的英式设计，这里最特别的要属宣礼塔，因为它离中心轴大约偏离了6度左右，很是引人注目。,2020-02-16 17:30:50.012933
,2,177,M21****856,4.0,2016-03-23,Not Available,哈芝巷旁边的清真寺，比较小，在马拉吧清真寺的旁边，那里清真寺还是比较多的，以伊斯兰教徒居住的多,2020-02-16 17:30:53.643506
,2,177,110****090,5.0,2016-06-08,Not Available,哈查花蒂玛清真寺是新加坡的一处很清静的清真寺，建筑主体很漂亮。看上去是一个很有历史的建筑物。,2020-02-16 17:30:53.648075
,2,177,东双河第一皮匠,4.0,2016-07-26,Not Available,哈查花蒂玛清真寺是历史悠久的清真寺， 又一次参观清真寺，一次非常难得的体验 还是觉得很新奇。,2020-02-16 17:30:53.652603
,2,177,杰森斯坦丶达,4.0,2016-08-24,Not Available,哈查花蒂玛清真寺每当周五这里聚集了信徒在这里，很热闹。拍照好去处。建筑也蛮美的。,2020-02-16 17:30:53.656881
