REVIEW_INDEX,WEBSITE_INDEX,POI_INDEX,REVIEWER_NAME,REVIEW_RATING,REVIEW_DATE,REVIEW_TIME,REVIEW_BODY,ATTRIBUTES_CRAWLED_TIME
,2,291,M32****5623,5.0,2019-05-10,Not Available,Fish@Big Splash是家不错的餐厅，很多人，高峰时期需要等位或者预约，餐厅环境不错的，菜品比较新鲜，特别是海鲜……,2020-02-16 18:24:20.963039
,2,291,tai****000,5.0,2016-10-18,Not Available,Fish@Big Splash是一个很有名的餐厅，它就在加东地区，餐厅的菜式都是色香味俱全，味道更是很不错，最重要的是价格并不是很贵，可以接受，如果到加东玩的话可以到这里就餐。,2020-02-16 18:24:20.969130
,2,291,M39****899,5.0,2016-08-13,Not Available,"这环境，高大上啊，这样的位置，吃的这么好，价位还不高,还等什么呢！",2020-02-16 18:24:20.975534
,2,291,飞屋环游007,5.0,2016-08-13,Not Available,路过的朋友一定要过来试吃一下，到现在还是满满的回忆啊....,2020-02-16 18:24:20.982226
,2,291,泉泉227676,4.0,2015-09-30,Not Available,在海边的一间中国式餐馆，里面的菜式都是中国的，味道正宗，对着大海非常漂亮，可惜价格一点都不便宜,2020-02-16 18:24:20.988918
,2,291,泉泉227676,3.0,2015-09-30,Not Available,这个餐厅确实挺不错的，在海边上景色非常漂亮，食品的种类也挺多的，味道有点接还中国的，价格有点小贵，不过能景色值回来,2020-02-16 18:24:20.995320
,2,291,tai****000,5.0,2016-10-18,Not Available,Playground @ Big Splash是新加坡一个很有名气的餐厅，这里的很多菜式都是属于中式的，菜式都是色香味俱全，味道也很不错，最重要的是这里面的价格并不贵，可以接受。,2020-02-16 18:24:21.001496
,2,291,千山任我行,4.0,2016-04-16,Not Available,再新加坡东部，面积不是非常大的水上乐园，设备保养和安全措施都相当到位。一个提供亲子活动的不错选择地点。,2020-02-16 18:24:21.007106
