REVIEW_INDEX,WEBSITE_INDEX,POI_INDEX,REVIEWER_NAME,REVIEW_RATING,REVIEW_DATE,REVIEW_TIME,REVIEW_BODY,ATTRIBUTES_CRAWLED_TIME
,2,296,Todemmy,5.0,2019-05-09,Not Available,真是是太有艺术气息的地方，非常适合来旅游玩耍，很不错的地方，很适合拍照，环境好，气候好，艺术氛围浓厚，很多创作灵感可以捕捉到～,2020-02-16 18:26:03.279461
,2,296,coldwar,4.0,2017-10-21,Not Available,这是一个有趣的集合，是东南亚艺术和西方艺术的混合体，收藏中包含了一些真正的古典艺术家，如伦勃朗、莫奈和杰克逊&#183;波洛克。西方绘画的不同时代的平衡表现是来自东南亚的民族雕塑，还有一个特别的专题画廊，关于埃及的工艺品和艺术。,2020-02-16 18:26:03.284540
,2,296,sunnycccc,5.0,2019-06-10,Not Available,这里交通虽然很繁忙但是也井然有序。,2020-02-16 18:26:03.289517
,2,296,qingqing11,5.0,2018-10-03,Not Available,環境比較貼近自然，美的傾城，空氣特別好，值得一去哦！,2020-02-16 18:26:03.294065
,2,296,sunnycccc,5.0,2018-05-20,Not Available,环境挺好的 在新加坡就是天气炎热了点,2020-02-16 18:26:03.298379
,2,296,M53****251,4.0,2018-04-28,Not Available,有一些细节的地方还是很喜欢的，而且去的时候人也刚好也不多。,2020-02-16 18:26:03.302610
