REVIEW_INDEX,WEBSITE_INDEX,POI_INDEX,REVIEWER_NAME,REVIEW_RATING,REVIEW_DATE,REVIEW_TIME,REVIEW_BODY,ATTRIBUTES_CRAWLED_TIME
,2,312,co****ean,5.0,2019-05-11,Not Available,Sri Senpaga Vinayagar Temple在当地非常有名，算是人气很旺的寺庙荬，无论有无宗教信仰，都不妨碍世界各地的游客来膜拜,2020-02-16 18:31:17.575571
,2,312,M44****533,5.0,2019-08-03,Not Available,圣帕加维那雅加兴都庙坐落于新加坡的加东，历史可以追溯至150年前，19世纪50年代，印度移民在池塘边发现了一座“维那雅加”神像，后来就在一棵圣帕加树下建造了一座简单的寺庙，因此而得名“圣帕加维那雅加”，为新加坡第二古老的印度寺庙。,2020-02-16 18:31:17.580347
,2,312,笃悠悠的鱼,5.0,2016-08-28,Not Available,位于加东的印度庙，隐匿在一片私人住宅区里，一般很少有游客会去，是当地印度人的信仰中心，印度庙的一大特色就是大门顶上的精功细雕，完全就是一件件完美的艺术珍品，让人叹为观止。,2020-02-16 18:31:17.585187
,2,312,tai****000,5.0,2016-10-17,Not Available,这个寺庙是新加坡加东地区的一个寺庙，它是一座典型的印度教寺庙，因为在一片私人住宅区的中间，因此不会被很多游客看到，周围也是很宁静的，不烦躁，很适合到此一游。,2020-02-16 18:31:17.589962
,2,312,cd****ei,4.0,2015-08-30,Not Available,"圣帕加维那雅加为新加坡第二古老的印度寺庙, 历史非常悠久，但是规模很小，壁画与雕塑精美程度一般。",2020-02-16 18:31:17.594667
,2,312,牛牛jack,5.0,2015-09-15,Not Available,这里的壁画雕刻很精美，有不少新加坡历史发展的痕迹，也颇具艺术观赏性,2020-02-16 18:31:17.599490
,2,312,coldwar,4.0,2017-10-20,Not Available,这座寺庙的历史始于一百五十多年前，在19世纪50年代，在池塘边发现了一尊维纳那格勋爵的雕像。四个主要的花岗岩柱子，每根柱子上有八个雕塑。碰巧在中午的时候，看到有印度教徒在各种神坛上献祭品，还伴随着鼓手和音乐。,2020-02-16 18:31:17.603791
,2,312,游在这方天地,5.0,2015-10-07,Not Available,是新加坡的一座古老的印度寺庙，地方不大，壁画和雕塑非常精美。,2020-02-16 18:31:17.607679
