REVIEW_INDEX,WEBSITE_INDEX,POI_INDEX,REVIEWER_URL,REVIEW_ID,REVIEW_DATE,REVIEW_RATING,REVIEW_TITLE,REVIEW_BODY,DATE_OF_EXPERIENCE,TRIP_TYPE,REVIEW_CRAWLED_TIME
,1,47,https://www.tripadvisor.com.sg/Profile/795gl,491491858,08-06-2017,4,Great hertiage info,If your into the hertiage of the culture and weddings then you will like. I was totally not interested in anything that has to do with weddings.,06-2017,Solo,2020-01-30 10:40:38.507476
,1,47,https://www.tripadvisor.com.sg/Profile/LiliumD1,479013440,26-04-2017,4,To learn about Peranakan culture,"This museum is situated in one of the monuments of Singapore. It used to be a school. In this museum, you will learn who are the Peranakans and how they used to live. I personally like their needlework and embroidery. Currently on exhibit is the ""Nyonya Needlework: Embroidery and Beadwork in the Peranakan World"". It is a wonderful exhibition displaying the art of nyonya needlework. Some artifacts includes the fusion of western influences. It is be very interesting to see and admire their delicate work. There are free guided tours. Do attend if you have the time.",04-2017,Solo,2020-01-30 10:40:38.870372
,1,47,https://www.tripadvisor.com.sg/Profile/Kat T,475532738,14-04-2017,5,museum out of a converted Chinese school building,"If you like heritage architecture conservation, then the building is interesting in itself. Apparently, it used to be a school, and the renovation (including sealing off for air-conditioning and modernising the lighting) looked pretty comfortable.

The museum pieces & curating were pretty good -- covered different facets of the life (marriage, funerals, ancestor worship, religion, food, needlework, furniture) but without being having too many pieces on display -- the lighting & spacing of the pieces were pretty good too, but the upper floor of the annex part of the needlework might have benefitted from a bit more lights.

Set aside at least 60 minutes for the exhibits, and maybe more if you want to snoop around the building.

Descriptions (personally didn't leave enough time to join the guided tour) were relatively detailed & nuanced. Could have been interesting to see information on how some of the nonyaware were made -- in particular how the colouring was achieved. If readers want to go deep about it, the Museum of Asian Civilisations down the quay had a ceramic exhibit showcasing mainland Chinese earthenware & stoneware pieces which did not have the raw materials to give the finished ceramic pieces, as here, the kind of glaze and background colours which 19th century and early 20th century nonyaware had. Notes about how these materials were produced (the industrial engineering behind it, so to speak) would have given yet another separate dimension to appreciate the spread of the artisanal & industrial techniques, the fashions & patterns, the clan/lineage networks between the mainland and SE Asia, etc.",04-2017,Solo,2020-01-30 10:40:39.231344
,1,47,https://www.tripadvisor.com.sg/Profile/Collin B,475452547,14-04-2017,5,Worth a visit,"This museum is in an old school, a very nice old building. There was an exhibition of Peranakan needle work, which was very interesting. This museum would be good if you are interested in social history, or in art / furniture. There is a very interesting reconstruction of a nyonya kitchen & dining room. Fair warning: part of the exhibition goes off on a tangent about local political notaries / families, not really interesting. Overall this was well worth a visit.",02-2017,Solo,2020-01-30 10:40:39.602060
,1,47,https://www.tripadvisor.com.sg/Profile/geographyguy_11,469295259,22-03-2017,5,Unexpected delight,"The Peranakan Museum is located a few streets away from the busy city centre but houses a rich collection of beautiful and fascinating artifacts that explain the unique culture of the Straits-born Chinese people of Singapore. The objects on show are quite exquisite, from beading to clothing to furniture. The ceremonies important to this culture are explained in detail and their unusual beliefs highlighted. I left having learnt a great deal about the customs and lifestyles of the Peranakans and was surprised how enjoyable I found looking at clothes and household items. Well worth making a trip to see this genuine look at ""local"" life.",03-2017,Solo,2020-01-30 10:40:39.965501
,1,47,https://www.tripadvisor.com.sg/Profile/Chris Q,469270152,22-03-2017,4,Very pleasant museum unique insights,"Throughly enjoyed the visit , clean modern and with a/c , lovely building with great pieces to view , nice shop to visit after too . Staff very helpful too .",03-2017,Solo,2020-01-30 10:40:40.315688
,1,47,https://www.tripadvisor.com.sg/Profile/Passportalwaysready,466253575,11-03-2017,5,Always a delight,"I have been to the Peranakan Museum several times over the years and appreciate the atmosphere, the spacious galleries and the fascinating stories shared there. This time I went for a temporary nonya beading exhibit which was well curated and very interesting and beautiful.",03-2017,Solo,2020-01-30 10:40:46.218387
,1,47,https://www.tripadvisor.com.sg/Profile/cadamsesq,464744251,05-03-2017,5,Great exhibit for a unique people,"This small museum chronicles the Peranakan peoples of Singapore ... a ""creole"" mixture of different asian cultures: Indian, Malaysian, Indonesian, and Chinese, all rolled up into one people. The exhibit here made it easy and interesting to understand the lives of these people who successfully blended diverse cultures into one interesting mix.",03-2017,Solo,2020-01-30 10:40:46.543874
,1,47,https://www.tripadvisor.com.sg/Profile/L1336FHpeterk,461594907,21-02-2017,3,Learn more about Singapore Culture and People,"On your next trip to Singapore you should make some time to visit this Museum wich is kind of the beaten track. It will take you abut 2 to 2.5 hours and there is a gudied tour available. Check out the Webside about the opening hours and time for the guided tours.
If you go there at 10.00am you can take a guided tour at 11.00am and you will be ready for a delicious lunch in the next dore restaurant which serves authentic Peranankan Food. The True Blue, see my seperate revue.",01-2017,Solo,2020-01-30 10:40:46.890662
,1,47,https://www.tripadvisor.com.sg/Profile/673heidis,459449034,14-02-2017,5,Beautifully presented introduction to Peranakan culture,"This museum was well worth the visit. It flows really nicely with a good intro video on ground floor setting the stage for the displays in the galleries above. The special exhibit that I saw on embroidery and beadwork was truly amazing. Visiting this museum really deepened my understanding of Singapore's culture - past, present and future.",02-2017,Solo,2020-01-30 10:40:47.200937
,1,47,https://www.tripadvisor.com.sg/Profile/TheEverydayTourist,458820954,12-02-2017,5,Beautifully staged primer on Peranakan culture.,"The museum contains three levels that give you an in depth look at what life was like for the Peranakans in Singapore.

The first level is the story of their origins - how they ended up in Singapore from different parts of China and India. It also gives you a broad view of what life was like for them - the kinds of elaborate wedding gifts that they received, their jewellery, their intricately beaded slippers. Another highlight is the giant portraits of faces of different Peranakans and their quotes on what it means for them to identify with their ethnicity.

The second level is devoted to their wedding ceremony - including the kinds of costumes that they wear during this 12-day celebration, their wedding crowns and jewelry, information on their peculiar superstitions (apparently a boy had to roll around in their bed before the couple's wedding night to ensure that they will get a son), their elaborately carved wedding bed and more.

The third level is about their daily life, religion, and mourning practices where you'll see a typical Peranakan kitchen, the gods that they worshipped (a unique mixture of Chinese and Indian gods and ancestor worship) on their beautifully carved altars, and an example of a coffin bed and what they wore during the entire mourning process (including a sack cloth at the end of the mourning period).

There are so many beautiful things inside this museum - hopefully, you'll learn to appreciate their gaudy, elaborate, extravagantly colourful aesthetic sensibility which comes out in their many multi-coloured and multi-carved jewelry, spittoons, furniture and other beautiful pieces.",02-2017,Solo,2020-01-30 10:40:47.567021
,1,47,https://www.tripadvisor.com.sg/Profile/Parvin S,456054421,31-01-2017,5,History and amazing arts of Peranakan,"Great collection of beautiful arts, history, and life. Very nice Interior design. Some fabulous items collected demonstrated the life style and handicrafts of Peranakan. Do not miss visit the gift shop at the main level out side of the museum.",08-2016,Solo,2020-01-30 10:40:47.940288
,1,47,https://www.tripadvisor.com.sg/Profile/ET3121,453877775,22-01-2017,5,excellent attraction,"I went in not knowing what perankan meant and now after visiting I have a new appreciation of this great culture. the sister museum of the asian civilisation museum, this attraction is extremely interesting",01-2017,Solo,2020-01-30 10:40:48.244723
,1,47,https://www.tripadvisor.com.sg/Profile/Micannjon,447641726,30-12-2016,5,Excellent,"What a lovely museum, a tasteful, respectful and interesting study of the Peranakans. Beautiful displays of embroidery, woodwork and clothing. Definitely worth a visit !",12-2016,Solo,2020-01-30 10:40:48.654318
,1,47,https://www.tripadvisor.com.sg/Profile/SharonM135,443633545,12-12-2016,5,Well done presentations explain Peranakan cultures,Great explanation of mixed race cultures in Singapore and how they have melded traditions. Loved the glass beadwork handicrafts!,12-2016,Solo,2020-01-30 10:40:49.000635
,1,47,https://www.tripadvisor.com.sg/Profile/allyjwatson,436075556,10-11-2016,5,Charming and rich,"This is simply a charming museum! Housed in a delightful building over three floors, the s slightly tucked away the Peranakan Museum showcases the culture of the Peranakan communities. The wedding collection is particularly of interest. The needlework exhibition demonstrates a colour part of the Peranakan culture. Easy to see why this museum rates so highly by fellow travellers!",10-2016,Solo,2020-01-30 10:40:49.342927
,1,47,https://www.tripadvisor.com.sg/Profile/Erica C,432594544,29-10-2016,3,Interesting place to know more about Malaysian Chinese,"I was introduced by Tourisum centre at Chinatown. I walked from Chinatown Backpacker. According to Google map, it was not far away around 20 mins. At last I used 35 mins, may be walking slow. The museum is free if charge. 3 storeys high elegance building. I like this type if building much. Exhibition room were great, full of collection, handmade sewing, household wares. If you are interested to know more about the life of Malaysian Chinese, you should come. They have a lot of things for you to see and touch.",10-2016,Solo,2020-01-30 10:40:55.217818
,1,47,https://www.tripadvisor.com.sg/Profile/tot2trish,432212217,27-10-2016,4,Informative insight into indigenous culture,"Peranakans are native-born people of mixed local and foreign ancestry. Peranakan culture is described as a blend of two cultures where the people are ethnic Chinese but culture and language are predominantly Malay-influenced. The Peranakan Museum is worthwhile to visit, if one wishes to learn about the local people who make up a good proportion of Singapore. There were interactive exhibits when I was there which involved locating a dozen different symbols (such as dragon, phoenix, floral designs, etc.) matched to exhibits, then embossing the symbol on a color wheel on paper provided by the museum docents. It was fun as well as educational. Learning about famous Peranakans and seeing some of their handiwork was interesting. The museum is three stories, but there's an elevator (or lift) available for those with mobility issues or young children in strollers.",04-2016,Solo,2020-01-30 10:40:55.517005
,1,47,https://www.tripadvisor.com.sg/Profile/Anna R,429893856,20-10-2016,4,Great insight into Peranakan culture,"The Peranakan Museum is a must for tourists who want to learn more about the history and culture of Singapore.
To make the most of the museum, make sure you take a free guided tour (available at least twice a day at 11 am and 2 pm, and some days also at 12.30). The tours are run by volunteers of Peranakan background and take about 1 hour.
Our guide was excellent: knowledgeable, entertaining and a great story teller. Also, take a look at the tiny gift shop near the entrance, selling genuine Peranakan crafts and souvenirs: the shop it is so small I nearly missed it...
And if you are interested in crafts, the incredibly intricate Peranakan beadwork has to be seen to be believed.",09-2016,Solo,2020-01-30 10:40:55.829232
,1,47,https://www.tripadvisor.com.sg/Profile/EaglevisionLowe,421983190,25-09-2016,5,Visit with fellow Rotarians,Excellent museum collection of Straits Chinese artifacts showcasing the history and living culture of these early residents of Singapore and Malaysia.,10-2015,Solo,2020-01-30 10:40:56.184230
,1,47,https://www.tripadvisor.com.sg/Profile/smiley98,414758984,05-09-2016,5,A little gem in Singapore,This museum is a little gem. I took part in a small guided tour which was very interesting and informative. There are several interactive areas and would be interesting to children too The exhibits are carefully displayed and it is interesting to follow that period of history. A great couples of hours spent in the Museum Highly recommended,09-2016,Solo,2020-01-30 10:40:56.516409
,1,47,https://www.tripadvisor.com.sg/Profile/Agus S,414176971,03-09-2016,3,"Ambitious, but Misses the Mark","The museum made a valiant attempt to define ""peranakan"" in a broad, general, and almost literal term; however, the message seems to shift as you make your way through the galleries. In the end, I find the original message and definition that were offered when you enter the museum have been undermined completely.

I understand the desire to expand the definition of peranakan to include the different ethnic groups and to present a harmonious and wholesome view of the heritage of Singapore that reflects the cultural make up of today's Singapore. I suppose that is the purpose of the series of large photographs of peranakan Singaporeans of different ages, most of them credited with a pretentious and/or ambiguous statement about what it means to be peranakan. It was almost a breath of fresh air when I came to the photograph of a man credited with saying he does not ""feel"" peranakan; he just feels--or something to that effect.

Beyond the first galleries, the exhibits limited their focus completely to the Chinese peranakan, specifically the Hokkien (Fujian) peranakan--probably the predominant peranakan group in Singapore. While it was interesting to see objects in the exhibit--wedding and funerary objects, clothing, dinner ware--I kept thinking about the central theme presented in the first gallery: What is a peranakan? I do not think those objects are what make one a Hokkien peranakan, let alone a general peranakan.

Ultimately for me, the lack of exploration of the ""why's"" --to use a simple example: Why did a young Fujianese woman suddenly decide that it was a good idea to wear sarong and kebaya?--makes the experience feel utterly incomplete and superficial.",08-2016,Solo,2020-01-30 10:40:56.851369
,1,47,https://www.tripadvisor.com.sg/Profile/Helen M,414088481,03-09-2016,5,Wonderful display of Singapore's history,I was lucky enough to catch the Nyonya Needlework exhibition and it was amazing. This intimate museum shows the colourful daily lives of the Peranakan culture.,07-2016,Solo,2020-01-30 10:40:57.237676
,1,47,https://www.tripadvisor.com.sg/Profile/Coral M,412161678,29-08-2016,5,A Look into Singapore's Interesting Heritage,"We were fortunate to arrive just before 2 pm and joined a tour led by Joan. What a wonderful guide, a forth generation Peranakan who led us through how the original local women formed partnerships with sailors and traders from mainly China and India forming the unique culture called Pernanakan. Over three floors of interesting exhibits. A wonderful experience.",08-2016,Solo,2020-01-30 10:40:57.578822
,1,47,https://www.tripadvisor.com.sg/Profile/Pippilotta111,405557856,15-08-2016,5,Beautiful museum,"The museum is housed in a beautiful building inside as well as outside. There was an exhibition of the embroideries of the Peranakan women and I have never seen anything like it. These women were real artists and they paint with beads and silk. The colour combinations are extraordinay and their expertise is amazing. All aspects of their life are represented in the museum like religion, marriage, cooking and furniture. These women had a style of their own and were educated as well and they loved beautiful objects. There is also a good shop next to the museum with lovely books.",08-2016,Solo,2020-01-30 10:40:57.880824
,1,47,https://www.tripadvisor.com.sg/Profile/SimoneSMC,399880899,01-08-2016,4,Fascinating museum,"A small cute museum tucked in a small lane called Armenian Street near the Hill Street fire station. I'll recommend that you visit if you're in town for a few days and want to know about the history of the Straits Chinese in the south east Asian region. Prior to the British colony days, Singapore was already an important port of call for international traders including the Chinese. The intermarriage between the indigenous peoples with the Chinese and even Indians (perhaps less represented in SG mainstream media) produced the Straits Chinese and peranakans.

I stayed two hours here in all. The artifacts are not as many as I'd thought would be collected so I'm somewhat disappointed. I think the important facet of peranakan food could have been better displayed and presented. The display for the prominent peranakan VIPs was also awkwardly done up, with information panels all over the place and lacking in pictures. I had to crane my neck to read. If space is a premium the curators could use multi media to tell us a more coherent story.

Nevertheless if you're just looking to while away a hot afternoon and you've visited the bigger museums, this one could still be intriguing.",07-2016,Solo,2020-01-30 10:40:58.192782
,1,47,https://www.tripadvisor.com.sg/Profile/JulieLimSY,395756745,23-07-2016,4,Good,"It was a well spent one and a half hours for me. Really interesting exhibits on the life and culture of the Peranakans. Free admission for Singaporeans and PRs.

I particularly liked the exhibits on Peranakan weddings, and also the barrister wigs of both Mr and Mrs Lee Kuan Yew that were on display.

I paid $4 for entry to the special exhibition on Peranakan beadwork which was so worth it as that took up about one third of the exhibition in the whole museum.

A must see for tourists and Singaporeans.",07-2016,Solo,2020-01-30 10:41:04.109214
,1,47,https://www.tripadvisor.com.sg/Profile/Patti B,391985763,13-07-2016,5,Beautiful and well presented,"This museum is small and well laid out. The pieces on display are stunning, the handwork involved must be seen to do it justice. You can spend hours in the place or quickly go through, but for folks who appreciate handmade articles of clothing, shoes, purses, bed spreads and beading, it may well take hours.

The little shoppe which sells souvenirs is expensive. Enjoy.",07-2016,Solo,2020-01-30 10:41:04.520478
,1,47,https://www.tripadvisor.com.sg/Profile/HokieGirl1999,387713214,30-06-2016,2,Too crowded,I really wanted to see this museum but it was packed with tour groups. There was absolutely no way to see any of the exhibits and the mouse of the children was distracting. Left after about 15 minutes. Very disappointing,06-2016,Solo,2020-01-30 10:41:04.827400
,1,47,https://www.tripadvisor.com.sg/Profile/Bearie241,386818788,28-06-2016,4,Good place to learn about Baba Culture,This is a place that is fully packed with the objects showing the unique Peranakan culture in Singapore. Worth a half day visit.,06-2016,Solo,2020-01-30 10:41:05.128389
,1,47,https://www.tripadvisor.com.sg/Profile/cazza13_13,385750901,25-06-2016,5,interesting step into history,I thought this would be a quick trip through this museum - boy was I wrong! I found the exhibits fascinating and a real insight into the Peranakan people. Well worth the time spent there and I will be going back to see what I missed the first time,03-2016,Solo,2020-01-30 10:41:05.501751
,1,47,https://www.tripadvisor.com.sg/Profile/moniker11,381381046,10-06-2016,3,Interesting information - uninteresting set up,"This museum is laid out in a very old-fashioned way and doesn't have much in the way of interactive displays or variations in presentations. Nevertheless, the topic is fascinating if you have an interest in history and ethno-history.",06-2016,Solo,2020-01-30 10:41:05.838252
,1,47,https://www.tripadvisor.com.sg/Profile/Rick M,375633159,23-05-2016,5,Few hours of SG history,"Wandered in not knowing what to expect. A very reasonably priced attraction. Took the English guided tour which was fun, and even if I missed something i was able to continue to wander around and fill in the gaps. Great way to get a chronological and cultural perspective of Singapore history. Really helped understand Singapore. I was alone so it was a perfect way to spend some time and take in what interested me, at my own pace.",05-2016,Solo,2020-01-30 10:41:06.137132
,1,47,https://www.tripadvisor.com.sg/Profile/BlueCupboard,371397829,09-05-2016,4,Interesting Visit,I have a particular interest in Peranakan culture and history so loved visiting this museum and viewing the lovely ceramics and fabrics traditionally associated with the Peranakan people. I really wish I'd gone for a guided tour though as although there are notes by the exhibits I think I would have gained more from a guide explaining the background to some of the pieces. I'll just have to go back again!,12-2015,Solo,2020-01-30 10:41:06.480772
,1,47,https://www.tripadvisor.com.sg/Profile/Bening M,367732365,26-04-2016,4,I enjoy the experience,"I visit this museum just out of curiosity. Luckily, the timing was just nice because there was a free tour with the guide. The guide showed us the prominent collection and gave a very clear explanation about the Peranakan culture. The food, the marriage, the religion, including the death.

This museum did not have huge amount of collection, it will not take soooo muuuuch time to explore and learn things in this museum.",04-2016,Solo,2020-01-30 10:41:06.865690
,1,47,https://www.tripadvisor.com.sg/Profile/NinaAsia,365295490,19-04-2016,3,If you are genuinely interested in Peranakan culture,"Since the last time I visited the museum, I noticed that they had made some changes.

For me, the biggest attraction about this place is the Nonya handicraft but very often, I find that the lighting is too dim for visitors to appreciate the fine beadwork.

In addition, some exhibits were not in working order. So that was kind of disappointing for those who wished to listen to a typical conversation by a Nonya.

I wish they had more about the music and dance the Peranakans enjoyed.",04-2016,Solo,2020-01-30 10:41:07.207291
,1,47,https://www.tripadvisor.com.sg/Profile/sueheim,364456790,16-04-2016,5,An interesting collection of Peranakan history,"Loved how this museum brought you through the life of a Perankan, through various life stages -- including wedding, death, both rich and poor. I also liked how there was a gallery devoted to famous Peranakans -- so many females made their mark! The guard in the kitchen area spent time explaining to me -- an American -- how this kitchen was what his home looked like when he was growing up. He was proud to take the time pointing out items of interest, explaining how this was the woman's domain (men daren't enter!). I'm not certain how many Americans enter this museum, and many others wandering the gallerys often didn't speak much English, but the Peranakans who were there were proud of their heritage and didn't mind doing a bit of bragging. Definitely recommend stopping in and spending a few hours. Do not miss the gift shop. The china and beadwork alone is fascinating -- worth taking a few tokens home as momentos of a interesting culture.",03-2016,Solo,2020-01-30 10:41:13.059518
,1,47,https://www.tripadvisor.com.sg/Profile/suzan2014,363594929,12-04-2016,5,Fascinating history of Chinese migration to Singapore,"This museum is not too large so you can see most of it before getting tired. History of Chinese community development in Singapore is quite interesting even if you think you already know a lot about the subject. Easy to access, reasonable ticket fee.",03-2016,Solo,2020-01-30 10:41:13.386605
,1,47,https://www.tripadvisor.com.sg/Profile/DaxeS,358771207,26-03-2016,5,Take the guided tour!,"If you are interested in the Peranakan history and culture then this is the place for you to visit. It's an outstanding hotel museum, which covers this people group very well. I was so pleased with the guided tour I took as we were guided through all aspects of the Peranakan's history and traditions. The tour is free of charge.",03-2016,Solo,2020-01-30 10:41:13.784880
,1,47,https://www.tripadvisor.com.sg/Profile/Vina_tsztsz,352984655,05-03-2016,5,Great museum,"Is a great museum . Their collections are beautiful . I learned many culture and custom of ""Perankans "" . I recommend you spend 2hours if you love to know the culture. Otherwise 1 hour is enough .",03-2016,Solo,2020-01-30 10:41:14.156035
