REVIEW_INDEX,WEBSITE_INDEX,POI_INDEX,REVIEWER_URL,REVIEW_ID,REVIEW_DATE,REVIEW_RATING,REVIEW_TITLE,REVIEW_BODY,DATE_OF_EXPERIENCE,TRIP_TYPE,REVIEW_CRAWLED_TIME
,1,47,https://www.tripadvisor.com.sg/Profile/ChristopherE159,495388886,23-06-2017,5,Brilliant!,As an introduction to the various different cultures which make up Singaporean society this museum is absolutely fabulous. We took a guided tour which was very interesting indeed and explained the evolution of the Peranakan culture very well indeed.,05-2017,Couples,2020-01-30 10:38:49.553833
,1,47,https://www.tripadvisor.com.sg/Profile/Rachael W,492774721,13-06-2017,5,Make sure to visit this gem!,Who are the people from this part of the world? That is the question that this museum will answer for you. We stumbled into this destination to escape the heat but we were very impressed by the dynamic and effective methods used to introduce visitors to the culture. A must-visit for anyone wanting to truly appreciate Singapore in all her uniqueness.,06-2017,Couples,2020-01-30 10:38:49.942760
,1,47,https://www.tripadvisor.com.sg/Profile/DeQuan,486009577,21-05-2017,5,Fun and exciting museum,This museum is amazing. It teaches so many things i didn't know about Peranakan. Fun side about this museum is there will be guided tour. Me and my partner enjoy going there once in a while as there are new exhibition every time. Good choice to go there!,10-2016,Couples,2020-01-30 10:38:50.256741
,1,47,https://www.tripadvisor.com.sg/Profile/nickd18,485468954,19-05-2017,5,Teach us,"museums are there, in part at least, to teach us something; to show us what has happened, to let us learn. The Peranakan Museum does that. It is a very impressive collection of materials, photos, artifacts, and memories of the ""mixed"" cultures of Singapore. We had a guide to ourselves for over an hour (thank you Julie) and then we spent another 3 hours going through the three floors of exhibits. We didn't know anything about the Peranakan culture but we learned some on our visit.",03-2017,Couples,2020-01-30 10:38:50.625809
,1,47,https://www.tripadvisor.com.sg/Profile/BillTaylor2014,481107965,03-05-2017,5,An interesting visit,A well set out museum giving a real insight into Asian culture. Some of the displays were breath taking.,04-2017,Couples,2020-01-30 10:38:50.948727
,1,47,https://www.tripadvisor.com.sg/Profile/murali8121,477353325,20-04-2017,4,Peranakan museum Singapore,Took a guided tour at 11:00 which gave us a very good insight to the history of singapore with regard to the life here before and after the world war. The life of a Nyonya- the girl in the family- is showcased in detail. The embroidery and bead work is also worth looking at. There is an entry charge with a discount for senior citizen but guided tour is free and part of voluntary service. Look to spend around two hours,04-2017,Couples,2020-01-30 10:38:51.338624
,1,47,https://www.tripadvisor.com.sg/Profile/viviennedBangalore,476738645,18-04-2017,4,A special place. A must see .,"A delightful museum that gives visitors an insight into a fast disappearing way of life. Child friendly and entertaining. Although brochures are available, I suggest you join a conducted tour for the best experience. Plan to spend a leisurely hour followed by a walk in the spice garden nearby.",03-2017,Couples,2020-01-30 10:38:51.662401
,1,47,https://www.tripadvisor.com.sg/Profile/Maplehawk,475400717,14-04-2017,4,A unique piece of local history,"We very much enjoyed learning about the local community as reflected in the blended cultures of the various local and immigrant communities.

This small museum is well organized and narrated. The building itself is a bonus piece of history. A very easy walk from the National Museum.",03-2017,Couples,2020-01-30 10:38:52.007100
,1,47,https://www.tripadvisor.com.sg/Profile/556bharris,470998542,29-03-2017,5,Tremendous museum.,"It is easy to spend a couple of hours in this fine old building with its interesting displays about the Straits Chinese and their interactions with Malay and Indian peoples and the hybrid cultures that developed as a result. Pick up the free Jubilee walk booklet and check out the other interesting sites on the walk. Also, pop into the nearby National Heritage Board and pick up their amazing free booklets on Little India, Kampong Glam, and a number of other parts of singapore.",03-2017,Couples,2020-01-30 10:38:57.861953
,1,47,https://www.tripadvisor.com.sg/Profile/flapflap,470777592,28-03-2017,4,Lovely museum,"This former school houses a lovely collection of treasures such as wedding wear, furniture and kitchenware. A special display of elaborate embroidery was also shown when we visited. Cute stamping collection available for the young and young at heart. $10 entry for non-Singapore citizens.",03-2017,Couples,2020-01-30 10:38:58.220275
,1,47,https://www.tripadvisor.com.sg/Profile/Frank S,470223927,26-03-2017,5,Great Museum,"Well put together museum! The Peranakan Museum celebrates the lives of Peranakans, or Chinese immigrants to the Malay Peninsula (including Singapore). You get to hear their stories, getting a closer glimpse of their lives after they chose to immigrate.",09-2016,Couples,2020-01-30 10:38:58.570307
,1,47,https://www.tripadvisor.com.sg/Profile/Steve W,467668594,16-03-2017,5,Very good displays of Peranakan culture.,"My wife is from a Peranakan family, and this was a very informative place for me to visit. Very heritage oriented, and no guides pushing you to move along.",04-2016,Couples,2020-01-30 10:38:58.916932
,1,47,https://www.tripadvisor.com.sg/Profile/ponnapa2016,464931281,06-03-2017,5,Exceptionally curated exhibition of Peranakan culture,"We visited this museum after viewing another exquisite exhibition at The National Gallery - SIAPA NAMA KAMU? ART IN SINGAPORE SINCE THE 19TH CENTURY. Both were outstanding and a brilliant effort at showcasing an unique Peranakan culture that makes Singapore what it is today. There is a lot that other nations can learn from these most interesting, passionate and revealing exhibitions as the world evolves into a global community and yet emphasises the need to preserve smaller cultures.",03-2017,Couples,2020-01-30 10:38:59.254313
,1,47,https://www.tripadvisor.com.sg/Profile/Bitte_von,464186727,03-03-2017,4,A very interesting culture,"Do not miss out on this interesting museum -it describes a culture most foreigners are not familiar with. Very charming and family friendly, take time to visit all the floors",02-2017,Couples,2020-01-30 10:38:59.597135
,1,47,https://www.tripadvisor.com.sg/Profile/happytraveller162,461644938,21-02-2017,4,A culturally interesting museum in Singapore,"This museum is definitely worth a visit. The guided tour by one of the staff is highly recommended. The history and culture of this mixed ethnic group is traced back to the Chinese and Indian traders who married the local women in this region. The exhibits are well presented and documented. The various galleries are clean and accessible. My only suggestion is that some of the rooms' lighting be a bit brighter. It was hard for me to read the small print on the plaques. Otherwise, this is an excellent museum for those interested in the Peranakan lifestyle, custom and culture.
Final word - a coffee shop or cafe serving Peranakan cakes and desserts would be well received. The gift shop is a bit cramp and the souvenirs pricey.",02-2017,Couples,2020-01-30 10:38:59.919315
,1,47,https://www.tripadvisor.com.sg/Profile/Vikinglady2,460124661,15-02-2017,4,Cultural Gem,Make your way here to learn about this important culture. Some displays are magnificent. Provides real insight into Singapore.,01-2017,Couples,2020-01-30 10:39:00.257626
,1,47,https://www.tripadvisor.com.sg/Profile/Foodloversue,459650050,14-02-2017,4,Understanding Peranakan culture,"This museum is an important overview to Peranakan culture, representing the diversity of Singapore. The displays are extensive, so you must come with a desire to know a lot about all aspects of this culture from clothing to food to funeral practices.",01-2017,Couples,2020-01-30 10:39:00.632985
,1,47,https://www.tripadvisor.com.sg/Profile/DownersAustralia,456265541,01-02-2017,5,Peranakan Museum - Singapore Heritage Tour,"My husband and I visited the Peranakan Museum, home to exhibits about the customs, language, clothing, religion and history of the Peranakan people. We booked our tour through viator and it included a visit to the spice garden and food tasting. Mr Foo, our tour guide, gave us a great insight into the culture, lifestyle and history of Singapore’s Peranakan population, the descendents of early Chinese immigrants and other ethnic communities.",01-2017,Couples,2020-01-30 10:39:01.030574
,1,47,https://www.tripadvisor.com.sg/Profile/Janet R,455571158,29-01-2017,5,A Gem,We learned about the rich heritage of the Perankan people. The museum is a beautiful space. Worth a visit.,01-2017,Couples,2020-01-30 10:39:06.878459
,1,47,https://www.tripadvisor.com.sg/Profile/two5kid,454645109,25-01-2017,4,Visit On A Friday!,"Why Friday? Because it's the day that the Museum has extended hours till 9pm, allowing you ample time to enjoy what the museum has to offer. Peranakans are a mixed bunch of people, combining a few heritage together into a unique fusion identity of its own and you have to see it to understand what that means.

Interesting and quaint little museum that will try to show you what is it to be a Peranakan in Singapore. Be sure to collect the letterpress stamp while doing the tour of the Museum!",10-2016,Couples,2020-01-30 10:39:07.259577
,1,47,https://www.tripadvisor.com.sg/Profile/MelissaHebbard,452068927,15-01-2017,5,Understand the culture at the heart of Singapore.,"This lovely old building has a comprehensive and informative display of the fascinating Peranakan culture that is at the heart of Singapore. Marvel over the exquisite bead work, the beautiful and colourful ceramics and get to understand the traditions and way of life of the Peranakan people. The guides are very thorough and worth listening to.",10-2016,Couples,2020-01-30 10:39:07.597151
,1,47,https://www.tripadvisor.com.sg/Profile/M M,451624419,13-01-2017,5,Good place to get understanding about Chinese history in South Eastern Asia,"Until I visited this museum, I had very rough understanding about Chinese people in this region. However, after the visit, it was eye-opening of how Peranakan people went through in the past years. Worth to visit.",01-2017,Couples,2020-01-30 10:39:07.914629
,1,47,https://www.tripadvisor.com.sg/Profile/Denis D,447026899,28-12-2016,4,Mid Morning Stroll,"We found this little museum at the rear of the Armenian Apostolic Church in Singapore. Not knowing anything about the Peranakans, we decided to take a look in and found a very interesting little museum set on three floors. The museum explains the origins of the Peranakan people in the area and shows many aspects of their culture and traditions such as weddings, food, death and afterlife and their exquisite needlework. A very interesting find.",12-2016,Couples,2020-01-30 10:39:08.301578
,1,47,https://www.tripadvisor.com.sg/Profile/JonathanL4849,446518627,25-12-2016,5,A truly interesting experience,The design of this museum is excellent with a truly vintage look. I enjoyed all the galleries of the museum and particularly like the one on weddings. The Peranakan culture is extremely interesting with such a rich blend of various cultures. Would definitely return again for more :),12-2016,Couples,2020-01-30 10:39:08.674904
,1,47,https://www.tripadvisor.com.sg/Profile/Karen B,444360849,15-12-2016,5,History!,A great place to learn more about the history of Singapore. We really enjoyed our visit there. We would say this is one of the best museums in Singapore.,08-2016,Couples,2020-01-30 10:39:09.048098
,1,47,https://www.tripadvisor.com.sg/Profile/0591TimS,442973963,09-12-2016,3,"Good for people interested in fabrics, clothing design and regional cultural history","We grabbed a couple of hours in this museum. The lower floor historical and mixed cultural background displays were very interesting. The upper floor displays included a lot of embroidery and beadwork by “Nyonyas”; Peranakan women. The intricate nature of these designs serves to emphasize how our view of time priorities has changed so radically. Displays of home life for these cultural traditions also remind us of how we’ve moved away to our current fast paced lives and perhaps have lost something in the process. The impression this museum gives is that the mixed cultural development of the 19th and early 20th centuries was a functional melting pot, nonetheless dominated by Chinese influences. It would be nice to be able to believe this cultural tolerance and happy coexistence of different religions and cultures is a strong foundation for a multicultural Singapore. I suspect that reality is not (and was never) quite so accepting.",12-2016,Couples,2020-01-30 10:39:09.437130
,1,47,https://www.tripadvisor.com.sg/Profile/allspice502016,439972654,25-11-2016,4,Peranakan’s Rich Culture,"Peranakan Chinese or Straits-born Chinese are the descendants of Chinese immigrants (from the 15th & 16th centuries) who came to the Malay Archipelago. They adopted the term ""Peranakan"" to distinguish themselves from the new immigrants. The male descendants were called Babas and female descendants Nyonyas. Some of the Nyonyas still wear their traditional costumes called the Kebaya which is a beautiful, translucent, figure-hugging embroidered blouse worn with a batik sarong.This museum specializes in Peranakan culture and displays a comprehensive understanding of Peranakan traditions, from traditional wedding ceremonies, to displays of traditional needlework and beadwork. The museum is housed in the former Tao Nan Chinese School built in 1912. A small museum but packs in a lot of interesting exhibits.",10-2016,Couples,2020-01-30 10:39:09.827179
,1,47,https://www.tripadvisor.com.sg/Profile/Jon S,427749478,14-10-2016,2,Very disappointed,"Probably not the fault of the museum, but due to extensive renovations, there were virtually no exhibits. Better to close than give high expectations, only to led the viewer down.",10-2016,Couples,2020-01-30 10:39:10.137025
,1,47,https://www.tripadvisor.com.sg/Profile/Khin Q,424406377,02-10-2016,5,Fascinating museum,"Even for locals. The Peranakan history is rich, colourful and interesting and you get to read about Peranakan who had played an important role in Singapore's history and development.",12-2015,Couples,2020-01-30 10:39:15.949570
,1,47,https://www.tripadvisor.com.sg/Profile/Harvee121,423432848,29-09-2016,4,Intricate Needlework,"Visiting this museum was a highlight of my visit to Singapore - luckily I saw an advertisement on the back of a bus that enticed me in!
The building itself is just beautiful, and houses displays of the Peranakan people's culture, art, and every day life objects. I found it fascinating.
There are 9 galleries over three levels covering everything from origins, food & feasting, language & fashion, religion, weddings and public life. There is a lift, but the stairwell is beautiful.
Until the end of March 2017 there is a special exhibition of Nyonya needlework which is the most amazing display of intricate embroidery and beadwork. Some of the works were from the permanent display, while others were on loan, and they were all incredible and well worth seeing. The colours and lustre of the silk threads were beautiful.",09-2016,Couples,2020-01-30 10:39:16.282814
,1,47,https://www.tripadvisor.com.sg/Profile/Allyjet,423425646,29-09-2016,4,Interesting museum that gives good insight in local culture and Heritage,"Took my parents to see this museum. Was very nice and informative. I had heard of Peranakan of course, but did not quite catch it until I visited this museum. Beautiful building and cute little giftshop. The small coffeebar is too expensive and does not have much to chose from unfortunately.",11-2015,Couples,2020-01-30 10:39:16.617951
,1,47,https://www.tripadvisor.com.sg/Profile/sunrisetacos_1,414526442,04-09-2016,5,Must visit,Fascinating on history and how weddings were so important. Be sure to get the free tour guide. Lots of info she shared with our group. Well done museum and good price,09-2016,Couples,2020-01-30 10:39:17.015846
,1,47,https://www.tripadvisor.com.sg/Profile/Dan M,409090024,23-08-2016,5,This museum is worth visiting,Exquisite and fascinating items presented beautifully to provide a wonderful glimpse into the past lives of the Peranakans.,08-2016,Couples,2020-01-30 10:39:17.352715
,1,47,https://www.tripadvisor.com.sg/Profile/ToleTravellers,404860161,13-08-2016,4,Interesting history museum housed in a beautiful colonial building,"An excellent introduction into the history and culture of the Peranakan people. Our guide was knowledgeable, passionate interesting and engaging. She explained the history through the significant displays and artifacts. We were fortunate to visit during the Nonya Embroidery and Beadwork exhibition.",08-2016,Couples,2020-01-30 10:39:17.821256
,1,47,https://www.tripadvisor.com.sg/Profile/roadtrippernineteen,404762014,13-08-2016,5,Gorgeous Museum full of straits history,Ensure you do the tour! It's a lovely museum seeped in history. Walking around without the tour one must read the signs to appreciate the nonya peranakan culture.,08-2016,Couples,2020-01-30 10:39:18.193623
,1,47,https://www.tripadvisor.com.sg/Profile/Meeghan Z,398399655,28-07-2016,4,Small but Interesting Museum,"We happened upon the Peranakan Museum. As foreigners, it was an introduction to an entirely new culture, which was fascinating. Even though the museum is a bit out-dated in most of its exhibits, it is pleasant to wander through and definitely a great introduction to Peranakan history.",12-2015,Couples,2020-01-30 10:39:18.510027
,1,47,https://www.tripadvisor.com.sg/Profile/Z K,397819895,27-07-2016,4,Interesting aspect of Singapore history,"This small museum holds some interesting displays showing the history and culture of the Peranakan people - the original settlers who intermarried with the locals in Singapore. They are a diverse population because the settlers came from a range of places, China, India and the ME included.
I would recommend taking the tour which is run by volunteers, to make better sense of the displays. Then I would recommend having a Peranakan meal to complete the experience!",04-2016,Couples,2020-01-30 10:39:18.849477
,1,47,https://www.tripadvisor.com.sg/Profile/SingaporeSuzie007,392413313,14-07-2016,3,Small and definitely geared toward adults,"I visited with my husband on a weekday afternoon - it was my birthday and we came after lunch. I was glad our boys weren't with us. They did have some hands-on exhibits for kids, but they were all broken, stolen or missing. It was mostly cases of things to look at with long explanations on placards. As an adult, that's what I expect from a 'museum'. But this is not for kids.

It's a small museum - especially given that, I've never seen so many security guards. Not even at the British Museum or the V&A. It's a bit off-putting to have them follow you around and hover over you. Everything's in glass cases; it's not like we were going to lift the exhibits.

Even for adults, it's pretty dry. I do feel like I have a better understanding of some of the aspects of Peranakan art and life in the early 20th century. But we spent about an hour and a half there and I didn't feel like I needed much more time. There's not much interactive and even the descriptions are dull.

I've seen what the creative staff here in Singapore can do at places like the Aquarium - it's clear they hired a staff with a very different approach to create the displays here, and it's sad. We did not partake of the guided tour as we came late and had limited time. We did overhear part of it and it did sound like it would brighten the experience and breathe a bit of life into the learning.

The gift shop is ridiculously overpriced. Stuff there is pricier than the exact same things in Orchard or Tanglin. The one thing we didn't get to do was eat. I may return to try some of their authentic Peranakan specialties.",05-2016,Couples,2020-01-30 10:39:19.231775
,1,47,https://www.tripadvisor.com.sg/Profile/WilliamBiol,392098822,13-07-2016,4,Learn the native culture of Singapore and surrounding area,I was fascinated by the intricate detail that created silkthread and beadwork art. Incredibly beautiful pieces on display from tapestries to beaded shoes. The home exhibit with furnishings of peranakan families and their traditions is also an excellent display.,07-2016,Couples,2020-01-30 10:39:25.099765
,1,47,https://www.tripadvisor.com.sg/Profile/Ruairi O,387984123,01-07-2016,5,Excellent insight into Singapore's multicultural background,"Lovely museum, fabulous building. It focuses on the peranakan (families with a Malay mother and foreign father), their lives, beliefs, roles in Singapore society and history. We arrived in the afternoon just as a free English-language guided tour was starting (thank you, Robert), which was excellent and then left time to back round and see other areas or revisit especially interesting exhibits.",06-2016,Couples,2020-01-30 10:39:25.477172
,1,47,https://www.tripadvisor.com.sg/Profile/Travellingraewyn,380563607,07-06-2016,4,Well presented cultural history museum,"An interesting museum for those curious about Peranakan culture and their contribution to Singapore's development. Exhibits had plenty of audio stops as well as information boards in all key languages. The galleries are arranged in an easy flowing layout over 3 floors, in a lovely old colonial building. Touching of many of the pieces is encouraged and allowed. We easily covered the exhibition in a couple of hours, reading most panels. Guided tours also available. Keep an eye open for the bronze statue of a cat on the entrance stairs. A lovely tribute to a former stray adopted by the museum.",06-2016,Couples,2020-01-30 10:39:25.873376
,1,47,https://www.tripadvisor.com.sg/Profile/MelbourneJade,373608461,17-05-2016,5,Wonderful insight into Peranakan life,"My husband and I visited this museum and found it very informative. The museum is over 3 floors and there were many photos and displays. The history of Peranakan is explained in great detail and there were many displays of clothes, chinaware, furniture etc.",05-2016,Couples,2020-01-30 10:39:26.203902
,1,47,https://www.tripadvisor.com.sg/Profile/liming,370366163,05-05-2016,5,Fascinating Museum,"I have a love of antiques and decorative arts and found the Peranakan Museum a real treat. We waited 10 minutes for the organized tour to begin and glad we did. A very knowledgeable French woman took us through the museum explain the culture and background of the Peranakans. Beautiful examples of porcelain, textiles, clothing, furnishings and more. A real eye opener on the distinct decorative arts embraced by the Peranakan people.",02-2016,Couples,2020-01-30 10:39:26.544575
,1,47,https://www.tripadvisor.com.sg/Profile/silvianisrir,366515200,23-04-2016,4,Good,"Now I understand the different between City/jawi/hokian. Peranakan not only Chinese-Malay, but also Hindi or Indian Moslem. The collections only about Chinese-Malay heritage. No Hindi or Jawi Collection",04-2016,Couples,2020-01-30 10:39:26.837399
,1,47,https://www.tripadvisor.com.sg/Profile/gloriab598,362042585,06-04-2016,5,A Great History of the First People of Singapore,"A history of the original people who lived in the city during Victorian Times. Take a tour and learn about the Wedding Ceremonies, the fashions, the furnishings and religious practices of these ""British Chinese"" who worked with and for the Colonialists during the 19th century. Beautifully laid out rooms in a white Colonial mansion on Armenian St. Off Stamford Rd.",04-2016,Couples,2020-01-30 10:39:27.236760
,1,47,https://www.tripadvisor.com.sg/Profile/danclem,361904075,06-04-2016,5,Excellent Museum,"This is a wonderful museum about Singapore's Peranakam, or mixed race Chinese, community. We found it very moving and a great help in understanding Singapore and its success. Very well done.",04-2016,Couples,2020-01-30 10:39:27.602862
,1,47,https://www.tripadvisor.com.sg/Profile/Epicure134,361036669,03-04-2016,5,A charming museum with an unique subject,The Peranakan culture is often ill-defined but here it is well explained in a delightful setting.The wedding scene is especially poignant and the stunning exhibits of Peranakan art really worth a visit.The museum shop although tiny has some marvellous pieces too.,04-2016,Couples,2020-01-30 10:39:27.901127
,1,47,https://www.tripadvisor.com.sg/Profile/Lesley T,359953686,30-03-2016,5,A cultural learning experience,"I found the museum to be a wonderful rich history of early Singapore life and its inhabitants, the Peranakans (persons of Chinese and Malay descent).",03-2016,Couples,2020-01-30 10:39:28.208638
,1,47,https://www.tripadvisor.com.sg/Profile/mckenzjed,359319330,28-03-2016,3,Insightful and enriching,very beautiful place. worth the visit to know about a little know history of singapore. very unique culture and colours in the museum. can spend a whole half a day there!,03-2016,Couples,2020-01-30 10:39:34.014623
