REVIEW_INDEX,WEBSITE_INDEX,POI_INDEX,REVIEWER_NAME,REVIEW_RATING,REVIEW_DATE,REVIEW_TIME,REVIEW_BODY,ATTRIBUTES_CRAWLED_TIME
,2,134,小猪猪,0.0,2019-07-25,Not Available,"新加坡亲子游最全攻略 新加坡地处热带，分部着大量的热带动植物，如果家里有正在上小学初中的孩子，那你来新加坡这些地方可千万不要错过哦。神秘的从林，雄伟的瀑布，科技感满满的展馆正在等你哦。 云雾森林玻璃屋——神秘世界 新加坡最值得一去的地方就是云雾森林玻璃屋了，千万不要犹豫哦。这里展出了大量的热带植物，各种各样的植物交汇在一起十分漂亮，一进门，巨大的热带植物瀑布展现在了眼前，据导游介绍这里的热带植物高达35米呢。所有的植物都被玻璃屋子笼罩起来，形成了一个半封闭的环境。里面除了植物就是各种造型的玻璃栈桥，十分美丽，非常适合拍照打卡哦，这里的空气非常清晰，湿气6在空气中弥漫，只有漫步在其中才能一扫旅途的疲惫。 门票：约80人民币 星耀樟宜——全球最绿色的机场 在全球的诸多机场中，也许星耀樟宜不是最豪华的，但它一定是最美的，最绿色的机场，在这里你甚至能在机场中看到瀑布。你甚至能够把星耀樟宜当成本次旅行的第一站，一下飞机走出航站楼，引入眼帘的是陌生的热带植物，高大的树木，各种各样的花朵。夜晚还有水上演出和灯光秀哦，有迷宫，瞭望塔，蹦床乐园等等。这里集合吃喝玩乐购物于一体，着实是一个休闲放松的好去处。带小孩在来的旅客朋友们其那晚不要错过哦。 门票：免费 新加坡科学中心——科学爱好者的圣地 新加坡科学中心是一个集科技研发和科技展览于一体的科技馆，门票建议小伙伴们提前在官网上面预定，这里的大部分展馆是免费开放的，剩余的一部分是收费的。如果你是一个科技爱好者或者带着孩子来新加坡游玩，这里可千万不要错过。一进去就会有工作人员和我们互动，会给我们看一些照片，感受变化等等。每个展馆都有自己独特的意义和展出内容，场馆是不是会有大型活动举办，可以适合各个年龄段的孩子。 门票：约60人民币 圣淘沙大自然探索中心——认识自然 新加坡作为一个热带城市，必然有着各种各样的自然博物馆了，圣淘沙大自然探索中心则是最值得去的自然博物馆之一了，这里有八个不同的区域，分布着不同的自然栖息地种类，非常适合带着孩子去玩，很好的给孩子做动植物的科普，增加孩子的知识储备和对大自然的兴趣。最出名的娱乐是穿越丛林，你需要借助各种刚刚学到的从林生存知识，挑战从林。建议一家人共同前往游玩哦。 门票：免费 ""美丽的冰雪王国——新加坡雪城 新加坡雪城，这个室内冰雪是新加坡非常有名气的室内冰雪公园，它在新加坡本地都非常非常的有名气，这边的造雪机器非常的先进，可以制造出白雪冰封的美丽景象，非常的好看，对于没看过雪的我简直是一种视觉的享受。我们进去的时候路过了一个小院子，我们看到了之后都笑出来的，里面有桌子和椅子已经被雪覆盖满了，上面堆着厚厚的雪，我们进去抓了一把雪，雪的手感真的像真的雪一样，有冰又凉，很多人也在别的院子里面打雪仗，场面一度十分混乱，这里还可以滑雪，学的质感很好，我们去玩了雪橇，用铁的棍子支撑着自己往前行走，很有趣，有的小朋友们在那边打雪仗，有的在堆雪人，在看着他们，自己的心情也飞扬了起来，这边还有一个小小的冰窖的酒吧，坐在冰雪王宫中享受酒精，也是一件很奇妙的事情。推荐来这里看看，这场奇妙的旅行一定不会让你后悔的！"" 门票：约65人民币 新加坡亲子游大概就介绍到这里啦，你有没有心动呢，快带上孩子们来玩耍吧，一扫身体的疲惫，呼吸大自然新鲜的空气，一起来学习提升你的科学分析能力，准备好向从林出发吧。",2020-02-16 17:06:37.048563
,2,134,M515shunyi1618,5.0,2019-07-23,Not Available,亲近大自然的好地方，可以在丛林中探索各种鸟类，昆虫和各种植物。,2020-02-16 17:06:37.054905
,2,134,馨馨宁宁,3.0,2019-03-17,Not Available,不幸的是圣淘沙大自然探索中心没有看到太多的野生动物，但是植物仍然让步行值得，大多数小径被树木遮蔽，感觉比岛上其他地方凉爽，可以租一辆自行车，很多石头上有化石的痕迹。,2020-02-16 17:06:37.064322
,2,134,kelly,5.0,2019-08-25,Not Available,圣淘沙大自然探索中心是个科普生物园，是一个让游客亲近大自然的热带园林，也是圣淘沙岛上早期开放的游客项目之一。在这里首先看到的就是交互式画廊，这里会展览出很多的迷人的画面，它还能提高你的科学分析技巧如果，你想要尝试穿越森林，一定要准备好水、防晒霜、舒适的鞋和驱虫剂。,2020-02-16 17:06:37.070777
,2,134,M25****4707,5.0,2019-05-18,Not Available,从交互式画廊展览中迷人的画面展开这段探索之旅，它可以提高您自己的科学分析技巧。 观察、分类、对比和推断。 掌握了这些技巧之后，前往丛林中探索各种鸟类、昆虫和其它野生动植物。好好的畅游这个动植物的世界吧。,2020-02-16 17:06:37.077352
,2,134,达达和妮妮,5.0,2018-12-18,Not Available,这个探索中心太不错了，能够有很多非常惊喜的发现。,2020-02-16 17:06:37.083902
,2,134,M22****2721,5.0,2017-09-06,Not Available,这个地方居然免费，个人觉得这才是必到之处，去了两次，碰到两拨当地学生上自然课。您就知道这个地方要不要来了。门口介绍也是从听到老一应俱全。,2020-02-16 17:06:37.089953
,2,134,kelly,5.0,2017-10-23,Not Available,大自然探索杂志是四川科学技术出版社主办的综合性的自然科学学术季刊。刊物设有“科技论坛”、“学术论文”、“科学技术史”、“自然辩证法”、“科学学与科学管理”等栏目，内容涉及到自然科学的各个方面，充分突出综、专、史、法和探索争鸣的特色，在中国自然科学学术性刊物中独树一帜。,2020-02-16 17:06:37.095296
,2,134,e01****90,5.0,2016-01-22,Not Available,圣淘沙大自然探索中心有差不多2公里的健身步道，动物植物都很多，这个小岛就是为孩子们量身定做的。如果你想要尝试穿越森林，一定要准备好水、防晒霜、舒适的鞋和驱虫剂。,2020-02-16 17:06:37.099739
,2,134,宫主爱,4.0,2016-11-23,Not Available,若是带着孩子来到圣淘沙岛上，别光顾着在海滩玩水了，去大自然探索中心吧。让孩子们认识那些千奇百怪的热带雨林植物吧，相信孩子们会很感兴趣而且收获颇丰,2020-02-16 17:06:37.103725
,2,134,M25****4240,4.0,2018-09-23,Not Available,据介绍这里是圣淘沙地区的最新的自然公园，这里面有很多人共小路，蜿蜒曲折很有意境，沿途可以看到很多不同种类的鸟类自然的走来走去，很舒服，和大自然融为一体,2020-02-16 17:06:45.359229
,2,134,笃悠悠的鱼,5.0,2016-08-29,Not Available,圣淘沙大自然探索中心是个科普生物园，是一个让游客亲近大自然的热带园林，也是圣淘沙岛上早期开放的游客项目之一，很适合亲子游！,2020-02-16 17:06:45.363937
,2,134,M11****150,5.0,2017-07-22,Not Available,很神奇，很长知识，孩子们暑假来,2020-02-16 17:06:45.368571
,2,134,carrie102799,5.0,2017-11-19,Not Available,强烈推荐住圣淘沙，岛上还有自然探索园，静，动都可以找到去向,2020-02-16 17:06:45.372980
,2,134,甘草4525,3.0,2018-06-30,Not Available,圣淘沙大自然探索中心如果晚上有时间的话，建议你晚上去有别一样森林的感觉,2020-02-16 17:06:45.377044
,2,134,我叫阿幼,0.0,2018-07-17,Not Available,来一场与大自然的亲密之旅 这次的小长假我和闺蜜都把时间留在了新加坡，在新加坡的第2天呢，我和闺蜜一起驱车来到了圣淘沙探索中心。这个探索中心和我以前见过的都不一样，刚进入探索中心，我感觉好像是来到了一个画展中心看画。 进入大自然探索中心的第1步，就是从画廊里美丽的画面展开对大自然的探索的奥秘的。对着画廊上的画，一步步的分析探索欣赏后。工作人员就带着我和闺蜜进入丛林来探索了。 我和闺蜜在丛林探索的时候，没有看到很多的野生动物，反而被丛林里的植物给绊住了好几次脚。 探索中心的天气很凉爽，我和闺蜜走累了，就在旁租了辆自行车，悠闲的继续来探索大自然的奥秘。骑着自行车到了探索中心的深处，我和闺蜜终于看到好多鸟儿聚在一起，真的很兴奋 实用TIPS: 1.圣淘沙探索中心，一年四季气温都很适宜，除了678月份比较炎热，不太适合来旅行。 2.探索中心里面蚊虫很多，一定要带好足够的驱蚊药物。 景区地址：圣淘沙探索中心,2020-02-16 17:06:45.380855
,2,134,杨坤,4.0,2018-08-31,Not Available,这里有很多植物，新加坡是植物花园。,2020-02-16 17:06:45.384680
,2,134,iiiiiiiiu,5.0,2017-07-25,Not Available,我自己去很好玩，建议有时间逛逛,2020-02-16 17:06:45.388449
,2,134,sunnycccc,5.0,2019-03-12,Not Available,新加坡有超级多的蝴蝶兰的哦(&#180;-ω-`),2020-02-16 17:06:45.391997
,2,134,M40****821,5.0,2018-07-25,Not Available,很多动植物，还可以互动，非常棒,2020-02-16 17:06:45.395495
,2,134,_cs48****8098,5.0,2017-12-25,Not Available,虽然不是很大，但是感觉还是比较值得的！,2020-02-16 17:06:49.868068
,2,134,豌豆豆,4.0,2015-11-26,Not Available,科普植物馆，免费开放的，中心有差不多2公里的健身步道，行走在热带雨林繁茂的植物中，有很多餐饮店，比如大家熟悉的星巴克咖啡店和KFC，我们就是在这里解决的饭。,2020-02-16 17:06:49.875241
,2,134,m97****35,5.0,2015-12-28,Not Available,真的不错，整个园区非常干净，票价便宜。人也很多，是个值得推荐的地方,2020-02-16 17:06:49.882456
,2,134,佛山易先生,4.0,2017-09-05,Not Available,小孩子玩得很开心，我们大人觉得比较一般,2020-02-16 17:06:49.889208
,2,134,爱爱李,4.0,2016-01-20,Not Available,圣淘沙大自然探索中心是一个巨大的花园，这个花园是开放式的，内部的建筑很多，还有星巴克可以休息，整个区域的空气很好，可以在草地上午餐。,2020-02-16 17:06:49.897018
,2,134,M23****1937,5.0,2017-11-29,Not Available,这里非常适合带孩子来，难怪说新加坡是个亲子行的国家,2020-02-16 17:06:49.903579
,2,134,yifulan,4.0,2016-10-31,Not Available,公园很大很安静，免费哦。这里的风景还是很不错，尽管地处闹市区，但园中犹如森林般的自然气息。,2020-02-16 17:06:49.911397
,2,134,Mary_Kiky_Zhu,5.0,2016-12-11,Not Available,通过探索，可以提高自己的科学分析技巧。,2020-02-16 17:06:49.917904
,2,134,_ceai****5795,4.0,2018-01-02,Not Available,处处鸟语花香，花园城市名不虚传。,2020-02-16 17:06:49.924936
,2,134,破坏死光,5.0,2016-09-09,Not Available,森林公园，环境舒适，空气超好的，很适合休闲锻炼，绿化面积超级大，非常舒适,2020-02-16 17:06:49.932060
,2,134,mmm212,4.0,2014-02-23,Not Available,很好的探索自然的机会 如果带小朋友来的话 可以去参观下,2020-02-16 17:06:54.245473
,2,134,sunnycccc,5.0,2017-12-18,Not Available,挺好玩的 非常的有益身心健康哦,2020-02-16 17:06:54.251693
,2,134,哈哈兄,5.0,2014-01-24,Not Available,装饰的很可爱~动物植物都很多，带你走进微观世界哈哈~~,2020-02-16 17:06:54.259029
,2,134,151****6081,4.0,2015-08-20,Not Available,经过岁月流逝，有一种奇妙的和谐之感，特色汇聚在其中,2020-02-16 17:06:54.265520
,2,134,天天成长,4.0,2016-02-24,Not Available,也是城市花园里不错的亲子场所，牵着孩子环走于绿化步道之中科普自然知识，满满地回忆,2020-02-16 17:06:54.271840
,2,134,gudonghui001,4.0,2015-08-18,Not Available,我们家小朋友不是太喜欢，我到感觉不错，第二天一个人又慢慢走了一遍。,2020-02-16 17:06:54.278397
,2,134,coldwar,4.0,2017-10-17,Not Available,圣淘沙大自然探索中心可以在下午4点半左右，当它凉快一点的时候，去丛林散步。有很多人工修葺的小路，还有人带一个婴儿车。在沿途拍摄照片的地方，还有信息指出树木和的种类，鸟类也非常多。,2020-02-16 17:06:54.284749
,2,134,望天树宝贝,4.0,2018-07-12,Not Available,从交互式画廊展览中迷人的画面展开这段探索之旅，它可以提高您的科学分析技巧。 观察、分类、对比和推断。,2020-02-16 17:06:54.291930
,2,134,Mary_Kiky_Zhu,5.0,2018-05-25,Not Available,圣淘沙大自然探索中心等探索之旅，是从互动式画廊中迷人的画面开始的，美妙乐趣伴随着自然的探索，层出不穷。,2020-02-16 17:06:54.298523
,2,134,_WeCh****995193,1.0,2018-07-16,Not Available,大家不要在携程上订票了，我在携程上定的机票，由于携程没有提示短信，导致误机，造成我们损失五千多元，服务实在是太差了,2020-02-16 17:06:54.305255
,2,134,M13****519,5.0,2018-08-18,Not Available,适合带小朋友去，空气很好，很舒服,2020-02-16 17:06:59.849368
,2,134,sunnycccc,5.0,2018-03-27,Not Available,就像一个植物园 里面有很多的植物,2020-02-16 17:06:59.853638
,2,134,M15****577,5.0,2018-06-21,Not Available,大自然总是充满了无穷的乐趣，值得去体验。,2020-02-16 17:06:59.857612
,2,134,206****159,4.0,2018-04-20,Not Available,美丽可爱的环境，大自然探索乐园,2020-02-16 17:06:59.861758
,2,134,M11****150,5.0,2018-03-30,Not Available,暑假带着孩子们一起来玩耍，开心,2020-02-16 17:06:59.865665
,2,134,118****433,5.0,2018-09-24,Not Available,没多大印象了，只记得很好很好,2020-02-16 17:06:59.869466
,2,134,136****1660,5.0,2017-09-16,Not Available,时间赶了点，没进去，外面拍照了 算到此一游，哈哈,2020-02-16 17:06:59.873028
,2,134,118****620,5.0,2017-08-24,Not Available,免费开放的，有趣味性和知识性，可惜有点下雨，我们只转了一圈,2020-02-16 17:06:59.876651
,2,134,M57****111,5.0,2017-10-25,Not Available,在这里看到另一番景象，自然的气息，和谐的画面,2020-02-16 17:06:59.880139
,2,134,jenny,5.0,2017-08-16,Not Available,探索大自然的好地方，活动和参与性很高,2020-02-16 17:06:59.883704
,2,134,tai****000,5.0,2016-10-17,Not Available,在圣淘沙有一个大自然探索中心，在这里最先看到的就是交互式画廊，这里会展览出很多的迷人的画面，它还能提高你的科学分析技巧，这种观察和分析很有意思，是一种很好的体验。,2020-02-16 17:07:04.761882
,2,134,鹄立头,5.0,2016-10-30,Not Available,温度适宜，空气好，景色好，带父母去旅行，还行！景色不错，跟团，时间紧凑。,2020-02-16 17:07:04.767992
,2,134,110****090,5.0,2016-06-08,Not Available,圣淘沙大自然探索中心是一个专门给孩子设计的森林探索公园，这里有一些小动物孩子很喜欢。,2020-02-16 17:07:04.774384
,2,134,M21****496,4.0,2016-03-23,Not Available,科普植物馆，免费开放的，中心有差不多2公里的健身步道，行走在热带雨林繁茂的植物中，有很多餐饮店推荐看看。,2020-02-16 17:07:04.781095
