REVIEW_INDEX,WEBSITE_INDEX,POI_INDEX,REVIEWER_NAME,REVIEW_RATING,REVIEW_DATE,REVIEW_TIME,REVIEW_BODY,ATTRIBUTES_CRAWLED_TIME
,2,10,路中寒梅,5.0,2019-11-29,Not Available,转机去了新加坡，10个小时的时间，匆匆忙忙去了市区一日游，下了飞机脱下棉衣换上短袖，从机场自己去了鱼尾狮公园，绕着新加坡河走了一圈，人最多的地方自然是这个鱼尾狮前，永远都有照相的人群，新加坡真的很热，时间允许还是早晚去比较合适。,2020-02-08 00:57:14.605321
,2,10,独孤雅剑,5.0,2019-11-28,Not Available,新加坡的标志性建筑就是鱼尾狮，鱼尾狮公园则是新加坡最热门的几个景点之一，我们到新加坡的第一站就来到了鱼尾狮公园，在这里可以看到很多建筑，有比较有名的金沙，还有滨海艺术中心以及新加坡摩天轮等等，在这儿游览的游客也比较多,2020-02-08 00:57:14.612879
,2,10,_WB4****635,5.0,2019-12-12,Not Available,《往事逾千年·财富象征摩天楼4⃣️》一一新加坡鱼尾狮公园·滨海湾花园18·12·24下午  《虞美人·爽心悦目惬意情》 运河高雅迎宾客，艺术行径色。滨海水柱萦环致，趣味创意银、喜人斯。       图腾神圣凭栏侧，鳞片鲜活啼。双含熹征尘，爽❤️悦目犹楚、徒步吟！                                           己亥年冬月十七,2020-02-08 00:57:14.620000
,2,10,小枫0702,4.0,2019-10-05,Not Available,鱼尾狮像是星加坡的地標，新加坡的鱼尾狮的由来?写回答鱼尾狮为什么成了新加坡的象征说法是，很久以前，淡马锡（新加坡的旧称)发生了一场可怕的风暴，渔船被打翻、房屋被吹倒。就在当地居民手足无措的时候，一只长着狮头鱼尾的动物从大海里走来，平息了风暴。所以在淡马锡人眼中，鱼尾狮就成了吉祥、和平的象征。,2020-02-08 00:57:14.627537
,2,10,M33****1944,5.0,2019-09-11,Not Available,值得一去拍照到不愿离开拍鱼尾狮走几步还可以拍到 Marina Bay Sands。下午跟晚上都一样漂亮，但很多人。建议下午的时侯去拍照，等到差不多7点晚上，可以拍夜景。,2020-02-08 00:57:14.634526
,2,10,旅游交友,5.0,2020-01-04,Not Available,鱼尾狮公园是新加坡的标志，由狮子头，鱼尾巴组成的雕像，代表新加坡的标志。鱼尾狮的嘴巴还会喷出远远的水柱，非常有趣。交通方便，从city hall 地铁站出来，沿着指示牌就能走到。,2020-02-08 00:57:14.641394
,2,10,BetTerDAY,5.0,2019-12-25,Not Available,鱼尾狮是新加坡当之无愧的地标，毕竟新加坡叫狮城，金沙酒店是新加坡的另一个地标，所以鱼尾狮公园是新加坡分最佳打卡景点，因为它可以包含两个地标,2020-02-08 00:57:14.649680
,2,10,旅游交友,5.0,2020-01-27,Not Available,新加坡的鱼尾狮是当地的象征，国家的代表。毅力在新加坡河边，周围是金融区。周围景色非常美，白天与晚上各有各的漂亮，晚上的灯光非常好看。,2020-02-08 00:57:14.655980
,2,10,BetTerDAY,5.0,2019-11-29,Not Available,鱼尾狮公园里有两只狮子，这是去了新加坡之后才知道的tips，不过小狮子跟大狮子一笔难看了很多，鱼尾狮跟前永远有旅行团在摆拍，人山人海,2020-02-08 00:57:14.663411
,2,10,BetTerDAY,5.0,2020-01-03,Not Available,多数人都知道滨海湾喷水的大的鱼尾狮，却不一定知道鱼尾狮公园里还有一个小的不喷水的鱼尾狮，两个狮子拍在一起真的是很别致的景色哈哈哈,2020-02-08 00:57:14.669732
,2,10,旅游交友,5.0,2020-02-02,Not Available,鱼尾狮，是新加坡的象征，每天的游客都川流不息，挤得满满的。特别是很多旅行社的团队，非常热闹，大家抢着拍照，周围景色非常漂亮。,2020-02-08 00:57:18.668894
,2,10,BetTerDAY,5.0,2019-11-22,Not Available,鱼尾狮公园有两个狮子，这是我去了之后才发现的事实，但是公园里的小狮子实在是太难看了，又小又难看，但是还是有很多人在那边合影,2020-02-08 00:57:18.674211
,2,10,freewangyong,4.0,2020-02-06,Not Available,鱼尾狮公园的两尊大小鱼尾狮塑像是已故新加坡著名工匠林浪新先生用混凝土制作的。现为新加坡的标志性景点之一，代表新加坡形象的鱼尾狮吐出强劲有力的水柱。公园不大，一般都是来自四面八方的游客。因为临河临海，微风徐徐，在公园里散步也是非常惬意的。,2020-02-08 00:57:18.679480
,2,10,辉哥_,5.0,2020-01-28,Not Available,9年前来鱼尾狮公园不巧遇到鱼尾狮全封闭装修。这次过来终于看到真面目了。夜景也超赞哦！特别是后面金沙酒店做背景。每晚8点，9点对面的金沙还有灯光加喷泉音乐表演哦！,2020-02-08 00:57:18.684729
,2,10,观音莲,4.0,2020-01-15,Not Available,这个公园是新加坡的地标性建筑，新加坡也叫狮城，鱼尾狮公园看上去就那样，没有什么特别的地方，就是去了拍个照片而已，很多人在这里摆拍脱水，接水照片，我们也跟着拍了起来。据说接水就是接财了，来年我们财运亨通了。,2020-02-08 00:57:18.689419
,2,10,大贤良师,4.0,2020-01-07,Not Available,柯南上次的剧场版真实搞了个新加坡旅游大宣传，看到这个鱼尾狮，我就想起柯南装箱子，狮子喷血的情况……已经不能好好玩了。。。这个狮子喷泉虽然是标志性景观，其实占地极小，当然，新加坡本来就小，人少点的话，在这歇会还是很惬意的呢。,2020-02-08 00:57:18.694250
,2,10,_june.6,5.0,2019-12-09,Not Available,我去年圣诞季之前去的，整个新加披都是圣诞节气氛，超级美丽，气候完美的！这个景点是新加坡标志性的景点，鱼尾狮公园，我去的时候人不多，自己一个人拿着自拍杆完美的拍了很多。各种pose  哈哈哈 走一会儿可以走到金沙那里，在这里看完可以去金沙逛逛，吃个饭，对了这里有个咖啡厅，忘记名字了，也可以小坐一会儿~,2020-02-08 00:57:18.698633
,2,10,M15****345,4.0,2019-11-19,Not Available,鱼尾狮公园，因为是周末拍照的人特别多，途中会经过新加坡美术馆和市政大草场，非常热闹。鱼尾狮公园拍照可以参照《我可能不会爱你》李大仁接水的造型，要选好点，还要注意抢位置，游客太多了，好在大家素质都很好。,2020-02-08 00:57:18.702448
,2,10,西门吹水1,4.0,2019-11-07,Not Available,夜晚，登上鱼尾狮像向下眺望海港，船影朦胧，千万盏灯火闪闪烁烁，一派海国风光。鱼尾狮是新加坡旅游局的标志，首次亮相这个矗立于浪尖的狮头鱼身也是新加坡的象征。 如同美国的自由女神像，巴黎的铁塔，是国家的标志。,2020-02-08 00:57:18.706041
,2,10,挪威森林北辰星,5.0,2019-09-16,Not Available,下午来到滨海湾，特意来看新加坡地标性建筑鱼尾狮公园，从安德逊桥走来，这里游客很多，都是来拍照留念和欣赏新加坡河两岸美景的，在这里散步很惬意，吹着海风，很多人在河边喝着咖啡聊天，各式各样的咖啡厅分布在公园周围，还有酒吧和饭店，鱼尾狮对面的是金沙酒店，然后晚上坐着船欣赏夜晚的灯光表演，很好看！,2020-02-08 00:57:18.709857
,2,10,狮子座的Pumpkin,5.0,2019-08-21,Not Available,鱼尾狮公园据说是新加坡这样的花园城市，面积最小的公园了。现为新加坡的标志性景点之一，代表新加坡形象的鱼尾狮吐出强劲有力的水柱。公园不大，一般都是来自四面八方的游客。因为临河临海，微风徐徐，在公园里散步也是非常惬意的。,2020-02-08 00:57:36.527803
,2,10,Queenie劉,5.0,2019-04-05,Not Available,新加坡的著名景点之一必须要来呀~快傍晚的时候就从住的地方往这里溜达着，一直逛到天黑，在大桥上吹着风看着这座城市夜间繁华却不躁的样子，真的超舒服~喷水的鱼尾狮还有对面的滨海湾金沙酒店，还有超多好看的建筑，除了标准的游客照，风景和建筑还能这么拍，有趣又可爱！每次翻到这组照片都忍不住多看两眼哈哈~,2020-02-08 00:57:36.531858
,2,10,夜一大老爷,5.0,2017-06-14,Not Available,坐地铁到很方便，给大家一个小建议，就是选择晚上来，因为整个公园真的没什么遮阳的地方，白天真的很晒，而夜晚来不仅可以避开旅行团人群，还能领略到不一样的风景，公园沿岸有咖啡店酒吧，除了和鱼尾狮身像合影以外，可以惬意的来杯鸡尾酒或饮料。我们去的时候晚上还有露天交响乐团表演，非常棒，不知道是不是每晚必备的演出，所以夜晚来这个地方真的是别有一番风情。,2020-02-08 00:57:36.536078
,2,10,鲸鱼的歌声,5.0,2020-01-17,Not Available,在这里，新加坡的鱼尾狮公园，你能看到的夜景，绝对是无敌的！公园对岸，是美丽的金沙大酒店，公园内，游客络绎不绝！其实这里真没什么看的，只不过，鱼尾狮的名气随着新加坡太大太大了，搞得自己一定要到此一游,2020-02-08 00:57:36.540065
,2,10,亮亮,4.0,2020-02-04,Not Available,新年新气象，打卡新加坡鱼尾狮公园。景色宜人，空气清新。在这里感受不一样的冬天，景色让人陶醉神往。特别适合带全家一起来。,2020-02-08 00:57:36.543867
,2,10,M33****9956,5.0,2019-09-11,Not Available,必打卡的地方这是一个到了新加坡的游客都会来打卡拍照的地方，也是新加坡人最多的一个景点了。周围环境不错，印度人，马来西亚都很多,2020-02-08 00:57:36.547523
,2,10,好好生活日日向前,4.0,2019-12-24,Not Available,鱼尾狮公园位于新加坡河口，是新加坡面积最小的公园，两尊大小鱼尾狮塑像是新加坡的标志。在塑像旁，有供市民和游客休息的看台。在看台上吹吹海风，欣赏滨海湾的曼妙景色，非常惬意。,2020-02-08 00:57:36.550979
,2,10,Chenhutamu,5.0,2019-12-10,Not Available,喷水的鱼尾狮是新加坡的地标，不论是白天还是晚上，总有很多的游客。这里就在新加坡的中心城区，周边吃喝玩乐应有尽有，适合城市休闲游。,2020-02-08 00:57:36.554348
,2,10,挪威森林北辰星,4.0,2019-09-28,Not Available,鱼尾狮公园是新加坡最有名的地标性建筑，这个标志性的鱼尾狮形象今年年初的时候刚刚重现整修完，还听当地司机介绍，这个鱼尾狮的建筑以前不在这里，在另一侧，挪过，有风水的讲究！,2020-02-08 00:57:36.557921
,2,10,辉哥_,5.0,2020-01-29,Not Available,日间游鱼尾狮公园，与夜间看到的滨海湾景色截然不同。在这里即可远眺对面的金沙酒店，还可以看到新加坡著名的榴莲建筑——音乐厅。,2020-02-08 00:57:36.561448
,2,10,正宗情流感,0.0,2020-01-16,Not Available,到新加坡游览，很多游客都知道要去标志性的鱼尾狮拍照打卡。鱼尾狮广场是免费游览的，无门票，这里也是财富的聚集地。那么打卡鱼尾狮公园广场如何拍照？有哪几张照片是必须拍的呢？第一张照片:接水求财鱼尾狮。鱼尾狮公园广场多数时候人山人海，但这张照片一定要拍，站在鱼尾狮侧下方的观景台，双手或者单手上捧，利用视角的错位和拍摄者机位的移动或者被拍人手位置的移动，制造手接住鱼尾狮吐出的发财水，这样就可以“永恒“的把发财水带回家了。第二张照片:手托60亿来福士。漂在海上的船型来福士据说是重庆朝天门来福士的哥哥(一个设计师设计)，价值60亿s，你手托着来福士拍一张，那么就相当于60亿的财富尽在你的手心掌握！你这辈子还愁啥？！第三张照片金融中心为背景拍一张海湾照:金融中心高楼密密麻麻很多(里面又多了好多白领在里面暗无天日的加班赚五位数)，里面的财富也不计其数。这样拍一张照片，整个金融中心都在你身后是你坚强的后盾，为你所用。拍完这三张照片你是不是感觉豪气了很多？！然后去拍拍新加坡的国树:雨树。如果大晴天天气好可以转转广场周边的绿地、建筑等候晚霞，新加坡城市的晚霞非常漂亮，一定会温暖你的全身。我最喜欢这里的清新空气/基本不塞车和法治的执行力度，蓝天白云下走在哪里都很安全，你好~Singapore！,2020-02-08 00:57:39.015446
,2,10,贱行旅志,0.0,2020-01-13,Not Available,"鱼尾狮公园可是是新加坡的标志和象征，我们穿过一条马路，就到了鱼尾狮公园了。好多人都在这里拍照留念，有多人利用错位的方式，拍出喝鱼尾狮喷出的水。狮头代表传说中的“狮城”，至于塑像的鱼尾造型，浮泳于层层海浪间，既代表新加坡从渔港变成商港的特性，非常适合拍照。地址：1FullertonRd,Singapore049213‍交通:新加坡地铁乘坐10、57、70、75等路公交车至FullertonSq站下车。门票：周一到周日全天免费。开放时间：周一到周日全天时间",2020-02-08 00:57:39.021573
,2,10,鱼色小药丸,0.0,2019-12-30,Not Available,新加坡手账 自从名侦探柯南官宣了今年的剧场版，我就天天盼星星盼月亮地盼着，毕竟这可是二十几年来，柯南和基德首次正式联手。更何况，这部剧场版，简直就是新加坡的宣传片，这对于还没去过狮城的我，诱惑不已，立马订下机票，要跟着柯南和基德，圣地巡游一番。 行程安排：Day1：上海——新加坡Day2：赞美广场——旧禧街警察局——福康宁公园——新加坡国家美术馆——鱼尾狮公园——滨海湾花园Day3：环球影城Day4：苏丹回教堂——哈芝巷——小印度——牛车水——星耀樟宜机场——上海 关于新加坡Tips（纯干货）： 新加坡签证，好像有些随意，分为35天单次/多次往返，63天单次/多次往返，半年、一年和两年多次往返签证，至于给你多少天，感觉纯凭运气，我和小伙伴两个人分别送签，我是两年多次，我朋友是两个月多次，嗯……很随意。虽说 新加坡电子签证材料比较简单，但据说对单身女性不太友好，所以送签时我们挺慌的，其实，只要你根据签证处的要求来提供材料，大多没啥问题。 新加坡的地铁还是很方便的，共有5条地铁线路：东西线（绿线）、南北线（红线）、东北线（紫线）、环线（橘黄）、滨海市区线（蓝线），票价根据乘车路程计算，在1-3新币之间，大家只要记住站名和其颜色即可。 新加坡的巴士也很多，上车和下车都需要刷下交通卡。但经实测不是很建议乘，因为巴士的时间不太好控制，班次约6至20分钟一趟。而且乘上巴士后你得随时关注着站头，需要到站前按按钮，不然会错过你所需要去的站头，但有的巴士上又很少报站头。 新加坡交通卡为易通卡（EZ-Link），可以搭乘公交、地铁、轻轨等公共交通工具，每次搭乘地铁使用易通卡会比购买单程票优惠一些。首次购买需支付10新元，其中有5新币的押金，这个押金不能退回。充值的话可以选择地铁站或超市都可，10新币起充，超市的话需要收取手续费。 货币1元新币相当于5元多人民币。新加坡很多地方都可以用支付宝，但是很多街边小店，还是可能会要求用纸币。 喜欢逛超市的，推荐给大家一家新加坡人常逛的超市。Fairprice，本地人也叫NTUC，新加坡最大的超市，大部分24小时营业。,2020-02-08 00:57:39.027867
,2,10,悠悠星空,5.0,2019-08-20,Not Available,非常壮观的一个标志性公园，来自天南海北的游客在这里相聚，这里紧邻着大海，映照着金沙酒店，更显美丽，在周围逛逛海风徐徐非常地惬意。鱼尾狮是一种虚构的鱼身狮头的动物，被新加坡旅游局采用作为标志。,2020-02-08 00:57:39.034478
,2,10,Tom Hung,5.0,2019-10-12,Not Available,位於新加坡河入海口的一處景觀公園，最主要的建築雕塑就是象徵新加坡開國精神的魚尾獅雕像，延海四周則設置了多處觀景平台，餐飲，購物等設施，遊客可於此處欣賞遠處的金沙賭場及新加坡河美景。,2020-02-08 00:57:39.040796
,2,10,刘邦之胄,5.0,2019-10-08,Not Available,这里是新加坡最热门的打卡地点之一，人潮如织，每天都有大量游客慕名而来，只为和鱼尾狮合影，周边有很多价格高昂的酒店，商铺，吃饭的地方也不少。,2020-02-08 00:57:39.047042
,2,10,挪威森林北辰星,5.0,2020-01-03,Not Available,去年去鱼尾狮公园，打算去的时候问了新加坡当地的朋友，说是鱼尾狮公园重新装修，结果说是五月份才开业，然后我就推迟了一个月去的，还是很棒的！,2020-02-08 00:57:39.053120
,2,10,~_~??,5.0,2019-12-10,Not Available,在新加坡鱼尾狮公园游玩，很多人都要拍照留影。其中一景就是到大狮子身后的小狮子附近，去一家狮子冰淇淋店买个小狮子去与大狮子对口型留影。本身天气炎热，吃个冰淇淋也挺好，就是小贵哦。,2020-02-08 00:57:39.059345
,2,10,~_~??,5.0,2019-12-04,Not Available,这个是新加坡必打卡景点，新加坡又叫狮城，这个狮子就是代表景点，雪白的狮子永不停息的喷水，确实很美。站在这里遥望河对岸的金沙酒店，景色宜人。晚上8:00可以看到河上的音乐灯光秀。,2020-02-08 00:57:39.064792
,2,10,我想遇到你,4.0,2020-01-01,Not Available,真的是蛮漂亮尤其是这里的夜景还真的蛮漂亮的，新加坡就是一个花园城市，每一个地方都深深的吸引着人们，而且超级的干净。好想在这里多待一会。,2020-02-08 00:57:39.069526
,2,10,挪威森林北辰星,5.0,2019-12-02,Not Available,今年要去新加坡的，本来定好了行程，然后了解到鱼尾狮公园正在进行大修，果断推迟了一个月再去的，这次去是鱼尾狮公园重新开放的，挺好的！,2020-02-08 00:57:43.589698
,2,10,Mr_Chan陳先生,5.0,2019-08-12,Not Available,鱼尾狮公园位于新加坡热闹的海滨地区，与金沙酒店隔海滨相望。据说是新加坡最小的公园，却是新加坡著名的标志性景点之一。可以说是游客必到打卡地。这里的夜景非常漂亮，值得来逛逛。,2020-02-08 00:57:43.594108
,2,10,~_~??,5.0,2019-12-07,Not Available,鱼尾狮公园是新加坡游必打卡景点。其实就在新加坡河岸边，与著名的金沙酒店隔河相望，狮子不停地吐出水柱，很壮观。游人都在此留影。在大狮子身后不远还有一个小狮子，别错过哦。,2020-02-08 00:57:43.598642
,2,10,M19****904,5.0,2019-09-17,Not Available,鱼尾狮公园景色不错，网红打卡地，标志性建筑物之一，趣味性强，有特色的景点之一，可以在公园里逛逛，吃吃当地的美食和水果，不错哦！,2020-02-08 00:57:43.603239
,2,10,M30****1190,5.0,2019-09-12,Not Available,我是晚上来的，所以仍然能欣赏到河两边的夜景。 适逢金沙酒店晚上8时有水舞秀，在鱼尾狮像看过去可以看到灯光的效果， 晚上有点冷风吹来也是很写意的。,2020-02-08 00:57:43.607782
,2,10,胡大老顽童,4.0,2020-01-02,Not Available,在滨海地区的新加坡鱼尾狮公园，是来这里的游客必须打卡的地方，从我们住的地方可以直接走来，一路人不多，但是到了这个地方人就多了，都是拍照摄影的！白天与晚上各有风情！,2020-02-08 00:57:43.613003
,2,10,M49****629,3.0,2019-11-19,Not Available,鱼尾狮公园，这里是新加坡最为繁华的地带，也是新加坡的地标性建筑，不过说实话这个公园真的不算大，逛完也就花个二十分钟顶多了。,2020-02-08 00:57:43.617305
,2,10,趴在墙头,3.0,2019-08-30,Not Available,对这个国家非常的向往，这次终于有机会来了，然后来到之后首先就观看了你为师，超级美的一个雕塑，看着还蛮可爱的。这个地方是整个新加坡景色最美的景色之一，绝对让你难忘！,2020-02-08 00:57:43.621106
,2,10,o冰凌雨o,3.0,2019-10-10,Not Available,新加坡，地标存在！专程前往，人多啊！寻找C位，开始排队，各种造型，时间有限，各种道具，轮番上阵！给大家附上两张C位区照片（其实还有）到这里个人建议搭地铁或者打车！建议早上来，中午太阳大，不推荐拍照总结，地标存在，推荐旅行的朋友必打卡！！,2020-02-08 00:57:43.624703
,2,10,M31****4522,5.0,2019-09-12,Not Available,"鱼尾狮是新加坡最为著名的景点之一了,是座很大的雕像,半身狮子,半身鱼,然后从嘴里一直喷水,尽管有点俗气,但是一定不可错过呢。周围的公园也很漂亮,最棒的是可以看到滨海以及地标金沙酒店(就是三栋楼,顶上有类似于船一样的建筑连起来)的景观,非常漂亮,实在是令人赏心悦目!",2020-02-08 00:57:43.628071
,2,10,M33****8363,5.0,2019-09-11,Not Available,去之前就在网路上看过很多照片， 结果狮子本人比想像中还大， 我们住在对面的酒店 看过去， 整天不管什么时候都给了满满的人， 所以我们是搭船从船上去看， 一样可以拍出有趣的照片。,2020-02-08 00:57:46.206627
,2,10,渭南松赞干布,5.0,2019-09-06,Not Available,鱼尾狮公园实际是新加坡河出海口临海的一个开放式小公园，这一带是填海建造的，来到新加坡游客都到此处留影。这里有大小两个鱼尾狮雕像，是新加坡标志性建筑，鱼尾狮嘴里有喷泉喷出到海里。雕像处有一个小型舞台，可进行音乐表演。,2020-02-08 00:57:46.212693
,2,10,bjlaoniu,5.0,2019-08-14,Not Available,鱼尾狮公园位于新加坡河的河口，其中一直在喷水的鱼尾狮是新加坡的象征，也是到新加坡旅游必须要去的打卡地。要说这是一个公园，还不如说就是一个以鱼尾狮为主的景点，完全没有我们印象中的那种有山有水或者满是绿树草坪具有很大休闲娱乐空间的地方。据说鱼尾狮公园的夜景最漂亮，可惜我们的旅行团只能在下午到此一游，大家根据导游的建议用手去接了鱼尾狮口中吐出的水，以图平安和发财。这里的游客很多，要找到一个好的拍照位置并不容易。,2020-02-08 00:57:46.218813
,2,10,1361130****,4.0,2019-07-08,Not Available,鱼尾狮绝对是新加坡标志性景点。这里是一个看景的好地方，眼前是湛蓝的海港，跨过大桥就是大榴莲，周围还有很多著名的建筑物。新加坡总理李光耀为鱼尾狮公园剪彩开幕。公园已迁到浮尔顿1号的新家。鱼尾狮公园内设有站台、购物商店和饮食店供游人合照和休息，看台也能变成可容纳100名表演者的舞台，观众坐在阶梯上，就能背靠滨海湾，在星空下欣赏音乐会和精彩的表演。,2020-02-08 00:57:46.223996
,2,10,多多,5.0,2019-04-15,Not Available,这里是比较旅行照的一个景点，基本也可以代表新加坡，算是标志建筑，大家都要用小狮子来凹造型。在这边能看到新加坡几大比较著名建筑：金沙或者大莲花，都可以远观一下下~从这里到教堂的路上还会遇见很多白色建筑，很有外国街头风，所以逛逛大街也是很好滴~总之到新加坡了总要来这里踩一脚，才不枉此行嘛,2020-02-08 00:57:46.228196
,2,10,yi****214,5.0,2019-09-12,Not Available,狮头鱼尾像鱼尾狮大概是新加坡最著名的标志了，来新加坡没和他拍个照仿佛没来过新加坡，我个人是觉得，鱼尾狮公园是个比较适合傍晚过后的景点。,2020-02-08 00:57:46.232042
,2,10,M33****9626,5.0,2019-09-11,Not Available,狮头鱼尾公园是最受欢迎的旅游景点之一。和狮头鱼尾的自拍照是一定要的。我也这么做了。但是要拍出一张完美的自拍照有点困难，因为这里太拥挤了，没什么其它可做的，只是放松一下，欣赏一下水和风景。,2020-02-08 00:57:46.235803
,2,10,M34****4580,5.0,2019-09-12,Not Available,狮头鱼尾像是世界著名的新加坡象征性建筑。从桥走到鱼尾狮喷泉，我们可以看到滨海湾酒店、新加坡剧院、摩天轮、中央银行区和新加坡河，一切看起来都很漂亮。这是一个繁忙的地方，有很多游客在拍照。,2020-02-08 00:57:46.239529
,2,10,M34****0586,5.0,2019-09-11,Not Available,"我喜欢来这里旅游,这是新加坡必去的地方,仅仅只是为了获得照相的机会。狮头鱼尾像非常酷而且整座公园区提供了这座城市令人印象深刻的景点,滨海湾区(Marina Bay)也很好。",2020-02-08 00:57:46.243192
,2,10,M33****3691,5.0,2019-09-11,Not Available,"在鱼尾狮旁边还有一个小鱼尾狮妹妹,但是我不知道这是干嘛的,在我相片里那个的雕像是主要的。圣淘沙岛也有鱼尾狮的吸引点,但是再去看一次吧,因为位于新加坡河的出口处的那个才是你要去的地方。",2020-02-08 00:57:46.246651
