REVIEW_INDEX,WEBSITE_INDEX,POI_INDEX,REVIEWER_NAME,REVIEW_RATING,REVIEW_DATE,REVIEW_TIME,REVIEW_BODY,ATTRIBUTES_CRAWLED_TIME
,2,10,_WeCh****76696,5.0,2017-06-01,Not Available,新加坡著名景点嘛，来到新加坡的人大概都不能免俗。鱼尾狮像公园没有我想象的人山人海，照相相对比较容易。不需要门票，而且地理位置很好，看完直接去金沙购物啦～,2020-02-08 00:59:51.933551
,2,10,徽周,4.0,2018-02-18,Not Available,新加坡标志性公园。必到之处。这次来新加坡恰逢鱼尾狮修缮，被包裹的严严实实，但是小鱼尾狮也亲切可人，四周景观密集，值得一览。,2020-02-08 00:59:51.937396
,2,10,sha****anna,4.0,2018-10-13,Not Available,新加坡旅游签到景点，从酒店一路走过来马上上并没有什么人，到这里瞬间人声鼎沸，简直到了联合国，拍照效果不错，但是并没有很震撼，赶紧拍照走人了！,2020-02-08 00:59:56.172157
,2,10,yi****214,5.0,2018-10-12,Not Available,我们达到鱼尾狮公园的时候，大概9点了吧，人真的很多，而且都是国人、都是跟团游。如果想去鱼尾狮公园好好拍照，建议8点之前到达吧，游人不会太多。,2020-02-08 00:59:56.178258
,2,10,KS炎炎,5.0,2018-07-09,Not Available,新加坡鱼尾狮公园是来新加坡旅游必打卡之地，旁边还有f1比赛的赛道，每年庆典、庆祝新年这里都有活动哦，十分热闹。还可以乘坐观光船，景色一览无余,2020-02-08 00:59:56.184663
,2,10,Kevin,4.0,2018-01-25,Not Available,新加坡鱼尾狮中最出名的一个，号称是鱼尾狮妈妈，还有后面有一个小的鱼尾狮儿子，只要早上九点一到，这里肯定人山人海，要拍照好的角度，需要等待哦。,2020-02-08 00:59:56.190955
,2,10,珊珊Z,5.0,2017-11-21,Not Available,带着好心情，专程造访了坐落于新加坡河畔的地标性标志“ 鱼尾狮公园 ”和世界名狮嬉了会儿水合了个影留个纪念哈…,2020-02-08 00:59:56.197239
,2,10,158****8930,5.0,2017-08-30,Not Available,鱼尾狮像公园正对着滨海湾金沙酒店、是新家坡的地标、来新家坡是一定要到次一游的；夜景非常美！我们是晚上看的夜景、人比较多！,2020-02-08 00:59:56.203583
,2,10,小鱼的狗子,5.0,2018-03-11,Not Available,鱼尾狮公园就位于滨海金沙酒店正对面，它是新加坡地标，因为每年的春节前是惯例的“洗白白”清洗阶段，很遗憾没有见到她，不过周围的港湾景色还是不错的，听说以前还是被雷打烂了重新修缮的！,2020-02-08 00:59:56.209819
,2,10,错了,5.0,2018-01-04,Not Available,公园真的没什么可玩儿的，主要就是看鱼尾狮雕像，毕竟是新加坡狮城的象征，人特别多，想拍个单人照不容易的，白天很热很热，晚上来比较好，有表演有风光，还是很不错的。,2020-02-08 00:59:56.215918
,2,10,M15****345,4.0,2018-07-27,Not Available,鱼尾狮这边的景点有鱼尾狮公园，金沙酒店，滨海花园还有摩天轮。如果安排的好的朋友应该把这几个景点排在一天，交通省事很多。其实新加坡很小。,2020-02-08 00:59:56.221914
,2,10,错了,5.0,2018-01-02,Not Available,鱼尾狮像公园是新加坡的打卡景点之一，新加坡被称作狮城就是因为这个石像，非常小的一个公园，主要就是看这个鱼尾狮像，人特别多，然后我们就在人群中拍了到此一游。,2020-02-08 00:59:56.228060
,2,10,Fafa125,5.0,2017-05-15,Not Available,位于市中心，是标志性建筑物，新加坡必去景点，而且免费的，去的时候人很多，等了很久才拍了几张，如果时间富裕可以多凹一些搞怪的pose。,2020-02-08 01:00:01.070269
,2,10,随风而去蒲公英,4.0,2019-05-31,Not Available,因为临河临海，微风徐徐，在公园里散步也是非常惬意的,2020-02-08 01:00:01.074718
,2,10,咖啡渣,4.0,2018-09-16,Not Available,鱼尾狮的两重形象实乃传神之处，白日晴空，所呈现在您眼前的是一只雄壮威武的雄狮。每到夜晚，在缤纷的霓虹灯和星星点点的渔火的映衬下，鱼尾狮就变成华美而神秘，清新而幽雅的雌狮。,2020-02-08 01:00:01.079115
,2,10,zhangli_zhangli,5.0,2017-08-30,Not Available,哈哈鱼尾狮是免费参观，新加坡的地标，在金沙酒店的对面，游客超级多，但是附近特别适合闲逛，很休闲的感觉。适合各种造型的拍照，很有趣。,2020-02-08 01:00:01.083309
,2,10,e****ye,5.0,2018-05-17,Not Available,很不错的晚上去看的，配上风光吹着风很舒服。可以看周围的夜景还有灯光秀，超级赞，对面就是金沙，每天晚上8点左右开始。还是很不错的。,2020-02-08 01:00:01.087128
,2,10,320****987,5.0,2018-10-12,Not Available,是新加坡的打卡地点之一了吧。人很多，尤其是适合拍照的那里，这个公园很小，附近没什么餐厅，但风景很不错，可以看到对面的滨海湾。,2020-02-08 01:00:01.090720
,2,10,世界美食游走达人,4.0,2018-02-11,Not Available,讲真的，从小就超级喜欢鱼尾狮，小时候，看新加坡的电视连续剧，里面就经常有！现在是第二次来看他了，超级超级happy啊！喜欢。,2020-02-08 01:00:01.094143
,2,10,khcc,4.0,2017-09-02,Not Available,鱼尾狮是新加坡的象征，可以说是不可分离的部分。虽然只是一个小雕像，它是一个重要的景点，大部分人到新加坡必定会到这里拍照留念。,2020-02-08 01:00:01.097750
,2,10,M33****138,5.0,2017-04-19,Not Available,站在鱼尾狮一侧可以欣赏对岸金沙酒店，和摩天轮组成的完美夜景。去的时候游客不是很多，很多人都会在那里拍“喝水”的搞怪游客照，所以很适合和朋友结伴而行，相互帮忙拍照呦。,2020-02-08 01:00:01.101413
,2,10,njcpa000,5.0,2019-04-10,Not Available,非常特别的建筑，气候宜人，人流不断，从特别的角度拍照得到惊喜！值得的花时间花金钱！,2020-02-08 01:00:01.105140
,2,10,杨坤,5.0,2018-08-16,Not Available,鱼尾狮公园，是新加坡最著名的公园，也是最小的公园，这里的游客非常多，鱼尾狮有两条，一条鱼尾狮妈妈，后面还有一条鱼尾狮宝宝。,2020-02-08 01:00:04.610230
,2,10,我麻麻叫我浪子,0.0,2018-12-31,Not Available,蓝天白云，晴空万里。对于我这种出门在外一遇到下雨天莫名想回家的人来说，遇见天气晴，蓝天白云那是格外惊喜可以说。泰国新加坡印度尼西亚，咖喱，肉骨茶、印尼九层塔......寻觅美食的同时，还是很有口福的哟！超级赞！前面说到的天气晴，傍晚也看到了晚霞，染红了整片天空，美极了！来不及拍照，我想这就是传说中的一眼万年吧？记忆里的美，无法抹去！那片天，美翻了！因为对于一个生活在内地的人来说，能看到大海就是幸福、看到美丽晚霞.....自己想象。,2020-02-08 01:00:04.616536
,2,10,甜蜜小乐乐,0.0,2018-11-10,Not Available,"不容错过的五大亲子游首选地新加坡以其独特的地理位置拥有着美丽自然风光，而相对完善的旅游业又为新加坡吸引了大批游客。相对一部分人不知道带着孩子出门旅游应该去哪里，或者怎么玩，玩什么，那么，希望这篇文章能够帮助到你。应有尽有–圣淘沙岛其实进入圣淘沙岛的方式有很多也很方便，可以火车地铁，但是坐缆车更加的好玩有趣。另外这里的娱乐活动非常多，基础设施完善，你总能找到你最喜欢玩的项目，还有就是环球影视城比较适合成年人玩，被称为亚洲最南点的小岛也非常的好玩，适合亲子一起去游玩。时光之翼里面有很多灯火表演，最后的火焰表演是最精彩的。Sea海洋馆是孩子们特别喜欢的一个地方，这里每天早上10点和下午3点都有海豚表演。开放时间:7:00-24:00地理位置:Sentosa Island建议游玩时间:2天经典必去–鱼尾狮公园鱼尾狮公园一直以来热度都非常大，而且鱼尾狮是新加坡的标志性建筑，来新加坡的游客们大多都会打卡这里。因为鱼尾狮不仅代表了新加坡以前的名字，而且还代表新加坡当今的经济发展，另外，这里的鱼尾狮是一座狮头鱼尾的石雕，可以吐出来巨大的水柱，经常有游客在这里拍照。鱼尾狮公园里面有商店，舞台，和饮食店，站台可供人们休息。晚上还有热闹非凡的音乐会，背靠滨海湾的地理位置让鱼尾狮公园的环境更加的优美。开放时间:全天地理位置:1Fullerton Rd singapore 049213建议游玩时间:1-2小时奇幻之旅–新加坡植物园植物园一共有六个大门，一不小心就会迷路。里面确实非常的大，首先去到的地方是白亭，因为有人说，没有去过才亭就相当于没有来过新加坡植物园。还有就是胡姬公园，这里需要另外买门票，是五美元，里面有1000多种兰花，非常的绚丽多姿。另外，带着小孩子的话就一定要来儿童公园了，因为这里是亚洲第一个为儿童专门设计的公园，里面所有植物娱乐设施数不胜数。开放时间:周一至周日05:00-次日00:00地理位置:1 Cluny Rd, Singapore 259569建议游玩时间:4-5小时丛林冒险–夜间野生动物园新加坡的夜间动物园起全球首个夜间野生动物园，这里有2500多个种类的野生动物。最令人值得感叹的是，这些夜间出行的动物都是非常罕见的，你可以在这里带着自己的孩子领略不同动物的习性和故事，还有就是游览夜间野生动物园其实全程都是做缆车的，不能够非常仔细的观察清楚，而且夜间光芒较弱，但是过程也确实非常有趣。开放时间:7:00-24:00地理位置:80 Mandai Lake Road, Singapore 建议游玩时间:1-2小时童年回忆–MINT玩具博物馆MINT玩具博物馆里面的玩具真的是应有尽有了，因为里面收藏了从上世界1930年代到现在的玩具，不同年代的人都能够在这里找到自己的童年回忆。还有就是孩子们对于玩具的幻想和渴望不亚于成年人对爱情的向往，所以在他们还存有童真的年龄，一定要带孩子们来寻找童年的美好，不仅可以圆了他们的梦想也给自己的童年画上完美的句号。开放时间:9:30-18:30地理位置:26 Seah Street, Singapore 188382建议游玩时间:1-2小时新加坡亲子游必去的五个景点已经给你们整理完毕，还在等什么？这里的故事和童年的句号等你来续写。",2020-02-08 01:00:04.622917
,2,10,湖仔变身,0.0,2018-11-07,Not Available,"令人流连忘返的美景众所周知的是新加坡的美景数不胜数。那么，第一次来到新加坡，又不想后悔去到不太好玩的地方，应该去哪里呢？这篇游记可以为你详细的介绍新加坡最火爆的网红景点，让整个旅行更加的意义非凡。经典必去–鱼尾狮公园鱼尾狮公园属于滨海的一个公园，经常有很多来自世界各地的游客，还有很多本地人在这里举办活动，中心有一个大的舞台，可以同时容纳100个演员。还有就是狮子嘴里可以吐水，很多游客在这里进行趣味拍照，鱼尾狮公园内各种服务设施一应俱全。我是在新加坡旅游的最后一天来的，玩的还是比较开心的，因为这里能够完全把心沉下来，还获得了意外的惊喜。开放时间:全天地理位置:1Fullerton Rd singapore 049213建议游玩时间:1-2小时风景宜人–新加坡滨海湾公园新加坡滨海湾公园白天晚上都非常适合去，白天可以在空中走廊，欣赏美丽的自然风光和远处的新加坡建筑物美景，晚上则可以欣赏漂亮的灯光音乐，高耸的彩色建筑物在黑夜里闪闪发光，特别浪漫。另外，我还在滨海湾公园里找到了几处适合拍照的地方，荷花池和金沙湖。荷花池里面的石头也很出境，能够拍出来比较唯美的照片。开放时间:9:00-21:00地理位置:18 Marina  Gardens Drive018953建议游玩时间:1-2小时网红圣地–哈芝巷哈芝巷真的是绝了，第一次来到这里真的是少女心爆棚啊，街道两边全部都是各种各样的精品店。还有国际大牌的soon Lee精品店，里面的小玩意儿都非常的精致，太喜欢了！除此之外，哈芝巷外部的涂鸦也为这里增添了浪漫的气息，非常适合拍照。我觉得如果在这里拍婚纱照的话将会是莫大的幸福。总感觉这里和深圳的较尾场有一点点相似。开放时间:全天开放地理位置:Haji Lane, Singapore建议游玩时间:1-2小时富丽堂皇–滨海湾金沙新加坡的金沙真的只能用富丽堂皇来形容了，因为这里的夜景非常的漂亮。而金沙的灯光秀也是新加坡三大地点之一，每到夜晚，精彩的灯光秀如期而至。白天的话可以去金沙顶部的观景台俯瞰整个滨海湾，不仅可以看到鱼尾狮还可以看到新加坡艺术科学博物馆。艺术科学博物馆是一个荷花型的建筑物，非常的有意思。开放时间:全天开放地理位置:10Bayfront Avenue Singapore ,018956建议游玩时间:2-4小时五颜六色–旧禧街警察局旧禧街警察局位于克拉玛头，旧禧街警察局是一栋有着彩色窗户的建筑物，具有十足的浪漫气息，喜欢拍照的朋友一定要来这里打卡。这里不仅可以看到海湾风景还可以看到很多新加坡的标志性建筑物，在这里可以感受到浓郁的新加坡古朴典雅的气息。如果你第一次来这里，肯定会被惊讶到的。开放时间:9:00-18:00地理位置:140Hill  st 新加坡179369建议游玩时间:1小时左右新加坡的美景远不止如此，但是以上的几个景点绝对是你来过绝对不会后悔的。在这次行程中，我收获了沿途独一无二的风景。临走之际，对新加坡仍念念不忘。如果有机会，下次还要带着家人再来看看。",2020-02-08 01:00:04.629214
,2,10,橘红的天空,0.0,2018-11-02,Not Available,去新加坡必须要去的5个地方有没有最近想去出国旅游，但是没准备多少钱的朋友呢，人生建议，不要走的太远，可以去周边的一些小国家转转，这些国家风景都不错奥，如果你要问那里最适合，那我给你推荐我前段时间刚去的新加坡。颜值什么的一点都不差。而且不用花太多的钱就能让你得到满满的收获感。鱼尾狮公园顾名思义，就是脑袋是狮子，尾巴是鱼。跟狮身人面像一样，听起来奇怪。但是看起来，你就会和我一样。感觉到美感的存在，做成雕塑形状的鱼尾狮形象，在新加坡的人眼里是一只吐水的喷泉，从狮子嘴里喷出来的泉水吸引大部分人打卡拍照。找好角度，拍一张水流进你嘴里的照片，喜感十足，我亲测有效，我回家发到朋友圈，朋友们都来问我。价格：免费开放：全天建议游玩时间：1小时克拉码头曾经以货物运输为主的码头，现在已经全然成为新加坡的美食聚集地，我和朋友上次去把美食尝了个遍。对了，克拉码头要晚上去，因为晚上才会有大部分店面开门。如果周日去的话能碰上古董跳骚市场。回家的时候在这里给家人带一些纪念性的礼品还是不错的，不要光顾着自己吃美食。买古董纪念品时，你也要擦亮眼睛，避免自己被坑，白花钱。价格：免费开放时间：全天建议游玩时间：2-3小时新加坡杜莎夫人蜡像馆听到这个名字你就会马上有印象，咱上海也有。但是这里的有点不一样，我上周在这里如愿的碰到了我喜欢的漫威英雄，还有我们可爱的彭麻麻，众多明星里有也有我喜欢的孙燕姿，天后在这里，你可以有机会跟她合影拍照奥，种类应该要比我们上海的杜莎夫人蜡像馆种类要多，各种政要明星都在这里。总之是好处不多说，推荐大家一定要去转转。价格：210开放时间：星期一至星期三: 早上10:00-下午18:00星期四: 早上10:00-下午17:00星期五: 早上10:00-下午18:00星期六和星期日: 早上10:00-下午19:30建议游玩：2小时滨海艺术中心滨海艺术中心的那个建会让我觉得是一块硕大的榴莲放在那里。实际上这里据说是一只蝇子的复眼的设计结构，考虑建筑的承受之外，又不乏众多的美感。剧院、音乐厅、图书馆在这里都有，我是一个伪文艺爱好者，这里是不可避免要去的一个地方。当然，很多地方都是根据当时的出演方式而售价的。有舞台剧、音乐剧之类都有不同的门票。价格：根据观赏内容定票价开放时间：12：00-22：30建议游玩时间：1-3小时新加坡滨海湾花园满满的绿色会让你觉得这就是植物的天堂，擎天树的出现会让你感觉置身科幻电影，去的时候注意备好衣服，气温很低。记得要带上自己的厚衣服，我上次去的时候没有带好衣服，感觉有点冷。所以在这里给大家建议一下。梦幻的感觉就像是你在游走在梦中一样，特别多的场景给你如梦。赏花、拍照，还能碰到全球最大的室内瀑布，推荐去奥。价格：190开放时间：05:00-次日02:00建议游玩时间：2小时好了，小伙伴们，以上就是我去新加坡游玩的经典的景点。不仅能让你有十足的旅游体验感，而且会让你印象深刻，最重要的是花的钱不多，之所以能做出来这个公盘点，是因为我也觉得特别省钱，建议有想去的朋友最近可以去看看。真的很不错，祝旅途愉快！,2020-02-08 01:00:04.635572
,2,10,血夜痕,0.0,2018-08-09,Not Available,来都来了，还不如来看看咯！说起新加坡，大家第一反应就是内个会喷水的鱼尾狮。作为一个地标性的建筑，鱼尾狮公园也就成了新加坡之旅的必备选项。传说鱼尾狮就是新加坡的象征，新加坡发展的这么好可能都和它有关。拍照圣地↓↓↓↓因为新加坡蛮小的，地标性建筑最出名的也就是这个鱼尾狮，所以这个公园就自然而然的变成了拍照圣地，我和爱人是傍晚的时候从酒店出来遛弯过来的，但是公园里的人还是挺多的，大家都带着专业的三脚架和单反在借位拍照，因为传说鱼尾狮喷出来的水会带来财运和福气。我和老婆也凑了个热闹，但是手机像素拍起来还是不如专业相机。周边建筑↓↓↓↓因为新加坡真的不大，所以地标建筑好像也都在这里扎堆了，比如金沙酒店、维多利亚剧院、还有来福士铜像，可以趁着晚风溜着弯就一口气逛完。TIP↓↓↓↓1.夏季到了，真的要去看鱼尾狮的话尽量不要白天去吧，太晒了，周围也没有遮挡。2.因为我住在附近的酒店，所以走路比较方便，住得远的话搭地铁到来福士站也不远。3.人太多的话可以去找小鱼尾狮像，没必要非得和大的合照。,2020-02-08 01:00:04.641906
,2,10,M48****413,5.0,2018-07-06,Not Available,新加坡鱼尾狮公园位于美丽的新加坡河畔，鱼尾狮公园共有两座鱼尾狮，一座是在河边喷水的鱼尾狮妈妈，一座则是她身后的小鱼尾狮。据说鱼尾狮爸爸是在圣淘沙，他们是新加坡的象征，同时这里也是游客最集中的地方。因为这里向前可以观看金沙大酒店，向后则是新加坡的金融区，是新加坡城市景观最集中的地方。,2020-02-08 01:00:04.647715
,2,10,玲玲子就是我,0.0,2018-07-06,Not Available,来到新加坡一定不要错过的地标景点与它的象征  我来新加坡的第1天就和闺蜜来到了鱼尾狮公园，一来到这个公园就可以看到一头巨大的鱼尾狮面对着前面的河口。我还看到它后面跟着一条小小的鱼尾狮还会口吐喷泉。这个公园里的游客很多，白天的时候没有夜晚的时候好看。我看到鱼尾狮晚上的时候口吐的水柱处会呈现出不同颜色的灯光。  我们还可以在这里和鱼尾狮合影，不过要小心自己的衣服，我在这里与它合影的时候，差点被它的水柱把衣服给淋湿。我在鱼尾狮旁边的台阶上关上周围的夜景，这就像是一个很好的观景台可以把新加坡的夜景都尽纳眼中。我们在这里游览的时候，还看到了好几场魔术表演，还有街头艺人表演新加坡的经典音乐。 在这个公园的前方就是一片海滨，我把公园的美景都欣赏完后，就来到这里吹着海风，在这洁白细腻的沙滩上漫步，感受此刻的静谧与悠闲时光。实用TIPS:1.公园全天开放。2.来这里游览不需要门票。景区地址：One Fullerton Singapore 049213,2020-02-08 01:00:04.652509
,2,10,M51****744,5.0,2017-05-08,Not Available,真的是服了新加坡的天气，逛外景的时候就下雨，进购物店的时候雨就立马停了，鱼尾狮公园的夜景真的是特别的美，秒杀所有的夜景！,2020-02-08 01:00:04.656745
,2,10,kknnss,5.0,2018-04-24,Not Available,新加坡标志性的地方 怎么错过呢 快来和鱼尾狮合影 接接财水吧 听说这一代是风水宝地哦 而且公园还能远望金沙 还能去买lady m,2020-02-08 01:00:04.660359
,2,10,诗意情节,5.0,2018-03-24,Not Available,去鱼尾狮公园打卡，新加坡地标性建筑！滨海湾一带有很多地标 可是最著名的 我想非他莫属了呀。与世界地标建筑的创意合影，我在鱼尾狮喷泉上冲浪。,2020-02-08 01:00:06.757595
,2,10,jankowong,4.0,2017-12-18,Not Available,鱼尾狮是新加坡的地标建筑之一，位于新加坡的市中心，周边都是高级写字楼，类似于香港的中环，正对着金沙酒店和滨海湾花园,2020-02-08 01:00:06.764654
,2,10,110****613,5.0,2017-07-29,Not Available,新加坡标志性建筑，游人也很多。拍照留影是必须的，可以看到金沙、摩天轮。晚上很美，漫步周边很不错。夜景留下了深刻的印象，晚上坐在河畔，吹吹风聊聊天，不错哦！,2020-02-08 01:00:06.771267
,2,10,凌--,5.0,2018-08-12,Not Available,左手太平洋，右手印度洋，亚洲十字路口的新加坡是花园城市的典范，鱼尾狮公园则是这座花园的点睛之处，拍照打卡的时候记得用手或者嘴接住狮嘴喷出的‘’财运‘’哦,2020-02-08 01:00:06.778034
,2,10,不动也动,3.0,2019-04-07,Not Available,封起来了在装修，下月才开放。打卡的话不要白跑一趟了,2020-02-08 01:00:06.785594
,2,10,feiji148,4.0,2018-10-02,Not Available,地标必须一到。。。。。。。。。,2020-02-08 01:00:06.792306
,2,10,小鱼的狗子,5.0,2018-03-21,Not Available,鱼尾狮公园虽然是新加坡的地标！但它是新加坡面积最小的公园，面积只有71平方米。它位于新加坡河口，而新加坡著名的鱼尾狮像就位于这里，吸引了很多人来拍照！,2020-02-08 01:00:06.800300
,2,10,小鱼的狗子,5.0,2018-01-17,Not Available,很漂亮的公园，新加坡花园城市的名片，也是新加坡的CBD所在，游客很多， 有演艺中心，滨海金沙酒店，超级豪华，来新加坡的必来之地。,2020-02-08 01:00:06.806717
,2,10,超凡188,4.0,2017-11-03,Not Available,鱼尾狮公园很小，但却是新加坡的标志性景点，就好像是上海的外滩。这边景色很美，鱼尾狮喷出的水，再加东后面的金沙酒店，看上去十分舒服！,2020-02-08 01:00:06.814532
,2,10,xierita,5.0,2017-06-29,Not Available,步行的终点是鱼尾狮公园，新加坡的标志，到此一游，临海临河的景色极其漂亮，对面就是摩天轮、F1赛道、榴莲大楼。最出名的金沙酒店也在对面清晰可见。,2020-02-08 01:00:06.820866
,2,10,错了,5.0,2018-04-08,Not Available,鱼尾狮公园整体说来没什么特别的，但是这座雕像是新加坡的标志，白天实在是没必要来，很热很热，晚上凉快一点了，再来灯光出来了，五颜六色的美许多。,2020-02-08 01:00:09.847008
,2,10,小鱼的狗子,5.0,2018-02-25,Not Available,鱼尾狮公园里的鱼尾狮是新加坡的标志，它坐落于浮尔顿一号隔邻的填海地带，是新加坡面积最小的公园。这确实是个不错的地方，有了很多，景色也很不错！,2020-02-08 01:00:09.851486
,2,10,D90****87,4.0,2017-09-22,Not Available,新加坡是名副其实的花园城市，而Merlion Park就是这座花园城市地标性的景点，鱼尾狮是一种虚构的神兽，将狮子头和鱼身结合在一起，其一是代表狮城新加坡从渔港变成商港的特性，也是代表了祖辈漂洋过海来南洋谋生的刻苦耐劳。,2020-02-08 01:00:09.856133
,2,10,紅氿,5.0,2018-03-16,Not Available,鱼尾狮是新加坡的标志。新加坡有好几个鱼尾狮，圣淘沙岛上也有。鱼尾狮公园是在本岛的鱼尾狮。一种就是坐鸭子船远距离观赏一下。要不就是要走路玩。,2020-02-08 01:00:09.860478
,2,10,ayx03200,5.0,2017-12-06,Not Available,鱼尾狮公园，一个拍拍照看看景，住不起对面酒店的地方。游客没有想象的人多，40分钟逛完吧。20分钟拍照20分钟溜达。太阳非常晒，记得打伞呦。,2020-02-08 01:00:09.864883
,2,10,此心无障,5.0,2017-06-29,Not Available,弹丸之地的新加坡标志性景点，基本也相当于总统府广场，位置绝佳，就是景观桥一点遮挡都没有，在这北纬一度的赤道国家再经得起晒十分钟也就够瞧咯。,2020-02-08 01:00:09.868766
,2,10,仙人掌海滩,4.0,2019-05-31,Not Available,鱼尾狮公园内设有站台、购物商店和饮食店供游人合照和休息,2020-02-08 01:00:09.872462
