REVIEW_INDEX,WEBSITE_INDEX,POI_INDEX,REVIEWER_NAME,REVIEW_RATING,REVIEW_DATE,REVIEW_TIME,REVIEW_BODY,ATTRIBUTES_CRAWLED_TIME
,2,10,小瞳bb,5.0,2017-07-31,Not Available,晚上去的鱼尾狮，很多游客在拍照，找个拍照的地方不容易。坐船看和近看是两个效果,2020-02-08 01:01:14.613107
,2,10,George Zeng,5.0,2018-02-24,Not Available,鱼尾狮是新加坡的象征，公园在滨海湾，附近是金沙大酒店。这里是外国游客聚集地,2020-02-08 01:01:14.617630
,2,10,300****081,5.0,2017-12-16,Not Available,这里是新加坡地标性建筑。来新加坡必来这里。就是人好多。拍的照像集体大合影。,2020-02-08 01:01:14.622006
,2,10,M39****215,5.0,2017-12-03,Not Available,新加坡的标志，旁边是新加坡河！无论是跟团还是自由行！都必须去的地方！赞！,2020-02-08 01:01:14.626293
,2,10,_M13****0010,5.0,2018-07-28,Not Available,新加坡的标志，虽然去到你可能就认为就这样，但不去到的话就不算到新加坡！,2020-02-08 01:01:14.630488
,2,10,136****1891,5.0,2018-08-31,Not Available,适合晚上去，人不多，喷水狮与金沙酒店、摩天轮、大榴莲和游船相得益彰。,2020-02-08 01:01:14.634383
,2,10,自由的米其林,5.0,2017-07-20,Not Available,小时候对新加坡的印象就是这个鱼尾狮，如今终于现场看到了，感觉时间好快,2020-02-08 01:01:14.638187
,2,10,wang1985_,5.0,2017-06-13,Not Available,景色很美，对面就是金沙，背后是金融城，晚上来看看激光秀，真的不要太美,2020-02-08 01:01:14.641940
,2,10,高级中学222,3.0,2017-06-11,Not Available,一般。在我脑海里只觉得是新加坡城市的一个标志而已。拍个照留作纪念吧！,2020-02-08 01:01:14.645770
,2,10,李琦Lee,5.0,2017-05-22,Not Available,鱼尾狮是新加坡的地标，到了新加坡旅游必须要去的地方。鱼尾狮喷的水，可以做张嘴和手托的姿势来拍照，寓意是聚财。,2020-02-08 01:01:18.166330
,2,10,298****152,3.0,2018-05-12,Not Available,鱼尾狮像公园这边是游客最集中的地方去新加坡的人没有不去，这个地方的,2020-02-08 01:01:18.171173
,2,10,M39****102,5.0,2018-01-23,Not Available,和金沙广场在一起 榴莲大剧院 还有好喝的甘蔗汁,2020-02-08 01:01:18.176148
,2,10,贝菲特LISA,5.0,2017-12-03,Not Available,这个是必去的地方。感叹一下人生，与大陆之间的距离就是辣么大辣么远！,2020-02-08 01:01:18.181155
,2,10,shower915,5.0,2017-05-27,Not Available,新加坡的标志，当然，人山人海，想要照出高逼格的照片得动动脑筋才行。,2020-02-08 01:01:18.185657
,2,10,QQQQQQQQ27,5.0,2017-01-18,Not Available,去的時候剛好下午，超級多人在那裡照相～講真，這個魚尾獅並沒有很大～比想像中小，而且白天如果天氣不好拍出來效果也不好，如果晚上能再來一次的話是最好～,2020-02-08 01:01:18.189664
,2,10,bjMichelle,5.0,2017-07-10,Not Available,景色不错，就是人多，都在拍照，免费开放，代表性景点，还是值得去的,2020-02-08 01:01:18.193380
,2,10,凤凤吖吖,5.0,2017-05-14,Not Available,鱼尾狮很亲切，跟那么多人合影都很配合，不害羞 著名的狮头鱼身像就面对这个海湾。这分秒不同的晨曦，很像这座力争上游，不断求变求新的城市。,2020-02-08 01:01:18.196888
,2,10,wann5200,5.0,2017-03-17,Not Available,新加坡的标志，24小时都在喷水，门票免费，所以拍照的人很多。大家都在错位拍照，回来发现只有给儿子拍的那张最满意。在金沙酒店起床看，早上人相对少很多，所以大家尽量避开下午和傍晚的高峰期。,2020-02-08 01:01:18.200258
,2,10,njcpa000,5.0,2018-03-22,Not Available,很棒也非常有特色的景点 特别是有几个角度照相特别喜欢,2020-02-08 01:01:18.203749
,2,10,起跑,5.0,2018-01-19,Not Available,这是一个让人去了还想去的国度，干净，安全，几乎游遍了所有景点。,2020-02-08 01:01:19.944521
,2,10,231****152,5.0,2017-11-01,Not Available,市区免费景点，打卡必到处，人多拍照靠技术，游览时间半小时足够了,2020-02-08 01:01:19.949259
,2,10,布良斯克夫差,5.0,2017-04-06,Not Available,新加坡标志性建筑 地理位置优越 周边酒店 商场 餐饮娱乐设施众多 鱼尾狮公园正对新加坡六星级金沙酒店 公交和地铁都方便到达,2020-02-08 01:01:19.953902
,2,10,子龙糖糖,5.0,2017-03-31,Not Available,鱼尾狮像坐落于市内新加坡河畔鱼尾狮公园内，是新加坡的标志和象征。高8米的狮子囗中喷出一股清水，汇入新加坡河中，每年有一百多万游客专程来此观看。,2020-02-08 01:01:19.958624
,2,10,320****249,4.0,2016-10-06,Not Available,开放的新加坡特色经典景点，是在旺季去的，游人非常的多，大家各种pose摆拍，要想避开人群找点不容易哦和周围环境很好的协调。,2020-02-08 01:01:19.963177
,2,10,summer139771,3.0,2018-03-28,Not Available,不花钱的广场，我们从金沙商场坐游船过去，6新币，拍照的人很多,2020-02-08 01:01:19.967186
,2,10,可可小小盆友,5.0,2017-11-15,Not Available,美，漂亮，特别是晚上！强烈推荐！！！！！,2020-02-08 01:01:19.970899
,2,10,阳光丫鬟,5.0,2017-10-02,Not Available,第一天在东海岸吃完晚餐第一站便是这鱼尾狮公园，让我感受最深的便是这城市的干净，空气清新，人们热情友好。这里的夜景很漂亮，先生的摄影技术杠杠哒,2020-02-08 01:01:19.974979
,2,10,njcpa000,5.0,2017-05-14,Not Available,必须回去的新加坡景点，如果走路过去，可以靠近了拍照，很有特点,2020-02-08 01:01:19.978728
,2,10,GrandLine,4.0,2017-04-07,Not Available,狮城的地标性景点，游人很多。对这个喷水狮子的最早印象来自于上世纪八十年代后期的一部新加坡电视剧《狮城勇探》，很多同龄和年长的都应该能想起来。,2020-02-08 01:01:19.982389
,2,10,juki235,5.0,2016-10-22,Not Available,鱼尾狮公园是新加坡的中心区域，这里可以看到新加坡的象征喷水的鱼尾狮，据说河边喷水的是狮妈妈，后面一只小的是狮宝宝，而狮爸爸则是圣淘沙的那只。,2020-02-08 01:01:23.586524
,2,10,0331小羊,5.0,2018-01-20,Not Available,位于市内新加坡河畔，里面有鱼尾狮像，是新加坡的标志和象征。,2020-02-08 01:01:23.591221
,2,10,_M13****8760,5.0,2017-08-11,Not Available,比想象的小点，在此看湾曲风景还是很好的,2020-02-08 01:01:23.595630
,2,10,litua,4.0,2017-02-26,Not Available,这是去新加坡必去的景点之一。但是也只是和鱼尾狮合影而已，背面就是金沙酒店和大榴莲，拍照还是非常不错的。就是天太热，走走比较累。还是推荐的。,2020-02-08 01:01:23.599760
,2,10,52****528,4.0,2018-01-24,Not Available,22日去的，没看到鱼尾狮，在修复中唉,2020-02-08 01:01:23.603899
,2,10,閬苑振豪,4.0,2017-06-11,Not Available,這裡值得去，位於海濱旁邊，夜景最美！,2020-02-08 01:01:23.607897
,2,10,肥肥安大王,5.0,2016-11-18,Not Available,金沙酒店、新加坡眼的对面，旁边全是写字楼。餐厅晚上的生意很好，游客络绎不绝。离老巴刹很近。新加坡地标之一。无论白天还是晚上景色都是超赞的,2020-02-08 01:01:23.611791
,2,10,Pinky Deng,5.0,2016-07-28,Not Available,这里适合拍照跟吃东西，虽然吃的挺贵的。一碗米饭新币1元，相当于人民币5元一碗啦，小小的呢。不过那壶椰汁跟那盆炒蟹真的炒鸡赞，重点吃饭的环境啊，这里的夜景真美，对面就是金沙酒店。,2020-02-08 01:01:23.615439
,2,10,散落的玫瑰,5.0,2018-05-21,Not Available,新加坡的标志性景点，就在市中心，肯定要去看看。人很多。,2020-02-08 01:01:23.619138
,2,10,翱翔的大鲨鱼,4.0,2018-02-18,Not Available,每年的中国新年大年初一初二在这里会有烟花汇演非常漂亮。,2020-02-08 01:01:23.622765
,2,10,楚奥茨宇文泰,5.0,2018-01-06,Not Available,看到了漂亮的鱼尾狮，好大好壮观，还有一个鱼尾狮的孩子。,2020-02-08 01:01:25.350834
,2,10,散落的玫瑰,5.0,2018-03-27,Not Available,免费的经典，有人很多，就在市中心的公园里，紧贴海边。,2020-02-08 01:01:25.357017
,2,10,阿里巴第二代,5.0,2017-06-24,Not Available,鱼尾狮像公园很有名气，早年新加坡对外宣传片得原景地。,2020-02-08 01:01:25.363395
,2,10,M11****786,5.0,2017-05-10,Not Available,这个公园就是看鱼尾狮身像喷水，远处的金沙酒店，艺术馆和大榴莲，这些景色配在一起就美了。鱼尾狮拍照的人超级多，各种怪异的拍照姿势都有。,2020-02-08 01:01:25.369809
,2,10,300****391,4.0,2018-04-30,Not Available,建议还是晚上来吧没有绿树很晒，拍张照就走了景色不错,2020-02-08 01:01:25.376034
,2,10,散落的玫瑰,5.0,2018-03-12,Not Available,新加坡的地标性建筑，来旅游的人都会到这里来看一看。,2020-02-08 01:01:25.381792
,2,10,SISISIY,5.0,2017-12-13,Not Available,这里白天和夜景都很漂亮，难怪来到新加坡是必到之处哦,2020-02-08 01:01:25.386713
,2,10,zhen****109,4.0,2017-08-30,Not Available,鱼尾狮像公园，这个公园太出名啦，他是新加坡的相征。,2020-02-08 01:01:25.390838
,2,10,PortiaJX,4.0,2017-07-04,Not Available,7月的新加坡每周六晚上都会在滨海湾浮动舞台上空燃放国庆节烟花，进行新加坡国庆节晚会的预演。鱼尾狮公园就是最好的观赏烟花的地点之一。,2020-02-08 01:01:25.394635
,2,10,E41****51,4.0,2017-03-16,Not Available,新加坡的标志物，人很多。很难找到一个没人的角落拍照。地铁可以到，交通很方便，景色也不错。就是没有遮阳的地方太晒了。一定做好防晒措施,2020-02-08 01:01:25.398134
,2,10,109****038,5.0,2016-04-14,Not Available,空气好，景色宜人，周围环境好，街道整洁，很适合家庭旅游的景点。在这里可以看到世界各地的朋友,2020-02-08 01:01:29.813420
,2,10,186****0022,4.0,2017-12-09,Not Available,新加坡必到的景点之一，好多人都在照张嘴接水的照片,2020-02-08 01:01:29.818511
,2,10,上海市民,4.0,2017-09-14,Not Available,特色总是要去看看，拍了很多搞怪的照片还是很开心的,2020-02-08 01:01:29.823395
,2,10,jessica,4.0,2017-05-26,Not Available,新加坡最小的公园，鱼尾狮是新加坡最具标志性的建筑,2020-02-08 01:01:29.827905
,2,10,南星话邮轮,5.0,2017-03-31,Not Available,新加坡的地标，总是游人如织，对面是金沙酒店，景色非常美丽，背后是城市风格建筑群，许多中国团队会在这边集中，狮身鱼尾像是留影重点。,2020-02-08 01:01:29.832089
,2,10,散落的玫瑰,5.0,2018-09-28,Not Available,这里是新加坡的标志性建筑，有人都会来这里拍照。,2020-02-08 01:01:29.836312
,2,10,蒂尔尼茨侯景,5.0,2018-05-06,Not Available,像外滩胜过外滩，景色好，空气新，灯光秀非常美！,2020-02-08 01:01:29.840361
,2,10,SISISIY,5.0,2017-10-11,Not Available,象征新加坡的雕像，让世界认识这个充满活力的国土,2020-02-08 01:01:29.844303
,2,10,Lily劉,4.0,2017-07-03,Not Available,等于是新加坡的特色，不錯，我覺得晚上去會漂亮些,2020-02-08 01:01:29.848047
,2,10,George Zeng,5.0,2017-06-05,Not Available,一个地标喷水鱼尾狮，人造景观但是是新加坡的符号,2020-02-08 01:01:29.851557
,2,10,1y2g3q,5.0,2018-10-26,Not Available,新加坡鱼尾狮公园真心不错，游客必去的网红景点,2020-02-08 01:01:31.941550
,2,10,M25****8528,5.0,2018-01-14,Not Available,这里游客太多了 很多跟团的都来这里,2020-02-08 01:01:31.947818
,2,10,dnx66,5.0,2017-12-02,Not Available,这里是去新加坡旅游必去的传统景点，环境不错。,2020-02-08 01:01:31.954470
,2,10,sunnycccc,5.0,2017-08-19,Not Available,这里超级多的游客 大家都来这儿拍照,2020-02-08 01:01:31.960829
,2,10,231****152,5.0,2017-03-26,Not Available,游客超多，找个拍照的地方都不容易，建议早晨七点左右到。MRT莱福士坊下，沿着新加坡河往滨海艺术中心方向走五分钟就到，景色不错,2020-02-08 01:01:31.966988
,2,10,m90****93,5.0,2018-05-20,Not Available,新加坡的地标建筑，到新加坡必去之地，人很多,2020-02-08 01:01:31.973089
,2,10,xu****369,4.0,2017-10-03,Not Available,景色不错，但是新加坡小了一点，环境很不错的,2020-02-08 01:01:31.979073
,2,10,JOY妈妈,5.0,2017-08-26,Not Available,跟着导航走过去，很多人在拍错位，很有意思。,2020-02-08 01:01:31.985022
,2,10,231****152,5.0,2017-04-04,Not Available,新加坡地标，免费公园，游客超多，如果想要拍个好照片那就要早点去，避免镜头里全是游人。公园里有两座鱼尾狮，一大一小都会喷水哦,2020-02-08 01:01:31.991051
,2,10,小丸子老可爱,5.0,2017-02-14,Not Available,新加坡的地标，到达新加坡后直接来到这里。好多来自世界各地的游客都在这里拍照。新加坡很小很多有名的景点在这里都可以看的到哦。,2020-02-08 01:01:31.996614
,2,10,这家伙很懒,4.0,2015-09-13,Not Available,我们去时候游人不是很多，大多数人都与鱼尾狮像合影，有接财的。更多人是因为它定新加坡标志，我们不能幸免脱俗，只能入乡随俗吧。,2020-02-08 01:01:36.459803
,2,10,游侠半仙,5.0,2018-11-30,Not Available,鱼尾狮像公园人流如织，景色宜人！,2020-02-08 01:01:36.465882
,2,10,杨坤,4.0,2018-11-29,Not Available,鱼尾狮公园，在新加坡河口，中心位置就是鱼尾狮雕像，高8米多，重达70吨，是已故的新加坡著名工匠林浪新先生用混凝土制作的。,2020-02-08 01:01:36.472166
,2,10,yg小小兔,4.0,2018-10-06,Not Available,就是在拍照，环境很好！算是标志性的景点！,2020-02-08 01:01:36.478479
,2,10,00****753,5.0,2018-10-06,Not Available,新加坡的最标志，来这里是一定要来看看的。,2020-02-08 01:01:36.484796
,2,10,M41****336,5.0,2018-06-01,Not Available,新加坡市中心的公园，地方不大，但是有地标的建筑,2020-02-08 01:01:36.491050
,2,10,tigerie,5.0,2018-05-31,Not Available,鱼尾狮像是新加坡的标志和象征，印象很深。,2020-02-08 01:01:36.497466
,2,10,蓝色星球的行者,5.0,2018-05-30,Not Available,非常值得到此一游的公园，这是一个非常小的公园，就在新加坡河畔，福尔屯酒店对面，不过他却有个非常标志性的雕塑，新加坡的logo鱼尾狮，而且本人看法，这是最漂亮一个鱼尾狮了，周遭环境也非常适合取景拍照。,2020-02-08 01:01:36.503731
,2,10,ccjccj,4.0,2018-05-29,Not Available,地标性景观，一大一小两只鱼尾狮，人很多。背后超多摩天大厦，蛮壮。,2020-02-08 01:01:36.509799
,2,10,gin-,5.0,2018-02-15,Not Available,鱼尾狮动不动就修一下 很难过☹,2020-02-08 01:01:36.515232
,2,10,aw1122,5.0,2018-01-31,Not Available,游客多，标志性建筑物，是坐着鸭子船去看的,2020-02-08 01:01:41.050651
,2,10,M21****474,5.0,2017-08-05,Not Available,漫步于湖边，吹着风、看着美景，非常值得！,2020-02-08 01:01:41.055214
,2,10,M36****659,5.0,2017-05-29,Not Available,新加坡的标志性景点之一，代表新加坡形象的鱼尾狮吐出强劲有力的水柱。公园不大，一般都是四面八方的游客。因为临河临海，微风徐徐，在公园里散步也是非常惬意的。而且金沙，摩天轮等景观在这里，尽收眼底，美不胜收！这些景点，早晨、中午、晚上，都不一样，有“秋水共长天一色，落霞与孤鹜齐飞”的画面；也有群雄逐鹿，争先恐后抢拍的场景；也有“夕阳西下，断肠人在天涯”的纯美；还有“夕阳无限好，只是近黄昏”的惋惜之美；还有“漫江碧透，百舸争流”的景象。总之，你一天当中，都可以在这里度过，不会感到枯燥、疲倦，只会感到一天的时间太短暂！,2020-02-08 01:01:41.059582
,2,10,JC爱旅行,5.0,2017-05-19,Not Available,地标，到此一游的性质，不过看起来挺可爱的,2020-02-08 01:01:41.063887
,2,10,鱼眼看天下,5.0,2017-03-04,Not Available,一年一度的照亮滨海湾（i-Light Marina Bay）在3月3日晚上拉开序幕啦，鱼尾狮又被装扮了缤纷色彩，这样的夜晚只持续20多天哦，一直到3月26日，想看七彩鱼尾狮的朋友，动作要快哦，建议星期一-四晚上来，周末太多人了。,2020-02-08 01:01:41.068095
,2,10,河糖月色,5.0,2017-02-05,Not Available,导游领我们来到这里介绍说，这个公园有个古老的传说，在14世纪的时候，有一位不知道是哪国来的王子远渡重洋来到新加坡，登陆的时候看到一只异常美丽的狮子，惊为天狮，随即将这片土地命名为新加坡，据导游说夜晚的公园也非常的美丽。,2020-02-08 01:01:41.072123
,2,10,justinwang1987,5.0,2017-01-18,Not Available,提到新加坡 你一定第一印象第一反应就是鱼尾狮的雕塑了 这里有两个 一个大的就是往海里吐水柱的 这里好多人呢 所以如果一个人 就找人帮你留影吧,2020-02-08 01:01:41.075884
,2,10,殷姨,4.0,2016-12-10,Not Available,鱼尾狮公园，大批旅行团必来的景点，当然也不能免俗，很多人喜欢在这里寻找拍照的角度，可以怕出很有趣的图片。鱼尾狮公园的酒吧街里有一家鼎鼎大名的甜品店&#160;Lady&#160;M。吃货们绝对不要错过啊。,2020-02-08 01:01:41.079640
,2,10,汤姆猫大王,4.0,2016-11-04,Not Available,鱼尾狮像，顾名思义，上半身是狮子，下半身是鱼，新加坡别称狮城，吐水的“鱼尾狮”雕像是新加坡的精神象征。又是新加坡的象征。所以，鱼尾狮景点有多少人看，几乎是人人必到的景点，想拍一张全景的鱼尾狮照片是有多难。,2020-02-08 01:01:41.083345
,2,10,Toshihiko,5.0,2016-10-05,Not Available,鱼尾狮公园内设有站台、购物商店和饮食店供游人合照和休息，看台也能变成可容纳100名表演者的舞台，观众坐在阶梯上，就能背靠滨海湾，在星空下欣赏音乐会和精彩的表演。鱼尾狮公园的两尊大小鱼尾狮塑像是已故新加坡著名工匠林浪新先生用混凝土制作的。,2020-02-08 01:01:41.086984
,2,10,leon,4.0,2016-08-29,Not Available,鱼尾狮雕塑是新加坡的象征，一直是期待已久了的。因此，来新加坡一定要来鱼尾狮看看。在出过午饭以后的时光，来了。旁边也还是可以逛逛，车在树荫底下停下来以后。听导游讲这里有一家卖冰砖的口味不错！就去试试，他卖的冰砖有各种水果口味的，的确口感可以的。就在这座桥的附近，喜欢的朋友可以一试。因为正好是国内的公众假期来的，因此游人不算少，拍照还是要时间排队的。但真的很有意思的一个雕塑。近看。新加坡的空军在庆祝节日。一眼望过去河对岸的风光！天气还算可以的。只是阳光没有了。周边饮食：有一些饭馆，但离景点远些。周边交通：地铁绿线、红线：莱佛士坊站。总的来讲，建议来新加坡这个景点不要漏掉，个人觉得很不错的一个景点。,2020-02-08 01:01:42.711702
,2,10,M58****21,4.0,2016-05-31,Not Available,新加坡必游景点之一，也是我到新加坡的第一站，不收费，非常适合拍照。,2020-02-08 01:01:42.718237
,2,10,云游四海翁,4.0,2014-05-15,Not Available,鱼尾狮公园是新加坡面积最小的公园，面积只有71平方米。它位于新加坡河河口，而新加坡著名的鱼尾狮像就坐落于新加坡河畔，是新加坡的标志和象征。该塑像高 8 米，重 40 吨，狮子口中喷出一股清水，是新加坡的地标，也是新加坡旅游的必到之处。,2020-02-08 01:01:42.725094
,2,10,爱爱李,4.0,2018-07-25,Not Available,鱼尾狮公园有着很标志性建筑，鱼尾巴狮子,2020-02-08 01:01:42.732110
,2,10,M22****532,5.0,2018-03-06,Not Available,景色很美，特别喜欢，性价比超高还有趣味,2020-02-08 01:01:42.738492
,2,10,沐沐汎,5.0,2018-01-29,Not Available,很有名的公园哦，风景也不错，不错的体验,2020-02-08 01:01:42.745867
,2,10,梁先森,5.0,2018-05-03,Not Available,旅游好去处，大家有机会可以去看看吧。,2020-02-08 01:01:42.752547
,2,10,205****976,5.0,2017-10-26,Not Available,游客必到的景点，可惜去时正好没喷水。,2020-02-08 01:01:42.760117
,2,10,诗意情节,5.0,2016-12-01,Not Available,一早的新加坡下了点雨，拍的照片有点暗沉。不过好累 懒得p图了~丝毫不影响他的美呀。鱼尾狮公园，狮爸爸和狮儿子哈哈哈 还找到组织拍了个合照,2020-02-08 01:01:42.767070
,2,10,jackie75,5.0,2016-10-17,Not Available,鱼尾狮就是新加坡的标志呀，每个人一说到新加坡第一就是想到这个鱼尾狮吧，这是到新加坡必到的地标，大家都一定会来和它合个影，不需要门票，是公众景点，来凹个造型吧,2020-02-08 01:01:42.774002
,2,10,djrlysc,5.0,2018-08-12,Not Available,标志性建筑，人也不少，拍照完了就走,2020-02-08 01:01:46.529598
,2,10,139****1880,5.0,2018-02-20,Not Available,新加坡标志性建筑物，游客必打卡之处,2020-02-08 01:01:46.534330
,2,10,286****615,5.0,2018-02-03,Not Available,哈哈哈必去景点，拍照就算来过了哈哈,2020-02-08 01:01:46.538793
,2,10,山东游子,5.0,2018-03-23,Not Available,新加坡必去景点，狮城的象征。。。,2020-02-08 01:01:46.543101
,2,10,晚night,5.0,2018-03-02,Not Available,新加坡经典，鱼尾狮喷水，必游景点,2020-02-08 01:01:46.547324
,2,10,M41****892,5.0,2017-10-03,Not Available,新加坡的地标建筑，很大，很现代。,2020-02-08 01:01:46.551617
,2,10,viv****w77,5.0,2017-08-15,Not Available,没什么好说的，必来的地方嘛。不错,2020-02-08 01:01:46.555460
,2,10,M21****710,4.0,2017-05-19,Not Available,这个几乎已经成为了新加坡的标志！,2020-02-08 01:01:46.559193
,2,10,288****028,4.0,2018-06-25,Not Available,白天晚上风景都不错，但是人多。,2020-02-08 01:01:46.562927
,2,10,shower915,4.0,2018-05-03,Not Available,新加坡的标志。当然人也非常多。,2020-02-08 01:01:46.566801
,2,10,ziguijiang,5.0,2018-02-19,Not Available,这座城市标志性景点，值得观看。,2020-02-08 01:01:50.454537
,2,10,frpviking,5.0,2017-06-13,Not Available,新加坡标志性的建筑，城市标签。,2020-02-08 01:01:50.459463
,2,10,一一仔,4.0,2017-05-13,Not Available,很小的公园，仅是打点拍个照而己,2020-02-08 01:01:50.464319
,2,10,秀峰翠谷,5.0,2017-02-21,Not Available,新加坡标志，旅游必去景点。遥望三桅巨帆金沙酒店，近处湖面上泛着点点白帆。巨大的鱼尾狮矗立在湖边，突突地吐着养育南洋的生命之水。（不过都被玩坏了）。,2020-02-08 01:01:50.469158
,2,10,MISS-SI,5.0,2017-03-02,Not Available,从教堂一路走过去，路上还能碰到卖很有名的雪糕的地方，从桥下面走比较方便，因为是必游景点，超多人在那拍照，如果你够有创意，pose就能吸引一大片人,2020-02-08 01:01:50.473614
,2,10,118****528,4.0,2017-02-06,Not Available,因为酒店离鱼尾狮不是很远，所以有幸白天和晚上都顺路看了一下，感觉在晚上灯光的衬托下更加显示出新加坡的繁华。白天游人很多，不如晚上感受一下他的别样,2020-02-08 01:01:50.477821
,2,10,SweetieVV,5.0,2018-02-07,Not Available,围着金沙地标go green 实在很惬意！,2020-02-08 01:01:50.481812
,2,10,悠悠游,4.0,2016-12-11,Not Available,在克拉码头吃完晚饭，沿着新加坡河走到滨海湾，金莎在晚上更加好看，八点有灯光秀，河边有自娱自乐唱歌的，还有表演的，这里是我在新加坡最喜欢的地方。,2020-02-08 01:01:50.485676
,2,10,糖灵,5.0,2016-08-28,Not Available,鱼尾狮像坐落于市内河畔的鱼尾狮公园内，是新加坡的标志和象征。塑像由雕刻家林南先生和他的两个孩子共同雕塑完成，每年来自全球的众多游客都会专程造访鱼尾狮公园，与世界著名的鱼尾狮拍照留念。,2020-02-08 01:01:50.489258
,2,10,唐旋看见,5.0,2016-12-16,Not Available,有位在新加坡生活了六十多年的亲戚告诉我，之所以在这片繁华中几乎见不到也找不到乞丐，一是因为政府提供的优厚福利，二是当地的教会一直在寻找和关注路边的乞丐。如有发现，教会将为他们提供免费的住宿和食物直到终老。即使如此，这些免费的名额从未满员甚至有些空闲。,2020-02-08 01:01:50.492721
,2,10,M19****904,5.0,2016-09-01,Not Available,新加坡有代表性的标志之一，景色不错，适合旅行与观赏，趣味性强，繁华地段，人流量也很多，周边当地的小吃街也不错，味道鲜美，便宜，性价比超高的。,2020-02-08 01:01:53.558445
,2,10,花洋甜心,5.0,2017-02-04,Not Available,我们的旅行团赶到这里时已经是晚上了，感觉到夜幕下的鱼尾狮，有着背景灯光的映衬显得这个城市非常的繁华，这也是新加坡最繁华的地段，各种金融中心与高楼林立，看到这里想到了上海的陆家嘴。,2020-02-08 01:01:53.564832
,2,10,Moka,4.0,2016-09-11,Not Available,鱼尾狮像公园，里面有新加坡的地标和象征-鱼尾狮像，很小的一个狮像，但是过来游览的人可是真多，很多人在这里拍照，这座狮子象征着吉祥，附近也有很多地标的建筑，来新加坡必来之地。,2020-02-08 01:01:53.571240
