REVIEW_INDEX,WEBSITE_INDEX,POI_INDEX,REVIEWER_URL,REVIEW_ID,REVIEW_DATE,REVIEW_RATING,REVIEW_TITLE,REVIEW_BODY,DATE_OF_EXPERIENCE,TRIP_TYPE,REVIEW_CRAWLED_TIME
,1,43,https://www.tripadvisor.com.sg/Profile/sck007,645170245,11-01-2019,5,History brought to life,"As others have mentioned, I stumbled across this while walking through Chinatown. It was fantastic. The audio tour really brings the lives of everyday people to life - the good, the terrifying and the mundane. At first, I thought that the displays were from the turn of the century - early 1900's maybe; but no, many of the displays are from the 1950's. I was shocked at how recent the history was.",09-2018,Solo,2020-01-30 10:08:55.257810
,1,43,https://www.tripadvisor.com.sg/Profile/dlam626,644148294,07-01-2019,5,Step Back In Time,"With limited time remaining in the city, I was on the fence about visiting this museum, but I am SO GLAD I did. This museum was amazing and a true step back in time to the beginning of Singapore. They are very detailed and thorough in their depiction of what it was like as a Chinse immigrant as Singapore was developing and it didn't shy away from the sometimes harrowing and grim parts of life in that time.

The museum is well organized and is easy to navigate with the audio guide. They also give guided tours at certain times. If you're a few minutes late I believe you can still join the tour.

If you're interested in history and culture, don't miss this.",12-2018,Solo,2020-01-30 10:08:55.566282
,1,43,https://www.tripadvisor.com.sg/Profile/439sonjaw,642150127,29-12-2018,5,Fascinating tour,"The Chinatown Heritage Centre offers a tour of former shop houses. The tour was one of the highlights of my visit to Singapore and proved to be very educational. The cubicles that show how people used to live in such reduced space were well presented, and the audio guide offered informative content. Well worth visiting.",12-2018,Solo,2020-01-30 10:09:01.417904
,1,43,https://www.tripadvisor.com.sg/Profile/KiwiTravelers,640060576,17-12-2018,5,Wonderful immersive museum,"I never planned going to this museum during my visit to Singapore but walked past it as i was strolling through Chinatown, but I am so glad i did.

This museum documents the story of Chinese immigrants a their descendants to Singapore. The entry ticket includes an audio guide which assists with the interpretation.
My favourute part of the museum was level 1 and 2 where they had recreations of how people lived. It really helped illustrate the hardship that much of the early chinese population had to endure to survive.

It was really immersive and interesting. At times though the audio guide was a bit long.

The floor above this one focused on the early chinese settlers and what they had endure coming across from china. It also looked at what customs and culture they brought with them.
The final section looked at what it means to be chinese today.

I thoroughly recommend you check out this museum. Not only is it educational but it's fun! But set aside a minimum of 2hours, there's alot to look at and read.",12-2018,Solo,2020-01-30 10:09:01.801194
,1,43,https://www.tripadvisor.com.sg/Profile/Stephanie G,640052048,17-12-2018,5,History buff and details to be observed,"Love all the stories lined up in this centre. To observe and study the various items existing through time from beyond decades, one wonders how the landscape of Singapore has changed.",12-2018,Solo,2020-01-30 10:09:02.156830
,1,43,https://www.tripadvisor.com.sg/Profile/S P,633886858,17-11-2018,5,Amazing experience,I've walked past this place the other two times I came to Singapore by myself and never really thought about it but this time I thought I would go in and see what it had to offer. You have the choice of going around yourself with an audio guide or paying a little bit extra for a real guide. I like the flexibility of the audio guide however and the instructions are easy to follow. They have laid out the museum in the style of living back when Chinatown was first developed and how each profession/ethnic group lived. It was a fascinating experience and best of all - in air conditioning!!! Highly recommended.,11-2018,Solo,2020-01-30 10:09:02.486683
,1,43,https://www.tripadvisor.com.sg/Profile/susanwebster6,626869259,21-10-2018,5,Interesting and informative tour!,Thoroughly enjoyed learning about the history of the early Chinese immigrants’ stories via the audio-tour. Very well done!,10-2018,Solo,2020-01-30 10:09:02.828370
,1,43,https://www.tripadvisor.com.sg/Profile/Tour726245,620103963,28-09-2018,5,Sobering and uplifting and enlightening experience,"Besides being a cool, air conditioned escape from the heat outside, a visit here immediately brings a profound appreciation for a part of Singapore’s history. Im not a history buff yet stayed well beyond the time I thought I would. The centre is beautifully, thoughtfully and creatively put together to provide a complete experience. The recreation of life in the 1950s is done in such a way that you experience fully the context of the times as well as the personal experience of people living then. The audio guide is simple, engrossing and entertaining. I walked into a real tailors shop and home in the 1950s and found out all about how he ran his business, his values, his family. Of course it is a history that is rooted in deep and at times brutal hardship. The Centre provides a profound appreciation for these and balances that with gratitude and hope for the future. If you look at what Singapore has become from those beginnings it is inspiring. Worth a visit for families and anyone who wants to get beneath the surface of the city. It’s right in the buzz of Chinia town so right outside are great restaurants and loads of interesting and delightful touristy shops.",09-2018,Solo,2020-01-30 10:09:03.198037
,1,43,https://www.tripadvisor.com.sg/Profile/scotth7581,619592913,26-09-2018,5,A must see,"This Heritage Centre is one of the best I have been to ever! The Centre really gives a comprehensive view of the trials the Chinese went through when coming to Singapore and what life was like in the 50-60s.

The centre looks deceptively small as it is a shopfront in the busy Chinatown, but in reality it is 3 floors: showing a typical shop, living quarters of the shop owner, the next level shows boarders quarters and how people communally lived. The centre had a lot of interactive displays and the audio guide was brilliant. I feel like I spent almost 2hours in the Heritage centre looking at all of the rooms, watching the videos, and reading the placards of information.

Overall, well worth the money spent -S$15.",09-2018,Solo,2020-01-30 10:09:03.570386
,1,43,https://www.tripadvisor.com.sg/Profile/saic629,618755943,23-09-2018,4,Eye opening knowledge on Chinatown,"This place is sort of a Museum and kind of historical place to show you the origin of Chinatown. This place shows you how Chinese people migrated from China to Singapore in hope for better lifestyle, their hardships here, their professions, their success stories and how they became the modern Singaporeans. This is must visit place if you are a History buff.",09-2018,Solo,2020-01-30 10:09:03.876065
,1,43,https://www.tripadvisor.com.sg/Profile/nicomarrone_93,596357685,15-07-2018,5,Great tour,"I went to the Chinatown Heritage Centre on a whim and ended up having a wonderful time. The Heritage Centre offers an incredible view of what life was like in Chinatown during the 1950s, with plenty of information provided.
I took a guided tour, and it was well worth the extra 5 dollars as our tour-guide, Karen, possessed a great deal of insight and also had plenty of anecdotes which made the tour all the more informative.
It's well worth taking some time out while visiting Singapore's Chinatown to have a look around.",07-2018,Solo,2020-01-30 10:09:04.207617
,1,43,https://www.tripadvisor.com.sg/Profile/fallfans,592300090,02-07-2018,5,Fanatastic,"Well laid out, tells the story of the growth of Singapore through the migrants & citizens of Chinatown; life was hard & not so long ago
The audio guide (inclusive with fee of $20 for visitor) was a little over detailed but informative. Staff were helpful & cheerful",06-2018,Solo,2020-01-30 10:09:04.569819
,1,43,https://www.tripadvisor.com.sg/Profile/Scruffy0506,583487068,29-05-2018,5,Skip Shopping & Come Here.,"I am going to keep this brief otherwise I could go on forever! My visit here was the highlight of my trip to this great city. For anyone who is interested in the beginnings of this financial and retail hub, the Heritage Centre will more than deliver. Even if you think you’re not interested in history, taking this tour will change your mind, I guarantee it!

To quote the Centre’s website, “Visitors will get to step into the humble homes of Chinatown’s early residents, rebuilt with the memories of many who had lived, worked and grown up in these small ‘eight by eight’ cubicles.”

The tour is self-guided. You are given earphones and a tablet a little larger than a smartphone which guides you through the rooms and floors. The commentary is consistently interesting and the re-creations of the rooms absolutely impeccable.

My only advice would be to perhaps get there early as the viewing spaces are narrow and you need a clear view of the rooms to fully appreciate the narrative.",04-2018,Solo,2020-01-30 10:09:10.526781
,1,43,https://www.tripadvisor.com.sg/Profile/rhondica,582744365,26-05-2018,4,A little bit of history,There’s an audio guide so you can get a lot of history of the Chinese coming to Singapore. It was a great way to escape the heat of mid day while learning some history,05-2018,Solo,2020-01-30 10:09:10.902515
,1,43,https://www.tripadvisor.com.sg/Profile/Lee_Lee000,577259819,02-05-2018,5,Very Educational Visit!,"The Chinatown Heritage Centre is easily accessible from Chinatown MRT station. Admission is $15 for an adult and with this you get your own audio guide. The audio guide takes you from the tailors shop in the 50's all the way through different rooms in the house to demonstrate different professions and ways of life in Chinatown. Further upstairs it takes you through a museum area which explained arrival of Chinese people to Singapore and the way of life and hardships. The audio guide talked about these otherwise there were also boards full of information. It was great to get a glimpse into what life was like and a part of Singapore's history. The centre was well air conditioned, easy to navigate and well worth the $15 entry. I would recommend a minimum of 2 hours to listen to the entire duration of the audio guide and take the time to look around.",04-2018,Solo,2020-01-30 10:09:11.252097
,1,43,https://www.tripadvisor.com.sg/Profile/dr3amar0undth3world,575383349,24-04-2018,5,A must visit for museum lovers!,"Excellently-put gallery that takes us back to the early days of Chinese immigrants' lives and settlement in Singapore. There's great audio commentary for those choosing to do the tour at their own pace, otherwise a guided tour is also available for an extra fee. Very rich and insightful in cultural and historical contents. Had goosebumps upon learning how super tough life was back then. Would recommend to take at least 2 hours to see/read everything.",02-2018,Solo,2020-01-30 10:09:11.602416
,1,43,https://www.tripadvisor.com.sg/Profile/Paul S,575084065,23-04-2018,5,An outstanding museum,"The Chinatown Heritage Centre is definitely worth a visit, especially if you are in the area. The museum traces the path of Singapore's Chinese pioneers. The displays give a good understanding of the lives of Chinatown's early residents through to the modern era. The historical section presents life over three levels in a typical shop-house, each level divided into small cubicles. One cubicle housing a family of eight!
The multimedia guide has an excellent narration and fleshes out the stories of the shop workers and residents of each cubicle.
Adult admission, including the multimedia guide cost $15. It is excellent value. The museum gives a full insight to Singapore's rich Chinese heritage.
The centre is located close to Chinatown MRT station. Take Exit A to Pagoda Street.",04-2018,Solo,2020-01-30 10:09:11.999612
,1,43,https://www.tripadvisor.com.sg/Profile/Gordaus,570688444,03-04-2018,4,Must see for history buffs.,"The display on the ground floor of the Chinatown flat of a tailor, his family and apprentices doesn’t prepare you for what you find on the floors above.
Whole families sharing a room barely 3 metres square, a person sleeping in the corridor; in all about a dozen people including the local doctor shred this second floor space including a primitive kitchen and loo.
This is underworld Singapore as it was abut 5o years ago. More interesting than the Singapore museum and much better value than the Singapore National Art Gallery.",02-2018,Solo,2020-01-30 10:09:12.302416
,1,43,https://www.tripadvisor.com.sg/Profile/fchan100,569208822,28-03-2018,5,Very informative place,"Well organized on the sightseeing route with lots of historical information presented. Also, under a hot sun this is a very good activities to spend 1-2 hours",03-2018,Solo,2020-01-30 10:09:12.613296
,1,43,https://www.tripadvisor.com.sg/Profile/HazelandAlanDTJ,566202419,13-03-2018,5,Brilliant experience,In Singapore visiting friends but visited here on my own - amazing afternoon! Went for the guided tour which only cost a few SGD more than the entrance fee. Our guide Guan was outstanding - clearly has a massive passion for the subject. Was totally absorbed into the experience which in the end took about 2 hours although he kept checking the pace but it was fascinating. Worth the time and money and really helped understanding some of the background.,03-2018,Solo,2020-01-30 10:09:12.998459
,1,43,https://www.tripadvisor.com.sg/Profile/Ishan A,559472291,10-02-2018,4,Busy Place .. Heritage & Culture,This Place is really busy but the best part is that it really holds a significant place in history with great culture & heritage of Singapore.. Must visit,09-2017,Solo,2020-01-30 10:09:13.330838
,1,43,https://www.tripadvisor.com.sg/Profile/Pinheadplanet,556869857,28-01-2018,4,Interesting and informative.,"Mascara warning, if you've any sensitivity then seeing how hard life was not too long ago for some people should tug at your heart strings.

It is very informative and interesting with the help of the audio guide, not something that i would ordinarily partake in. The reproduction seems to be very good.

Tells the reality of life for all groups of immigrants from China.

Stand in the doorway of the room of the family of 2 adults and 6 kids and think about it...",01-2018,Solo,2020-01-30 10:09:13.629611
,1,43,https://www.tripadvisor.com.sg/Profile/bcheong,547605516,17-12-2017,3,Tours and museum,Kind of a tourist office and mini museum combined. Interesting for westerners into singapore history and culture,12-2017,Solo,2020-01-30 10:09:19.587341
,1,43,https://www.tripadvisor.com.sg/Profile/jollyrobert,546726257,12-12-2017,5,Hard times,"Offering a rare glimpse onto the lives, homes and struggles of Chinatown's early residents, this Heritage Centre, half-way down Pagoda St., is a fascinating place, and a must-do for visitors. Most of the early Chinese residents, escaping from wars and famine in their native land, paid for passage to this malaria-infested island, to seek a better life, often pushed overboard in the only clothes they wore as there were few landing places. Those that made it gravitated to Kreta Ayer, water-cart in Malay, south of the Singapore river, where they settled into what has become known as Chinatown.Singapore has benefitted greatly from this early influx of hard-working, energetic and enterprising people who have transformed the former British colony into the successful, model nation state it has now become, the envy of the World.",12-2017,Solo,2020-01-30 10:09:19.913878
,1,43,https://www.tripadvisor.com.sg/Profile/MilHist,546365501,10-12-2017,5,"Excellent Museum, Intriguing Tour","The Chinatown Heritage Center is a must-see and I’d highly recommend the guided tour. Our guide Clinton provided an intriguing look at the grim lives of early Chinese immigrants in Singapore, taking us through several levels of the museum. The stories about tailor apprentices, night soil collectors, the families who lived in tiny rooms upstairs, and early hospices really made the place come to life. Put this place on your itinerary.",11-2017,Solo,2020-01-30 10:09:20.297144
,1,43,https://www.tripadvisor.com.sg/Profile/Salsera713,532197799,12-10-2017,4,Interesting,"I really enjoyed learning more about the cultural heritage of Singapore (or at least part of it). The setup is quite good. The audio tour is a bit long - I lost focus about halfway through. The good thing is it's included in the ticket price, so you can use it as much or little as you'd like without feeling too guilty. Staff are very friendly.",10-2017,Solo,2020-01-30 10:09:20.629660
,1,43,https://www.tripadvisor.com.sg/Profile/Esther Anna R,524292173,14-09-2017,5,get to know the way of living in old Chinatwon,"It is a very informative, excellent way of seeing and learning how people used to work and live in the old days. The exhibition is fun and the latest technology is used. The stories of the different families together with the exhibits are so lively that you feel yourself becoming part of them.
The S$ 15 entrance fee was well worth it!",09-2017,Solo,2020-01-30 10:09:20.944345
,1,43,https://www.tripadvisor.com.sg/Profile/Rich D,522511702,08-09-2017,5,A must-see museum to understand Singapore's Chinatown history better...,"An interactive museum about the Chinese immigrants experience in Singapore. It's a three story walking exhibit through a little cramped spaces. But definitely worth it. The ticket price of SG$15.00 includes an audiovisual guide explaining you of facts about the lives, customs, festivals, entertainment, and much much more, and helping you to experience the museum in a more vivid, funny and casual educational way.

Another of my favorites to must-see while visiting Singapore.

See all my pictures to get a best preview of the this amazing heritage museum...",09-2017,Solo,2020-01-30 10:09:21.321689
,1,43,https://www.tripadvisor.com.sg/Profile/Marco C,518802920,29-08-2017,4,Interesting overview of Chinese immigration,Multimedia exhibition of Chinese immigration was a long time (years?) in restoration before being again opened to the public. Three floors reproduce the living and working conditions of Chinatown in the middle of the XX century. I found it quite interesting and spent about 2 hours in the museum.,08-2017,Solo,2020-01-30 10:09:21.683604
,1,43,https://www.tripadvisor.com.sg/Profile/Akademik2,518570067,29-08-2017,5,Moving and disturbing,"There is something incongruous about the cheerful voice on the audioguide that tells you how a family of 8 lived in a cubicle about the size of a minivan, or what happened in the tiny communal kitchen used by forty people when the single toilet also located in that space could not be flushed because the water was being used downstairs. And then you realize that this was not the middle ages or even the 19th centure, but the 1950s. In this small museum, especially its second-floor, you see how the working people of Chinatown lived their lives, preserving some modicum of dignity and raising families in appalling, practicaly unbelievable conditions, a mere half-century and a bit ago. Honestly, one of the most disturbing, moving, and interesting museums I visited in Singapore, something to contrast with today's country, with all its faults and strivings.",08-2017,Solo,2020-01-30 10:09:22.034942
,1,43,https://www.tripadvisor.com.sg/Profile/OccultismT,513192003,15-08-2017,4,Detailed information,"People who are curious and willing to know the history of Chinatown, this is the right place for you to visit! The entrance fee is SGD 15, but if you required guided tour, the fee will be SGD 20.
*Prohibited to video the place but taking photo is allowed.",08-2017,Solo,2020-01-30 10:09:22.385959
,1,43,https://www.tripadvisor.com.sg/Profile/Judith F,507264776,31-07-2017,5,Well set out and very informative,This was an old chop house and is set out as it would have been. Unbelievable that families of 8 would live in a space little bigger than a cupboard! Very friendly and helpful staff who show how the tape system works. Arrive early to get best out of it. Well worth a visit before seeing the rest of Chinatown.,07-2017,Solo,2020-01-30 10:09:22.740051
,1,43,https://www.tripadvisor.com.sg/Profile/PoppaChu,507181217,31-07-2017,4,Informative and great way to cool off from Singapore's mugginess,"Seeking refuge from the unending humidity, I stumbled into the Chinatown Heritage Center by chance when a tourist leaving triggered the automatic door which released a huge column of cool, cool air. Sold!

I wandered in and figured what better way to escape the heat than by learning a little bit about the plight of the Chinese immigrants during Singapore's early history. A nice mini-tablet with headphones was provided in the cost of the tour. A blink of an eye later, a solid hour had passed as the tour was both informative and interesting.

Towards the end of the museum displays, there are many interactive touchscreens that allow you to learn more about areas, items that particularly interest you and your group. The entrance fee (~$15 SGD) was well worth the relief provided from the outside humidity along with the informative displays shared throughout the three floors of the centre.",07-2017,Solo,2020-01-30 10:09:28.648837
,1,43,https://www.tripadvisor.com.sg/Profile/Appleen,506103739,27-07-2017,5,Great Chinatown Singapore,"I really feel grateful to join Monster Day Tours to Chinatown one Saturday. The tour guide's explanations were very detailed and impressive. Gain valuable knowledge of  Chinatown heritage and its culture.

We also experienced entering an Indian temple in Chinatown. Buddha tooth Relic temple is also very much worth to visit.

Thankful to the kindness of the tour guide to having us some local foods to try, like onde2, popiah and kaya bread. They are delicious and very interesting.",07-2017,Solo,2020-01-30 10:09:29.014675
,1,43,https://www.tripadvisor.com.sg/Profile/245cathrynl,504772094,23-07-2017,5,Amazing insight into pioneering lives,"Tucked into the heart of busy, bustling Chinatown is this little oasis of history. Clean and cool (especially compared to the damp heat of outside), and uncrowded (definitely compared to the crowded streets outside), this is WELL worth a visit - its a vital antidote to the colours, in-you-face commercialism and sheer weight of humanity outside the doors. Get the audio guide and learn the fascinating stories of the early Chinese settlers in Singapore: their resilience, determination and hard work was absolutely staggering. The recreation of an original shophouse, and the cubicle living inside was brilliantly done. The audio guide evoked the lives of the people who lived in the shophouse with detail and humanity and brought the whole thing to life in a really clever and empathetic way. I was captivated.
Staff were really helpful and friendly. I had to go out to meet friends and was able to split my visit into two halves on one ticket. They also stored a bag for me while I went round. Third floor display is still under construction: I will certainly be back, and taking friends to this fascinating and important museum.",06-2017,Solo,2020-01-30 10:09:29.406289
,1,43,https://www.tripadvisor.com.sg/Profile/BrazilTraveller1,501314792,12-07-2017,5,Lots of well displayed information,"It was the only interesting thing i found in Chinatown. Excellent guide, air-conditioned and lots of information about the history of the area and the country. Don´t miss it.",06-2017,Solo,2020-01-30 10:09:29.723003
,1,43,https://www.tripadvisor.com.sg/Profile/weezywiz,497158385,29-06-2017,5,awesome,this place is very good and full of beautiful people . thank you for making my stay very comfortable and visit memorable.,05-2017,Solo,2020-01-30 10:09:30.022543
,1,43,https://www.tripadvisor.com.sg/Profile/fdoll,490829171,06-06-2017,3,Worth a look,"I wouldn't make a special trip across town to come see this center, but if you happen to be in the area it is an interesting side trip. You are given headphones for the first two floors and there are stories and explanations as you look at each room. The third floor is self explanatory. Although there were a few interesting things to see, I was not overly impressed with anything here.",06-2017,Solo,2020-01-30 10:09:30.403466
,1,43,https://www.tripadvisor.com.sg/Profile/JoyShurjo,482113878,06-05-2017,5,Best China town,"I have visited many China towns in many countries. This one is the small though small. There are many restaurants, handicrafts and clothing shops. Reasonable price.",08-2016,Solo,2020-01-30 10:09:30.780383
,1,43,https://www.tripadvisor.com.sg/Profile/occhiolist,482020345,06-05-2017,5,Very well done,"Although I prefer to stay in Chinatown when I come to Singapore, I'd never made it to the Heritage Centre - I think it was being refurbished on my last visit, and besides, I live in Hong Kong and feel like this is the Singaporean culture I already know the most about.

However, while there were many aspects of Chinese culture I recognised, the centre tells the story of Chinese immigrants from a uniquely Singaporean viewpoint. The first part is a reconstruction of how the shophouse might have looked when filled with an assortment of renters, and the audio guide really brought the scenes to life. The second part had further displays about links with mainland China and Chinese culture. Highly recommended.",04-2017,Solo,2020-01-30 10:09:31.103970
