REVIEW_INDEX,WEBSITE_INDEX,POI_INDEX,REVIEWER_NAME,REVIEW_RATING,REVIEW_DATE,REVIEW_TIME,REVIEW_BODY,ATTRIBUTES_CRAWLED_TIME
,2,15,BetTerDAY,4.0,2019-04-24,N,2002年10月落成的滨海艺术中心(The Esplanade)，是新加坡最新的地标。外型奇特突出，宛若两颗大榴莲，很多人都称它为榴莲艺术中心。但实质上建筑师的灵感是采掘，根据蜻蜓的复眼来设计的。一开始可能感觉不到，当你看了滨海艺术中心的全景之后，可以越来越清晰地感到作者的想法及模仿蜻蜓复眼的逼真了。滨海艺术中心不仅外观独特，建筑物蕴含了不少的科学计算。它是由4，590片玻璃所组成的屋顶遮阳罩，依据新加坡日照环境的模拟计算设置。其内部陈设却充满欧洲剧院风味，功能多元化，包含音乐厅、戏剧院、购物中心、餐厅及户外表演空间等，让东方与西方的艺术文化在此撞击出最美的火花。,2020-02-04 17:55:03.525950
,2,15,M48****413,5.0,2019-12-02,o,新加坡滨海艺术中心绝对是新加坡一座非常有创意的建筑，它就像是一只巨大的菠萝蜜，摆放在滨海湾之上。内部的设施非常的现代豪华，这里几乎每天都会上演精彩的艺术剧目，是新加坡文艺艺术的综合性场馆，绝对值得来参观一下。,2020-02-04 17:55:03.532132
,2,15,BetTerDAY,5.0,2020-01-05,t,滨海艺术中心的外形像一个大榴莲，是新加坡滨海湾的几大地标建筑之一，下午进去看了一圈，发现有几十个中国旅行团在这里集合，因为外面太热了，就选在室内集合了,2020-02-04 17:55:03.538470
,2,15,BetTerDAY,5.0,2019-11-23, ,滨海艺术中心又被称为大榴莲，因为外形酷似榴莲而得名，夜景尤其美丽，真的像一个闪闪发光的大榴莲，不过内部设施很一般，走了一圈没有什么惊艳的感觉,2020-02-04 17:55:03.544727
,2,15,BetTerDAY,5.0,2019-11-29,A,esplanade在英语里居然特指滨海艺术中心，它的外形像一个大榴莲，非常有创意，不过进到内部参观就觉得比较一般了，不过演出剧目还是很赞的,2020-02-04 17:55:03.551159
,2,15,旅游交友,5.0,2020-01-06,v,滨海艺术中心，外形像一朵盛开的莲花，很多艺术活动在这里举行，里面的灯光幻影非常漂亮，孩子们看了都不愿离开。特别是晚上，整个艺术中心不停地变化各种颜色，非常漂亮。,2020-02-04 17:55:03.557306
,2,15,独孤雅剑,5.0,2019-11-28,a,到新加坡的第一站就是去游览鱼尾狮，在拍鱼尾狮的时候，发现了有一个比较像榴莲造型的地方，一查才知道，原来这就是著名的新加坡滨海艺术中心，在这里主要都是一些戏剧音乐剧之类的演出，晚上的时候灯光亮起来，从外观看更加的漂亮。,2020-02-04 17:55:03.562739
,2,15,狮子座的Pumpkin,5.0,2019-08-15,i,新加坡滨海艺术中心，位于新加坡著名的滨海区，与鱼尾狮 金沙酒店隔水相望，远远看去宛如大榴莲，也因此名声大噪，已成为新加坡的标志性建筑。其实，它的建筑师团队以昆虫的复眼为灵感，造就了其独特的外观。又由于平视建筑时，艺术中心主体宛如两颗榴莲，因而又名“榴莲艺术中心”。,2020-02-04 17:55:03.567222
,2,15,M30****5169,5.0,2019-09-24,l,滨海艺术中心是新加坡首屈一指的艺术表演场地，造型独特的圆顶为它赢得了“大榴莲”的称号。滨海艺术中心毗邻滨海湾，艺术中心内有音乐厅、剧院、演奏厅和排练室，还有户外表演空间。,2020-02-04 17:55:03.571258
,2,15,M30****2342,5.0,2019-09-23,a,外形像两个大榴莲的滨海艺术中心坐落在海边，成为新加坡地标性建筑。其实，它是模仿蜻蜓的复眼建造，依据新加坡日照环境的模拟计算设计，蕴含了许多科学原理。里面是欧式剧院风格。有音乐厅、剧院、独奏室、视听艺术中心等。,2020-02-04 17:55:03.574913
,2,15,Mr_Chan陳先生,4.0,2019-08-13,N,新加坡滨海艺术中心，是新加坡地标之一，位于滨海湾畔，俗称“大榴莲”，因为其外观就像两棵巨大的榴莲。乘坐地铁至city hall站下车，步行可达。艺术中心里面平时会有一些公益表演。大榴莲的夜景也很不错，可与金沙酒店、鱼尾狮公园等一并游玩。,2020-02-04 17:55:07.676337
,2,15,q****ky,3.0,2019-12-31,o,艺术中心是新加坡一个地标性的建筑，位于滨海区，从平面看它会显得像是榴莲，但是从高处看又显得像是两个比较复古的麦克风，这里经常会有一些很棒的演出。,2020-02-04 17:55:07.682644
,2,15,旅游交友,5.0,2020-01-04,t,滨海艺术中心设计得非常巧妙，外形看很像一朵莲花，特别是晚上，在灯光的照射下，会不停的变化各种颜色，非常漂亮。经常有一些艺术活动会在这里展示。,2020-02-04 17:55:07.690277
,2,15,我想遇到你,4.0,2019-11-09, ,新加坡整体建筑都特别的漂亮，而且很多国家每一个地方都特别的干净。整个艺术中心设计的特别的好，尤其是晚上灯光超级的漂亮，建议去新加坡去玩一下。,2020-02-04 17:55:07.696453
,2,15,鱼眼看天下,5.0,2017-03-04,A,两颗大榴莲很显眼，就是滨海艺术中心，前面有个舞台，在晚上的时候经常有举办活动，很经常是摇滚音乐，免费的哦。逛累了，不防坐下来听听音乐。,2020-02-04 17:55:07.702686
,2,15,hiluoling,3.0,2019-12-31,v,其实在海滨海湾游览的时候，大家一定会看到这个艺术中心的，非常的令人瞩目的一组建筑，很现代也很超前，整个外观也是非常密集的突出的结构。,2020-02-04 17:55:07.708820
,2,15,M30****6151,5.0,2019-09-24,a,对于我这种建筑审美渣来说，着实不能感受到这样的设计是为了什么，难道是设计师比较喜欢吃榴莲？后面咨询了下度娘，发现这两坨“榴莲”的设计初衷不是源于榴莲，而是苍蝇等昆虫的复眼（好吧我其实宁愿相信它是榴莲谢谢！）。,2020-02-04 17:55:07.714796
,2,15,M30****5864,5.0,2019-09-23,i,新加坡滨海艺术中心坐落在新加坡市区内的新加坡河入海口，与滨海湾毗邻。滨海艺术中心是新加坡首屈一指的艺术表演场地。造型独特的圆顶为它赢得了“榴莲”的称号。,2020-02-04 17:55:07.721247
,2,15,M30****5232,5.0,2019-09-23,l,话说最早设计师是想设计两个麦克风，结果搞成了两个大榴莲，外面看上去还是比较时尚的，从广告牌不难看出节目多数都是以中华文化作为背景的，所以从这里可以看出新加坡文化最基础的还是我们的大中华文化.,2020-02-04 17:55:07.727064
,2,15,胡大老顽童,4.0,2020-01-02,a,滨海艺术中心，俗称大榴莲，新加坡的标志型建筑，各种照片，攻略上都建国，还是远眺比较美，近距离看也没有突出的特色，里面常有各种文艺演出！！,2020-02-04 17:55:07.731884
,2,15,旅游交友,5.0,2016-12-01,N,外面看非常象榴莲壳，建筑非常宏伟，是著名的旅游景点，周围很多景点，夜景更漂亮，晚上的灯光照射下，更是显得多彩多资，有很多表演团在表演,2020-02-04 17:55:11.474470
,2,15,小小呆60,3.0,2019-12-31,o,这个艺术中心是新加坡的一个演出的地标，外形很独特，感觉既像是一个菠萝，又像是一个榴莲，晚上来的时候发现有小型的户外的演出，挺好的。,2020-02-04 17:55:11.483342
,2,15,小凌60,3.0,2019-12-31,t,这个艺术中心的外观看上去像是一个被切开的榴莲倒扣在岸边一样还是挺特别的，但是会觉得造型也还是漂亮的，这里主要还是看一下露天广场吧。,2020-02-04 17:55:11.489959
,2,15,M30****2777,5.0,2019-09-23, ,这个被俗称“榴莲剧院”的奇异建筑，被公认为是新加坡的地标，榴莲壳是由一片片三角形金属板所组成的，这些金属板在太阳的照射下，呈现出各种光与影的变幻，很有质感和现代感哦……,2020-02-04 17:55:11.497822
,2,15,M29****5648,5.0,2019-09-23,A,这个景点真是糟心啊，天气炎热本来打算去里面凉快凉快的，结果网上定的票还不是在景点取票，我们走到了景点才发现是在地铁站旁的7-11里取票，只能委屈蘑菇去取票了，这一趟走了将近2个小时，真是累啊，回来人都黑了,2020-02-04 17:55:11.504624
,2,15,宫主爱,5.0,2016-11-21,v,若要问路人尤其是问到了游客的话“请问滨海艺术中心怎么走？”，估计没多少人回答得了。但若问“大榴莲？”，那么几乎每个都能向你指明方向。大榴莲真就是新加坡最为知名的建筑了，将国家特产与建筑设计完美结合的最佳典范！,2020-02-04 17:55:11.511537
,2,15,juki235,5.0,2019-06-08,a,这座风格大胆且引人注目的表演艺术中心，经常被比喻像是昆虫的复眼，融化的蜂巢，或者是两颗倒置的榴莲。无论你喜欢与否，滨海艺术中心俨然已经成为了新加坡一张城市名片和游客眼中令人难忘的一道亮丽风景。,2020-02-04 17:55:11.518036
,2,15,东张西望望东西,5.0,2019-10-18,i,滨海艺术中心其实是很漂亮的，晚上有灯光的时候也是特别的漂亮的，不过本人有密集恐惧症，看到这样的建筑就全身有点发麻，外观建筑密密麻麻的刺一样,2020-02-04 17:55:11.525056
,2,15,素素77,5.0,2019-06-30,l,滨海艺术中心位于新加坡最繁华的滨海区，是当地最具特色的地标建筑之一。艺术中心于2002年10月正式落成，其建筑师团队以昆虫复眼为灵感，造就了其独特的外观。艺术中心主体外观宛如两颗大榴莲，所以游客们亲切地称之为——“榴莲艺术中心”。,2020-02-04 17:55:11.532294
,2,15,sha****anna,4.0,2019-02-10,a,新加坡滨海艺术中心，又称大榴莲。特别的有名，无论是远眺还是近距离欣赏都有别样的风情，可以说熠熠生辉。这里是新加坡市容的代表建筑之一，值得拍照留念！,2020-02-04 17:55:11.538707
