REVIEW_INDEX,WEBSITE_INDEX,POI_INDEX,REVIEWER_NAME,REVIEW_RATING,REVIEW_DATE,REVIEW_TIME,REVIEW_BODY,ATTRIBUTES_CRAWLED_TIME
,2,19,Slyling,9,2015-12-02,13:01,新加坡河是新加坡的母亲河，早期移民依靠这条河流进行贸易，从而维持生计。整条河流就几公里左右，跟广州珠江比是差远了，但是河水的洁净，也是珠江不能比的。在河边漫步，会经过很多著名景点和极具特色的建筑物。譬如鱼狮尾公园、金沙酒店、摩天轮等等。怕走路太累的话，也可以选择在河上游船。开放时间是每天上午9:00–晚上11:00末班船，晚上10:00。耗时大概大半个小时，票价成人15新加坡币。新加坡河岸边有多个码头（克拉码头、驳船码头和罗伯逊码头）。我们是购买了新加坡全景通的（400元人民币），含环球影城、摩天轮等景点。游船项目也包含在内。在克拉码头换票。乘坐地铁NE线在克拉码头站（ClarkeQuary）下车即可。我个人还是比较建议傍晚时候来这游船的。因为克拉码头白天比较安静，晚上则要繁华得多。灯红酒绿，觥筹交错，热闹非凡。如果白天游船，那个热呀！！傍晚来，才可以先看清两岸的真容，然后到克拉码头对面的商场（著名的肉骨茶，在商场后）吃个饭，再开始游船欣赏两岸华灯初上的美景，那真是赞。游船线路：克拉码头-罗伯逊码头-鱼狮尾公园-滨海湾-金沙酒店-摩天轮…..每到一个景点，船上都会播放关于这个景点的历史视频简介，不过是全英语解说，没有字幕的。由于我们下一站到摩天轮，所以中途就下船了。但其实只有某几个站是可以下的。上船前要跟服务员问清楚，不然船就会一直驶回克拉码头。他们态度十分的友好，到站会特别提醒我们。这是一个可以了解新加坡历史和体验繁华夜生活的旅游胜地，值得推荐。,2020-02-04 17:57:22.642720
,2,19,M48****413,5,2019-12-08,14:54,新加坡河是新加坡的母亲河，现代化的新加坡就是依托着新加坡河而发展起来的。河的两岸既有古老的建筑，也有现代化的高楼大厦。大家可以乘船沿河而下，一直到滨海湾欣赏新加坡河两岸的风光，穿越古今欣赏一下新加坡的发展历史，绝对是游览新加坡不可或缺的项目。,2020-02-04 17:57:22.657892
,2,19,M30****8811,5,2019-09-27,22:59,新加坡河(Singpore River)，是新加坡唯一的河流，是一条在海水冲涌的基础上由人工开凿而成的运河，长约4.1公里，贯穿于整个城市，是新加坡的生命之河，早期移民都是依靠这条河流来维持生计。,2020-02-04 17:57:22.670335
,2,19,BetTerDAY,5,2019-11-24,06:44,城市的内河一直是很美的，尤其在新加坡这种高楼林立的大城市，河流和建筑的组合一直是很美的，本来不怎么瞧得上新加坡的旅游价值，没想到再滨海湾真香了几个小时,2020-02-04 17:57:22.677181
,2,19,渭南松赞干布,5,2019-09-04,18:10,新加坡河是新加坡的母亲河，全长只有3.2公里，河水穿过市区，河口就是新加坡港，是非常重要的水上交通运输要道，河两岸有诸多景点和林立的高楼大厦，游客可乘游船观赏两岸的风光。,2020-02-04 17:57:22.682973
,2,19,大贤良师,5,2020-01-13,15:16,新加坡河可能在我天朝眼里就是个沟…毕竟总长不足4公里，但这条河是新加坡历史的见证，因为河口就是新加坡港，对于地理稍有了解的应该都听过马六甲海峡，新加坡港正是这条黄金航线上的天然良港+重要枢纽，是亚太地区最大的转口港，新加坡繁荣的基石。在发展时期，新加坡河作为驳接港口海运和新加坡内部河运的工具，重要性可见一斑，虽然现在新加坡已经完成了经济转型，新加坡河水运功能已经不太重要了，但经过环境整治和旅游开发的小河，无论是历史古迹还是自然风光都是值得游玩的。,2020-02-04 17:57:22.688380
,2,19,旅游交友,4,2020-01-27,16:10,新加坡河的夜景非常漂亮，在五颜六色的灯光照射下，反射在河里的灯光倒影，组成一副非常绚丽多彩的画面，真是美极了。吹着海风，爽死了。,2020-02-04 17:57:22.692385
,2,19,蔡蔡Cynthia,5,2019-12-16,20:46,漫步在新加坡河两岸                                                               新加坡河流经新加坡市中心，尤其是滨海的河口一带是新加坡景点最集中的区域。不同的时间段来到这里，都能拍到不同的景色和风情。当然最推荐的是黄昏时刻，酷热褪去，在河边漫步还有习习凉风，无论是从鱼尾狮公园沿河走到Fullerton酒店再到驳船码头，还是在对岸的亚洲文明博物馆、旧新加坡国会大厦、新加坡国家美术馆一直走到克拉码头，沿路都有十分多赏心悦目的建筑可以停驻、留念。这一带横跨新加坡河的桥也很有特色，无论是河口的安德逊桥、还是往里走的爱琴桥，都很上镜值得一拍。当最后走到克拉码头的时候，也到了华灯初上的时间，这里的夜景十分美丽，又有众多美味特色的餐厅，晚饭之后还有各种夜场酒吧可以玩到深夜。半日游路线：中午在驳船码头的珍宝海鲜或者松发肉骨茶吃完午饭。从爱琴桥到对面的克拉码头，逛一下白天的克拉码头之后。再往东走可以去新加坡国家美术馆、亚洲文明博物馆看看引人入胜的展览。再穿过安德逊桥到鱼尾狮公园，拍照留念之后往西走。可以去Fullerton酒店喝个下午茶。最后晚上回到克拉码头吃完饭泡吧，非常完美的半天行程。,2020-02-04 17:57:22.696227
,2,19,q****ky,9,2020-01-01,16:08,这条河就是新加坡的母亲河，河面非常的开阔，但是我觉得它的景观只在于河的一侧，另外一侧反而会觉得很平淡一些，不管是坐游船还是在河边散步都还不错。,2020-02-04 17:57:22.699906
,2,19,M38****6867,3,2020-01-12,11:08,很棒，晚上的沿河风景很美，在新加坡河上的风景船可以带你领略新加坡的繁华风光，你可以看到新加坡的许多名建筑，在船上拍出的照片也是绝佳角度。,2020-02-04 17:57:22.703136
,2,19,hiluoling,3,2020-01-01,16:37,新加坡河整个碧波荡漾，波光粼粼的感觉非常的舒服，河面上那种非常宽阔但又几乎波澜不惊的状态，让人觉得很惬意，挺不错的一条大河的。,2020-02-04 17:57:27.296325
,2,19,zhulei831230,3,2020-01-01,17:06,新加坡河的河面非常的宽阔，他绕着新加坡流向了大海，这条河的两边都是一些现代的建筑，很多地标性的建筑都在河边，可以好好看看。,2020-02-04 17:57:27.312525
,2,19,小凌60,3,2020-01-01,17:39,这条河是孕育了新加坡城市形态和风貌的一条河流，所以新加坡人对这条河是非常有感情的，河道的两侧也是一些人文，或者是城市景观，不管是散步，还是坐船都可以。,2020-02-04 17:57:27.324645
,2,19,小小呆60,3,2020-01-01,18:05,这条河是新加坡的母亲河和生命河，感觉其实也没有什么太大的特别之处吧，和世界上的大江大河一样，两岸都是这个城市最具代表性的一些建筑和风貌而已。,2020-02-04 17:57:27.331786
,2,19,摩小亚,4,2019-09-05,11:47,鱼尾狮那儿的那一条河就是新加坡河吧。新加坡河是新加坡32条主要河流之一。从金声桥源起，向南倾入滨海湾蓄水池。现在又小型的机动船在河上穿梭，也是可以供游客观光游览的。 总长3.2公里。游船价格：成人15新元，儿童8新元。 新加坡确实还是蛮值得一去的旅游城市，但是建议不要节假日去，人多酒店贵，吃东西还排队很长。也不建议夏天去，虽然一年四季都热，但是我们国内的冬天去，和夏季去还是有明显不一样的感受。 酒店价格最好选1000元以上的，因为房间实在是太小了，大一点休息好了，才能愉快的玩耍呀。,2020-02-04 17:57:27.337104
,2,19,_WeCh****929101,5,2019-10-12,20:22,非常棒的一次体验！一个小时左右的时间，中文导游全程专业，幽默，互动介绍新加坡，恰好是傍晚时分，沿途景色很美。强烈建议第一次来新加坡游玩的去坐这个鸭子船。,2020-02-04 17:57:27.341544
,2,19,东张西望望东西,4,2019-10-18,18:17,新加坡河是新加坡人的母亲河，类似苏州河是上海的母亲河一样的，河水没有想象中的清的，有兴趣的可以坐观光船游玩的，不过我们觉得没必要就没坐的,2020-02-04 17:57:27.345501
,2,19,一只爱旅行的牙齿,5,2019-08-28,12:41,被誉为城市花园的新加坡。是一个值得一去再去的一个国家。从国民素质到城市建筑每一点都特别值得我们去学习。空气特别的清新，环境特别好。,2020-02-04 17:57:27.349136
,2,19,翱翔的大鲨鱼,4,2019-05-27,22:46,新加坡河是现代新加坡的源头，是近代新加坡开埠的地方。也见证了新加坡的迅速发展。可以坐鸭子船游览，可以远眺新加坡的点点滴滴。河畔的近代建筑是一大亮点。,2020-02-04 17:57:27.352450
,2,19,_WeCh****929101,5,2019-10-12,20:21,非常棒的一次体验！一个小时左右的时间，中文导游全程专业，幽默，互动介绍新加坡，去的时候恰好是傍晚时分，沿途景色很美。强烈建议第一次来新加坡游玩的去坐这个鸭子船。,2020-02-04 17:57:27.355648
,2,19,M30****4954,5,2019-09-28,06:39,其实和国内的大城市的河差不多，两岸倒是很漂亮，坐船在河上游览就没必要了，随便国内一个大城市感觉差不多。环绕新加坡河有很多著名景点 酒店 以及地标性建筑 有时间的话悠闲的走一圈是不错的选择,2020-02-04 17:57:31.341635
,2,19,203****096,5,2019-09-01,23:20,报了个团队游，主要是感受下，什么是新加坡和马来西亚吧，新加坡大半天，然后3天马来西亚新加坡的物价确实是不低，但还能接受，也不算贵的离谱，这两年我们的物价突飞猛进，现在也不觉得新加坡贵了新加坡河边上就是著名的圣淘沙了,2020-02-04 17:57:31.358221
,2,19,老鹰在飞翔,5,2019-06-26,19:27,新加坡河是新加坡32条主要河流之一，。河从西部的金声桥源起，向南倾入滨海湾蓄水池。河的两岸就逐渐发展成新加坡的商贸中心。,2020-02-04 17:57:31.369850
,2,19,流星DCQ,5,2020-01-27,22:41,新加坡河夜游，别有一番风味，河边沿线晚上都很热闹！,2020-02-04 17:57:31.376676
,2,19,M32****2880,5,2019-10-04,11:17,鸭子船挺好玩的哈哈，可以听导游说一下新加坡的历史和周围的建筑，但是坐后排车的噪音有点大，讲话不是听得很清楚，但是整体还是很满意啦,2020-02-04 17:57:31.382013
,2,19,yi****214,5,2019-04-26,13:38,新加坡河可以说是新加坡的一条动脉，横贯整座城市，从上游到下游，可以看尽许多新加坡不同的区域与面貌，是一条值得花时间好好体验的地方，从上游的高级住宅区走克拉码头，在走到滨海湾，步道规划完善，可以走的十分舒适愉快,2020-02-04 17:57:31.386698
,2,19,桂林仙儿,5,2017-02-28,21:48,河边景点众多：鱼尾狮公园、莱佛士登陆点、莱佛士坊、国会大厦、国会大厦艺术之家、国家艺术画廊、老邮政局（现为浮尔顿酒店）、酒吧街、美食街…应有尽有，可以沿着河边走，累了就地坐下来，凉风习习，灯红酒绿，极度舒爽……,2020-02-04 17:57:31.390693
,2,19,endlesssummer,5,2017-07-20,15:05,新加坡河两岸都是各种酒店，有时能看到鸭子船。新加坡河贯穿市中心，沿着河边走就能看到加文纳桥，安德森桥还有一个历史蛮久的富尔顿酒店，外型有点像豪华巨轮。河边可以买冰激凌吃，还有各种美照拍拍拍,2020-02-04 17:57:31.394286
,2,19,星海湾北,5,2020-01-09,10:31,新加坡河逶迤蜿蜒于狮城的市中心，见证了这个东南亚城市国家的发展。河岸两旁有很多不同时期的建筑，夜景很漂亮！,2020-02-04 17:57:31.397617
,2,19,_WeCh****052107,4,2019-12-23,17:38,这条河很长，而且顺着河坐船游的话，在两旁可以看到很多标志性建筑，所以在河里坐船游览也是一个不错的计划。,2020-02-04 17:57:31.400958
