REVIEW_INDEX,WEBSITE_INDEX,POI_INDEX,REVIEWER_URL,REVIEW_ID,REVIEW_DATE,REVIEW_RATING,REVIEW_TITLE,REVIEW_BODY,DATE_OF_EXPERIENCE,TRIP_TYPE,REVIEW_CRAWLED_TIME
,1,55,https://www.tripadvisor.com.sg/Profile/rama1,479723372,28-04-2017,5,"Think Singapore know where their going. Your right, they do.","This exhibition shows what a clever planning government this is.

Singapore has a plan for their city state, unlike my home town. They know where the need is, they plan to address it and they are successful.

Well worth a couple of hours in this place to see some of the history and their view of the future.

It's free and it well air conditioned.",04-2017,Couples,2020-01-30 14:29:12.543995
,1,55,https://www.tripadvisor.com.sg/Profile/Rossendale22,478827416,25-04-2017,3,City Gallery,"A beautiful air conditioned building with excellent wifi and toilets. Ground floor foyer has an excellent, very large 3D model of the whole island of Singapore which makes an excellent spectacle",02-2017,Couples,2020-01-30 14:29:12.896049
,1,55,https://www.tripadvisor.com.sg/Profile/ng_ryan,469227681,22-03-2017,4,Nice Little Gallery,I enjoyed my short visit to the Singapore City Gallery. It gave me an insight into the history of Singapore as well as its future plans. The 3D model of Singapore was very nicely constructed and detailed. A must visit for tourists and locals alike.,03-2017,Couples,2020-01-30 14:29:13.252136
,1,55,https://www.tripadvisor.com.sg/Profile/MarkRosa,461879862,22-02-2017,5,Very impressive,"Had not heard of this gallery, but was recommend to us.

We had a great time earning about how Singapore was planned and where the town planner are taking the country over the next 20+ years. The model of Singapore on the ground floor is fantastic.",02-2017,Couples,2020-01-30 14:29:13.642449
,1,55,https://www.tripadvisor.com.sg/Profile/travelwithwinny,459167488,13-02-2017,5,Super interesting,Learnt so much about Singapore at this free exhibition! It's close to Chinatown and perfect for a hot humid afternoon. There were so many facts that I didn't know about. The exhibitions were clear and easy to understand. There were some school kids with their teachers but it didn't create too much fuss.,02-2017,Couples,2020-01-30 14:29:14.014705
,1,55,https://www.tripadvisor.com.sg/Profile/two5kid,454642084,25-01-2017,4,Unexpected Discovery,"Stumbled upon this free gallery while exploring Chinatown/Ann Siang Hill. This is for the architectural buffs and they have a 'to scale' map of the whole Singapore including new and upcoming developments. Well, that's because this is the Urban Renewal Authority's gallery, no one else does it better than them. You can basically see the future of Singapore through the eyes of this Ministry. And heck it's FREE!

Do check out their glass lift!",10-2016,Couples,2020-01-30 14:29:14.387247
,1,55,https://www.tripadvisor.com.sg/Profile/kevs515,453846186,21-01-2017,5,Very interesting,"You need to visit this location to understand and see how singapore is changing in the future, the gallery is free to visit.",01-2017,Couples,2020-01-30 14:29:14.742399
,1,55,https://www.tripadvisor.com.sg/Profile/Judith C,451922709,14-01-2017,5,planners' paradise,definitely worth a stop really helps with understanding both the colonial history of Singapore as well as its post-colonial transformation and where it is likely going. paradise for planners!,12-2016,Couples,2020-01-30 14:29:15.120962
,1,55,https://www.tripadvisor.com.sg/Profile/262eugenew,451123658,11-01-2017,5,Really fascinating displays,A great insight into Singapore's development. Really informative and interesting. The city models are fantastic. Really worth a trip - and it's free!,01-2017,Couples,2020-01-30 14:29:21.051756
,1,55,https://www.tripadvisor.com.sg/Profile/gaggi2017,450437013,08-01-2017,5,The Best Way to learn facts of the City,"Huge model of Singapore. There a so many things to do and create by your own. Example: You have the part to create your ""own"" Singapore. In a virutual mode you get a piece of land and you must build schools, house, transportation system like in the real city. Great fun and the admission is free.",12-2016,Couples,2020-01-30 14:29:21.423108
,1,55,https://www.tripadvisor.com.sg/Profile/LSSmiami,447894517,31-12-2016,5,Perfect way to start your visit!,The gallery has a scaled diorama of the entire city. Makes it easier to understand the areas of the city and the different buildings.,12-2016,Couples,2020-01-30 14:29:21.724313
,1,55,https://www.tripadvisor.com.sg/Profile/Jason D,440780824,29-11-2016,5,See this first,"My wife and I visited this gallery for a self-guided tour while on route to Chinatown. It provides great insight into all the planning that's gone into the city, both above and below ground. It really is amazing how organized the city is and how much thought is put into green space, the environment, transportation, culture, economic development, etc... For instance, they have layers of infrastructure underground, up to 150 meters, and use the rock they dig out to further expand the city above ground. I advise seeing this gallery early in your trip so you've an appreciation for the city as you tour it.",11-2016,Couples,2020-01-30 14:29:22.027109
,1,55,https://www.tripadvisor.com.sg/Profile/Escapementality,419353452,17-09-2016,5,Hidden Gem,"A fantastic way to get an overview of Singapore both geographically and historically.
As a free entry attraction in a government building, this one may be easy to overlook but there are plenty of interactive displays and the models are amazing. Highly recommended.
Make sure to make your way upstairs, the other model is even more impressive than the one in the foyer and there's lots more to see.",09-2016,Couples,2020-01-30 14:29:22.393479
,1,55,https://www.tripadvisor.com.sg/Profile/Kaye S,415300370,06-09-2016,4,Answered all of my Singapore questions,"Terrific topographical map, historic information and video displays help a newcomer understand how Singapore grew from a small fishing village into the metropolis it is today. Additionally, plans for,the future are shared. Very visually interesting.",09-2016,Couples,2020-01-30 14:29:22.693222
,1,55,https://www.tripadvisor.com.sg/Profile/DayleePaleta,415163900,06-09-2016,5,Love it!,"If you are at all interested in urban planning, you have to go to this gallery. It’s free and really well put together. On the first floor you can see a scale model of the city, but upstairs is where you get to understand how Singapore came to be what it is. I’d go back for a second visit if I had time.",06-2016,Couples,2020-01-30 14:29:23.001149
,1,55,https://www.tripadvisor.com.sg/Profile/Kathryn M,405135561,14-08-2016,5,Good overall history,"Anna Ong our fantastic tour guide took us here, worth the visit for the 50 year plan model alone,so much detail and what a fantastic idea. It is so good you can pick out all the landmarks and hotels and great place to walk around, not much of a detour either.",03-2016,Couples,2020-01-30 14:29:23.375928
,1,55,https://www.tripadvisor.com.sg/Profile/cynicalwitch,403464156,10-08-2016,4,Gives a good perspective on Singapore,"Whenever I tour friends around Singapore, I always make sure this little museum in the CBD is one of the first stop. It primarily tells how Singapore was planned and gives a good introduction to life in the Little Red Dot. From how Singapore gets its water, to how it disposes of its waste, how its communities are planned and the types of housing that has evolved over the years, this little gallery showcases all these.",08-2016,Couples,2020-01-30 14:29:23.735415
,1,55,https://www.tripadvisor.com.sg/Profile/Nathan V,402210313,07-08-2016,5,Fascinating for anyone thrilled by this city.,"Not many tourists know about this place. The URA building is very near to the bottom end of China town and quite easily accessible. The Building itself is a government ministry building, but the bottom three floors are open to the public. The key thing here to see - and its completely free - is the huge scale models of Singapore city with immaculate detail. See how the country has reclaimed 1/3 of it's landmass from the sea in the last 30 years and discover how much of the CBD, Marina Bay Sands and even Changi airport were underwater not 50 years ago. A really fascinating insight into how this city was built.",07-2016,Couples,2020-01-30 14:29:24.037244
,1,55,https://www.tripadvisor.com.sg/Profile/Jackie R,392985858,16-07-2016,5,Brilliant FREE and interactive gallery,"Be sure to visit all levels of this gallery. Its totally free and has many different interactive displays and exhibits. You can learn all about resource management, land use and the plan for Singapore going forward. Great place. Must see in Singapore",06-2016,Couples,2020-01-30 14:29:29.834198
,1,55,https://www.tripadvisor.com.sg/Profile/Jimmy N,372765716,14-05-2016,5,An overview of the well planned country,"Seriously, many display of such nature are usually academic. Not here. They had summarized their achievements into a single exhibit. Great show off to our overseas guest. Adjourn to the Maxwell Road market for a cuppa of coffee & kaya toast later.",12-2015,Couples,2020-01-30 14:29:30.138597
,1,55,https://www.tripadvisor.com.sg/Profile/David J,365995608,21-04-2016,5,Development of Singapore Urbanisation,"Well worth a visit, it outlines the urbane development of Singapore over the past 50 years and the future plans using graphics, displays and models.",04-2016,Couples,2020-01-30 14:29:30.550607
,1,55,https://www.tripadvisor.com.sg/Profile/follow_ussg,358630158,26-03-2016,5,One place to see the whole Singapore tranfrom from the old age to the mordern city,"This is a free exhibition for tourist and local to visit to see how this city develop to a garden city.
Visitors can see the develop master plan of every corner of Singapore, and also some model of the building in Singapore, also there are some touch screen monitor for you to play along the develop plan, there are some corner to show how deep the development goes and how the drain system work too.",03-2016,Couples,2020-01-30 14:29:30.896303
,1,55,https://www.tripadvisor.com.sg/Profile/JoyfulG,357738011,23-03-2016,4,Very interesting.,"We had seen the good reviews for this so on our last day here decided to go have a look. We took a long way there. However finally found it with help of some locals. We were tired so only explored the bottom floor..what we saw very impressive. Great for design students , town planning students or those into architecture or just the tourist interested in how Singapore has evolved.",03-2016,Couples,2020-01-30 14:29:31.252633
,1,55,https://www.tripadvisor.com.sg/Profile/hallyboy1,356308899,17-03-2016,5,Very interesting,"This is on Maxwell Road, close to the Maxwell Road hawker centre in Chinatown. Not only will you learn a lot about the history of the island through displays and audio visual presentations but the scale model of the city centre is a phenomenal sight.",03-2016,Couples,2020-01-30 14:29:31.599017
,1,55,https://www.tripadvisor.com.sg/Profile/Calvin L,355503570,15-03-2016,5,"Very interesting, especially if you are interested in town planning","Very detailed and interesting display with large models, don't miss if you are interested in the development history of Singapore and planning and development of towns.",03-2016,Couples,2020-01-30 14:29:31.986638
,1,55,https://www.tripadvisor.com.sg/Profile/299geoffw,354221099,10-03-2016,4,nice to see,"You get a great prospective of Singapore, being able to see the complete layout of the city and read/hear about it was great.",09-2015,Couples,2020-01-30 14:29:32.314517
,1,55,https://www.tripadvisor.com.sg/Profile/deeontheroadagain,353066424,05-03-2016,5,Singapore into the future,A really interesting insight into future planning for Singapore. Lots of models to show lay out of the whole island and the city.,03-2016,Couples,2020-01-30 14:29:32.678827
,1,55,https://www.tripadvisor.com.sg/Profile/bombaymartini,349013390,19-02-2016,5,Excellent History of Singapore,"You not only see the history of Singapore, but the future of Singapore. The government here plans out 40 to 50 years and it shows in what's been done and what's going to be done.",02-2016,Couples,2020-01-30 14:29:33.034644
,1,55,https://www.tripadvisor.com.sg/Profile/patrickfiat21,348699012,18-02-2016,5,best kept secret for urban buffs,"it is a really experience to visit the gallery with its giant model of Singapore landscape, the presenat and the next 30 years to come. A great tribute picture gallery to show the old Singapore and its iconic building. A must visit for architect buff.",02-2016,Couples,2020-01-30 14:29:38.934970
,1,55,https://www.tripadvisor.com.sg/Profile/margiedrew,348109410,16-02-2016,5,Well worth the visit,The Singapore City Gallery is an excellent place to learn about how Singapore has developed from a fishing village into one of the most successful countries in SE Asia. The vision of the city-planners and the remarkable land reclamation programme has ensured Singapore's success. An added bonus is that it is free!!!,02-2016,Couples,2020-01-30 14:29:39.286173
,1,55,https://www.tripadvisor.com.sg/Profile/Travelfan,348007117,16-02-2016,4,Urban Redevelopment Authority model for future Singapore,"Our local guide, who was once an intern for the Urban Redevelopment Authority, brought us here to show us the models of the future Singapore and the displays about the history of Singapore. If you are impressed with what the city looks like now, you should definitely stop by to see these exhibits. It explains how most of what we currently see has been done in the past 50 years, with the bulk of it in the past 20 years. It shows where they plan to continue building. And when Singapore makes plans, things happen. It is very impressive, unless you factor in the people who are forced to move. Their say is exercised when they vote, and they have voted for the same party for those same 50 years, so I would have to say that in general they are satisfied with the direction of the country. Trying to implement anything like this in another democracy would be nearly impossible. Lots to think about, and these exhibits show all the thought that went into Singapore's progress and is going into Singapore's future.",01-2016,Couples,2020-01-30 14:29:39.603610
,1,55,https://www.tripadvisor.com.sg/Profile/c9007rsh,344720028,03-02-2016,4,Great way to get an overview,"The city gallery is a hidden gem. Truly a great way to see what this city is made of, how it works and where it is going to go. Worth your time!",03-2015,Couples,2020-01-30 14:29:39.961070
,1,55,https://www.tripadvisor.com.sg/Profile/Speedbird747,342646809,25-01-2016,4,Interesting city vision,If you have an hour spare this is an interesting exhibition worth a visit showing how one man's vision for the regeneration of a city came into being. I can think of few cities (if any) that have developed in this way.,01-2016,Couples,2020-01-30 14:29:40.286387
,1,55,https://www.tripadvisor.com.sg/Profile/TARDIS4956,341495978,20-01-2016,5,Explains well how Singapore developed and its future plans,We did this as part of a food tour and found it fascinating. Shows how Singapore has developed in 50 years from a small country into a powerful trading nation. Worth even a short visit to put the city into perspective,01-2016,Couples,2020-01-30 14:29:40.648742
,1,55,https://www.tripadvisor.com.sg/Profile/ElenaIS,339832152,14-01-2016,5,A must when looking to understand this city,"Easy to find , cross the street to Maxwell Centre ( great local food and atmosphere). Free entrance for the museum. Lots of information presented very attractively and meaningfully. It is a great learning opportunity about the city, it's problems, their sollutions. It gives hope that clean and sustainable cities are not a dream.",12-2015,Couples,2020-01-30 14:29:41.020447
,1,55,https://www.tripadvisor.com.sg/Profile/Brad_Herbert,668566685,23-04-2019,5,"Maps, models and more!","If you are into urban planning, maps, models or how a city can develop, or even if you’re not, the Singapore City Gallery is a very well done space. I found it surprisingly interesting and ended up staying much longer than I expected. There is plenty to read and the models of the city are very impressive and informative.

Entry is free which is a bonus and they do also run guided tours. I’ll certainly recommend this to visitors to Singapore. It’s also directly across the road from the Maxwell Hawker food centre which is handy for pre or post visit food.",04-2019,Solo,2020-01-30 14:30:07.307921
,1,55,https://www.tripadvisor.com.sg/Profile/barfiner,637358803,04-12-2018,4,Enjoyed,I really enjoyed my time here. Its a great gallery to visit and pretty big. I found my visit fun and educational,11-2018,Solo,2020-01-30 14:30:07.655307
,1,55,https://www.tripadvisor.com.sg/Profile/Philip1120,636716715,30-11-2018,5,Excellent story of Singapore’s remarkable physical transformation,"This is a belated review. While not as exciting as the stunning high-tech Urban Planning Exhibition in Shanghai, the free-to-enter Singapore City Gallery is nonetheless of interest to anyone wanting to understand more about the city’s physical transformation over the past 60-odd years, especially to someone like me who, in the 1950s, spent part of their childhood living on the outskirts of the city.

The exhibition, which is on two floors, includes various models, displays and interactive screens that tell the story of Singapore’s development in an engaging way. It also outlines the Urban Redevelopment Authority’s ambitious plans for the future. The gallery, which was a stop during a half-day guided walking tour of the city, is well worth visiting even if you don’t have a professional interest in planning. I visited it twice. It’s just across the road from the Maxwell Food Centre.

At the time of writing this review the gallery is apparently being revamped, although some exhibits are still available for viewing.",12-2017,Solo,2020-01-30 14:30:08.065392
,1,55,https://www.tripadvisor.com.sg/Profile/Flitz8,573021795,13-04-2018,4,Free and not so big,"This gallery is not so big and free.The second floor which sign in shows how Singapore how grown today with help city planning,enjoyed interactive exhibits",04-2018,Solo,2020-01-30 14:30:08.437904
,1,55,https://www.tripadvisor.com.sg/Profile/TheOExpress,559907529,12-02-2018,5,Free and loads to do.,"Not all of the floors were open when I visited but this is still an excellent place to visit and the fact that it's free makes it essential. There are loads of interactive exhibitions and information about the city's past, present and future development, as well as two huge models of the city's centre and overall geography. All very interesting, and easily accessible for tourists.",02-2018,Solo,2020-01-30 14:30:08.740605
,1,55,https://www.tripadvisor.com.sg/Profile/Stephanie J,554548536,18-01-2018,5,Go with Rene of Singapore City Explorers,"I wouldn't have gotten much out of going here alone, but going with Rene of Singapore City Explorers was a fantastic experience. I enjoyed the large model of the city and the board that showed ""old"" and ""new"" scenes. The displays were interesting and informative - such as the one on how trash is burned to eliminate trash, create energy and create new land. Just fascinating!!",01-2018,Solo,2020-01-30 14:30:09.119809
,1,55,https://www.tripadvisor.com.sg/Profile/riff-raffkind,526405133,22-09-2017,5,This should be your first stop in Singapore,"This museum gives an excellent overview of Singapore’s historic transformation, current land reclamation and future projects such as water independence. This museum also serves to seamlessly integrate every aspect and facet of touring Singapore, such as Chinatown, the Malay enclave, the current project of connecting green spaces and how the geology of the city/state allows for the MTR, tunnels and military secret sites to exist - all under ground!",09-2017,Solo,2020-01-30 14:30:09.472393
,1,55,https://www.tripadvisor.com.sg/Profile/Rich D,522548210,08-09-2017,5,There is urban planning and then there is Singapore...,"It's a must visit for anybody who wants to understand and marvel at Singapore's urban planning achievements. There is no city in the world that is so forward looking and progressive with its own design trying to strike a balance between functionality, efficiency, affordability and environmental beauty of its living spaces. Truly astonishing when you understand that it was only 50 years ago since Singapore kickstarted its urban development into overdrive.

There is a huge 1:400 scaled model of the city, plus lots of exhibits documenting the different stages in the city development, starting with public housing projects and culminating with its latest efforts around the Marina Bay and its 'Garden City' projects throughout the whole city... Plenty of architectural plans and drawings of the many famous structures in Singapore and around the world designed by Singapore's architectural firms. Lots of models of famous buildings, audiovisual presentations... Future plans... Very impressive and immersive...

Very much recommended for anybody who visits Singapore. One of my favorites!!! And it's FREE to visit;)

See all of my pictures to get a better sense and preview of this superb urban planning museum.",09-2017,Solo,2020-01-30 14:30:09.908601
,1,55,https://www.tripadvisor.com.sg/Profile/KGB777,492721163,13-06-2017,3,Worth a look,If you're interested in the plans for Singapore's future then this place is well worth a visit. Quite impressive scale model of the central districts on the second floor. Free to enter and not many other visitors. I combined with a lunchtime visit to one of the nearby government offices.,06-2017,Solo,2020-01-30 14:30:10.240160
,1,55,https://www.tripadvisor.com.sg/Profile/celge,490075193,03-06-2017,5,Excellent insights into urban development,"Unlike some other reviewers I believe you will appreciate this excellent exhibition more if you don't go there at the beginning of your stay, but after exploring the city on your own. You will then have seen some of the places shown here and be able to associate with them much more. I continue to be impressed how responsibly this city is being developed and how transparent the URA communicates their master plans.",06-2017,Solo,2020-01-30 14:30:10.599304
,1,55,https://www.tripadvisor.com.sg/Profile/nejadm,485188119,18-05-2017,5,Great Models and Information!,A very beautiful scale model of the city of Singapore plus a smaller scale model of the entire island definitely worth visiting and free! Plus afterwards or before hand you can stop by Maxwell foodcourt for some authentic Asian cuisine.,05-2017,Solo,2020-01-30 14:30:16.565777
,1,55,https://www.tripadvisor.com.sg/Profile/occhiolist,481970572,06-05-2017,5,Modern and interesting,"Of course, if you find the idea of urban planning terminally dull, you're never going to enjoy this museum. However, if you have an interest in city planning or have found yourself wondering how such a small country functions, this is an excellent, modern museum that can give you a good insight into Singapore's development.",04-2017,Solo,2020-01-30 14:30:16.924895
,1,55,https://www.tripadvisor.com.sg/Profile/LearnAsIgo13,481450967,04-05-2017,4,In Chinatown? Go see it for an hour.,"A short walk from the Chinatown MRT this is a good place to visit especially if it's raining or extremely hot. It's free and it's interesting. I had never given much thought to town planning but with a country as tiny as Singapore there's clearly no room for error. It was very impressive to see their foresight and how cleverly everything has been, and continues to be, planned and executed. It also gave me an appreciation for the uniqueness of Singapore and made me realize it's not as fabulous as it is by chance. It's most definitely by design.",04-2017,Solo,2020-01-30 14:30:17.259629
,1,55,https://www.tripadvisor.com.sg/Profile/bethanylou,480789274,02-05-2017,5,Fantastic Free Attraction,"I decided to visit this Gallery after reading reviews on it. What an amazing experience. The Gallery is a multi sensory journey into the planning of Singapore City. It goes through the past present and future plans of the city and also includes one of the worlds largest architectural models showing a great view of Singapore.
This is worth a visit, takes about 1-1.5 hrs to go though. One hint arrive at 9am opening as by the time I left at 1100 it was packed with school tours.
One of the rare free things to do in Singapore.
Highly recommend!",05-2017,Solo,2020-01-30 14:30:17.651181
,1,55,https://www.tripadvisor.com.sg/Profile/geographyguy_11,469293892,22-03-2017,5,Highlights Singapore's amazing success,"The City Gallery was an unexpected highlight of my Singapore visit. The massive island and city centre models give a great overview of how this city-state functions and the following displays are truly fascinating. How a tiny country makes do with such a small space is clearly explained for the housing, energy, water, economic, transport, conservation and environmental sectors and is a fascinating story. There are lessons here for visitors from around the world to take home to their own cities.",03-2017,Solo,2020-01-30 14:30:17.966859
,1,55,https://www.tripadvisor.com.sg/Profile/Pisagua23,463389960,28-02-2017,5,Low Key but Totally Worth it!,"This is a wonderful museum which displays the urban planning and transformation of Singapore. Best to go early in your trip as it will give you a great perspective of the City and its amazing evolution.
Right next to Maxwell Hawker food center - you can combine the outline with trying the world famous Chicken Rice served there.",02-2017,Solo,2020-01-30 14:30:18.297245
