REVIEW_INDEX,WEBSITE_INDEX,POI_INDEX,REVIEWER_URL,REVIEW_ID,REVIEW_DATE,REVIEW_RATING,REVIEW_TITLE,REVIEW_BODY,DATE_OF_EXPERIENCE,TRIP_TYPE,REVIEW_CRAWLED_TIME
,1,55,https://www.tripadvisor.com.sg/Profile/charlexandr99,718846747,16-10-2019,5,Very impressive architectural exhibitions and models.,"Every Architect and citizen interested in urban development must visit the gallery. There is lot more to learn from it. If you have a big group, engage a tour guide - they're really knowledgeable and helpful!",10-2019,Family,2020-01-30 14:27:59.058751
,1,55,https://www.tripadvisor.com.sg/Profile/nicholashawkins55008,712299930,23-09-2019,5,Professional and professional,Great models of the city and Information on the developement plan for Singapore in the future! And absolutely free! Really worth a visit especially during a short rain period.,09-2019,Family,2020-01-30 14:27:59.389868
,1,55,https://www.tripadvisor.com.sg/Profile/Traveller95389,708403744,10-09-2019,5,Interesting!!!,The gallery was very captivating. I got to see how they slowly build Singapore. The gallery was also very interactive. I liked the scale model alot.,09-2019,Family,2020-01-30 14:27:59.710905
,1,55,https://www.tripadvisor.com.sg/Profile/Josephine N,665058687,09-04-2019,5,Return for the Cherry Blossom season,was there on late March ... was too late to visit as some of the cherry blossom flowers were dying ... but other flowers were still in good & pretty conditions especially the orchids...,03-2019,Family,2020-01-30 14:28:00.043605
,1,55,https://www.tripadvisor.com.sg/Profile/jonathan f,651358604,11-02-2019,5,If you don't have much time...,"Overall birdseye view of sg. Future planning and landscape. First stop here to get overall view. Give Sentosa a miss, Go to east coast instead.",02-2019,Family,2020-01-30 14:28:00.453947
,1,55,https://www.tripadvisor.com.sg/Profile/Greg_Rowlings,648279450,26-01-2019,4,Great insight in Singapore,"We were taken here by a proud Singaporean local who wanted to show us a birds eye perspective of his city. We were not disappointed...the planning, history and cultural preservation were at the forefront. If you have a few hours, go and have a look. We have been coming to Singas for years, and this was well worth the visit!",01-2019,Family,2020-01-30 14:28:00.795674
,1,55,https://www.tripadvisor.com.sg/Profile/guineapea,640466765,19-12-2018,4,Partially closed,The Gallery is currently undergoing renovations and will take up to a year. You can still visit level 1 where the model of the Singapore city is located. However the other parts in level 1 and 2 closed. Was a disappointing trip for today but hope to be back again end next year.,12-2018,Family,2020-01-30 14:28:01.123407
,1,55,https://www.tripadvisor.com.sg/Profile/JanKofMelbourne,639533204,14-12-2018,4,Pop in for a birds-eye view of the island and the city,Terrific models of the island and of the city that give you a great overview. There's lots of information for those interested in urban planning but we just popped in for the models (and the air-conditioning!). They really are great models! And it's very close to the Maxwell hawker centre (lunch).,12-2018,Family,2020-01-30 14:28:01.479779
,1,55,https://www.tripadvisor.com.sg/Profile/kathysim1,620866673,01-10-2018,5,The Comprehensive View,Visited the Maxwell food center and walked in to this building by chance and saw the map. It was great to learn about the development around the area.,11-2017,Family,2020-01-30 14:28:01.814917
,1,55,https://www.tripadvisor.com.sg/Profile/Rohit B,612556235,31-08-2018,4,Singapore City Gallery,"this place tells about the history of Singapore and how the city was built, good place to visit for traveller",06-2018,Family,2020-01-30 14:28:02.192884
,1,55,https://www.tripadvisor.com.sg/Profile/Tracey S,611266919,28-08-2018,5,Stunning,The gardens are so beautifully presented. Each section has a theme and the amount of thought and effort that is displayed is obvious and in places very entertaining. Well worth a visit.,07-2018,Family,2020-01-30 14:28:08.163071
,1,55,https://www.tripadvisor.com.sg/Profile/KuntheavyChak,593135429,05-07-2018,5,Enjoyed,"We visited Singapore with our children, there were enjoy and full experience. We have visited a few place and we plan to visit again in future",06-2018,Family,2020-01-30 14:28:08.453161
,1,55,https://www.tripadvisor.com.sg/Profile/Elisabeth G,585752007,07-06-2018,5,A perfect idea about what is Singapore,You can see the evolution of Singapore and the Maser plan of the country. It is easy to visit also for children and very interesting.,06-2018,Family,2020-01-30 14:28:08.746543
,1,55,https://www.tripadvisor.com.sg/Profile/Karel K,575187294,23-04-2018,4,Interesting place to see,If you are intersted in the way how Singapore was build to the modern city and ceneter of business you need to visit the exposition there. It will show you the way of thinking and planning the city grow for the people and good life there. Very interesting. Entry is free.,04-2018,Family,2020-01-30 14:28:09.090842
,1,55,https://www.tripadvisor.com.sg/Profile/Chris H,563520808,01-03-2018,4,Planning geek heaven,"The model of the city is great, and there are some brilliant historic photos and descriptions of how the city has been developed.",01-2018,Family,2020-01-30 14:28:09.428647
,1,55,https://www.tripadvisor.com.sg/Profile/FerrisXL,516150048,22-08-2017,4,Good to get an overview,Would recommend this place to all newcomers to Singapore as the detailed scale model on the ground floor gives a great overview about the various parts and neighbourhoods of Singapore and a sense of where these are located vis a vis the CBD and nature reserves. Also interesting for people who have lived in Singapore for a while and know the various iconic buildings and developments for which construction drawings are shown.,08-2017,Family,2020-01-30 14:28:09.770690
,1,55,https://www.tripadvisor.com.sg/Profile/StevenJackson2016,513767841,16-08-2017,5,"Interesting for the whole family, insightful and impressive","We spent 70min with a family of four and would have stayed longer, if it was not closing by 5pm. It really grabbed the attention of everyone. When other countries will start running out of land in 50 years they will look to Singapore, because the Singaporeans already have invented everything that is needed to run a city sustainably on limited space. Very impressive. Learned more about urban planning than in any other city before.",08-2017,Family,2020-01-30 14:28:10.131769
,1,55,https://www.tripadvisor.com.sg/Profile/Florencesingap,458407784,10-02-2017,5,A super interesting place !,"A compulsory visit for any people discovering Singapore for the first time ! It shows you the evolution of the city, its development, its urbanism. A lot of interactive activities for the kids who always enjoy that place.",06-2016,Family,2020-01-30 14:28:10.475422
,1,55,https://www.tripadvisor.com.sg/Profile/ezjosa,454230220,23-01-2017,5,A Very Useful Information of Singapore,"This gallery is located near the Tanjong Pagar MRT Station. At this place, you can learn a lot of things related to the development history of Singapore and their upcoming plannings about the city. I can say that this is the most informative gallery that I’ve ever visited in the context of urban topics. Very recommended, and don’t forget to stop by at the interactive games upstairs.",02-2016,Family,2020-01-30 14:28:10.835867
,1,55,https://www.tripadvisor.com.sg/Profile/helencathcart,442964705,09-12-2016,4,Very interesting.,Thoroughly enjoyed having a wander around and reading all the information. Well set out. The miniature display of Singapore was really well down and would have taken a lot of time to build.,12-2016,Family,2020-01-30 14:28:11.172639
,1,55,https://www.tripadvisor.com.sg/Profile/janmichael10,439630959,24-11-2016,5,SG Downsized,"This gallery provides tourists and educationalists a perfect big picture of the city, from what it is today and its envisaged future. A brief history of SG's development is shown here, and how its forefathers turned the once brackish, swampy small island into the first world status it is today. It recounts the 50 years of SGs land management and zoning plan to make the city one of the most livable in the world. All free.",11-2016,Family,2020-01-30 14:28:17.133580
,1,55,https://www.tripadvisor.com.sg/Profile/joesweg,427767960,14-10-2016,5,A must visit,"As a geographer I totally loved this place - it was on my must visit list, and I wasn't disappointed. I loved the scaled 3-D models/maps of Singapore. Very interesting images and stories about the geographical changes which have occurred on the island of Singapore over the years. It provides you with a good understanding of the complex issues related in designing and developing a city like Singapore.
There were great interactives as well for people to play and explore",10-2016,Family,2020-01-30 14:28:17.525937
,1,55,https://www.tripadvisor.com.sg/Profile/byb2103,426550657,10-10-2016,5,History of Singapore,"This is a lovely, free museum to learn more about the history of Singapore. From extremely detailed models of the country to exhibits about Singapore infrastructure, this museum offers a whole host of knowledge about the country. I really enjoyed learning about the country's development.",11-2015,Family,2020-01-30 14:28:17.912570
,1,55,https://www.tripadvisor.com.sg/Profile/LKK78,421082543,22-09-2016,5,A hidden gem and a must if you want to understand this island nation,"I honestly would not have thought to visit this gallery, but it was part of a walking tour (Food Tours Singapore), and a testament to the understated relevance of development to the culture of Singapore.

The gallery is free admission, and gives you real insight into the size of Singapore in comparison to other large cities, it's real need for constant re-evaluation of development to keep up with it's growing population, and a history of it's redevelopment and the significance of different cultures on the construction and urban planning from the days as a port city to today.

A great way to spend an hour if you're in the Chinatown area and need a cool airconditioned reprieve from the humidity, close to hawker centres for a treat afterwards! and even great for kids of all ages",09-2016,Family,2020-01-30 14:28:18.279702
,1,55,https://www.tripadvisor.com.sg/Profile/needtochillout,417728152,13-09-2016,5,Singapore WOW,"My daughter made me go to the URA centre, as I had previously lived in Singapore in the 80's - this display is amazing. It shows the quality of the Singapore people to have a display of a plan for their future.",09-2016,Family,2020-01-30 14:28:18.637124
,1,55,https://www.tripadvisor.com.sg/Profile/Mayank831,414091102,03-09-2016,4,History of Singapore,Go if you want to know how Singapore is built and made. Decade by decade they have shown their growth. It is really amazing to see how they have grown in past 50 years. They have laid down master-plans for the future and its amazing how they are chasing these plans.,08-2016,Family,2020-01-30 14:28:18.983474
,1,55,https://www.tripadvisor.com.sg/Profile/ricardam78,399412183,31-07-2016,5,The Future and Past of Singapore City,"We were pleasantly surprised by our visit here! We loved learning about both the past and the future plans for Singapore and we learnt alot about the city itself. Highly interactive and a great place to take the family as there is something for everyone, we love the large scale model of the city itself.",07-2016,Family,2020-01-30 14:28:19.352432
,1,55,https://www.tripadvisor.com.sg/Profile/VinP393,381524219,11-06-2016,5,A must-see though it is low on tripadvisor things to do,"To understand how Singapore became this beautiful, eco friendly and an amazing country you need to check this museum out. They explain how much of planning goes into making their roads, structures, underground, transport and greenery, The entire city's 3D miniature model is in one floor of the building. Quite a feat to replicate the whole of Singapore with all its sky scrapers and every street. Its a free for all and yet it is not in the top 10 list .I almost missed this attraction in Singapore, managed to do it on the last that too an hour before closing. You will even see a Malay lady doing the next new building's miniature.",06-2016,Family,2020-01-30 14:28:19.735414
,1,55,https://www.tripadvisor.com.sg/Profile/Otaytak,380404479,07-06-2016,4,City of Singapore,Good information on the development and plans for the City of Singapore. It is interesting with outstanding displays. Plus it is totally FREE.,06-2016,Family,2020-01-30 14:28:20.082343
,1,55,https://www.tripadvisor.com.sg/Profile/Kevin B,379503116,04-06-2016,5,Overview of Singapore,They are so forward thinking in Singapore. Display gives you great overlay of city. It is such a small country but they are so innovative on planning,05-2016,Family,2020-01-30 14:28:20.409718
,1,55,https://www.tripadvisor.com.sg/Profile/stephye0,358065906,24-03-2016,4,friendly staff and interesting exhibits,"staff at registration counter were very friendly. i like the interactive exhibitions, as well as the hourly shows. there's a game where you can plan a city with fellow gallery visitors!",02-2016,Family,2020-01-30 14:28:26.306142
,1,55,https://www.tripadvisor.com.sg/Profile/Neville F,353452075,07-03-2016,5,Great,The tour took us to the gallery and looking at the display of the city was great and the info from the tour guide was very interesting. To see the city in this was was great and to see what is plan intresting,02-2016,Family,2020-01-30 14:28:26.639150
,1,55,https://www.tripadvisor.com.sg/Profile/aIRdEE,344761389,03-02-2016,5,Fascinating insights to how the city was planned and built,"Fans of the game SimCity will love this exhibition on how Singapore was built and what the plans are for the future. Interactive, informative. Excellent.",01-2016,Family,2020-01-30 14:28:27.000999
,1,55,https://www.tripadvisor.com.sg/Profile/Adesitraveller,337093644,04-01-2016,4,A wonderful look at Singapore's planning,"I'd intended to visit this Gallery but could never find the time to do it.

The school holidays gave us the perfect chance.

Entry is free and there are wonderful scale models of Singapore and it's different areas.

It was great to see literally a bird's eye view of the development and how well planned it has all been.

There are nuggets of information about the development as well as key architectural highlights of some of the buildings.

A nice way to spend an hour.",12-2015,Family,2020-01-30 14:28:27.383429
,1,55,https://www.tripadvisor.com.sg/Profile/123elendil,698255246,12-08-2019,5,Very interesting place!,The main exhibit is a model of the whole island with future planning. It is fascinating. In addition the exhibition shows maps of Singapore along history. I was amazed to see the 1971 plan for Singapore. For almost 50 years this plan is realized step by step. Really remarkable. I enjoyed the visit very much!,08-2019,Couples,2020-01-30 14:28:53.751853
,1,55,https://www.tripadvisor.com.sg/Profile/EJBSHJ,681800546,16-06-2019,5,"More great Singapore architecture, and fabulous art",This beautifully designed building which marries the old Supreme Court building and the old City Hall is a treasure. There are exhibitions and activities for children and adults. We loved the large exhibition of Singapore art from early days to contemporary.,06-2019,Couples,2020-01-30 14:28:54.127827
,1,55,https://www.tripadvisor.com.sg/Profile/651darrinr,660248568,22-03-2019,3,Gallery,A place to find out the art and pictures of Singapore and surrounds. Helpful staff and will guide you around,10-2018,Couples,2020-01-30 14:28:54.471278
,1,55,https://www.tripadvisor.com.sg/Profile/ranjanapathak,654207452,23-02-2019,4,Appreciate Singapore,"Located between historic Chinatown and the Central Business District, Singapore City Gallery is a three storey visitor centre which houses an enormous model replica, giving visitors a complete view of the Central Area of Singapore. It also shows the city's physical transformation past, present and future. Opening time is in attached photo.",11-2018,Couples,2020-01-30 14:28:54.840597
,1,55,https://www.tripadvisor.com.sg/Profile/Katie K,652414729,15-02-2019,4,Go here for the model!,"If you like maps and urban planning GO HERE! Fascinating. Loved the 1:400 scale model, I could get lost looking at it for hours. Knowledgeable volunteers offer free tours and extra tidbits throughout the day.
1 point off since parts of the museum were roped off.",02-2019,Couples,2020-01-30 14:28:55.215755
,1,55,https://www.tripadvisor.com.sg/Profile/mr923,646111317,16-01-2019,5,Interesting place to visit,We stumbled upon this by accident. Very interesting and informative on the growth and development of the city.,01-2019,Couples,2020-01-30 14:28:55.515585
,1,55,https://www.tripadvisor.com.sg/Profile/Michael K,630262725,02-11-2018,3,Interesting scale model of the city state,"The scale model of the city was quite intricate and interesting. Even though it is not a must see, if you are in the vicinity of Maxwell Food Centre, it is well worth the effort to pop in for a quick look especially since it is free.",11-2018,Couples,2020-01-30 14:28:55.883325
,1,55,https://www.tripadvisor.com.sg/Profile/fatherdoninnyc,611676669,29-08-2018,5,Over All,To be able to see how the planning of this Island nation has and is taking place is amazing. It was great to see the way the city is being shaped and shaping a social structure that at least on the surface is healthy.,11-2017,Couples,2020-01-30 14:28:56.206336
,1,55,https://www.tripadvisor.com.sg/Profile/Henry A,604286815,08-08-2018,5,The cheapest tour in Singapore!,Nothing beats a free gallery. The Singapore City Gallery shows you how Singapore has been developed over the years and gives you glimpses into the future.,09-2017,Couples,2020-01-30 14:28:56.489227
,1,55,https://www.tripadvisor.com.sg/Profile/LxRigger,586315881,10-06-2018,4,Historic Insight,A great place to step into out of the afternoon humidity to get a feel for the history of Singapore. A big 3d map shows the layout of the city as well as future plans for reclaiming land.,03-2018,Couples,2020-01-30 14:28:56.814291
,1,55,https://www.tripadvisor.com.sg/Profile/georgig2016,576144365,28-04-2018,5,Interesting !,"A must-see for people interested in how Singapore was planned and built. It gives plenty of information about this amazing city state - history , planning , infrastructure and future development opportunities.",04-2018,Couples,2020-01-30 14:29:02.685516
,1,55,https://www.tripadvisor.com.sg/Profile/Mchangle,570312499,02-04-2018,5,Excellent Introduction to Singapore in the heart of Chinatown,This is a free city planning museum next to the Maxwell Center Food Stalls and is an excellent Introduction to Singapore in the heart of Chinatown. There are floor sized 3D model exhibits of the entire city that are very impressive. There is an excellent discussion of the different types of architecture found in the city as well as the thought behind the sustainability planning of the area. Well worth a visit.,02-2018,Couples,2020-01-30 14:29:03.041251
,1,55,https://www.tripadvisor.com.sg/Profile/adamathompson,569875794,31-03-2018,4,Interesting gallery and plan of city,"Not somewhere we would have thought to come without our guide, but glad we did as the exhibit on the history of the country and the scale models of the city and expansion plans were fascinating and gave a lot of cultural context to our short stop in Singapore.",10-2017,Couples,2020-01-30 14:29:03.349058
,1,55,https://www.tripadvisor.com.sg/Profile/lga311,560480518,14-02-2018,5,Best thing we did in Singapore,"We started our visit to Singapore here. In terms of community planning, perspective and history, this place gives a really good base to start exploring the city. In a short time, we were introduced to the culture and development of Singapore. We were amazed at the smart planning and development. Singapore is an amazing place and this Gallery exhibit will help you understand why.",12-2017,Couples,2020-01-30 14:29:03.673348
,1,55,https://www.tripadvisor.com.sg/Profile/OhNoNotHerAgain,554846906,20-01-2018,5,Not to be missed if you have any interest in this unique city-state,"Singapore is has a very interesting history and mixture of cultures and there are several excellent museums to learn about it's people, past and present.

But Singapore is unique in it's rapid development in just a few decades from what was essentially a colonial backwater to a high-tech global city-state tasked with providing for over 5 million residents on a finite island that struggles with its size.

The City Gallery's exhibits highlight the building and infrastructure challenges faced and how each challenge has been (and continues to be) met, from reclaimed land to transportation to housing to the creation of whole neighborhoods, water resources and management, and the preservation of its historical districts and shop houses. The enormous 3-D scale model of Singapore is worth the prices of admission, but there is so much more. It is a great place to start to learn about how this place came to be what it is and get a feel for the physicality of the city.

As in everything Singapore, the City Museum is well organized, quiet, with good lighting and clean restrooms. You could go through this museum in an hour or you could easily spent 2 or 3, depending on your interest and time constraints.",02-2017,Couples,2020-01-30 14:29:04.074794
,1,55,https://www.tripadvisor.com.sg/Profile/Lynda-DaveClarke,550226482,30-12-2017,5,Amazing Place,This place is great. Tells you all the changes from the old to the new and the future for Singapore. It's very interesting and interactive in places. Would recommend.,12-2017,Couples,2020-01-30 14:29:04.393001
,1,55,https://www.tripadvisor.com.sg/Profile/BumblechickFood,547367679,15-12-2017,5,Amazing Full Scale City Models,This is the place to go to get an idea of the way Singapore thinks and plans. You can see all the work that goes into making a city of this size work so smoothly. The models are unbelievable.,12-2017,Couples,2020-01-30 14:29:04.690551
,1,55,https://www.tripadvisor.com.sg/Profile/SagaloutsTour,535386869,23-10-2017,4,Understand The Development Of Singapore,"This is a bit out of the way and possibly not my first choice of sights to see. How wrong I was. To fully understand how Singapore has been so precisely planned and developed over the decades you need to see this place. When you look at the Singapore skyline and sights you may believe that these were just randomly built in a race to build the biggest, wierdest buildings alongside each other. But after visiting you will understand how much planning took place, especially the reclaimation of land from the sea.
In my view a must see and free!",10-2017,Couples,2020-01-30 14:29:05.060361
,1,55,https://www.tripadvisor.com.sg/Profile/Pranav N,517694331,26-08-2017,4,Great spot to learn about singapore,"Singapore is quite a well planned city, and only when you know what went into it can you truly appreciate it. Do here to know all that and see a large model of the downtown area.",04-2017,Couples,2020-01-30 14:29:05.438205
,1,55,https://www.tripadvisor.com.sg/Profile/AdrianT-Perh,504046931,21-07-2017,4,Would have never of thought to visit here,"We visited here on our Chinatown walking tour and were really surprised when we went inside.

The have a scale model of all of Singapore showing current and future developments.

There is also a informative display about the development of Singapore upstairs.

If you are in the area spend 30 minutes of so and have a look around. We found it very interesting.",11-2016,Couples,2020-01-30 14:29:05.798539
,1,55,https://www.tripadvisor.com.sg/Profile/Bernice R,493744940,17-06-2017,4,Educational visit,Worth a look if you're interested in city planning or learning about how Singapore physically transformed itself in recent decades. The city replicas look impressive. The staff and volunteers at the gallery seemed quite happy to explain this aspect of Singapore's story to visitors.,07-2016,Couples,2020-01-30 14:29:11.737648
,1,55,https://www.tripadvisor.com.sg/Profile/TheWTandNBTT,483626212,12-05-2017,5,Definitely worth a visit.,"We spent a few hours wandering freely around this modern gallery which explains in innovative ways, how Singapore has grown, matured and developed over the years. There are a variety of benches inside the reception area and are made from the old National Stadium seats. They were apparently part of a local competition and the results are incredibly inventive and quirky, and they aren't even in the exhibition space, they're just dotted around for visitors to enjoy. The water feature in the reception area is wonderful, and apparently catches a few people out, who mistake the expansive marble covered flowing water for a seating area....take a change of clothes!
Inside the gallery, which is free to enter, is a very interesting pictorial history of this beautiful island state and how innovation and sensitive planning have taken this once Colonial outpost from poverty into a vibrant, productive, verdant, modern and pristine country. The huge scaled down cityscape model is amazingly lifelike and fully shows the vast improvements that are being and have been made over recent decades. This might be seen as a rainy day activity, however it warrants a visit whatever the weather, and greatly enhanced our understanding of this beautiful island and its people. Give it a try, it will be a delightful couple of hours, well spent.",05-2017,Couples,2020-01-30 14:29:12.105804
