REVIEW_INDEX,WEBSITE_INDEX,POI_INDEX,REVIEWER_URL,REVIEW_ID,REVIEW_DATE,REVIEW_RATING,REVIEW_TITLE,REVIEW_BODY,DATE_OF_EXPERIENCE,TRIP_TYPE,REVIEW_CRAWLED_TIME
,1,29,https://www.tripadvisor.com.sg/Profile/Rossendale22,657386794,09-03-2019,4,Two visits Ideal,Visit during the day to see the sites and second visit to view the light show given each evening. Modest entry fee,02-2019,Couples,2020-01-30 05:42:18.949167
,1,29,https://www.tripadvisor.com.sg/Profile/Alister L,657272862,09-03-2019,5,Great views,Don’t try this if you have a fear of heights.. one gets great views over the gardens and you can get some great pictures. Well worth the $8 charge,03-2019,Couples,2020-01-30 05:42:19.270244
,1,29,https://www.tripadvisor.com.sg/Profile/Tammy D,656987157,07-03-2019,5,Great views,Don’t try this if you have a fear of heights..great views over the gardens and you can get some great pictures. Well worth the $8 charge,03-2019,Couples,2020-01-30 05:42:19.559982
,1,29,https://www.tripadvisor.com.sg/Profile/easterntreker,655858718,02-03-2019,3,Nice but can be missed,It us expensive for what you get. It does give a great view of the area and buildings near by . we didn't know you can only stay a short time and couldn't stay another 15 minutes to see the light show. They hustle you off the walkway.,02-2019,Couples,2020-01-30 05:42:19.950894
,1,29,https://www.tripadvisor.com.sg/Profile/careyandsarahb,655614164,01-03-2019,2,Not worth the money,"Waste of money in my opinion, long queues and views were ok but far too expensive for what you actually get. The walkway is a bit wobbly also",01-2019,Couples,2020-01-30 05:42:20.246991
,1,29,https://www.tripadvisor.com.sg/Profile/pdrey,654935138,26-02-2019,5,Be there at 9:00,"We were in line a bit before 9:00am and were the first in line.

I suffer from vertigo and a fear of heights but neither were triggered by the skywalk. Quite breezy the morning we visited but the movement was subtle and not disturbing.

They only allow a certain number of people on the skyway, so never felt crowded.",02-2019,Couples,2020-01-30 05:42:26.012859
,1,29,https://www.tripadvisor.com.sg/Profile/vacaljhoy,653267382,18-02-2019,5,OCBC SKYWAY,OCBC SKYWAY is one of the good spot to see the singapore view. The fresh singapore air and the breath taking view releases my stress from all walking in singapore. But take note this is not for those people who have fear of heights because when the weather is windy the bridge really swing hardly. But for those brave heart you can take the risk.,02-2019,Couples,2020-01-30 05:42:26.414819
,1,29,https://www.tripadvisor.com.sg/Profile/Margo124792,649956798,04-02-2019,5,Beautiful at night when the light show is on.,We tried to get onto the actual skywalk but the queue was huge and not prepared to wait the hour time given for tickets. Did purchase tickets once on a previous trip during the day but before we could go up a storm (frequent in Singapore) threatened and the walkway was immediately closed for safety reasons (i.e. rain and lightning strikes). Our money was refunded. There's always next time as we are regular visitors to Singapore,01-2019,Couples,2020-01-30 05:42:26.750407
,1,29,https://www.tripadvisor.com.sg/Profile/AnnMielle P,646477352,17-01-2019,5,Modern Day Architecture,"This one’s superb.
We went at night but it’s way too crowded since everyone was waiting for the illumination,
the following day we went over in the afternoon and it was a perfect time to explore
and take pictures
S$8 for 15 mins fee is totally worth it.
To those afraid of heights,i recommend that you stay on the grounds because the pathway/bridge, of the skyway gets a little shaky while walking.",01-2019,Couples,2020-01-30 05:42:27.110528
,1,29,https://www.tripadvisor.com.sg/Profile/cantleyblade,646144456,16-01-2019,4,Really good value,Gives you nice elevated view of the Gardens for a modest cost and should be incorporated in your visit. It is a walk with elevator at either end,11-2018,Couples,2020-01-30 05:42:27.499541
,1,29,https://www.tripadvisor.com.sg/Profile/kausarwali,645143728,11-01-2019,4,Scenic view observation,Sky way walk on the bridge between Tree Groves. It has 8 $ ticket to walk on the bridge but we already seen views from the doom in the Gardens by the Bay. One major attraction is light and sound show.,01-2019,Couples,2020-01-30 05:42:27.866410
,1,29,https://www.tripadvisor.com.sg/Profile/RobY240,645052258,11-01-2019,4,Great views but over too quick,"Only $8 and the views are worth it, but I was ushered along a bit too quick. You go up one tower and walk along to the next where you descend. It would be awkward to reverse and go back so it does feel a bit rushed. Advice then is to take your time, let others past and enjoy the views.",01-2019,Couples,2020-01-30 05:42:28.162350
,1,29,https://www.tripadvisor.com.sg/Profile/RaffyS52,644857835,10-01-2019,4,christmas songs,"its nice to witness ""dancing"" color effects in tune with our favorite Christmas songs. cant blame for people to wait hours just to witness the light show.",12-2018,Couples,2020-01-30 05:42:28.483137
,1,29,https://www.tripadvisor.com.sg/Profile/kellyx112017,644307033,07-01-2019,4,Lovely views,"Considering I am a bit afraid of heights it wasnt the best choice for me, but enjoyed it all the same. Happened to be up there during the light show, soooo nice!Costs 8 dollars, but has such long queues. Very well organized , they ask you to get visiting time on your ticket!",01-2019,Couples,2020-01-30 05:42:28.857796
,1,29,https://www.tripadvisor.com.sg/Profile/Dunnersfireman64,640641561,20-12-2018,5,Great fun,"The skyway around the supertrees was awesome! Great views over the Gardens by the Bay, also good spot for pics of the Marina Bay Sands.",12-2018,Couples,2020-01-30 05:42:29.145559
,1,29,https://www.tripadvisor.com.sg/Profile/Holz64,640426141,19-12-2018,5,Highly recommend this,A must do in Singapore! We went up during the day but the views at night would be amazing too. Just beware the queues can be quite long,12-2018,Couples,2020-01-30 05:42:35.058161
,1,29,https://www.tripadvisor.com.sg/Profile/CondeNast1,639443160,13-12-2018,5,Light and sound show,"It was a superlative experience light and sound show at the super tree grove if you are viewing it from the skywalk. In June the show was around 19.45 to 20.00. Fortunately, we were there.",06-2018,Couples,2020-01-30 05:42:35.446142
,1,29,https://www.tripadvisor.com.sg/Profile/Christine J,639231100,12-12-2018,5,lovely evening,"lovely light show on the huge trees, thoroughly enjoyed our evening walk around here, the views were amazing",11-2018,Couples,2020-01-30 05:42:35.795715
,1,29,https://www.tripadvisor.com.sg/Profile/moonlight_20,637746711,06-12-2018,3,Average views,Personally this wasn’t worth the time as the views are nice but you don’t achieve the best views that other places provide. I would definitely say to visit this place as soon as it opens as the lines get very long. For $8 it’s pretty cheap to give this a go.,12-2018,Couples,2020-01-30 05:42:36.101435
,1,29,https://www.tripadvisor.com.sg/Profile/mo_aiguille,636591023,30-11-2018,5,Highly recommend,"I would definitely recommend this skyway. You can great take pictures and it costs 8SGD per adult and children between the age 3-12 it’s 5SGD.
You get great views of the Marina Bay sands hotel and of the park.
It’s quite high up so anybody with a fear of heights should avoid.
If it’s raining they tend to stop entry into the skyway until the weather becomes better.",11-2018,Couples,2020-01-30 05:42:36.469835
,1,29,https://www.tripadvisor.com.sg/Profile/Alvin D,635475298,25-11-2018,4,Worth it,Definitely worth the admission charge while your doing the Garden by the bay experience. You will have the opportunity to take some fantastic photos,11-2018,Couples,2020-01-30 05:42:36.829937
,1,29,https://www.tripadvisor.com.sg/Profile/PJ777,632854883,12-11-2018,4,Long wait for lifts,"Didn't think the wait for the lifts was really worth it! Good views but too busy really, were going to go to the cafe but decided against it due to the volume of people.",03-2018,Couples,2020-01-30 05:42:37.205161
,1,29,https://www.tripadvisor.com.sg/Profile/Polz,632553673,11-11-2018,5,Beautiful gardens,"The Skywalk, Cloud Dome and Flower Dome are all excellent. The Flower Dome has an extremely attractive Christmas display at the moment, Disney themed. The Cloud Dome is brilliant, very clever and very illuminating we found it very interesting. The Skywalk is amazing, to be up at the level of the rain forest canopy and see everything is fabulous.
Don’t go to Singapore and miss this off your itinerary.",11-2018,Couples,2020-01-30 05:42:37.528140
,1,29,https://www.tripadvisor.com.sg/Profile/Iain H,632309980,10-11-2018,5,Super Experience,"There is a nominal fee to enter theOCBC Skyway, but this keeps numbers down. The bridge is suspended on cables and so it sways a little, which is rather disconcerting at first, but the views are lovely, either towards the sea and the gardens or towards Marina Bay Sands and the city.",11-2018,Couples,2020-01-30 05:42:37.904991
,1,29,https://www.tripadvisor.com.sg/Profile/mglrowan,625336654,16-10-2018,5,Recommend,Loved the opportunity to get a different view of the super trees and other areas of the Marina Bay. This is well run and not overcrowded so you don’t have to wait ages to get some good photos.,09-2018,Couples,2020-01-30 05:42:38.228641
,1,29,https://www.tripadvisor.com.sg/Profile/Jedda21,622498972,06-10-2018,5,Over the top,Enjoyed this so much as when you get up you can see so much and looking down on the Gardens is very beautiful especially just on dusk. Enjoyed this immensely,09-2018,Couples,2020-01-30 05:42:43.991742
,1,29,https://www.tripadvisor.com.sg/Profile/Gul C,619662766,26-09-2018,4,From high above,One of the most impressive attractions in Singapore is of course the Super Trees. To make the most of this experience I highly recommend to go up to the Skywalk between the trees. It costs 8 Sinapore dollars and definately worth the money. If your timing is well planned you can even experience the the light and sound show in the evening from the skywalk. The view is a heaven for photographers.,08-2018,Couples,2020-01-30 05:42:44.354765
,1,29,https://www.tripadvisor.com.sg/Profile/Travell_ing_Matters,618860473,23-09-2018,4,Make sure you visit,"For $8pp, it is an affordable way to have a gain a panorama of the giant trees up close. There was this time limit as to how long one can stay on the skyway but we were never hurried along.

We were here close to sunset and the views on a clear day gave a beautiful hue. Can only imagine being here at 8-9pm when the trees come to ""live"" with a blaze of colours and music.",08-2018,Couples,2020-01-30 05:42:44.730235
,1,29,https://www.tripadvisor.com.sg/Profile/mgrocks,616821272,16-09-2018,5,A clear night of lights,I brought the tickets in advance to avoid one que with a risk of cancellation if it rained and was closed. Tickets last a month and I returned on a clear night. Street style food van pull the crowd to the lawn to watch the light and sound show. Wheelchair stroller access to the top is easy by the up and down lifts. The view was spectacular with the changing colours and light timed to the big band and swing music.,09-2018,Couples,2020-01-30 05:42:45.112323
,1,29,https://www.tripadvisor.com.sg/Profile/smpja,615095806,09-09-2018,4,Great to do at sunset but otherwise a bit boring,Started the skywalk before sunset and it was average. Didn't really have any impact. As the sunset though the change was incredible. The best photo opportunities were from where you initially take the lift up to the skywalk. As you progress along the skywalk the opportunities for photos aren't as spectacular. A must do at sunset.,09-2018,Couples,2020-01-30 05:42:45.474367
,1,29,https://www.tripadvisor.com.sg/Profile/Dee S,601866722,01-08-2018,5,OCBC Skyway,"Great way to be amongst ""the trees"". Have done this on two occasions but hard to take good photos as it sways - but that part of the fun",10-2017,Couples,2020-01-30 05:42:45.837323
,1,29,https://www.tripadvisor.com.sg/Profile/enricoca1,595415903,12-07-2018,5,Stunning,"I am Italian, totally trustworthy and well travelled.
Awesome. Go there two times: one staying up the skyway at the sunset enjoing from above the light and sound show, the other enjoying the same show lining down at the ground looking up.
It is a must: go there.",06-2018,Couples,2020-01-30 05:42:46.207813
,1,29,https://www.tripadvisor.com.sg/Profile/lucasng29,590254559,24-06-2018,2,Just one time,"You can go up for experience. But don't be too excited, As I feel it is underwhelming. Stay up there and get as much photos as possible",08-2017,Couples,2020-01-30 05:42:46.529819
,1,29,https://www.tripadvisor.com.sg/Profile/Mobius86,579442197,11-05-2018,5,Amazing views,"This skyway offers amazing views of supertree grove, Marina bay Sands hotel, Singapore skyline and beyond, even to the port.
I went on it in day time, it is 8$ per person ticket. In evening, you may have a huge waiting time, even an hour or so. So I covered this in the day.
It would take around 15 mins considering all the photos you want to take once on the skyway. Otherwise it's a small walk.",04-2018,Couples,2020-01-30 05:42:46.893113
,1,29,https://www.tripadvisor.com.sg/Profile/MBB1952,578177630,06-05-2018,5,BEAUTIFUL VIEW DAY OR NIGHT,"The OCBC Skyway gives you a beautiful view over the gardens, the Flyer, Flower Dome and Cloud Forest ,only shame is that you can spend only 15 minutes on the skyway, as only 70 people are allowed at a time.",04-2018,Couples,2020-01-30 05:42:47.224888
,1,29,https://www.tripadvisor.com.sg/Profile/TassiaI,577632189,03-05-2018,5,Beautiful at night!,"We timed this just right as got to be up there during the musical lighting show at 8.45pm. Absolutely stunning, well worth the additional ticket price (although would recommend pre booking online to get a better discount!) The only downside is we were ushered to hurry up by the staff member on duty as they closed at 9, but when you’re watching such a beautiful show you want to savour the moment!",05-2018,Couples,2020-01-30 05:42:53.050840
,1,29,https://www.tripadvisor.com.sg/Profile/376gordonh,576166100,28-04-2018,3,Nice but not great,"This is optional when visiting the Gardens in the bay, good views but if you are thinking of going on the Singapore Flyer or the observation deck at Marina Bay Sands these offer far better views.
You are only allowed 15 minutes to walk round (its a one way system) but we did it in much less time.",04-2018,Couples,2020-01-30 05:42:53.411800
,1,29,https://www.tripadvisor.com.sg/Profile/meatm8,573012347,13-04-2018,5,Walk,Great place for a walk around. Can really get some good photos to brag to ya mates back in ya home town.,04-2018,Couples,2020-01-30 05:42:53.730540
,1,29,https://www.tripadvisor.com.sg/Profile/rraktim,569629870,30-03-2018,5,Nice View,"The Skyway is beautiful. But if it rains they usually close it. But one can talk a walk along the skyway, we need to purchase tickets",01-2018,Couples,2020-01-30 05:42:54.062981
,1,29,https://www.tripadvisor.com.sg/Profile/MateEeMa,564657704,05-03-2018,4,Wow!,"It's a short walk above ground between the trees. You need a ticket to get up. Spectacular, but the trees are beautiful from the ground too.",12-2017,Couples,2020-01-30 05:42:54.413967
,1,29,https://www.tripadvisor.com.sg/Profile/Coopper29,563946768,03-03-2018,5,A must do attraction,"We were only in Singapore for 5 days, it is worth doing, but not the first thing to do. The views are great on a clear day, one needs a head for heights, a bit expensive to go up.",02-2018,Couples,2020-01-30 05:42:54.775146
,1,29,https://www.tripadvisor.com.sg/Profile/DadaGee,562060146,22-02-2018,5,Spectacular - but very busy at night,"A suspended walkway through the Supertree Grove. Gives great views of the ‘trees’ and surrounding areas. S$8 to go round, but lots of queues for both tickets and to get up. Open 09:00 - 21:00, but last admission is 20:30. There’s an amazing light show nightly at 19:45 and 20:45, but to be honest, if you’re not up by the start of the first show you probably won’t get up.

During the day it’s a lot less busy.",10-2017,Couples,2020-01-30 05:42:55.146438
,1,29,https://www.tripadvisor.com.sg/Profile/Connor_winham,561357218,19-02-2018,5,A must do!,"Me and my girlfriend loved it up there, you get 15 minutes and it’s not too crowded at all, great views and even though they told us an hour wait it wasn’t even half an hour! Would highly recommend",02-2018,Couples,2020-01-30 05:42:55.490474
,1,29,https://www.tripadvisor.com.sg/Profile/Molly E,561225455,18-02-2018,4,Stunning views!,"Visited here with my boyfriend after reading so many good reviews and recommendations and it was definitely worth it! The views are stunning and make for lovely photos/videos. It says that it accommodates for up to 50 people at one time, however I don’t think there was that many when we was there which made it easier for photos. The queue said it was an hour wait, but it wasn’t even half an hour which was a pleasant surprise. The only downside is that you only get 15 minutes, however I suppose if it’s not too busy and you can get your photos done then you don’t need much more than 15 minutes anyway. Not too badly priced either, we did it at around 7pm, but it looked nice when the lights were on at around 8pm so that might be a nice time to try it too!",02-2018,Couples,2020-01-30 05:42:55.832927
,1,29,https://www.tripadvisor.com.sg/Profile/DominicDeBurca,560357180,14-02-2018,5,"Unique, futuristic take on outdoor garden spaces","I forgot to count how many of the garden towers there were but I think there are between 10 and 12 them. One is quite a bit taller than all the others as it contains a restaurant just below the top level which h itself boasts and open air bar with panoramic views of the gardens, downtown Singapore Nd the Marina Bay Sands hotel.

The towers are deceptively large and a number of them are interconnected with a series of elevated walkways suspended by steel guy ropes. All in all, a one of a kind magical space.",02-2018,Couples,2020-01-30 05:42:56.220380
,1,29,https://www.tripadvisor.com.sg/Profile/MSKD007,554549934,18-01-2018,5,Worth every penny ...,This is a paid entry but worth every penny .. we were not expecting big heights but this was actually at some height ... avoid the sun and try the activity in the evening .. it is much more fun with all the lights around you ..,02-2017,Couples,2020-01-30 05:43:01.955097
,1,29,https://www.tripadvisor.com.sg/Profile/Melsa85,550195533,30-12-2017,1,Sadly closed and no info on when it would reopen,"I completely understand they need to close in rain. However, there was no signage about this (we had to get through the stupidly long ticket line to find that out) and we were rudely dismissed when trying to find out more details - like if it might open again that afternoon, what time it opens the following day etc. So, it’s 1 star for us as we didn’t even get to try it!!",12-2017,Couples,2020-01-30 05:43:02.317557
,1,29,https://www.tripadvisor.com.sg/Profile/zaijacobs,547554020,17-12-2017,5,Amazing views at sunset!,Be here exactly during sunset and you will get some amazing views of Singapore! The walk itself is kinda short but it is totally worth it. I recommend!,08-2017,Couples,2020-01-30 05:43:02.662834
,1,29,https://www.tripadvisor.com.sg/Profile/prab0dhad,541947332,19-11-2017,5,Fantastic for Photos,This place is awesome to take some good photos with the gardens in the background or the marina bay hotel. The gardens really offers great scenery and the OCBC bridge offers a great view. 8 SGD to go up the sky way but the gardens are free.,11-2017,Couples,2020-01-30 05:43:02.973362
,1,29,https://www.tripadvisor.com.sg/Profile/Ros T,538657443,06-11-2017,4,Gardens from a different perspective,After looking around the gardens at ground level it was worthwhile seeing the gardens from a different perspective. We were there before 11am on a weekday so didn't have to wait in line. Definitely worth a visit and to see the trees close up.,11-2017,Couples,2020-01-30 05:43:03.314298
,1,29,https://www.tripadvisor.com.sg/Profile/95dannif,538188167,04-11-2017,3,Nice view of city,"Enjoyed being able to see above the Gardens by the Bay. Walkway uncovered, so not recommended in middle of day or when raining. Nice photo opportunities.",08-2017,Couples,2020-01-30 05:43:03.678981
,1,29,https://www.tripadvisor.com.sg/Profile/IMHO_57,535760588,25-10-2017,3,Get there early for night viewing,"Attempted to go to the skyway at 7:15pm, but wait times was already 50 minutes so had to pass. Looks spectacular, but if you want to be on the walkway during the Super Tree Grove light show at 7:45 or 8:45, you really have to plan ahead. I don't think you can buy for specific times so a bit of a gamble. Cash only.",10-2017,Couples,2020-01-30 05:43:04.009378
,1,29,https://www.tripadvisor.com.sg/Profile/MissPP89,528269794,29-09-2017,5,Great views,"Not too pricey, limited to 15 mins. Great views of the gardens and surrounding buildings. Really great for photos",09-2017,Couples,2020-01-30 05:43:04.329446
,1,29,https://www.tripadvisor.com.sg/Profile/drn85,528133449,29-09-2017,5,Ocbc skyway..,Ocbc skyway is located in the gardens by the bay which is located in the heart of singapore. Super tree Grove which are large vertical garden tower is connected by a huge bridge and the skywalk is allowed on the top of it. We can have a better lighted up view of the city if you are taking this at night. The light and sound show in the super tree Grove will also be a nice experience once you are viewing it from the skywalk. Altogether it's a nice place to visit on your trip to singapore.,09-2017,Couples,2020-01-30 05:43:04.714447
,1,29,https://www.tripadvisor.com.sg/Profile/Joesv1,521761601,06-09-2017,5,Great view,Make sure you go up the skyway the views of the gardens and the city are amazing can get some lovely photos and long memories,09-2017,Couples,2020-01-30 05:43:05.062521
,1,29,https://www.tripadvisor.com.sg/Profile/125sarib,514832769,18-08-2017,5,Amazing walk above the trees,Definitely worth the wait on tickets and queue. Lift to go up and down. Nice way to see the garden and have a closer look at the trees.,08-2017,Couples,2020-01-30 05:43:10.783793
,1,29,https://www.tripadvisor.com.sg/Profile/sakisgreece,502169239,15-07-2017,5,Eco friendly and so beautiful,There is a ticket to go up.8 sing$ . When you go up the view is amazing. There is a lightshow every day 19.45 and 20.45. To reach this take mrt to bayfront station and through marina bay sands you will arrive at the gardens by bridge.,07-2017,Couples,2020-01-30 05:43:11.136424
,1,29,https://www.tripadvisor.com.sg/Profile/fel1xp,496547796,27-06-2017,5,Excellent walk to do at sunset,"At 8 SGD a person the skyway was definitely worth it. You get great views of the gardens, domes and hotel. Would definitely recommend",06-2017,Couples,2020-01-30 05:43:11.507014
,1,29,https://www.tripadvisor.com.sg/Profile/DarrenL20,486336958,22-05-2017,4,Great Treetop Canopy Walk,"While in the Marina Bay gardens this is worthwhile doing, it's only a 15 / 20 minute experience but the views are great and at nighttime all of the trees light up. The pics show you what it looks like. Cost was 16SGD each.",05-2017,Couples,2020-01-30 05:43:11.873574
,1,29,https://www.tripadvisor.com.sg/Profile/EuForia_01,483101611,10-05-2017,1,Don't waste your money here,"In a park of beautiful trees, airconditioned green houses this is the dumbest thing! Unless you are desperate for a view of the skyline. The one from Marina Bay Sands Shopping Centre's upper open space is free!",08-2016,Couples,2020-01-30 05:43:12.202970
,1,29,https://www.tripadvisor.com.sg/Profile/272philr,479485985,27-04-2017,5,Garden Rhapsody at night- a must see,Twice a night at 7.45 and 8.45 the OCBC Skway gets transformed into this sound and light show which is most spectacular! There is no charge to see this outstanding presentation! Highly recommended.,04-2017,Couples,2020-01-30 05:43:12.623856
,1,29,https://www.tripadvisor.com.sg/Profile/UBrummyZ,468006327,17-03-2017,5,Nice overviews,"Every aspect of gardens by the bay is amazing. We decided to climb and walk the bridge too. Best time to go is just before sunset and stay until after, you'll get to see it in all its beauty. Very scenic and you'll get to see things in a different way nwar and far.",11-2016,Couples,2020-01-30 05:43:13.002495
,1,29,https://www.tripadvisor.com.sg/Profile/ChrisS390,467230684,14-03-2017,3,It's ok but wouldn't bother again,The walkway is quite short - approx 400 mts and does give good views of the lovely park. But that's about it and for $8 per person it's a bit of just alright.,03-2017,Couples,2020-01-30 05:43:13.313229
,1,29,https://www.tripadvisor.com.sg/Profile/KLPow,460829123,18-02-2017,5,Relax and romantic,"This is my 2nd visit to the OCBC skyway and ia amazingly surprised how different I feel compared with my last trip.

I went at about 7 pm. So was able to view the daylight scene of the area. When night falls, the tree lights up. The skyline changes. All lighted up. Then at about 7,30pm, the highlight began. There is a musical tree performance. Wow, non wonder there are so many people lying on the floor watching the performance. I was lucky to get to the lift and reach the treetop at about 7.25pm. So was able to see the Singapore's skyline before it became dark and witness the changes when the lights are lighted up. So romantic.
Truly recommend for 1st time visitors to Singapore and also suggest you visit at about 7pm and at the same time to catch the musical tree show. Otherwise, you will miss a lot from here.",02-2017,Couples,2020-01-30 05:43:13.680709
