REVIEW_INDEX,WEBSITE_INDEX,POI_INDEX,REVIEWER_URL,REVIEW_ID,REVIEW_DATE,REVIEW_RATING,REVIEW_TITLE,REVIEW_BODY,DATE_OF_EXPERIENCE,TRIP_TYPE,REVIEW_CRAWLED_TIME
,1,29,https://www.tripadvisor.com.sg/Profile/Heather S,518082526,27-08-2017,5,Great views,"Take the MRT to Bayfront and follow the signs for Gardens by the Bay. Once there, there are signs all over the place to the various attractions. We had no queues at all for the OCBC skyway and just went straight up in the lift. The cost is SGD 8 per adult and SGD 5 for children (up to 12 years). They say that you have 15 minutes before they move you along but I'm not sure how this is enforced. The views are great from the walkway and you can time it to go up when the light show starts (7.45pm and 8.45pm) if you like, but I think the views would be better from below for that. The lift is available for coming down too but you can take the stairs if you wish. No worries about vertigo at all on this and I'm a bit scared of heights!",08-2017,Family,2020-01-30 05:41:10.151714
,1,29,https://www.tripadvisor.com.sg/Profile/Mike H,514656276,18-08-2017,4,Great views of Marina Park,"The Skyway is a raised walkway between two of the 'trees' in Gardens by the Bay. Cost is S$8 per adult which gives you 15 minutes on the Skyway. It offers great views over the whole Marina Park and Bayfront area and, given the modest cost, is worth doing.

We went in the morning to avoid the long queues that build up during the afternoon and evening (it closes at 9pm).",08-2017,Family,2020-01-30 05:41:15.950949
,1,29,https://www.tripadvisor.com.sg/Profile/Happy_Man_2017,487672561,25-05-2017,4,"The OCBC SKYWAY & The SUPER TREE GROVE - Landmark Of Gardens By The Bay, Singapore","The OCBC SKYWAY is an elevated walkway high up & attached to two of the larger manmade steel ""trees"" forming the SUPER TREE GROVE at the Gardens By The Bay in Singapore.

The SUPER TREE GROVE is a group of towering futuristic steel ""SuperTrees"". Each ""tree"" has various flower plants attached throughput its outer wall & a bunch of facing-upwards umbrella-like ""branches"" at the top.

The tree-like vertical gardens stretch to heights from 25 to 50 meters (82 to 160 ft). These man-made ""trees"" are the Gardens’ landmark landscape of Gardens By The Bay.

At night the SuperTrees are the star performing the OCBC Garden Rhapsody Light Show - a fantastic display of light and music.

The OCBC Skyway is for visitors to enjoy a panoramic aerial view of the Gardens. An entrance fee is chargeable to access the OCBC Skyway.",12-2016,Family,2020-01-30 05:41:16.315803
,1,29,https://www.tripadvisor.com.sg/Profile/AKRCH,483844343,13-05-2017,5,Definitely one time must visit,Reached the spot at 7.30 the sound and light show begins at 7.45 for 15 mins and is beautiful with the lights and music . It's a little crowded over the weekend but enough place to stand . Once the show was done we took the skyway ticket and went up . Views are good they let u walk on the Supertree path for 15 mins which is good enough for viewing and taking some pics,05-2017,Family,2020-01-30 05:41:16.690036
,1,29,https://www.tripadvisor.com.sg/Profile/Priyadarshi5,482898106,09-05-2017,4,Awesome Experiance,The skywalk connects two main tress of the Singapore Supertree Grove. The view from the bridge is awesome at night and it seems like one is hanging midair. The best place to view the light and sound show at the Supertree Grove.,07-2016,Family,2020-01-30 05:41:17.079737
,1,29,https://www.tripadvisor.com.sg/Profile/astventures,470123631,26-03-2017,5,Best lights show ever,"We went here just in time for the lights show. Please do note that you only have 15 minutes on top, so plan your time carefully. The lights show was great, but seeing it at the skyway gives us a different angle on it and it gave us chills. The site was really spectacular.",03-2017,Family,2020-01-30 05:41:17.459502
,1,29,https://www.tripadvisor.com.sg/Profile/628eugenek,469302018,22-03-2017,4,Worth the queue - best during the evenings,"Yes, the walkway is short and you're mostly paying for the height and the view. Obviously not for those with a fear of heights because the floor isn't exactly solid but you'll be afforded excellent views. Evenings are best because you might catch a sunset along with the lights. There is a queue on weekends so do come prepared to wait. They do move the people through to avoid congestion and the queue does move fairly quickly.",03-2017,Family,2020-01-30 05:41:17.839323
,1,29,https://www.tripadvisor.com.sg/Profile/Taipei921,457491674,06-02-2017,5,Exciting Walk with the Giants!,"These gigantic SuperTrees rose 22m from the ground and is connected via a circular and at times narrow sky walkway. You can enjoy a panaromic view of the city lush greenery in the day, and when dusk approach, the captivating Marina Bay skyline gets lighted up and the entire area comes alive during the Garden Rhapsody light and sound show (twice daily).

These futuristic giant trees transport you high up on the air ad you can enjoy an aerial walk which approx 128m long, stopping at various points to take pictures of the bay and lush park beneath. While the view from the top is remarkable, it is even more so when on the ground! That's when you can see how high and majestic these SuperTrees are. It gives you a sense of perspective and you felt that you are transported to a futuristic land, where dinosaurs are expected to appear at any one time!

Note: Photographers: Super wide angles, and tripod, for the fascinating twilight view when the trees lights up and the sky colors deepens in hues of red, orange, purple and pink. You can buy tickets at the foot of the Supertrees itself and entrance is via a elevator just behind the stand. Else, you can make reservations or purchase the tickets together when entering the Gardens by the Bay. You can spend some 30-40 mins just on the skyway (more if you stop for photography at every spot, and you can choose to dine in the fine restaurant located up on the tree too! No pets allowed on the bridge, and children should be supervised at all times.",09-2016,Family,2020-01-30 05:41:18.214832
,1,29,https://www.tripadvisor.com.sg/Profile/Journeyfamily,446268036,23-12-2016,2,Just a walkway; hope it doesn't rain,"Given it's just a walkway (and not a very long one at that), S$8 seems a bit steep (tickets can be purchased at the foot of the walkway). You could literally walk at one end to the other in a few minutes. Of course we lingered, admired the views, took photos etc - still, we didn't feel it was of great value.

As it was cloudy when we visited, we were informed that if it rained, we would be asked to come down from the walkway for safety reasons. However, as your tickets are ""one use only"", you would not be allowed back up. Whilst we can appreciate the safety considerations, not sure if that ticketing policy is reasonable. Staff describing the policy were not very sympathetic.

Further, there was a Christmas Fair when we visited. The Fair was in the same grounds as the supertrees where the walkway is located. In order to access the walkway, you were required to pay for Fair tickets first (even if you only wanted to visit the walkway). Signage was poor - only found this out after some fruitless walking around and asking staff. Fair tickets were not available at the door - you had to go to a ticket booth a good 10-15 minutes walk away (with no guarantee of tickets), buy the tickets online (difficult as a tourist with no internet access), or come again before 3pm (before the Fair opens).

Whilst we appreciated the beauty of the structures and the ingenuity of the designers, overall was rather disappointing.",12-2016,Family,2020-01-30 05:41:18.598612
,1,29,https://www.tripadvisor.com.sg/Profile/BhawaniPathania,445792892,21-12-2016,4,Be cautious of the timing..,"The best time to be on this observation skyway is in the evening when the lights are on. It might even be worth the while if you are watching the evening sound and light show from here.

Just be careful about the timings as they are very particular in letting you up. The person in charge will not even make a 5 minutes exception. So be on time, and just enjoy the show.",11-2016,Family,2020-01-30 05:41:18.915277
,1,29,https://www.tripadvisor.com.sg/Profile/itspriyanka,440040802,26-11-2016,4,Good view; go for the experience,"The tickets are available at the entrance of the skywalk. We took the Gardens by the bay open ticket from Klook but it did not include this. Entrance is 8 SGD per person which can be paid by card. You get uninterrupted view of Marina Bay Sands and Singapore flyer which is quite nice. The skywalk itself is not very high so its not scary at all. It just connects 2 supertrees in the garden. A good experience, costly though.",09-2016,Family,2020-01-30 05:41:19.275860
,1,29,https://www.tripadvisor.com.sg/Profile/Paul M,431810196,26-10-2016,3,Its only a short skywalk,"Its only a short skywalk, not really worth the money. You also have a better view of the light show from down below lying on the grass.",10-2016,Family,2020-01-30 05:41:25.167509
,1,29,https://www.tripadvisor.com.sg/Profile/Lawrensha,424246053,02-10-2016,4,Nice Experience,"Try to visit in the evening. You may have to wait a bit longer in the queue to go up on the skyway but it's worth waiting. It costs $8 pp. You go up by lift, 32m high and get a great view of downtown Singapore. They say that you only get 15 mins up. At the top you can enjoy the view from the top of the trees which gives you an incredible overview on the gardens, Marina Bay Sands, cloud forest and flower dome.",07-2016,Family,2020-01-30 05:41:25.520878
,1,29,https://www.tripadvisor.com.sg/Profile/nroomas,405120950,14-08-2016,5,Worth the fee,"As I commented in another review posted on the Gardens by the Bay, it is worth getting up on the Skyway to view the gardens from different angles. You take an elevator to go up, and to come down, you have a choice of taking the other elevator or walking down the spiral staircase. We walked down and was able to observe the artificial Supertree in detail from the inside.",08-2016,Family,2020-01-30 05:41:25.909790
,1,29,https://www.tripadvisor.com.sg/Profile/juleskarz,391645096,12-07-2016,5,Finally!!!,"After 3 visits, I finally get to go up the skyway. It's an amazing view and love the scenic views. Will love to come again.",07-2016,Family,2020-01-30 05:41:26.271856
,1,29,https://www.tripadvisor.com.sg/Profile/BrisbaneTraveldoctor,391311176,11-07-2016,5,Fantastic way to experience the Gardens by the Bay lightshow,"Missed out on the Skyway on our first visit to Gardens by the Bay on a previous trip to Singapore as by the time we finished exploring the domes it was too late (last access is usually around 8.30 pm).

This time we arrived early enough to make sure we could experience the Skyway & hopefully view the light show from on the Skyway. Bought our very reasonably priced tickets (S$8 for adults & S$5 for kids) at 7pm.

Unfortunately even at that time it was an hour plus wait in line to access the Skyway.

Light show from the ground was spectacular nonetheless. The Singapore skyline was spectacular from the rainforest canopy vantage point of the Skyway!

Tip: if you want to watch the 7.45 pm light show from the Skyway - you'll need to get there & get tickets by 6.00-6.30 pm.",07-2016,Family,2020-01-30 05:41:26.617899
,1,29,https://www.tripadvisor.com.sg/Profile/Global T,382023266,13-06-2016,4,Tremendous Sound and Light Show,Returned to the Skywalk in the evening to experience what Singapore does so well - the sound and light show. We experienced this very popular 20 minute display laying on the ground looking up at the massive Avatar like trees -a very powerful experience - and totally free!,06-2016,Family,2020-01-30 05:41:26.977902
,1,29,https://www.tripadvisor.com.sg/Profile/Reynards42,713774954,29-09-2019,5,Short but great views.,"OCBC skyway is not to be missed for a birds eye view of the surrounding gardens and other city landmarks. Entrance to this suspended walkway can be found at the base of one of the super grove tree towers located in the central part of the Gardens of the bay. Cost is. $8per person for a 15 minute trip, and can be easily accessed by all via a lift.",09-2019,Couples,2020-01-30 05:41:50.204439
,1,29,https://www.tripadvisor.com.sg/Profile/Z5335GProb,703392963,27-08-2019,5,Engineering and nature combined,"Enjoy the stroll along the walk way and marvel at the engineering and enjoy the skyline,the views and the park below You simple will not be disappointed",08-2019,Couples,2020-01-30 05:41:50.560912
,1,29,https://www.tripadvisor.com.sg/Profile/Sharon H,691533942,22-07-2019,5,Great views of Singapore and the Gardens of the Bay,The skyway is good to do in either daylight or at night. Last entry is 8 pm but then you can see the light and music show from the skyway. We did the skyway in daytime which was warm and humid but the views were worth it. At night we sat under the trees and the skyway to watch the light and music show. Free entry to the gardens but to go up to the skyway it cost S$8,07-2019,Couples,2020-01-30 05:41:50.916197
,1,29,https://www.tripadvisor.com.sg/Profile/traveller1234562015,691338867,21-07-2019,5,Awesome,If you have a head for heights.... then this is perfect. Great views from the Skyway...again try to book for the early evening when the lights are at their best.,07-2019,Couples,2020-01-30 05:41:51.259247
,1,29,https://www.tripadvisor.com.sg/Profile/FyingKiwi,690208923,17-07-2019,5,Visual Delight,"Despite being told at the mail ticket office that the walkway was closed for maintenance, and signs in the Super Tree grove stating that it was closed due to inclement weather (which while overcast was otherwise rain free), the ticket office at the base of the entry tree was open, and quite willing to sell tickets.
For a relatively inexpensive entry fee, you are treated to a walkway between two of the Super Trees that offer an absolutely spectacular viewing platform from which to sight a panorama of the Gardens by the Bay area (and Singapore Flyer).",07-2019,Couples,2020-01-30 05:41:51.622517
,1,29,https://www.tripadvisor.com.sg/Profile/Greg N,685471301,30-06-2019,5,Fantastic light and music show in the evening,"The Gardens By the Bay are a place to go to, but in the evening the large artificial trees light up are there is a fantastic light and music show. You have to go up onto the Skyway in the evening to get great night time views of the park and the city.",01-2019,Couples,2020-01-30 05:41:51.986203
,1,29,https://www.tripadvisor.com.sg/Profile/Django987,684525562,26-06-2019,5,Amazing views,"Be warned, this skyway is high and narrow. The views are amazing though but unfortunately my vertigo got the better of me and I couldn't face walking where the path narrowed considerably so got the lift back down to the ground. If you're ok with heights though, you will love this!",06-2019,Couples,2020-01-30 05:41:52.352228
,1,29,https://www.tripadvisor.com.sg/Profile/nitisshh_travelblogs,683198527,21-06-2019,5,Perfect place to watch the Light and Sound show,It was an amazing feeling to watch the light and sound show through the OCBC Skyway that gives you a closer look of the Supertrees from top and the hanging skyway puts more adventure to that,04-2019,Couples,2020-01-30 05:41:52.696383
,1,29,https://www.tripadvisor.com.sg/Profile/LancsTravelMan,682248156,17-06-2019,5,Well worth it,Very cheap addition to a trip to gardens by the bay and definitely worth it for the views across the bay and the gardens,05-2019,Couples,2020-01-30 05:41:53.033909
,1,29,https://www.tripadvisor.com.sg/Profile/garcon59G,679899541,08-06-2019,5,The Skyway rocks!,The light show is not to be missed. Be sure to arrange a visit to the Skyway for a fantastic view of the show and the Singapore skyline.,06-2019,Couples,2020-01-30 05:41:53.381667
,1,29,https://www.tripadvisor.com.sg/Profile/norbertg203,679654268,07-06-2019,4,Nice to have,Offers you the opportunity to get an overview of the gardens and take some fotoshots but very short.,05-2019,Couples,2020-01-30 05:41:59.345535
,1,29,https://www.tripadvisor.com.sg/Profile/marcusrjr,676432492,26-05-2019,5,Really must do it,"The artifical trees at gardens by the bay are simply unique!! So beautiful!! And the skyway is a path between the streets. Great for photos and viewing. There is a show every night, so you can enter it at the sunset and wait to see the show from teh top.

Please follow @mapamunditravel, and if you find it helpful, please vote as an importante colaborator =) thanks in advance",05-2019,Couples,2020-01-30 05:41:59.703589
,1,29,https://www.tripadvisor.com.sg/Profile/Jonofromcas,675536451,22-05-2019,5,Different view of Supertrees,Well worth $8 for adult ticket. Suggested that you spend 15 mins or so on the walk as they limit the number of people who can use at the same time and you probably don’t need much longer as the skyway isn’t that long.,02-2019,Couples,2020-01-30 05:42:00.025763
,1,29,https://www.tripadvisor.com.sg/Profile/CathyGri,672956965,10-05-2019,5,Great views for a nominally priced ticket,Great to walk along the SkyWay and view the whole of the gardens and especially the Supertree Grove. Great for pictures during the evening sound and light show and a good place to escape all the crowds watching the show.,04-2019,Couples,2020-01-30 05:42:00.347719
,1,29,https://www.tripadvisor.com.sg/Profile/gszekely,671935278,06-05-2019,4,interesting,"There is a nice path high among the supertrees, but I was waiting for some special experience that I missed finally. It is funny walking among tree-tops but that is all. You have a much better view from the Marina Bay Sands hotel's terrace.",04-2019,Couples,2020-01-30 05:42:00.724657
,1,29,https://www.tripadvisor.com.sg/Profile/653scv,671703022,06-05-2019,1,OCBC Skyway,"Do NOT pay by contactless card at the OCBC Skyway ticketing booth. We think we had our card details stolen there on Sunday morning, 5th May 2019. The girl took our card off us and tapped it on the machine herself, then rested it on top of her own mobile phone while she waited for the tickets to print. I was so worried I took a photo of her but I've cancelled my card now anyway!",05-2019,Couples,2020-01-30 05:42:01.021943
,1,29,https://www.tripadvisor.com.sg/Profile/Wardimus,671207833,03-05-2019,3,Great but with a price and be prepared to WAIT.,"Very interesting suspended walkway - not for those with fear of heights for sure. If you can, try to time with one of the light shows - would be cool to be up there during the show: you'd need to get in queue a couple time slots before a show and maybe an hour in advance depending on time of year. Regardless, enjoyable",04-2019,Couples,2020-01-30 05:42:01.354676
,1,29,https://www.tripadvisor.com.sg/Profile/kyoshikiwi,670040432,29-04-2019,4,sweet as,"for an extra $8 you can go up here and i loved it , well worth the effort so make the trip, limited to 70 people at a time so go early to avoid queing",04-2019,Couples,2020-01-30 05:42:01.723521
,1,29,https://www.tripadvisor.com.sg/Profile/buttons81,668274704,22-04-2019,4,"Cheap, great views, access easy","Wonderful views of the gardens, safe lifts up and a good length walkway to view the gardens from the top, cheap.",04-2019,Couples,2020-01-30 05:42:02.092879
,1,29,https://www.tripadvisor.com.sg/Profile/FranklinDcat,668181737,22-04-2019,4,Novelty attraction with good views,$8 tickets for a skywalk between the towers. Best to do it in the evening/night and not the daytime as you will get nuked by the sun and be all hot and sweaty!,04-2019,Couples,2020-01-30 05:42:02.422316
,1,29,https://www.tripadvisor.com.sg/Profile/Rosie8855,667881616,20-04-2019,5,excellent,a wonderful time in singapore seeing these amazing sites these sculptured tree are iconic as every travel magazine /tv programme shows them lite up at night they look amazing we definately will return to Singapore,02-2019,Couples,2020-01-30 05:42:08.248763
,1,29,https://www.tripadvisor.com.sg/Profile/LindaRB2314,667529936,19-04-2019,4,Great view,A lift is available so I was able to enjoy the skyway (I use a Walker & Oxygen). It was another great feature to be able to see these Tower tops so close up and the views were great.,03-2019,Couples,2020-01-30 05:42:08.633719
,1,29,https://www.tripadvisor.com.sg/Profile/littleacorn101,667064073,17-04-2019,5,Fly above the city,"Really great views to be seen from the walkway, which you access for a small fee to ride the lift. It also allows you to see the huge extent of this magnificent park.",02-2019,Couples,2020-01-30 05:42:08.943996
,1,29,https://www.tripadvisor.com.sg/Profile/Amandeep K,666710628,15-04-2019,5,Gorgeous Views,"Gorgeous views of Marina Bay Sands, Marina Bay, Singapore River from OCBC Skyway. Also, we were there during the light show. So watching the light show from above was spectacular. The only thing that bothered me was the employees were rushing people to keep moving. I wanted to stay there for longer.",03-2019,Couples,2020-01-30 05:42:09.286271
,1,29,https://www.tripadvisor.com.sg/Profile/jolane2013,665036058,09-04-2019,5,Prepare to be amazed,"So glad we stayed to see this attraction. We didn’t go up on the Skyway but watch the light show in the evening. Well worth the wait, best light show we have seen. Highly recommend.",03-2019,Couples,2020-01-30 05:42:09.642318
,1,29,https://www.tripadvisor.com.sg/Profile/MrBakar,664286799,07-04-2019,5,Totally amazing,Go if you get the chance. The wife and I had the pleasure of the Skyway at night when the light and music show was on. There are some amazing views to be had. Just remember that it's not fixed and does swing a bit as it's suspended. It will be closed if there is any chance of rain.,12-2018,Couples,2020-01-30 05:42:10.021953
,1,29,https://www.tripadvisor.com.sg/Profile/Timea S,663600910,04-04-2019,5,"A great view of the famous ""Supertree Grove"" in the Gardens by the Bay!","This skyway provided a great view of the World-famous ""Supertree Grove"", both during the daytime, and at night when they are fully illuminated. If visiting Gardens by the Bay, this should be a must-see item!",03-2019,Couples,2020-01-30 05:42:10.369451
,1,29,https://www.tripadvisor.com.sg/Profile/Tenorman41,663403351,03-04-2019,4,Great aerial views of the Gardens By the Bay complex.,"This a aerial walkway links some of the structures of Supertree Grove, and offer an elevated view of much of the Gardens By The Bay Area, especially a lot of the gardens and lakes and trees outside the Conservatories. Currently $8 to access by elevator, and well worth it.",04-2019,Couples,2020-01-30 05:42:10.705390
,1,29,https://www.tripadvisor.com.sg/Profile/Baliroz,661527079,27-03-2019,5,Breathtaking,"My husband has acquired a fear of heights, so I was very pleased that I went alone on this walk. One is able to take amazing photos from the various points around the walk. You get such a different perspective when up so high. the price was $8 pp",03-2019,Couples,2020-01-30 05:42:11.101177
,1,29,https://www.tripadvisor.com.sg/Profile/pk124s,660286691,22-03-2019,3,"""Optional""",Completely optional as price is expensive but watching supertree grooves very closely just do it. This is what you can skip and watch supertrees from the ground at free of cost.,03-2019,Couples,2020-01-30 05:42:11.430943
,1,29,https://www.tripadvisor.com.sg/Profile/651darrinr,660020888,21-03-2019,5,Do It,"Excellent place to have a feed and watch all of the Garden by the bay lights at night, price expensive but the views are worth every cent",10-2018,Couples,2020-01-30 05:42:17.185378
,1,29,https://www.tripadvisor.com.sg/Profile/spanishrose1952,658992558,17-03-2019,5,Great views,"The cost per person is $8 and as they only allow 70 people at a time to be on the Skyway there may be a wait. It is a walkway between two of the supertrees and gives you a different aspect to the whole experience of Gardens in the Bay. Great views from up there and, if you are lucky, you could time your walk when one of the two light shows are on in the evening",03-2019,Couples,2020-01-30 05:42:17.515379
,1,29,https://www.tripadvisor.com.sg/Profile/Tim H,658800904,16-03-2019,5,Totally worth it,"We bought tickets for the OCBC Skyway in advance from voyagin, along with tickets for the Flower Dome and the Cloud Forest for 20% off. Considering all three are pricey, it was a great idea to get the discounted tickets.
We arrived around noon, and we were worried that it'd be really hot on the skyway, but it turned out that it was the opposite and there was a cool breeze along with spectacular views. Because they only let a few people at a time onto the Skyway, it wasn't crowded at all, we could get all the photos we wanted, and the great views weren't obstructed at all.
Later in the evening, the lineups for the skyway get REALLY long, and everyone wants to be on the skyway for the evening light show so the best time to go is in the morning or afternoon when you can walk straight on to the elevator.

Find this review helpful? Give it a thumbs up!",03-2019,Couples,2020-01-30 05:42:17.877505
,1,29,https://www.tripadvisor.com.sg/Profile/Connorsofnewcastle,658731594,16-03-2019,5,Up close to trees,Amazing walkway which gets you up close and personal to the trees. Brilliant views of the gardens - there is a small charge but definitely worth it.,03-2019,Couples,2020-01-30 05:42:18.216182
,1,29,https://www.tripadvisor.com.sg/Profile/Scott B,658600730,15-03-2019,4,Narrow and Confronting,"I was up here with my girlfriend, who is not a lover of heights. This is an other perspective of the fake trees but all you get is a little claustrophobic and a view of a restaurant you wished you’d eaten in. Feel free to pass if you are pressed for time and money.",03-2019,Couples,2020-01-30 05:42:18.588607
