REVIEW_INDEX,WEBSITE_INDEX,POI_INDEX,REVIEWER_URL,REVIEW_ID,REVIEW_DATE,REVIEW_RATING,REVIEW_TITLE,REVIEW_BODY,DATE_OF_EXPERIENCE,TRIP_TYPE,REVIEW_CRAWLED_TIME
,1,29,https://www.tripadvisor.com.sg/Profile/AirFuss,739353974,16-01-2020,3,Nice views from the top,"The views of the garden and the supertrees are beautiful. Supertrees look even more beautiful in the night when they light up.

As only limited number of people can go on the skyway at a time you get a queuing slot along with the ticket. On the skyway the coordinators keep asking you to move forward as the bridge needs to be empty before next group of people come in. It took around 10-15 minutes for us to cross the skyway along with taking few pictures.",09-2019,Family,2020-01-30 05:40:21.508211
,1,29,https://www.tripadvisor.com.sg/Profile/harrisonware,725788283,12-11-2019,5,Awesome views and Amazing Light Show,Great place to come with families and to do the skywalk and light show. The skywalk provided us with great view of the bay and the gardens. The light show was amazing and very well done. We really liked it here and there was nothing to wrong about it.,11-2019,Family,2020-01-30 05:40:21.875718
,1,29,https://www.tripadvisor.com.sg/Profile/Excursion31974983236,716727167,09-10-2019,4,doable during daytime; night show a must,The skyway is located at the site of the gardens by the bay! The evening light n sound show is good else daytime a may be doable thing,10-2019,Family,2020-01-30 05:40:22.225546
,1,29,https://www.tripadvisor.com.sg/Profile/bluehive,716360002,08-10-2019,3,You can Skip it,An entry fee of $8 and more than an hour of wait is not a fair price of the skywalk. It’s nothing extraordinarily and I personally preferred the view of supertrees from the ground. Skip it and rather explore gardens by the bay.,10-2019,Family,2020-01-30 05:40:22.612459
,1,29,https://www.tripadvisor.com.sg/Profile/Stha77,703315760,26-08-2019,5,Absolutely beautiful 😍😍,"We viewed the skyway during the night and came back to go on it during the day. Either way, this takes your breath away! What an amazing structure! It feels really futuristic and magical.
The views from the Skyway are breath taking. Seeing it in pictures is nothing compared to the real experience. The skyway does sway a little so perhaps if you are afraid of heights this might not be for you. However, the feeling you get from just standing on it is worthwhile!

During the night, when it is busy, time spent on it can be limited to 15 minutes. This is not enforced though. When it is not busy, you can spend as much time as you want and take in the experience and feeling that comes with standing on top of such a magical structure while you marvel at the trees.

The tickets can be purchased just beside the skyway and are not expensive.

If you come to Singapore and you do not go on the Skyway, I mean, were you even in Singapore?",08-2019,Family,2020-01-30 05:40:22.964164
,1,29,https://www.tripadvisor.com.sg/Profile/WillB2000,691556623,22-07-2019,4,Enjoyable walkway and view,Another enjoyable part of our trip to the garden domes. We went on the way on a pretty hot day. It was refreshing to get above the trees into the breeze. They are set up to manage a lot of people (which I assume is the case at sunset). It wasn’t busy in the middle of the day. Great view of marina bay sands and the domes.,07-2019,Family,2020-01-30 05:40:23.306118
,1,29,https://www.tripadvisor.com.sg/Profile/russellw907,689713084,15-07-2019,4,Timed for performance,We were lucky enough to get on the skyway a few minutes before the music and light show began and it was quite a wonderful experience.,07-2019,Family,2020-01-30 05:40:23.662580
,1,29,https://www.tripadvisor.com.sg/Profile/lea63,688897346,12-07-2019,4,Great Night View,This attraction has timed tickets. Limited numbers are allowed on the Skyway at each time slot. There is an elevator to the top. Not great for those who don't like heights but a great view.,07-2019,Family,2020-01-30 05:40:24.016612
,1,29,https://www.tripadvisor.com.sg/Profile/DarThen,687240770,06-07-2019,4,Great Vantage Point for view of the Marina Bay landmarks and vicinity,Elevated bridge offers a fantastic vantage point of the surrounding and landmarks. Easy walk for a surround view.,07-2019,Family,2020-01-30 05:40:24.382179
,1,29,https://www.tripadvisor.com.sg/Profile/manda_yani,686629454,04-07-2019,4,Amazing view,"One of must try attraction when visited Garden by the bay. We can walk from one supertree to others with amazing view. It's a short distance but please take care of your children. At the bridge we can see many of Singapore landmark such as Marina Bay Sand or Singapore Flyer. But if you afraid of heights of have vertigo, just choose another attraction :)",06-2019,Family,2020-01-30 05:40:24.755171
,1,29,https://www.tripadvisor.com.sg/Profile/SASHAH2503,684510785,26-06-2019,3,Good,a good place to view the Light and Sound show available every evening free of cost at Garden by the Bay.,06-2019,Family,2020-01-30 05:40:30.702292
,1,29,https://www.tripadvisor.com.sg/Profile/tancksf,679835981,08-06-2019,4,Stunning Panoramic View,Enchanting view of the beautiful skyline of Singapore city ... especially great when coupled with cool weather ... on a suspended walk way,06-2019,Family,2020-01-30 05:40:30.977679
,1,29,https://www.tripadvisor.com.sg/Profile/sgdeepakkamath,679385425,06-06-2019,5,SHOW STOPPER,Its a 25 to 30 minutes show in the evening after 7 pm.The show with lights and music is just amazing.,05-2019,Family,2020-01-30 05:40:31.299570
,1,29,https://www.tripadvisor.com.sg/Profile/Rajeebg,672897616,10-05-2019,4,Beautiful at Nights !!,Wait n Watch the Nights and the OCBC skyway to see entire Simgapore . Its simply awesome and what everyone should like.,05-2019,Family,2020-01-30 05:40:31.659123
,1,29,https://www.tripadvisor.com.sg/Profile/Fidzje,671932302,06-05-2019,5,beautiful!,"Waw, you need to see this! The small fee you need to pay is so worth it! Go and explore, enjoy the great views!",05-2019,Family,2020-01-30 05:40:32.014703
,1,29,https://www.tripadvisor.com.sg/Profile/TLZZE,671913243,06-05-2019,5,Worth it!,"If you get a good deal for the OSBC and the park is not packed, then would highly recommend for a different perspective. Really nice views and can get some great pics.
Lining up was a bit of a pain, but kept the skyway less crowded.",04-2019,Family,2020-01-30 05:40:32.378973
,1,29,https://www.tripadvisor.com.sg/Profile/AnaAngelica,670678887,01-05-2019,4,Tip: Get tickets beforehand,We were disappointed that we couldn't go up on the Skyway because you need to buy the tickets way before the light show as they quickly run out.,01-2019,Family,2020-01-30 05:40:32.694888
,1,29,https://www.tripadvisor.com.sg/Profile/NandanRao,670438948,30-04-2019,5,Worth visiting,"Up close to the Super Trees, it is a different experience to see the super tree grove from up above. For an Extra $8, you can take an elevator to go up the skyway and get a birds eye view of the super tree grove as well as the surroundings.

The Skyway serves two purposes - get a closer view of the super trees and the surroundings and for many people - most importantly provide multiple photo opportunities.

Tip: Queue up at the ticketing kiost around 7:15pm and get on top by about 7:40pm to enjoy the light show from the top of the bridge. Note that the number of people on top is limited, so depending on the number of people, the queuing time differs",04-2019,Family,2020-01-30 05:40:33.066141
,1,29,https://www.tripadvisor.com.sg/Profile/mikempink,670406520,30-04-2019,5,Supertrees are amazing at night,"Don't miss this garden lighted area with spectacular ""supertrees"". It is located near the city center and the equally spectacular hotel with at ""ship"" on top. Also, very near the Merlion park area.",04-2019,Family,2020-01-30 05:40:33.423835
,1,29,https://www.tripadvisor.com.sg/Profile/Timothy Cameron B,669068302,25-04-2019,5,Great View,"This skyway walk is surprisingly high and affords great vies of the gardens, Flyer and Marina Bay Sands Hotel. Not expensive and worth the time.",04-2019,Family,2020-01-30 05:40:33.731515
,1,29,https://www.tripadvisor.com.sg/Profile/Sylvia G,665146985,10-04-2019,5,Scary and wonderful,Our daughter and I went up on the Skyway - terrifying if you don't like heights (they do warn you of this). I don't do heights and became scared about half way around BUT the view from up there is magic. You really feel like you are up in the trees. The light show (after we came down) was spectacular. Lovely colours and the choreography was well done. Long ques but worth the wait - and they do move reasonably quickly - very orderly.,03-2019,Family,2020-01-30 05:40:39.543516
,1,29,https://www.tripadvisor.com.sg/Profile/GautamChawla9,662660665,01-04-2019,5,Very nice experience,It was an amazing experience being on the top of the super grove trees. One of a kind and great experience.,03-2019,Family,2020-01-30 05:40:39.883675
,1,29,https://www.tripadvisor.com.sg/Profile/Muhammed n,661761535,28-03-2019,5,The skyway is at its best during light show,It is different experience when you watch the free light show in evening from skyway. Since it is the busy time you will be in a big queue. Plan accordingly.,02-2019,Family,2020-01-30 05:40:40.218055
,1,29,https://www.tripadvisor.com.sg/Profile/Shefa13,661094097,25-03-2019,5,#AmazingHeights,I really love this place. This is perfect for family and friend. Even my three-year-old daughter was very happy to appreciate the surroundings and the light show.,03-2019,Family,2020-01-30 05:40:40.590825
,1,29,https://www.tripadvisor.com.sg/Profile/PasiJ3,658952190,17-03-2019,4,"If you like the Supertree Grove, don’t skip this","Yes, the Skyway is basically just a walking bridge from one supertree to another but there’s a cool sci-fi feel to it and the view is fascinating. Of course the supertree structures are artificial and all that but the Skyway kind of plays along and adds another angle to this otherworldly location. Fear of heights may be a problem here, though.
On a February Sunday the queues were rather minimal.",02-2019,Family,2020-01-30 05:40:40.955973
,1,29,https://www.tripadvisor.com.sg/Profile/Shelley M,658932298,17-03-2019,5,Beautiful views,Only cost $8 to walk up here. Go early to avoid crowds and heat. Get timed on the walkway but you have plenty of time. Great views out over Marina bay and the gardens. The maintenance is beautifully done and so clean and tidy. A really nice place to be.,03-2019,Family,2020-01-30 05:40:41.299782
,1,29,https://www.tripadvisor.com.sg/Profile/JakubJ1079,657145127,08-03-2019,1,Just do not do it,We went on Friday evening to do walk. They sold us 8:20 pm spot tickets around 7:45. We left 8:30 with at least 100 people in front of us.,03-2019,Family,2020-01-30 05:40:41.653413
,1,29,https://www.tripadvisor.com.sg/Profile/555erzs_betb,653915267,21-02-2019,4,Nice views,"I did not know that the skyway is trembling! I mean by walking there you could feel the smalll movements, which kept mee holding the handrails all the time.",02-2019,Family,2020-01-30 05:40:41.971532
,1,29,https://www.tripadvisor.com.sg/Profile/faecelinee,650967922,09-02-2019,4,Unique experience,"highly recommend walking the ocbc skyway, i suggest coming at morning when it opens so there are less crowds and more peaceful",10-2018,Family,2020-01-30 05:40:42.323887
,1,29,https://www.tripadvisor.com.sg/Profile/Tony W,649093984,30-01-2019,4,Life high up in the (artificial) trees,Everything about and in the Gardens by the Bay is well thought out and spectacular. This walkway winds its way around the tops of the Supertree Grove being suspended in the trees themselves. Can get very busy so add a little time.,01-2019,Family,2020-01-30 05:40:42.683671
,1,29,https://www.tripadvisor.com.sg/Profile/Bellsie17,648645193,28-01-2019,4,It isn't free,"I always expect to pay to see things but I am not so sure why, when we were there, so many people thought they should head on up for free. It is worth the small entrance fee to walk among the treetops",01-2019,Family,2020-01-30 05:40:48.567689
,1,29,https://www.tripadvisor.com.sg/Profile/FranzA848,647650007,23-01-2019,5,Nice views from the skyway,Very affordable and great views from above. A good 30-minute walk from one end to another. Would recommend,01-2019,Family,2020-01-30 05:40:48.855263
,1,29,https://www.tripadvisor.com.sg/Profile/EssEffMD,647569987,22-01-2019,2,Yawn....,"If you opt to pay the $8 to do this, go early as the walk is relatively short, the skyway is narrow and suspended by cables so it sways slightly as you walk on it. There is also invariably someone taking a picture which impedes your walk, in general, the concept of the skywalk is intriguing but there was something lacking in the overall execution of it. Save your $8 and check out Satay by the Bay instead.",01-2019,Family,2020-01-30 05:40:49.228869
,1,29,https://www.tripadvisor.com.sg/Profile/Ilmar T,644720335,09-01-2019,5,Wonderful view of Singapore,"The only complaint I had about this walkway was that it was too short and the experience was over too quickly. At S$8 it was worth every cent. The walkway swayed a bit due to the reasonably fresh wind, which only added to the experience. The view back to Marina Bay high rise contrasted to the enormous expanse of green which really showcased what Singapore is about, a modern city which is highly environmentally conscious. I would recommend anyone visiting Gardens by the Bay to include the Skyway in their visit, despite the additional cost.",01-2019,Family,2020-01-30 05:40:49.591795
,1,29,https://www.tripadvisor.com.sg/Profile/div106,641926771,28-12-2018,5,Amazing view,"The OCBC skyway has an amzing view. Rain may cause a hindrance to your travel plans, so you must check the weather before planning. The cost is extra apart from the entrance ticket to the gardens.",07-2018,Family,2020-01-30 05:40:49.901363
,1,29,https://www.tripadvisor.com.sg/Profile/chooseong,641688101,27-12-2018,4,Insta-worthy,"If you're in Singapore and you need a 'trophy shot' for your instagram, this is probably the place to be. If you're into artificial giant trees, you'd be surrounded by 18 of them. In the background - Marina Bay Sands with it's giant ship stranded on top of 3 towers, the clam shell / brassiere-inspired Domes, you'd also get the Singapore Flyer thrown in, a great bargain for an $8 entrance fee.
The majestic curved Skyway offers a great 360º view of Gardens by the Bay.

Go early and avoid getting photobombed.",12-2018,Family,2020-01-30 05:40:50.251277
,1,29,https://www.tripadvisor.com.sg/Profile/salonib595,634756643,21-11-2018,3,Just ok,"Not a bad experience at the price it is offered, but you can get better view of the city from other buildings.",11-2018,Family,2020-01-30 05:40:50.658738
,1,29,https://www.tripadvisor.com.sg/Profile/sharadshrimali61,633779445,16-11-2018,4,Good,"One can get a nice view of the Supertree Grove atop OCBC Skyway. One visitor is entitled to be on the skyway for only 15 mins, however, for its length, I find the time adequate.

There's a fee of 8 SGD for the Skyway. Last admission is at 8pm. However, it's not that one gets admission as soon as one buys tickets. Instead, the staff assigns a queuing time i.e. at that particular time (maybe half-an-hour after buying tickets) you need to queue at the lift area.

Frankly speaking, though it is nice to get views of the whole area, but it didn't meet my expectations. Nevertheless, one shouldn't miss it.",11-2018,Family,2020-01-30 05:40:51.038817
,1,29,https://www.tripadvisor.com.sg/Profile/AquaticHawk,630179539,02-11-2018,5,Great view,"There's a great view, and you can see a lot of Singapore from there. It makes a trip to Gardens By The Bay much more interesting.",09-2018,Family,2020-01-30 05:40:51.406664
,1,29,https://www.tripadvisor.com.sg/Profile/Angel_Traveler444,630003263,01-11-2018,4,Moderate,Man Made beautiful place. You need to buy tickets to go up. There is a lift which can take you up. The walk is beautiful - this is a place for people who love taking pictures. You can truly appreciate the design and the effort by the people to create this place.,03-2018,Family,2020-01-30 05:40:51.769383
,1,29,https://www.tripadvisor.com.sg/Profile/Mazmannan,624900299,15-10-2018,4,Great viewing walkway,"The OCBC Skyway is a walkway that is located above the ground and is a great viewing gallery of the surrounding areas of the Gardens by the Bay.

Admission prices are SGD8 for adults - but I question whether an admission charge is really necessary.

It can get quite crowded in the evening when the light show takes place.",04-2018,Family,2020-01-30 05:40:57.704366
,1,29,https://www.tripadvisor.com.sg/Profile/antoniosk,622701040,06-10-2018,4,"Kinda cool, visit at night though","These false trees are actually kinda cool, and the skyway is an interesting one way walk. The limit is 70 people at any one time, and this is selfie land so lots of phones on stalks.

Tickets are $8/pp, but you can get them on discount so shop around.",09-2018,Family,2020-01-30 05:40:58.088643
,1,29,https://www.tripadvisor.com.sg/Profile/Possie B,622061788,04-10-2018,5,A must do in Singapore,"Well worth the few $ for thus amazing experience. The views are absolutely spectacular. We visited during the day so there were no queues and we could take our time on the bridge.
Night time is another matter - expect to wait up to 90 minutes to even get up there and you only get 15 mins to look at night as it’s just so busy.",09-2018,Family,2020-01-30 05:40:58.448107
,1,29,https://www.tripadvisor.com.sg/Profile/KJCairns,620445145,29-09-2018,5,Amazing views of the super trees,The super trees were the highlight of our singapore trip as they look amazing and you can get great photos. They look pretty awesome from the ground but for $8 it's worth going up on the skywalk as you see them from a whole different dimension plus with added city views. If you go around sunset be prepared for wait times of about an hour though,09-2018,Family,2020-01-30 05:40:58.774618
,1,29,https://www.tripadvisor.com.sg/Profile/Andrew S,618801121,23-09-2018,5,Great Fun,"Its only 8S$ for this. the walkway between the supertrees give a great view over the park and the city, and the unusual Marina Bay Sands hotel.",09-2018,Family,2020-01-30 05:40:59.170095
,1,29,https://www.tripadvisor.com.sg/Profile/Bea T,612113926,30-08-2018,5,Worth Walking on it Once,"One thing is to view the supertrees from ground level up, and another to view it at eye level. On the skyway, you can really appreciate the intricate and artistic design of the supertrees' top/crown. From high above, you can also see the two domes of the garden, the Flyer, and the Marina Bay Sands hotel. It's an amazing view and worth visiting it!
Beware that on a crowded day, they allow people to be there for 15 minutes only.",07-2018,Family,2020-01-30 05:40:59.555346
,1,29,https://www.tripadvisor.com.sg/Profile/mangeshtilve,611584915,28-08-2018,5,excellent skyway,"Ocbc skywayand supertreegrove. beautiful vertical plant displays.Enjoy a birds eye view from 22 mtrs high ocbc skyway walk and enjoy
At night there is light and sound show ,very very spectacular not to be missed. one can sleep on grass in open ground and enjoy the show,of
apprx 15 minutes,not to be missed. must in Singapore visit.
this place is part of Garden by bay .
shows are at 7.45 and 8.45 pm
taxi fare from little india 10 singapore dollars
time of visit appr 3 hrs",08-2018,Family,2020-01-30 05:40:59.942384
,1,29,https://www.tripadvisor.com.sg/Profile/khoo g,610708774,27-08-2018,5,OCBC Skyway,"Please beware this place closed for 1 day each months. Before go there, check which day on the schedule are closed.",08-2018,Family,2020-01-30 05:41:00.288407
,1,29,https://www.tripadvisor.com.sg/Profile/ttttssssszzzzzz,600446695,28-07-2018,5,Breath-taking Night Views and Great light show.,"Beautiful, enchanting and a wonderful opportunity to capture some pictures.
OCBC Skyway is a real highlight of any visit to the Gardens by the Bay, but you should aim to visit when it is dark and the artificial trees are lit up with some wonderful lights.
Also try and catch the evening Light and Music show either before you go up or when you are on the Skywalk itself.
The queue to get up to the walk itself is pretty busy, but it does move along.
There are signs that say they try to limit people on the skywalk itself to a maximum of 15 minutes, but I am not sure how they manage to usher people out as there seems to be a continual stream of people visiting the walk, I suspect you can stretch the time on the walk to more than 15 minutes - but 15 minutes is probably enough time to catch the views and any photo opportunities anyway, it is not a long walk.
I found the walk more enjoyable than both Cloud Forest and the Flower Dome.
Do yourself a favour, take a trip up to the Skywalk, it takes less time than visiting the domes.",07-2018,Family,2020-01-30 05:41:00.676568
,1,29,https://www.tripadvisor.com.sg/Profile/Rohit B,600321240,28-07-2018,5,OCBC Skypark,It gives an amazing view to the evening show here in Garden by the bay but one can also choose to relax on the ground and have a view of it,06-2018,Family,2020-01-30 05:41:00.996471
,1,29,https://www.tripadvisor.com.sg/Profile/Hussain M,584157884,31-05-2018,3,A tree bridge,"Nothing special, just a tree bridge between artificial tree groves in gardens by the bay. Don't see what's special.",07-2017,Family,2020-01-30 05:41:06.886266
,1,29,https://www.tripadvisor.com.sg/Profile/NafeeTA,582021024,22-05-2018,5,A great place to view the Gardens by the Bay,"Besides the allure of the Structure itself, the skyway provides a more majestic look of the Supertrees and the view of Gardens by the Bay",05-2018,Family,2020-01-30 05:41:07.210386
,1,29,https://www.tripadvisor.com.sg/Profile/PushExplore,580083790,14-05-2018,5,Great Night Views of Gardens by the Bay & Super Trees,"If you are in the Gardens by the Bay area, you must go in the evening so you can enjoy the psychedelic lights and the walk along the OCBC Skyway is really amazing. It offers great views of the garden....",08-2017,Family,2020-01-30 05:41:07.561539
,1,29,https://www.tripadvisor.com.sg/Profile/Amit K,575049394,23-04-2018,3,"Nice walk, good view but not a must do item","We went to the gardens by the bay in the evening and spent around 3-4 hours there.
The garden is spectacular and a treat to the eyes. OCBC skyway provides a view of the supertrees from a height but there isn't anything you are missing from the ground as well.
I did take the OCBC skyway but its not a must do item. Also, someone mentioned OCBC skyway are the perfect place to watch the evening light and music show but I disagree. The show looks better from the ground.",04-2018,Family,2020-01-30 05:41:07.925290
,1,29,https://www.tripadvisor.com.sg/Profile/rdubbs08,560094597,13-02-2018,4,"Worth it for some, not for others","This is ticketed and is just a short walk elevated in the trees. For some it may be worth it, for others not so much. We enjoyed it and can check it off the bucket list...and our 23 month old enjoyed the view from up high!",02-2018,Family,2020-01-30 05:41:08.313854
,1,29,https://www.tripadvisor.com.sg/Profile/vipi0017,554881123,20-01-2018,3,Not worth it,"You just get an elevated view from this , Better to spend entrance at flower dome & specially cloud forest as it has better and higher elevated views though indoor .",08-2017,Family,2020-01-30 05:41:08.630694
,1,29,https://www.tripadvisor.com.sg/Profile/Seatroutfisher-1,550381077,31-12-2017,5,Worth the fee...if you don't mind heights!,"Unfortunately I do and this was at that awkward height and I felt very uncomfortable! The rest of the review is my son's! He said the views were wonderful and this was the place to be when the light show is on in the supergrove.

As for me...I didn't see much as I was focused on getting to the end!",11-2017,Family,2020-01-30 05:41:08.961048
,1,29,https://www.tripadvisor.com.sg/Profile/Archited2013,548934476,24-12-2017,5,Amazing must see attraction at the Gardens by the Bay!!!,"We totally enjoyed the Gardens by the Bay during our Singapore trip, and the Super Trees. This elevated walkway just makes it that much better. We visited the Super Tree grove three times during our trip. The last time, we went at dusk and paid for the OCBC walkway. After getting our ticket (you pay and enter at one end, and exit at the other), we took the elevator up the first Super Tree to the top. They limit how many can be on the walk at once, so there is sometimes a wait. Once we were up, we took our time to walk the bridge which is all suspended by cables from the trees. There is a time limit of 15 minutes which seems loosely enforced. They do seem to try to move you along, but we had plenty of time for lots of pictures. The view from here is amazing, and especially magical at night with the fabulous lighting. Highly recommended!!!",10-2017,Family,2020-01-30 05:41:09.383507
,1,29,https://www.tripadvisor.com.sg/Profile/185graemes,520492982,02-09-2017,4,Great viewd,A great addition to the Gardens by the Bay the skywalk gives a different perspective and allows you to see close up the structure of the Super Trees as well as giving excellent city views. If you try to do it at night there are large queues and your time is managed,09-2017,Family,2020-01-30 05:41:09.751310
