REVIEW_INDEX,WEBSITE_INDEX,POI_INDEX,REVIEWER_URL,REVIEW_ID,REVIEW_DATE,REVIEW_RATING,REVIEW_TITLE,REVIEW_BODY,DATE_OF_EXPERIENCE,TRIP_TYPE,REVIEW_CRAWLED_TIME
,1,85,https://www.tripadvisor.com.sg/Profile/JustLoveToFly,538206599,04-11-2017,4,Not Big But Good,"This is not a place for shoppers but if you just want food and buy groceries. This place is considered good with a varierty of eateries, restaurants, etc. There is also a fairprice and daiso. The daiso was real crowded. Uniqlo has an outlet here as well.",11-2017,Friends,2020-01-31 17:43:59.763422
,1,85,https://www.tripadvisor.com.sg/Profile/PAC_WestOz,485562089,19-05-2017,4,So many food options near Chinatown MRT,"Met my local friend for dinner tonight, we have eaten at many of the restaurants here during other visits to Singapore.

Tonight we choose the Soon Huat Dining Room on 2F for a pleasant meal, we choose BKT soup with mushrooms and Tow Kee plus bean sprouts with garlic, plus a braised mix platter, rice and cool drinks.

The meal was quite good.

Afterwards we wandered amongst the retail shops on different levels...Chinatown Point Mall was quite busy for a Friday night.

Recommended for a meal or for a shopping feast...tis your choice.",05-2017,Friends,2020-01-31 17:44:00.139389
,1,85,https://www.tripadvisor.com.sg/Profile/JONHallettCoveJ,420359682,20-09-2016,4,Lot To See and Do,"Literally dozens of upmarket little shops and stalls offering good retail options and souvenirs etc.
Seceral good, clean restaurants (japanese, Thai, Korean) all busy and well patronised: ""Sets"" seem to have the best specials but odering straight from the menu is convenient: good beverages and in the main good service. This mall is dierctly acroos from Furama: access is by overpass.
There is even a ""Mackers) downstairs.",09-2016,Friends,2020-01-31 17:44:06.069245
,1,85,https://www.tripadvisor.com.sg/Profile/linweisingapore,394575567,20-07-2016,4,Lunch Hour Dining,"Visited Chinatown Point for lunch. Had lunch at Genki Sushi which featured self order on the tablet. Nice meals at above average prices (about $22 per person).

The mall has many travel agencies on the 2nd to 4th floor. Also many dining options such as Poulet, Ding Tai Fung, Song Fa Bak Kut Yeh, Delifrance, Coffee Bean & Tea Leaf, Toast Box, Genki Sushi, Bread Talk etc. Anchored tenant are NTUC Fairprice, Uniqlo, MacDonald. Also Crocs, Samsung Shop, pre-owned branded leather product shop, Singapore Pool, Cortina Watch, etc. There is also a money changer (Level 2) and a national library on Level 5.

Always busy traffic during weekday lunch hour but still a pleasant shopping and dining experience.",04-2016,Friends,2020-01-31 17:44:06.449314
