REVIEW_INDEX,WEBSITE_INDEX,POI_INDEX,REVIEWER_NAME,REVIEW_RATING,REVIEW_DATE,REVIEW_TIME,REVIEW_BODY,ATTRIBUTES_CRAWLED_TIME
,2,55,U44658****049084,5,2019-07-27,23:05,给力的鸭奶奶，还为我们拍照，完美的讲解。,2020-02-13 01:26:23.589693
,2,55,王雅熙,5,2018-08-29,00:00,"新加坡比打卡的五个热门景点！新加坡作为一个超级著名的旅游城市，好玩的东西太多啦，但是去了新加坡，在众多的景点中，我选出了五个必须要打卡的地方，下面我介绍给大家，让大家感受好玩的新加坡。 新加坡摩天观景轮新加坡摩天观景轮是亚洲最高的摩天轮，一百多米的高度，登上去就可以俯瞰整个城市美景。新加坡的夜景也是非常好看的。我也坐过不少地方的摩天轮，新加坡这个给我的感觉就是大，一个舱可以容纳20个人，我们那个舱做了8个人，所以还是相对来说很宽松的。摩天轮转一周大概20分钟左右。之前看攻略说下午很晒，所以我也推荐大家傍晚欣赏落日或者晚上欣赏夜景。营业时间：08:30-22:15滨海湾金沙酒店无边泳池滨海湾金沙酒店号称是世界上最昂贵的酒店，该酒店的室外游泳池建在酒店的57层的塔楼楼顶，是这一高度下世界上最大的游泳池。无边泳池的旁边还有酒吧，晚上天气凉下来去喝一杯还是非常惬意的。但是就是来参观的人太多啦，明明是很适合拍照的地方因为人流量感到拍不出大片的感觉，水天相接是真的超级美！推荐大家早上日出的时候去，太阳升起来，光和煦的打在水面，整个泳池都呈现着温暖的黄色光晕。营业时间：全年无休City Tours鸭子船从陆地到水面安全行驶的小船。在很久以前就听说过有水陆两用船。除了电视上，还重来没有亲眼见识过。因此对这种船也充满了好奇。船的样子也很奇葩，居然给做成了飞机的式样，就是没有飞机的小翅膀。在当地人的指引下我来到1City Tours鸭子船的售票处，买了一张票子去感受下那个可爱的小船。船在岸上行驶着。慢慢的靠近附近的水域。这个时候我的小心脏还是有点起伏的。开放时间：上午9点—下午5点  幻彩生辉灯光秀很久之前，就一直想去新加坡去看看幻彩生辉灯光秀，因为那场表演真的超级漂亮。经过两个小时旅程，我们来到了幻彩生辉灯光，真的是有点小兴奋呢！，晚上在几棵人造大树上亮起了五颜六色的光，真的是超级好看。这些灯光配合着美妙的音符，随着节拍改变着颜色，真的越来越漂亮，让人看的目不转睛。据说经历了多次的翻修，这里的灯光秀还会掺杂着烟火秀，所以才会更加的吸引人吧！除此之外，这里还有别的表演，比如说激光投影，音乐喷泉表演等等，这些表演都很精彩。营业时间：周一-周四、周日：有20:00、21:00两场；周五、周六：有20:00、21:00、22:00三场Big Bus Singapore新加坡观光大巴士新加坡的巴士,是敞篷的双层巴士哟。坐在巴士上面，可以看到新加坡沿路的风光， 还可以热情地和新加坡居然打招呼。新加坡的海风吹来，你站在巴士上，嘿嘿，你就是街上最靓的崽了。等你到了一处景点，你可以下来参观，像摩天轮，滨海湾金沙，还有标志性的鱼尾狮，都可以尽情享用。这个巴士的特色就是，你下车了之后可以原路返回到下车的地方，等下一辆车过来，你又可以接着上车啦！巴士一共有七条线路哦，你们在购票的时候可以先了解一下，看看你更喜欢哪条线路，保证你一天玩遍新加坡啦！还不重样！时间：09.30-18.00好啦，这就是我想给大家推荐的三个新加坡一定要打卡的景点。在摩天轮俯瞰新加坡夜景，在无边泳池感受日升日落，感受鸭子船的摇摇晃晃，在双层巴士上欣赏新加坡的城市风情，灯光秀感夜晚的快乐。一起去打卡吧！",2020-02-13 01:26:23.593199
,2,55,139****2732,9,2018-01-17,23:04,因为全船都是中国人，特意中文讲解的。船噪音有点大，家里一岁多的宝贝吓哭了。但很适合第一天到了座一下，水陆能到达很多景点,2020-02-13 01:26:23.596390
,2,55,e00****62,5,2019-08-18,11:13,不错，中文讲解，了解一下新加坡历史。,2020-02-13 01:26:23.599534
,2,55,yeeywy,3,2019-05-04,18:09,首先换票地点没有短信说明那么好找，此外，鸭子船在水里巡游不到30分钟，上岸后，在市区转了不到20分钟，时间有些太短。,2020-02-13 01:26:28.181308
,2,55,135****0119,5,2019-02-01,17:05,如果没有过的，可以坐坐，毕竟水陆两栖,2020-02-13 01:26:28.187433
,2,55,110****163,5,2018-06-07,22:29,水陆两栖鸭子船孩子超级喜欢。只是预定成功时一定看清时间是预定时间还是备选时间,2020-02-13 01:26:28.193436
,2,55,138****7135,5,2019-04-10,14:17,鸭子船小朋友很喜欢，推荐～～～～～～～～～～～～～～～～～～～～～～～～～,2020-02-13 01:26:28.199403
,2,55,M34****122,5,2018-02-15,06:54,非常方便，都不用换票，登记排队上船,2020-02-13 01:26:28.207080
,2,55,willcc,5,2018-02-12,10:14,下水的瞬间挺刺激的，鸭子奶奶很幽默,2020-02-13 01:26:28.211569
,2,55,_WeCh****603163,5,2019-06-11,13:56,可以了解新加坡发展，体验感不错。,2020-02-13 01:26:28.215579
,2,55,M22****636,5,2019-02-19,09:34,最好是早点定，第一天去游玩就坐。,2020-02-13 01:26:28.219702
,2,55,施派尔苏轼,4,2019-04-08,13:34,挺有意思的观光之旅，下水很刺激,2020-02-13 01:26:28.223309
,2,55,M29****723,5,2018-03-21,20:30,水陆都走很好的线路，可以拍到很好的照片，新加坡总体服务水平很高，各方面都没有什么好担心的，挺有意思的体验。,2020-02-13 01:26:28.226511
,2,55,150****8348,4,2019-03-16,01:45,这种鸭子船价格相对便宜些 我们坐的这趟人不多 大部分都是中国人 导游提供中文讲解 相对而言性价比非常不错,2020-02-13 01:26:29.814199
,2,55,晚叶秋枫,4,2019-05-26,23:32,兑换票的地点不是很好找，特别是没有华人的帮助下，体验还可以的，携程这条鸭子船线路，对比还是性价比不错的,2020-02-13 01:26:29.819724
,2,55,Jasmine0528,5,2018-06-16,12:33,鸭奶奶讲解到位，沿途经过所有地标景点，鸭子船入水那一刻很有意思,2020-02-13 01:26:29.824997
,2,55,大海里不会游泳的鱼,5,2018-02-06,10:16,很幸运，天气非常好！居然没有下雨！建议坐在前排，噪音小，还可以清楚听到讲解！,2020-02-13 01:26:29.829901
,2,55,朱朱,5,2017-10-04,07:58,很有意思，一趟下来了解了经典的景点，导游也很不错，值得！,2020-02-13 01:26:29.835616
,2,55,戴文哥,5,2018-04-07,21:20,很好很强大，就是有一点难找，对于刚到新加坡的人。很好啊，都来买 呀！！！为什么要写这么长啊。,2020-02-13 01:26:29.842907
,2,55,286****905,3,2018-03-18,16:48,不值得坐，噪音很大，柴油味很重，景色虽好但不一定需要搭乘鸭子船游览。,2020-02-13 01:26:29.848253
,2,55,zxssjames,5,2019-03-06,11:40,水陆两栖，环市巡游，轻松休闲，比较适合小孩子一起。要提前预定，我试了十几个人一起预定就不成功，分成3个人一组就预定成功了。,2020-02-13 01:26:29.852808
,2,55,181****7277,5,2017-12-28,22:19,不错的体验，建议来新加坡第一天就坐这个船！,2020-02-13 01:26:29.856418
,2,55,M95****82,1,2019-08-04,15:33,携程真的很差劲，首选买的海豚伴游门票比现场买还要贵，再次携程说是中文讲解根本是英文讲解，只会说几句简单的中文，所以我们也没有学到什么海豚知识，甚至基本注意事项都不清楚！因为不让自己拍照，所以我们买了198新币的两张8寸照片加所有底片，底片要自己上网下载，按照他们黑的说明我都没有办法注册，我找携程帮忙看看，他说这和携程没关系，不管，此时此刻除了脏话我无话可说，如果是在**买的绝对不会不管的,2020-02-13 01:26:29.859817
,2,55,M22****2332,5,2018-03-04,22:27,很赞呀，风景优美，鸭子船下水的那一刻很棒,2020-02-13 01:26:31.967636
,2,55,M58****912,5,2018-12-09,19:02,来新加坡，首先坐个鸭子船，非常的好……,2020-02-13 01:26:31.972223
,2,55,205****322,5,2018-02-01,23:37,很好玩，全新的一次体验，水上风景很美,2020-02-13 01:26:31.976426
,2,55,chaohit,5,2018-07-18,22:13,不错，适合第一次到新加坡的时候观光,2020-02-13 01:26:31.980575
,2,55,Starry  Sky,5,2019-02-04,00:53,特别有意思，值得一乘！水陆两栖车,2020-02-13 01:26:31.985463
,2,55,箫箫雨歇,4,2017-08-01,18:49,"还是值得去,就是看一下滨海湾风景",2020-02-13 01:26:31.993637
,2,55,62****393,5,2017-12-01,17:55,适合带老人小孩儿，不累还可以感受另一种游览方式。,2020-02-13 01:26:31.998789
,2,55,皮戈斯武则天,5,2019-04-10,11:32,入水的时候很好玩，会溅水！沿着溜一圈，路上溜一圈！狮首鱼尾象在维修,2020-02-13 01:26:32.007411
,2,55,coldwar,4,2017-10-15,13:13,鸭子船在新加坡是一个水陆联运的观光工具，外形就是小鸭子，如果时间短，在新加坡转机的话，可以在樟宜机场坐免费的观光巴士，参观包括莱佛士，滨海湾在内的所有关键新加坡景点。,2020-02-13 01:26:32.012127
,2,55,哈哈儿,5,2019-05-19,20:43,很好，提前购票非常方便，不用排队，节约了很多时间，孩子很开心，我们也非常满意，下次出游还会选择提前购票,2020-02-13 01:26:32.016207
,2,55,阿翔cei,5,2019-03-20,21:06,很独特的体验，换票方便，导游非常风趣幽默，到景点还指导大家如何拍照，给苹果用户传了很多美图，不虚此行。,2020-02-13 01:26:35.350381
,2,55,dreamerinsummer,5,2019-02-28,20:39,定的是早上8点半的，可是不知道什么缘故等到9点才开动。一路上风景不错，很适合带小朋友玩！导游也很风趣。,2020-02-13 01:26:35.358242
,2,55,宝宝不是永远,5,2018-02-20,17:00,导游热情介绍，也不累，好玩，推荐,2020-02-13 01:26:35.366390
,2,55,Fiona456,5,2019-05-25,00:19,很有趣的游玩 虽然时间不长 啦,2020-02-13 01:26:35.374287
,2,55,夏夜飞萤,5,2019-04-20,11:55,讲解的姐姐很风趣，中英双语，还加上闽南语，广东话,2020-02-13 01:26:35.380280
,2,55,M30****225,5,2018-03-23,19:04,     水陆两用车，入水一瞬间很好玩，我们运气好，看到了水獭在吃鱼，坐船可以看到很多景点，不错,2020-02-13 01:26:35.388707
,2,55,_cmb43****0382030,5,2018-02-17,21:36,可以，鸭奶奶很有趣！一路讲话不断，想睡觉都难,2020-02-13 01:26:35.392933
,2,55,_ceai****5795,4,2017-12-19,12:47,水陆两栖船本身很有看点，再说还有城市美景。,2020-02-13 01:26:35.396681
,2,55,_M13****2516,4,2019-04-02,15:55,不错，滨海湾的景点都能逛到，先有个印象。,2020-02-13 01:26:35.403492
,2,55,e09****01,4,2018-02-20,08:44,没有想象中好玩 导游还不错 但是船的噪音太大,2020-02-13 01:26:35.407728
,2,55,_ceai****5795,4,2017-11-11,15:58,乖二战时的鸭子船，游览现代化文明都市。,2020-02-13 01:26:37.670453
,2,55,Fly way,5,2018-04-21,08:09,这家船不错的！解说大姐老热情了！好,2020-02-13 01:26:37.686761
,2,55,宝宝不是永远,5,2018-02-20,17:03,导游热情介绍，不累，值得推荐大家,2020-02-13 01:26:37.694936
,2,55,210****938,5,2018-05-17,16:38,很好的主要是不累 就可以浏览市区景色了 船下水很好玩 鸭奶奶服务意识超好,2020-02-13 01:26:37.701379
,2,55,乔小美,5,2019-03-07,10:09,感觉来新加坡必要这个鸭子船，尤其带孩子出行的家庭，特别应该体验！,2020-02-13 01:26:37.705893
,2,55,allenson,5,2019-02-07,00:14,超级大的SUV，非常有特色，入水的刹那间，还是很刺激的，值得一游,2020-02-13 01:26:37.709688
,2,55,zovin,5,2018-10-08,14:45,不会再用携程，坑死了。一不小心钱就被坑了，用其他软件吧！,2020-02-13 01:26:37.713154
,2,55,m70****54,5,2018-06-27,11:56,服务特别好，特别热情，解说很精彩，下水的一瞬间特别震撼！,2020-02-13 01:26:37.716430
,2,55,可乐,5,2018-05-26,11:11,很有意思的两栖船，沿着市区转一圈，适合初到新加坡游览一圈,2020-02-13 01:26:37.719599
,2,55,M27****9140,5,2018-08-26,14:35,去新加坡值得坐一次鸭子船，陆上海上主要景点都可走马观花的游一遍，只是领票的地方我们找了一大圈,2020-02-13 01:26:37.722751
,2,55,189****3446,3,2018-02-01,21:58,兑换票地点不好找，带孩子玩还是有点意思，坐一次足够！,2020-02-13 01:26:40.836993
,2,55,138****2345,5,2018-04-14,13:53,时间不长，感觉票价比较贵，算比较特殊的体验。,2020-02-13 01:26:40.846304
,2,55,M39****569,5,2018-02-03,01:42,门票兑换很方便。小朋友很喜欢！能在水上开，能在地面跑，值得一玩。,2020-02-13 01:26:40.861528
,2,55,小卷卷家的妞妞,5,2018-04-10,12:35,遇到两年前同一个讲解，缘分啊…一如既往的好,2020-02-13 01:26:40.869355
,2,55,191****707,5,2018-01-27,21:40,真的要提前几天买票，我提前一天好的时间都没有座位了，但还是值得体验一下观光新加坡。,2020-02-13 01:26:40.874611
,2,55,300****564,4,2019-03-08,20:40,就是多数人说的，有些吵，双语解说，还是可以去做的，滨海湾很大，只有坐船才能大概的看一遍，带娃的就不要想着走路什么的可以了，步行只能在鱼尾狮广场看看。上船和取票都在滨海广场购物中心那，根据**发的短信，出地铁宝门廊A口，往左一直沿路走几百米，就可以看到。,2020-02-13 01:26:40.879560
,2,55,Bobo,5,2018-08-15,23:13,其实并没有买这家的鸭子船，但因为换票跑错地方了，被city tour的换票人员感动到。是city tour商城地下服务点的一位戴眼镜的工作人员，非常非常热心的给我们指路，还画了草图，虽然后面还是没赶上我们要坐的那班时间，但他的热情还是感动到我，特地到此点个赞,2020-02-13 01:26:40.887725
,2,55,D35****219,5,2018-04-05,06:13,很有趣 值得一去 尤其是讲述新加坡历史很详细,2020-02-13 01:26:40.893008
,2,55,234****555,5,2019-05-29,21:06,挺好的，孩子喜欢的很，特别是入水时。,2020-02-13 01:26:40.897368
,2,55,coldwar,4,2017-10-24,13:09,新加坡遗产之旅是一个两栖主题的旅游景点，这是为期六十分钟的陆上和海上探险。这条旅游路线将覆盖新加坡湾周边的大部分景点。得到了敞开式的公共汽车旅行门票，有红色和黄色路线，车辆外形就是一只小鸭子。,2020-02-13 01:26:40.901158
,2,55,09****630,5,2017-10-16,23:48,可以参观好几个景点超好！一定要去,2020-02-13 01:26:42.864428
,2,55,施派尔苏轼,4,2019-04-08,13:34,挺有意思的观光之旅，下水很刺激,2020-02-13 01:26:42.880744
,2,55,320****749,4,2019-03-14,00:29,一般般，不过小孩子挺喜欢的..,2020-02-13 01:26:42.891669
,2,55,shininglai,5,2018-07-21,17:25,水中、陆地，两边风景还不错的。,2020-02-13 01:26:42.897697
,2,55,300****782,4,2018-02-03,08:24,这值得一坐，海陆两栖适合亲子游,2020-02-13 01:26:42.902691
,2,55,233****988,5,2018-02-03,13:24,水陆感受新加坡中心地带，全程45分钟，随车导游很活跃，中英双语讲解。,2020-02-13 01:26:42.906555
,2,55,M12****074,5,2018-07-08,08:32,性价比高，水陆两栖，能看到市中心最美的风光,2020-02-13 01:26:42.909901
,2,55,M25****998,1,2018-05-26,23:56,坐船虽然下暴雨，鸭奶奶还是有说有笑很快过完了。差评是因为取票处里的一位中年女工作人员。“用下你的脑子”这是我听到的原话。我女儿坐船途中发烧了，一下船我就求助于鸭子船里的工作人员，说借电话打给酒店，这位女工作人员一看酒店很近就指着一条手扶电梯的路让我们自己走回去。我们带着婴儿车肯定是应该坐lift，而且来的时候就是走的手扶电梯那条路是会被雨淋湿的。花钱买了服务，电话不肯借，乱指路，侮辱客人！看着躺在婴儿车里发烧的女儿我也懒得理论，愤然离去！,2020-02-13 01:26:42.913623
,2,55,m96****19,5,2018-04-07,19:07,出票算是很快的，比某宝快，这种需要预定的票当天能出很惊喜。兑换也没有任何问题。鸭子船对老人和孩子来讲比较方便，不用走很多路，但我们家少爷回来的时候睡着了…鸭子船的汽油味道比较重，介意的请考虑。鸭奶奶介绍景点已经成了条件反射，话都是成串的。但我个人对他感觉一般，好像比较喜欢外国人，对中国人就那么回事儿。,2020-02-13 01:26:42.916761
,2,55,木点青灵,4,2018-10-07,10:55,找乘车地点花了点时间，马路边有两个鸭子船是不同方向的，需要问一下。乘鸭子船可以看到鱼尾狮的正面，还是不错的，导游介绍的也挺仔细，感觉第一次去新加坡，去坐坐玩玩还是比较推荐的,2020-02-13 01:26:42.919883
,2,55,118****620,5,2018-03-07,00:52,带小孩子值得一玩，快速浏览新加坡滨海湾地区的风景,2020-02-13 01:26:46.791057
,2,55,菲尼克斯,4,2018-10-01,14:05,水陆两用观光车有点意思 一大圈一共50分钟 风景还行 可以看到鱼尾狮公园 还可以拍照 路面上的风景主要是古建筑物,2020-02-13 01:26:46.803667
,2,55,91****730,5,2018-02-09,09:16,值得一去，特别是阿姨导游的讲解非常非常好。,2020-02-13 01:26:46.812677
,2,55,91****730,5,2018-02-09,09:16,值得一去，特别是阿姨导游的讲解非常非常好。,2020-02-13 01:26:46.818609
,2,55,110****440,4,2018-02-05,14:11,赶上下雨，影响欣赏，不过导游全程讲解很好。,2020-02-13 01:26:46.823009
,2,55,firskyjj,5,2018-06-15,10:25,换票地方按提示很快就找到了，店里有会中文的很好，鸭奶奶的讲解还可以，一船很多中国人讲中文就很多，水上行程比岸上有意思,2020-02-13 01:26:46.827062
,2,55,真真爸,2,2018-02-21,18:03,没玩到，领票地点太难找，错过了时间,2020-02-13 01:26:46.830555
,2,55,雅迪威,5,2018-01-27,23:51,初到新加坡必游，解说员很热情专业。,2020-02-13 01:26:46.833788
,2,55,203****155,5,2018-02-04,20:31,不错不错不错不错不错不错不错不错,2020-02-13 01:26:46.836937
,2,55,M28****020,5,2018-02-03,14:43,出票快，可惜乘坐时下雨，下次再来,2020-02-13 01:26:46.840038
,2,55,mm917,4,2018-08-22,14:42,挺适合大人和比较大的孩子，可以分陆地和湖上游览新加坡，了解新加坡的历史,2020-02-13 01:26:49.852051
,2,55,138****7135,5,2018-09-23,23:35,鸭子船不错，小朋友很喜欢，入水的时候最好玩～新加坡河沿岸风景尽收眼底～就是兑换票的位置稍微有点难找……,2020-02-13 01:26:49.869380
,2,55,小乐涵涵,4,2018-09-25,07:33,取票方便，在船上有个华人讲解很风趣，在新加坡河转一圈，然后在市中心也转一圈。介绍下附近景点。还不错！,2020-02-13 01:26:49.881647
,2,55,hs****567,5,2018-04-08,22:12,"已坐過2次了, 這次便宜些, 經過景點都一樣, 全程約莫1小時不到,但新加坡著名的景點都盡在眼底,水陸兩棲,不同視野看風景, 下次還會再來",2020-02-13 01:26:49.888142
,2,55,铁板肥牛,5,2018-10-26,14:51,取票就在a出口穿马路后的711商店附近，很好找。导游阿姨非常可爱，给我们提供了中文讲解～ 风景很美丽，家人都很喜欢,2020-02-13 01:26:49.893446
,2,55,junjunbb,4,2018-08-19,13:46,换票时，明明是工作人员失误，害我们大热天跑了两次，还联系了携程，但连对不起都不说，好说你们是中国人，明明歧视中国人。让我对新加坡的印象大打折扣。整个旅程还是很不错的，讲解的老奶奶，中英双语，详细讲解了新加坡的著名景点，是我们对新加坡的历史文化有了初步了解，非常不错,2020-02-13 01:26:49.897970
,2,55,_WeCh****56004,5,2018-07-18,09:29,比较另类的船，水路两用，这家公司的鸭子船不仅价格优惠，而且解说的鸭奶奶也很有趣，全程用中文解说，是根据船上中文游客的数量决定是否用中文，还很积极的帮游客拍照，给游客拍照建议，还免费给我们很多美美的照片,2020-02-13 01:26:49.901582
,2,55,工匠,3,2017-11-02,12:20,好几家鸭子船，建议到新加坡一定要体验的，现在陆地然后水上开，乘船拍摄视角很好，解说也到位。挺有趣味性。但是舒适度不太好。,2020-02-13 01:26:49.904867
,2,55,206****739,5,2018-10-14,22:50,鸭子船是很特别，但是1真的是非常热，闷热，船是没有空调的。2发动机在船尾，噪音特别大，我坐最后一排，导游用麦克风说话我都基本听不清的。本来以为孩子会喜欢，结果上车五分钟就喊着热太热要下车,2020-02-13 01:26:49.908115
,2,55,黑尔讷齐桓公,3,2018-04-04,23:54,噪音实在太大了。如果对新加坡的历史文化感兴趣的话，坐一坐还是可以的。纯玩的话就不建议了,2020-02-13 01:26:49.911422
,2,55,_WeCh****68784,3,2018-10-20,12:14,预订的那天下着小雨，稍微影响了一些体验。1个小时的时间，导游会间断的用英语、中文和本地语言介绍一些景点。除了下水那下稍稍欢快些，其它时间和自己逛差不多。介绍景点时的内容基本和百科上一致,2020-02-13 01:26:52.374703
,2,55,爱爱李,4,2018-07-26,22:44,鸭子船很好玩，好多中国游客在这里体验,2020-02-13 01:26:52.382425
,2,55,M76****65,5,2018-06-24,12:13,非常幸运，刚结束鸭子船就下雨了. 船上的鸭奶奶会细心的中文英文各一遍的介绍景点还用airdrop传相片给我们 还帮我们拍照 32个赞！！,2020-02-13 01:26:52.387940
,2,55,胖猫梅,5,2018-08-04,19:12,订的有点晚了，很多地方都定不到合适的时间了，还是携程给力地方挺好找的，换票方便，门口上车，鸭奶奶全程中文服务，虽然阴天但是还是感觉挺好的，主要的新加坡景点都远观了,2020-02-13 01:26:52.392686
,2,55,M13****788,5,2018-05-17,09:36,换票的地方有点难找。。。两家换票点旁边都有7-11，绕了好大一圈。鸭子船司机很好，上船之前，下船以后都主动让我们拍照留影,2020-02-13 01:26:52.398215
,2,55,_WeCh****87946,5,2018-07-09,10:41,没有点评中介绍的那么好玩，不过工作人员的态度棒棒的，为华裔工作人员点个赞。,2020-02-13 01:26:52.402140
,2,55,M27****2948,5,2018-07-06,14:14,鸭子船很有意思，一半行程在陆地上，一半在水里，特别是下水的时候最刺激，溅起一片大浪，孩子们是最开心的，鸭奶奶讲解得很认真，还会主动帮游客拍照，值得一玩。,2020-02-13 01:26:52.405599
,2,55,105****678,5,2018-07-27,11:19,鸭子船不错！鸭爸爸讲解有激情！当天乘坐遇上活动，陆地游览时间少了10分钟，公司免费赠送观光巴士1小时游览。,2020-02-13 01:26:52.409824
,2,55,hardrain,5,2018-10-03,00:20,有趣而特别，一路看风景听介绍，了解历史，也是许多好玩的说法和故事,2020-02-13 01:26:52.413462
,2,55,子吟子曰,4,2018-07-18,17:32,一般般，不过鸭子奶奶很亲切，但是上车秩序没有维护好，一个同车的国人随意插队（实在不想说了，因为自己也是一个中国人，感觉这个女的真是丢中国人的脸）,2020-02-13 01:26:52.416913
,2,55,sh****210,4,2018-07-14,10:29,新奇 的东西吧、下水一刹那蛮好玩的。其他，远观景点也不错。解说嘛，中文，呵呵，本人一般不发表不好的评论，还行。,2020-02-13 01:26:54.762117
,2,55,爱睡觉的小能,5,2018-09-02,17:26,导游是个年纪有点大的阿姨，虽然天气很热，又是下午差不多最后两场，但是导游阿姨依然精力充沛，嗓门洪亮，讲解内容幽默风趣，孩子很喜欢鸭子船。,2020-02-13 01:26:54.782781
,2,55,Shelly1020,3,2018-11-01,16:04,鸭子船导游说全程五十分钟，其实很多时间都浪费了，就是在水上看看那几个标志性建筑，听导游讲讲新加坡的历史，个人认为不是一定要去体验的景点,2020-02-13 01:26:54.794492
,2,55,kaien0611,5,2018-05-22,12:34,很不错，陆地和水里都可以走，看到重要的标志性建筑物,2020-02-13 01:26:54.802571
,2,55,M29****723,5,2018-03-21,20:29,因为基本都是中国游客，讲解员中英都进行了讲解，唯独鸭子船是二战战车改造而来，噪音巨大，讲解听不太清，总体来说仍然是很不错的体验。,2020-02-13 01:26:54.808186
,2,55,m90****93,5,2018-05-19,14:17,提前预订时间，水陆两栖船，鸭奶奶讲解细致，很好,2020-02-13 01:26:54.813000
,2,55,136****9210,5,2018-04-01,16:06,总体来说，还可以，但鸭子奶奶的讲解没有想象中的精彩丰富，值得坐一回感受一下水陆两栖的船,2020-02-13 01:26:54.816935
,2,55,com****ucky,5,2018-09-18,16:11,还不错，确实是入水的时候最激动。沿途的景点还不错，省得自己逛，还有介绍。都是中国人，胖阿姨直接说中文，小朋友听着更方便。,2020-02-13 01:26:54.820504
,2,55,Jasmine0528,5,2018-08-23,07:26,有两个公司，线路一样，这个价格便宜一些，鸭奶奶会中英文双语解说，全程一小时，下水瞬间很刺激，注意不要坐太前，不然会湿,2020-02-13 01:26:54.823841
,2,55,_CFT01****3653611,5,2018-06-23,18:52,很好玩啊，值回票价。。。。。。,2020-02-13 01:26:54.827166
