REVIEW_INDEX,WEBSITE_INDEX,POI_INDEX,REVIEWER_NAME,REVIEW_RATING,REVIEW_DATE,REVIEW_TIME,REVIEW_BODY,ATTRIBUTES_CRAWLED_TIME
,2,55,D09****48,5,2018-04-17,22:25,位置好找，导游中文讲解很好！！,2020-02-13 01:26:56.645044
,2,55,Hollis Ye,5,2018-11-12,10:05,靠近地铁站，位置不难做，工作人员热心，买了下午四点半，三点半人不满可以上，有三分一外国人，解说用英语比较多。,2020-02-13 01:26:56.654005
,2,55,elabin,5,2018-11-12,17:08,水陆两栖很有趣。沿途可以看到滨海湾比较著名的景点，合适孩子。取票也很方便，提早预订可以订到中文讲解。,2020-02-13 01:26:56.662070
,2,55,可乐,5,2018-06-05,11:26,很有意思的两栖船，沿着市区转一圈，经过很多市中心的景点，适合初到新加坡游览一圈，体验还是很不错的。,2020-02-13 01:26:56.667484
,2,55,ccli83,5,2018-07-30,16:21,鸭子船先在陆地上开一段路程，然后直接开下水，没坐过的可以去坐一下，沿得河游一圈，经过鱼尾狮公园,2020-02-13 01:26:56.671948
,2,55,koeymoon,5,2018-05-19,14:44,换票很方便，打印出来就可以直接进园，不用排队，非常好，还有微导游指引，下次还会继续用携程,2020-02-13 01:26:56.677935
,2,55,gyn1981,4,2018-08-07,11:05,很适合带孩子和老人参加，因为在水陆两栖的车子可以带大家轻松的浏览新加坡的市区风光,2020-02-13 01:26:56.682399
,2,55,芝a芝,4,2018-05-08,22:35,总体体验不错，订票和在当地兑换都很方便,2020-02-13 01:26:56.686144
,2,55,宸大宝Celine,4,2018-10-29,22:38,挺好的体验。小朋友很喜欢。唯一不足的是噪音实在太响，解说员也基本等于没讲解,2020-02-13 01:26:56.690034
,2,55,206****739,5,2018-10-14,22:53,总体不错，但是船内非常闷热，而且发动机噪音太大，基本听不清导游说什么,2020-02-13 01:26:56.694267
,2,55,宸大宝Celine,5,2018-10-29,22:39,带孩子的可以来体验一下，水陆俩用车，挺新鲜。缺点是噪音太大，路程短,2020-02-13 01:27:00.370781
,2,55,M21****392,3,2018-09-07,21:54,坐这船就很方便很偷懒的坐在船上就可以看到很多景点，不过真的很热很晒,2020-02-13 01:27:00.384915
,2,55,105****678,5,2018-07-27,11:21,不错！鸭爸爸讲解有激情，船尾发动机很吵，坐前排听讲解更清晰！,2020-02-13 01:27:00.391017
,2,55,糯米团子她妈,5,2017-11-14,23:51,通过水路、陆路观赏几个著名景点，还是很值得一玩的。就是提醒一下其他买票的游客，特别是还填写了备选时间的，一定要看仔细携程发来的短信，确认好最后预订成功的时间段，那个船的班次，很有可能就是代表了船的时间的，如“船的班次1530”就代表了是船的时间是15:30。,2020-02-13 01:27:00.395500
,2,55,shininglai,5,2018-07-21,17:24,就下水那一刻比较惊艳，全程发动机太大声，不太听得清解说。,2020-02-13 01:27:00.399497
,2,55,M56****990,5,2018-06-10,17:15,还不错，还有一个导游一路上介绍周边景点，小孩子很喜欢！,2020-02-13 01:27:00.403077
,2,55,M27****9318,5,2018-08-30,17:38,地面上开一段，然后下水开一段，介绍一下主要的建筑。,2020-02-13 01:27:00.406402
,2,55,mm917,5,2018-08-22,14:44,可以同时在陆地和湖上游览新加坡，了解新加坡历史不错,2020-02-13 01:27:00.413252
,2,55,139****2807,4,2018-06-18,14:08,也就一般般吧，不如摩天轮，推荐河川动物园，人少好玩,2020-02-13 01:27:00.419551
,2,55,Merrphin,5,2018-05-21,12:41,鸭子船下水一瞬间还蛮好玩 鸭奶奶很敬业,2020-02-13 01:27:00.424253
,2,55,kaien0611,5,2018-05-22,12:31,新加坡第一天必选项目之一，可以看到标志性建筑,2020-02-13 01:27:01.964420
,2,55,158****5691,5,2018-07-14,17:53,有两个鸭子船，不要走错了，这个在711里面,2020-02-13 01:27:01.969237
,2,55,268****824,5,2018-05-02,07:36,从水上看看新加坡 也是一种体验,2020-02-13 01:27:01.974139
,2,55,M12****307,5,2018-04-26,18:49,很有意思，而且赶上中文导游，就是噪音很大,2020-02-13 01:27:01.978294
,2,55,233****848,5,2018-03-20,14:05,绿树成荫环境优美，晚上去最好,2020-02-13 01:27:01.982028
,2,55,魏旭楠,5,2018-08-01,10:31,水陆两栖不错，就是噪音太大，听不清解说,2020-02-13 01:27:01.985397
,2,55,M27****449,5,2018-07-05,22:16,除了噪音大一些，其他很满意，挺有特色的,2020-02-13 01:27:01.988681
,2,55,樱桃逸子,5,2018-08-28,07:14,好玩好玩好玩，就是人晒得很黑！！！！,2020-02-13 01:27:01.992183
,2,55,M18****169,5,2018-05-10,20:38,非常好凭短信直接换票，孩子老人都喜欢,2020-02-13 01:27:01.995301
,2,55,118****343,5,2018-04-10,01:10,非常有意义的体验，看遍新加坡主打地。,2020-02-13 01:27:01.998455
,2,55,288****002,5,2018-06-18,18:01,挺不错的，可以舒服的游览新加坡城市,2020-02-13 01:27:06.049534
,2,55,D09****48,5,2018-04-21,18:23,换票方便，中文讲解，很详细，非常棒,2020-02-13 01:27:06.055447
,2,55,普拉塔蒂柏代诺伊莎迦尔,5,2018-11-25,11:39,鸭子船有点吵，拍风景的位置比较好,2020-02-13 01:27:06.060115
,2,55,288****751,5,2018-09-30,07:44,很好玩的，就是船有点吵，风景不错,2020-02-13 01:27:06.063881
,2,55,ppppig,5,2018-09-26,12:06,水路2用，小朋友喜欢，就是有点吵,2020-02-13 01:27:06.067230
,2,55,惊喜的K,5,2018-08-24,18:11,换票很方便，导游中英双语，还不错,2020-02-13 01:27:06.071213
,2,55,kaien0611,5,2018-05-22,12:38,good满意，很适合带小朋友做。,2020-02-13 01:27:06.076206
,2,55,D35****219,5,2018-04-06,15:35,很好，很舒服，风景不错，比去景点,2020-02-13 01:27:06.080074
,2,55,M14****362,5,2018-11-25,22:47,挺好的，导游中英文讲解，不错。,2020-02-13 01:27:06.083500
,2,55,普拉塔蒂柏代诺伊莎迦尔,5,2018-11-25,11:39,鸭子船有点吵，讲解员的服务很好,2020-02-13 01:27:06.087124
,2,55,普拉塔蒂柏代诺伊莎迦尔,5,2018-11-25,11:38,鸭子船有点吵，其他的感觉还好.,2020-02-13 01:27:07.677421
,2,55,M75****35,1,2018-08-21,18:46,记错日期，没法坐船，钱沒得退。,2020-02-13 01:27:07.683244
,2,55,淘气de糖糖,5,2018-08-18,16:31,非常好玩！鸭子奶奶讲解很不错！,2020-02-13 01:27:07.688990
,2,55,M57****118,5,2018-05-06,08:10,很好啊！下水时候超级好玩！值得,2020-02-13 01:27:07.693141
,2,55,233****524,5,2018-04-22,22:52,取票方便，一次令人满意的旅程！,2020-02-13 01:27:07.696789
,2,55,樱桃妈,5,2017-10-17,13:48,非常有意思，车上的工作人员非常热情，一车上游客除了我们两家两个小宝宝不会英语，都是来自菲律宾印尼的游客，但是工作人员看到两个孩子不会英语特别穿插中文讲解！工作人员特别热情，积极调动游客气氛，天气炎热却依然热情如火！整个过程讲解认真全面！赞赞赞！,2020-02-13 01:27:07.700176
,2,55,mxfofprc,5,2017-11-16,23:23,这个鸭子船很实惠，比起其他的划算很多，而且玩的都路径都一样，导游阿姨奶奶讲的更棒！取票还是比较方便的,2020-02-13 01:27:07.703679
,2,55,樱桃妈,5,2017-10-17,13:49,非常好！帮我朋友订票的，所以提她评价。一起出游一起鸭子船，玩的很开心。说名字就可以当场验证。携程指引的寻找路线非常精确易找。,2020-02-13 01:27:07.707038
,2,55,M41****443,5,2017-10-04,19:42,乘坐鸭子船，可以债务游览很多景点,2020-02-13 01:27:07.710118
,2,55,M24****1738,5,2017-11-18,21:17,不错，很有特色！水陆两栖的鸭子船很有意思！导游大妈很热情！还会帮忙拍照！,2020-02-13 01:27:07.713239
,2,55,M13****941,5,2019-03-03,17:53,超级好用！！！********,2020-02-13 01:27:10.237536
